DOI,Título,Autores,Año,Citas,Revista
10.1504/ijbic.2010.037023,Resolving the pursuit evasion problem in known environment using graph theory,Rabah Lakel and Adel Djellal,2010,0,International Journal of Bio-Inspired Computation
10.1504/ijbic.2019.099186,Adaptive discrete cat swarm optimisation algorithm for the flexible job shop problem,Tian hua Jiang and Chao Zhang,2019,13,International Journal of Bio-Inspired Computation
10.1504/ijbic.2018.091232,Population-based variable neighbourhood search algorithm applied to unconstrained continuous optimisation,Wesklei Migliorini and Rafael Stubs Parpinelli,2018,1,International Journal of Bio-Inspired Computation
10.1504/ijbic.2012.048066,Dynamic objectives aggregation methods for evolutionary portfolio optimisation. A computational study,Gabriella Dellino and Mariagrazia Fedele and Carlo Meloni,2012,1,International Journal of Bio-Inspired Computation
10.1504/ijbic.2017.084314,SEOA-based optimal design of analogue CMOS amplifier circuits,Soumen Mallick and Rajib Kar and Sakti Prasad Ghoshal and Durbadal Mandal,2017,0,International Journal of Bio-Inspired Computation
10.1504/ijbic.2014.059969,Bio-inspired computation: success and challenges of IJBIC,Xin She Yang and Zhihua Cui,2014,5,International Journal of Bio-Inspired Computation
10.1504/ijbic.2018.10020764,An Overview on Structural Health Monitoring: From the Current State-of-the-Art to New Bio-inspired Sensing Paradigms,Paulo B. Lourenco and Paulo Amado Mendes and Luis F. Ramos and Alberto Barontini and Maria Giovanna Masciotta,2018,1,International Journal of Bio-Inspired Computation
10.1504/ijbic.2018.10014002,An improved twin support vector machine based on multi-objective cuckoo search for software defect prediction,Xiaotao Rong and Yang Cao and Fei Xue and Zhiming Ding,2018,0,International Journal of Bio-Inspired Computation
10.1504/ijbic.2012.049897,Investigating the application of opposition concept to colonial competitive algorithm,Hamid Reza Lashgarian Azad and Nader Shetab Boushehri and Naser Mollaverdi,2012,2,International Journal of Bio-Inspired Computation
10.1504/ijbic.2013.055451,Optimising the semantic web service composition process using bio-inspired methods,Viorica Rozina Chifu and Cristina Bianca Pop and Ioan Salomie and Dumitru Samuel Suia and Alexandru Niculici and Adela Negrean and Horatiu Jeflea,2013,1,International Journal of Bio-Inspired Computation
10.1504/ijbic.2012.048064,Production planning and scheduling by means of artificial immune systems and particle swarm optimisation algorithms,Ivana Budinská and Tomáš Kasanický and Ján Zelenka,2012,3,International Journal of Bio-Inspired Computation
10.1504/ijbic.2012.047181,Optimal sequencing of design projects' activities using discrete particle swarm optimisation,Hisham M. Abdelsalam and Amany M. Mohamed,2012,5,International Journal of Bio-Inspired Computation
10.1504/ijbic.2022.127502,Genetic regulatory network-based optimisation of master production scheduling and mixed-model sequencing in assembly lines,Youlong Lv and Jie Zhang and Liling Zuo,2022,0,International Journal of Bio-Inspired Computation
10.1504/ijbic.2017.081843,Detection and classification of structural changes using artificial immune systems and fuzzy clustering,Maribel Anaya and Diego Alexander Tibaduiza and Francesc Pozo,2017,12,International Journal of Bio-Inspired Computation
10.1504/ijbic.2015.069554,Quantum inspired cuckoo search algorithm for graph colouring problem,Halima Djelloul and Abdesslem Layeb and Salim Chikhi,2015,13,International Journal of Bio-Inspired Computation
10.1504/ijbic.2020.109676,Time-to-contact control: improving safety and reliability of autonomous vehicles,Liang Wang and Berthold K.P. Horn,2020,0,International Journal of Bio-Inspired Computation
10.1504/ijbic.2018.092801,EGA-FMC: enhanced genetic algorithm-based fuzzy k-modes clustering for categorical data,Medhini Narasimhan and Balaji Balasubramanian and Suryansh D. Kumar and Nagamma Patil,2018,1,International Journal of Bio-Inspired Computation
10.1504/ijbic.2017.083100,Dynamic network structured immune particle swarm optimisation with small-world topology,Yifei Sun and Licheng Jiao and Xiaozheng Deng and Rongfang Wang,2017,12,International Journal of Bio-Inspired Computation
10.1504/ijbic.2015.071065,Parameter identification of power plant characteristics based on PMU data using differential evolution-based improved shuffled frog leaping algorithm,Farzan Rashidi and Ebrahim Abiri and Taher Niknam and Mohammad Reza Salehi,2015,4,International Journal of Bio-Inspired Computation
10.1504/ijbic.2012.049884,Enhancing robustness for speech recognition through bio-inspired auditory filter-bank,Hari Krishna Maganti and Marco Matassoni,2012,0,International Journal of Bio-Inspired Computation
10.1504/ijbic.2017.10004011,Mobile robot path planning with modified ant colony optimisation,Madhu Kumari and Utkarsh Rajput,2017,2,International Journal of Bio-Inspired Computation
10.1504/ijbic.2015.068001,A self-organising cooperative hunting by robotic swarm based on particle swarm optimisation localisation,Zebing Wang and Li Qin and Wei Yang,2015,4,International Journal of Bio-Inspired Computation
10.1504/ijbic.2011.041144,Advances in complexity engineering,R. Frei and Giovanna Di Marzo Serugendo,2011,23,International Journal of Bio-Inspired Computation
10.1504/ijbic.2013.055452,Bootstrapping learning from abstract models in games,Purvag Patel and Normal Carver and Shahram Rahimi,2013,0,International Journal of Bio-Inspired Computation
10.1504/ijbic.2016.10000242,Comparative study of diversity based parallel dual population genetic algorithm for unconstrained function optimisations,Wei Chiang Hong and Madhuri S. Joshi and A.J. Umbarkar,2016,5,International Journal of Bio-Inspired Computation
10.1504/ijbic.2012.047186,Investigations on the synthesis of uniform linear antenna array using biogeography-based optimisation techniques,T.S. Jeyali Laseetha and R. Sukanesh,2012,4,International Journal of Bio-Inspired Computation
10.1504/ijbic.2022.128094,Artificial leaf-vein network optimisation algorithm for urban transportation network design,Baozhen Yao and Chao Chen and Wenxuan Shan and Bin Yu,2022,0,International Journal of Bio-Inspired Computation
10.1504/ijbic.2022.128097,Hybrid moth-flame optimisation algorithm with differential evolution for visual object tracking,K. Narsimha Reddy and Polaiah Bojja,2022,0,International Journal of Bio-Inspired Computation
10.1504/ijbic.2017.085890,Multi-leader migrating birds optimisation: a novel nature-inspired metaheuristic for combinatorial problems,Eduardo Lalla Ruiz and Jesica De Armas and Christopher Expósito Izquierdo and Belén Melián Batista and J. Marcos Moreno Vega,2017,2,International Journal of Bio-Inspired Computation
10.1504/ijbic.2010.032130,Fractal dimension and time factors of sawdust pattern formation in sawmills,Tajudeen A.O. Salau and S.A. Oke,2010,0,International Journal of Bio-Inspired Computation
10.1504/ijbic.2021.117430,Binary fireworks algorithm application for optimal schedule of electric vehicle reserve in traditional and restructured electricity markets,Srikanth Reddy Konda and Lokesh Kumar Panwar and Bijaya Ketan Panigrahi and Rajesh Kumar and Vishu Gupta,2021,2,International Journal of Bio-Inspired Computation
10.1504/ijbic.2022.120732,A new multi-objective artificial bee colony algorithm based on reference point and opposition,Songyi Xiao and Wenjun Wang and Hui Wang and Zhikai Huang,2022,4,International Journal of Bio-Inspired Computation
10.1504/ijbic.2021.118091,Distance-based immune generalised differential evolution algorithm for dynamic multi-objective optimisation,María Guadalupe Martínez Peñaloza and Efrén Mezura Montes and Alicia Morales Reyes and Hernán E. Aguirre,2021,3,International Journal of Bio-Inspired Computation
10.1504/ijbic.2021.119999,PSO-based optimal online operation strategy for multiple chillers energy conservation,Jing An and Luyuan Xu and Zheng Fan and Kefan Wang and Qi Deng and Qi Kang,2021,1,International Journal of Bio-Inspired Computation
10.1504/ijbic.2021.113362,Comparison of three nature inspired molecular docking algorithms,Petra Čechová and Martin Kubala,2021,2,International Journal of Bio-Inspired Computation
10.1504/ijbic.2020.109674,A novel squeeze YOLO-based real-time people counting approach,Peiming Ren and Lin Wang and Wei Fang and Shulin Song and Soufiene Djahel,2020,17,International Journal of Bio-Inspired Computation
10.1504/ijbic.2021.117426,A real adjacency matrix-coded evolution algorithm for highly linkage-based routing problems,Hang Wei and Han Huang and Zhi Feng Hao and Qin Qun Chen and Witold Pedrycz and Gang Li,2021,0,International Journal of Bio-Inspired Computation
10.1504/ijbic.2010.033088,Multi-area hydrothermal coordination using modified mixed integer hybrid differential evolution,L. Lakshminarasimman,2010,1,International Journal of Bio-Inspired Computation
10.1504/ijbic.2021.118101,Adaptive optimisation driven deep belief networks for lung cancer detection and severity level classification,Malayil Shanid and A. Anitha,2021,2,International Journal of Bio-Inspired Computation
10.1504/ijbic.2015.072257,On the application of multi-objective harmony search heuristics to the predictive deployment of firefighting aircrafts: a realistic case study,Miren Nekane Bilbao and Javier Del Ser and Sancho Salcedo Sanz and Carlos Casanova Mateo,2015,12,International Journal of Bio-Inspired Computation
10.1504/ijbic.2016.079569,A new hybrid method based on krill herd and cuckoo search for global optimisation tasks,Gai Ge Wang and Amir H. Gandomi and Xin She Yang and Amir H. Alavi,2016,82,International Journal of Bio-Inspired Computation
10.1504/ijbic.2014.059967,Bio-inspired optimisation for economic load dispatch: a review,Hari Mohan Dubey and Bijaya Ketan Panigrahi and Manjaree Pandit,2014,23,International Journal of Bio-Inspired Computation
10.1504/ijbic.2015.072259,An investigation on mixing heterogeneous differential evolution variants in a distributed framework,S. Thangavelu and C. Shunmuga Velayutham,2015,9,International Journal of Bio-Inspired Computation
10.1504/ijbic.2019.100139,Cloud service composition using an inverted ant colony optimisation algorithm,Saied Asghari and Nima Jafari Navimipour,2019,27,International Journal of Bio-Inspired Computation
10.1504/ijbic.2010.033096,Dynamic economic load dispatch with wind energy using modified harmony search,V. Ravikumar Pandi and B.K. Panigrahi and Swagatam Das and Zhihua Cui,2010,11,International Journal of Bio-Inspired Computation
10.1504/ijbic.2018.091722,A firefly inspired game dissemination and QoS-based priority pricing strategy for online social network games,Ebin Deni Raj and L.D. Dhinesh Babu,2018,5,International Journal of Bio-Inspired Computation
10.1504/ijbic.2021.114087,Latent dactyloscopy pairing: presentation attained through feedback from EPITOME,R. Pugalenthi and F. Sangeetha Francelin Vinnarasi and P. Mohan Kumar and R. Arokia Renjith,2021,0,International Journal of Bio-Inspired Computation
10.1504/ijbic.2011.041147,Linear antenna array synthesis with modified invasive weed optimisation algorithm,Siddharth Pal and Anniruddha Basak and Swagatam Das,2011,14,International Journal of Bio-Inspired Computation
10.1504/ijbic.2011.040312,A study of the relationship between scale-freeness and evolution of cooperation,Ei Tsukamoto and Susumu Shirayama,2011,0,International Journal of Bio-Inspired Computation
10.1504/ijbic.2016.076336,Distributed strategy for robots recruitment in swarm-based systems,Luneque Del Rio de Souza e Silva Junior and Nadia Nedjah,2016,8,International Journal of Bio-Inspired Computation
10.1504/ijbic.2018.10012205,Embedded implementation of template matching using correlation and particle swarm optimisation,Yuri Marchetti Tavares and Nadia Nedjah and Luiza De Macedo Mourelle,2018,0,International Journal of Bio-Inspired Computation
10.1504/ijbic.2012.047174,Neuro-fuzzy-based torque ripple reduction and performance improvement of VSI fed induction motor drive,G. Durgasukumar and Mukesh Kumar Pathak,2012,1,International Journal of Bio-Inspired Computation
10.1504/ijbic.2015.067999,Cavitary nodule segmentation in computed tomography images based on self-generating neural networks and particle swarm optimisation,Juan juan Zhao and Guo hua Ji and Yong Xia and Xiao long Zhang,2015,15,International Journal of Bio-Inspired Computation
10.1504/ijbic.2022.10045869,Capacity estimation method of lithium-ion batteries based on deep convolution neural network,Renwang Song and Lei Yang and Linying Chen and Zengshou Dong,2022,0,International Journal of Bio-Inspired Computation
10.1504/ijbic.2016.076335,Test case optimisation a nature inspired approach using bacteriologic algorithm,Praveen Ranjan Srivastava,2016,9,International Journal of Bio-Inspired Computation
10.1504/ijbic.2019.098413,Analysis of PID controller for the load frequency control of static synchronous series compensator and capacitive energy storage source-based multi-area multi-source interconnected power system with HVDC link,Rajendra Kumar Khadanga and Amit Kumar,2019,5,International Journal of Bio-Inspired Computation
10.1504/ijbic.2009.022778,On a hybrid weightless neural system,T.B. Ludermir and M.C.P. De Souto and W.R. De Oliveira,2009,4,International Journal of Bio-Inspired Computation
10.1504/ijbic.2017.10003989,Dynamic network structured immune particle swarm optimisation with small-world topology,Yifei Sun and Licheng Jiao and Rongfang Wang and Xiaozheng Deng,2017,0,International Journal of Bio-Inspired Computation
10.1504/ijbic.2016.10004313,A modified bats echolocation-based algorithm for solving constrained optimisation problems,Nafrizuan Mat Yahya and M. Osman Tokhi,2016,1,International Journal of Bio-Inspired Computation
10.1504/ijbic.2017.10004357,Enhanced colliding bodies optimisation-based optimal design of wideband digital integrators and differentiators,Durbadal Mandal and Suman Kumar Saha and Rajib Kar and Shibendu Mahata,2017,0,International Journal of Bio-Inspired Computation
10.1504/ijbic.2017.10005480,Biogeography-based Optimization with Migration Velocity for Multi-objective Optimization Problems,Weian Guo and Lei Wang,2017,0,International Journal of Bio-Inspired Computation
10.1504/ijbic.2016.10004306,Encodings and Genetic Operators for Efficient Evolutionary Design of Digital Circuits - new,Nadia Nedjah and Luiza Mourelle,2016,0,International Journal of Bio-Inspired Computation
10.1504/ijbic.2019.10019886,Constrained optimisation by solving equivalent dynamic loosely-constrained multiobjective optimisation problem,Ruwang Jiao and Changhe Li and Rui Wang and Sanyou Zeng,2019,1,International Journal of Bio-Inspired Computation
10.1504/ijbic.2019.10025279,An ISO/IEC 24745 compliant ECG template protection based on linear prediction coding,Rabah Attia and Adel Benzina and Emna Kalai Zaghouani,2019,0,International Journal of Bio-Inspired Computation
10.1504/ijbic.2021.10039652,Swarm and evolutionary algorithms for energy disaggregation: challenges and prospects,Rammohan Mallipeddi and Trinadh Pamulapati and Samira Ghorbanpour,2021,0,International Journal of Bio-Inspired Computation
10.1504/ijbic.2020.10027564,Performance-aware deployment of streaming applications in distributed stream computing systems,Shang Gao and Rajkumar Buyya and Fengyun Li and Xunyun Liu and Dawei Sun,2020,0,International Journal of Bio-Inspired Computation
10.1504/ijbic.2021.10041425,Adaptive optimisation driven deep belief networks for lung cancer detection and severity level classification,A. Anitha and Malayil Shanid,2021,0,International Journal of Bio-Inspired Computation
10.1504/ijbic.2016.10004293,Syllogistic Reasoning by Strand Algebra,Kumar S. Ray and Mandrita Mondal,2016,0,International Journal of Bio-Inspired Computation
10.1504/ijbic.2016.10004290,SEOA based Optimal Design of Analog CMOS Amplifier Circuits,Durbadal Mandal and Sakti Ghoshal and Rajib Kar and Soumen Mallick,2016,0,International Journal of Bio-Inspired Computation
10.1504/ijbic.2019.10025302,User identification by keystroke dynamics using improved binary particle swarm optimisation,Xiujuan Wang and Guangzhi Xu and Chunhua Wu and Kangfeng Zheng and Tong Wu,2019,0,International Journal of Bio-Inspired Computation
10.1504/ijbic.2020.10031121,A privacy-preserving recommendation method based on multi-objective optimisation for mobile users,Stephen Shaoyi Liao and Austin Shijun Ding and Chonghuan Xu,2020,0,International Journal of Bio-Inspired Computation
10.1504/ijbic.2021.10037528,Improved gravitational search algorithm based on chaotic local search,Zhaolu Guo and Wensheng Zhang and Shenwen Wang,2021,0,International Journal of Bio-Inspired Computation
10.1504/ijbic.2021.10037537,3D reconstruction of structural magnetic resonance neuroimaging based on computer aided detection,Heba M. Afify and Samir Y. Marzouk and Mai S. Mabrouk,2021,0,International Journal of Bio-Inspired Computation
10.1504/ijbic.2019.10019906,Analysis of PID controller for the load frequency control of static synchronous series compensator and capacitive energy storage source-based multi-area multi-source interconnected power system with HVDC link,Rajendra Kumar Khadanga and Amit Kumar,2019,0,International Journal of Bio-Inspired Computation
10.1504/ijbic.2019.10021708,Integration of Kestrel-based search algorithm with artificial neural network for feature subset selection,Hongji Yang and Simon James Fong and Israel Edem Agbehadji and Richard C. Millham,2019,0,International Journal of Bio-Inspired Computation
10.1504/ijbic.2021.10039666,Neural network-assisted expensive optimisation algorithm for pollution source rapid positioning of drinking water,Yingkang Hu and Xuesong Yan,2021,0,International Journal of Bio-Inspired Computation
10.1504/ijbic.2019.10022758,A fuzzy-based method for task scheduling in the cloud environments using inverted ant colony optimisation algorithm,Nima Jafari Navimipour and Mehdi Hosseinzadeh and Poopak Azad,2019,0,International Journal of Bio-Inspired Computation
10.1504/ijbic.2016.10004315,A clustering algorithm based on elitist evolutionary approach,Lydia Boudjeloud Assala and Minh Thuy TA,2016,0,International Journal of Bio-Inspired Computation
10.1504/ijbic.2017.10004322,A distributed combinatorial optimisation heuristic for the scheduling of energy resources represented by self-interested agents,Michael Sonnenschein and Christian Hinrichs,2017,0,International Journal of Bio-Inspired Computation
10.1504/ijbic.2016.10004312,Programmable DNA-Mediated Decision Maker,Jian Jun SHU,2016,2,International Journal of Bio-Inspired Computation
10.1504/ijbic.2017.10005264,Ant colonial-based approach for the minimal full trie problem,Yi Zhang and Meng Zhang,2017,0,International Journal of Bio-Inspired Computation
10.1504/ijbic.2019.10020503,Adaptive discrete cat swarm optimisation algorithm for the flexible job shop problem,Tian hua Jiang and Chao Zhang,2019,0,International Journal of Bio-Inspired Computation
10.1504/ijbic.2017.10004355,TRUST-TECH-Enhanced Differential Evolution Methodology for Box-Constrained Nonlinear Optimization,Xuexia Zhang,2017,0,International Journal of Bio-Inspired Computation
10.1504/ijbic.2016.10004345,Computer Aided Detection and Classification of Pap smear Cell Images Using Principal Component Analysis,Sukumar Ponnusamy and Ravi Samikannu,2016,0,International Journal of Bio-Inspired Computation
10.1504/ijbic.2020.10028011,Fractional Lévy flight bat algorithm for global optimisation,Redouane Boudjemaa and Fatima Ouaar and Diego Oliva,2020,2,International Journal of Bio-Inspired Computation
10.1504/ijbic.2020.10029696,Archived elitism in evolutionary computation: towards improving solution quality and population diversity,Maxim A. Dulebenets,2020,0,International Journal of Bio-Inspired Computation
10.1504/ijbic.2020.10029697,An enhanced breeding swarms algorithm for high dimensional optimisations,Ali Arefi and Ghavameddin Nourbakhsh and Jon A. Hansen and Jørgen Sund and Dylan Tollemache,2020,0,International Journal of Bio-Inspired Computation
10.1504/ijbic.2020.10034176,Application an improved swarming optimisation in attribute reduction,Yong Xu and Yi Zhang and Honglie Zhu and Xingjuan Cai,2020,0,International Journal of Bio-Inspired Computation
10.1504/ijbic.2021.10045575,Deep learning based mitosis detection using genetic optimal feature set selection,Anand S and Lakshmanan B,2021,0,International Journal of Bio-Inspired Computation
10.1504/ijbic.2021.10041413,DVR-based power quality enhancement using adaptive particle swarm optimisation technique,L. Ravi Srinivas and S.S. Tulasi Ram and B. Mahesh Babu,2021,0,International Journal of Bio-Inspired Computation
10.1504/ijbic.2020.10031992,Time-to-contact control: improving safety and reliability of autonomous vehicles,Liang Wang and Berthold K.P. Horn,2020,0,International Journal of Bio-Inspired Computation
10.1504/ijbic.2012.047241,Optimal design of constraint engineering systems: application of mutable smart bee algorithm,Ahmad Mozaffari and Mofid Gorji Bandpy and Tahereh B. Gorji,2012,24,International Journal of Bio-Inspired Computation
10.1504/ijbic.2018.096484,A discrete particle swarm optimisation algorithm to operate distributed energy generation networks efficiently,Pablo Cortés and Jesús Muñuzuri and Luis Onieva and José Guadix,2018,12,International Journal of Bio-Inspired Computation
10.1504/ijbic.2018.10017836,Cooperative co-evolution with improved differential grouping method for large-scale global optimisation,Tao Zhang and Peter J. Fleming and Fuxing Zhang and Rui Wang,2018,0,International Journal of Bio-Inspired Computation
10.1504/ijbic.2018.10017835,RoughPSO: rough set-based particle swarm optimisation,Yang Li and Lei Yu Tang and Geng Kun Wu and Jian Cong Fan,2018,1,International Journal of Bio-Inspired Computation
10.1504/ijbic.2020.10030555,A swarm intelligence labour division approach to solving complex area coverage problems of swarm robots,Renbin Xiao and Jinqiang Hu and Liang Hu and Husheng Wu,2020,0,International Journal of Bio-Inspired Computation
10.1504/ijbic.2022.10047735,An ensemble-surrogate assisted cooperative particle swarm optimisation algorithm for water contamination source identification,Jinyu Gong and Xuesong Yan and Chengyu Hu,2022,0,International Journal of Bio-Inspired Computation
10.1504/ijbic.2022.124333,Solving systems of nonlinear equations with real world problems using an advanced hybrid algorithm,Pooja Verma and Raghav Prasad Parouha,2022,0,International Journal of Bio-Inspired Computation
10.1504/ijbic.2022.126773,A many-objective particle swarm optimisation algorithm based on convergence assistant strategy,Wusi Yang and Li Chen and Yanyan Li and Fazeel Abid,2022,0,International Journal of Bio-Inspired Computation
10.1504/ijbic.2016.076652,Probability collectives hybridised with differential evolution for global optimisation,Zixiang Xu and Ahmet Unveren and Adnan Acan,2016,20,International Journal of Bio-Inspired Computation
10.1504/ijbic.2022.126789,Adversarial transformation network with adaptive perturbations for generating adversarial examples,Guoyin Zhang and Qingan Da and Sizhao Li and Jianguo Sun and Wenshan Wang and Qing Hu and Jiashuai Lu,2022,0,International Journal of Bio-Inspired Computation
10.1504/ijbic.2016.076634,Optimal energy management of smart renewable micro-grids in the reconfigurable systems using adaptive harmony search algorithm,Taher Niknam and Abdollah Kavousi Fard,2016,20,International Journal of Bio-Inspired Computation
10.1504/ijbic.2020.10027531,Performance analysis of intrinsic embedded evolvable hardware using memetic and genetic algorithms,S.P. Joy Vasantha Rani and Ranjith N.A.,2020,1,International Journal of Bio-Inspired Computation
10.1504/ijbic.2021.118095,Clustering algorithm for mixed attributes data based on glowworm swarm optimisation algorithm and K-prototypes algorithm,Yaping Li and Zhiwei Ni and Weiliang Zhou,2021,2,International Journal of Bio-Inspired Computation
10.1504/ijbic.2021.119197,A novel oversampling technique based on the manifold distance for class imbalance learning,Yinan Guo and Botao Jiao and Lingkai Yang and Jian Cheng and Shengxiang Yang and Fengzhen Tang,2021,2,International Journal of Bio-Inspired Computation
10.1504/ijbic.2020.112339,Bee-inspired task allocation algorithm for multi-UAV search and rescue missions,Heba Kurdi and Shiroq Al Megren and Ebtesam Aloboud and Abeer Ali Alnuaim and Hessah Alomair and Reem Alothman and Alhanouf Ben Muhayya and Noura Alharbi and Manal Alenzi and Kamal Youcef Toumi,2020,3,International Journal of Bio-Inspired Computation
10.1504/ijbic.2018.091700,Economic load dispatch using memory based differential evolution,Raghav Prasad Parouha and Kedar Nath Das,2018,13,International Journal of Bio-Inspired Computation
10.1504/ijbic.2021.119950,An improved extension neural network methodology for fault diagnosis of complex electromechanical system,Yunfei Zhou and Yunxiu Sai and Li Yan,2021,3,International Journal of Bio-Inspired Computation
10.1504/ijbic.2017.085332,A time-varying strategy for urban traffic network control: a fuzzy logic control based on an improved black hole algorithm,Mohammad Hassan Khooban and Alireza Liaghat,2017,9,International Journal of Bio-Inspired Computation
10.1504/ijbic.2010.030042,Hybrid particle swarm optimisation with k-centres method and dynamic velocity range setting for travelling salesman problems,Xumei Zhang and Hanguang Qiu,2010,6,International Journal of Bio-Inspired Computation
10.1504/ijbic.2018.094223,An elitist-flower pollination-based strategy for constructing sequence and sequence-less t-way test suite,Abdullah B. Nasser and Kamal Z. Zamli and AbdulRahman A. Alsewari and Bestoun S. Ahmed,2018,11,International Journal of Bio-Inspired Computation
