DOI,Título,Autores,Año,Citas,Revista
10.1504/ijbic.2018.10011279,3D reconstruction of pulmonary nodules in PET-CT image sequences based on a novel 3D region growing method combined with ACO,Xiang fei Zhou and Juan juan Zhao and Guo hua Ji and Wei Qiang,2018,0,International Journal of Bio-Inspired Computation
10.1504/ijbic.2013.053507,Artificial plant optimisation algorithm with three-period photosynthesis,Zhihua Cui and Shujing Fan and Jianchao Zeng and Zhongzhi Shi,2013,20,International Journal of Bio-Inspired Computation
10.1504/ijbic.2012.047182,A monitoring and control framework for lost foam casting manufacturing processes using genetic programming,Alaa F. Sheta and Peter Rausch and Alaa S. Al Afeef,2012,5,International Journal of Bio-Inspired Computation
10.1504/ijbic.2012.051411,Light responsive curve selection for photosynthesis operator of APOA,Xingjuan Cai and Shujing Fan and Ying Tan,2012,16,International Journal of Bio-Inspired Computation
10.1504/ijbic.2022.126290,VAR strategic planning for reactive power using hybrid soft computing techniques,Swetha Shekarappa G and Sheila Mahapatra and Saurav Raj,2022,0,International Journal of Bio-Inspired Computation
10.1504/ijbic.2022.126788,Capacity estimation method of lithium-ion batteries based on deep convolution neural network,Renwang Song and Lei Yang and Linying Chen and Zengshou Dong,2022,0,International Journal of Bio-Inspired Computation
10.1504/ijbic.2021.119200,A novel bio-inspired stochastic framework to solve energy management problem in hybrid AC-DC microgrids with uncertainty,Sattar Shojaeiyan and Taher Niknam and Mehdi Nafar,2021,4,International Journal of Bio-Inspired Computation
10.1504/ijbic.2020.108593,PSO-MoSR: a PSO-based multi-objective software remodularisation,Amarjeet Prajapati and Sanjeev Kumar,2020,7,International Journal of Bio-Inspired Computation
10.1504/ijbic.2018.096481,Cooperative co-evolution with improved differential grouping method for large-scale global optimisation,Rui Wang and Fuxing Zhang and Tao Zhang and Peter J. Fleming,2018,8,International Journal of Bio-Inspired Computation
10.1504/ijbic.2017.083101,On solving partition driven standard cell placement problem using firefly-based metaheuristic approach,Maninder Kaur and Pradip Kumar Sharma,2017,4,International Journal of Bio-Inspired Computation
10.1504/ijbic.2014.059966,An empirical study of test effort estimation based on bat algorithm,Praveen Ranjan Srivastava and Amit Bidwai and Anam Khan and Kritika Rathore and Rohit Sharma and Xin She Yang,2014,14,International Journal of Bio-Inspired Computation
10.1504/ijbic.2018.092797,Multi-objective bat algorithm for mining numerical association rules,Kamel Eddine Heraguemi and Nadjet Kamel and Habiba Drias,2018,23,International Journal of Bio-Inspired Computation
10.1504/ijbic.2018.091235,A memetic algorithm for power system damping controllers design,Wesley Peres and Valceres V.R. Silva and Francisco C.R. Coelho and Ivo C. Silva Junior and Joao A. Passos Filho,2018,1,International Journal of Bio-Inspired Computation
10.1504/ijbic.2013.055092,Bee royalty offspring algorithm for improvement of facial expressions classification model,Amir Jamshidnezhad and Md Jan Nordin,2013,5,International Journal of Bio-Inspired Computation
10.1504/ijbic.2017.084318,An improved artificial bee colony algorithm for global numerical optimisation,Tahere Yaghoobi and Elahe Esmaeili,2017,11,International Journal of Bio-Inspired Computation
10.1504/ijbic.2014.066975,Multi-criteria probability collectives,Neha S. Patankar and Anand J. Kulkarni and Kang Tai and T.D. Ghate and A.R. Parvate,2014,5,International Journal of Bio-Inspired Computation
10.1504/ijbic.2012.047240,Alert correlation using artificial immune recognition system,Mehdi Bateni and Ahmad Baraani and Ali Ghorbani,2012,3,International Journal of Bio-Inspired Computation
10.1504/ijbic.2017.083702,Genetic algorithm-based improved sampling for protein structure prediction,Md Tamjidul Hoque and Sumaiya Iqbal,2017,6,International Journal of Bio-Inspired Computation
10.1504/ijbic.2011.038703,Unbalanced supply chain design using the analytic network process and a hybrid heuristic-based algorithm with balance modulating mechanism,Z.H. Che and Zhihua Cui,2011,2,International Journal of Bio-Inspired Computation
10.1504/ijbic.2013.057183,Generation of neural networks using a genetic algorithm approach,Felipe Trujillo Romero,2013,1,International Journal of Bio-Inspired Computation
10.1504/ijbic.2010.033095,Perceptual image analysis,C. Henry and J.F. Peters,2010,11,International Journal of Bio-Inspired Computation
10.1504/ijbic.2014.060608,Research on structure emergence based on cellular automata,Renbin Xiao and Yingcong Wang and Zhenwu Tao,2014,3,International Journal of Bio-Inspired Computation
10.1504/ijbic.2017.086700,Genetic algorithm-based feature selection for classification of land cover changes using combined LANDSAT and ENVISAT images,N. Suresh Kumar and M. Arun,2017,1,International Journal of Bio-Inspired Computation
10.1504/ijbic.2018.10013988,A new method to solve optimisation problems via fixed point of firefly algorithm,WenXin Yu and JunNian Wang,2018,2,International Journal of Bio-Inspired Computation
10.1504/ijbic.2015.069558,A viral system to optimise the daily drayage problem,Alejandro Escudero Santana and Pablo Cortés and Jesús Muñuzuri and Pablo Aparicio,2015,3,International Journal of Bio-Inspired Computation
10.1504/ijbic.2010.033093,Optimal image colour extraction by differential evolution,Gerald Schaefer and Lars Nolle,2010,2,International Journal of Bio-Inspired Computation
10.1504/ijbic.2010.036160,A hybrid genetically-bacterial foraging algorithm converged by particle swarm optimisation for global optimisation,Tushar Jain and M.J. Nigam and Srinivasan Alavandar,2010,7,International Journal of Bio-Inspired Computation
10.1504/ijbic.2017.083145,Let the swarm be: an implicit elitism in swarm intelligence,Luis M. Torres Treviño,2017,2,International Journal of Bio-Inspired Computation
10.1504/ijbic.2021.10043938,An efficient ensemble framework for outlier detection using bio-inspired algorithm,Ganesh Vaidyanathan and Sharon Femi,2021,1,International Journal of Bio-Inspired Computation
10.1504/ijbic.2023.10048934,Bio-inspired Algorithms for Cybersecurity,Kwok Tai Chui and Xinyu Zhang and Mingbo Zhao and Ryan Wen Liu,2023,0,International Journal of Bio-Inspired Computation
10.1504/ijbic.2017.087920,A mathematical framework for possibility theory-based hidden Markov model,Neha Baranwal and G.C. Nandi,2017,2,International Journal of Bio-Inspired Computation
10.1504/ijbic.2013.055091,Using APPM-trained ANN to solve stochastic expected value mode,Lichao Chen and Lihu Pan and Chunxia Yang,2013,0,International Journal of Bio-Inspired Computation
10.1504/ijbic.2017.085334,Programmable DNA-mediated decision maker,Jian Jun Shu and Qi Wen Wang and Kian Yan Yong,2017,0,International Journal of Bio-Inspired Computation
10.1504/ijbic.2009.023813,A micro niche evolutionary algorithm with lower-dimensional-search crossover for optimisation problems with constraints,Sanyou Zeng and N.A. Yang and Yulong Shi and Xianqiang Yang and Bo Xiao and Song Gao and Danping Yu and Zu Yan,2009,1,International Journal of Bio-Inspired Computation
10.1504/ijbic.2018.090080,An elite opposition-flower pollination algorithm for a 0-1 knapsack problem,Mohamed Abdel Basset and Yongquan Zhou,2018,20,International Journal of Bio-Inspired Computation
10.1504/ijbic.2010.037022,A dynamic max-min ant system for solving the travelling salesman problem,Mohammad Reza Bonyadi and Hamed Shah Hosseini,2010,1,International Journal of Bio-Inspired Computation
10.1504/ijbic.2013.053058,APOA with parabola model for directing orbits of chaotic systems,Zhihua Cui and Shujing Fan and Jianchao Zeng and Zhongzhi Shi,2013,14,International Journal of Bio-Inspired Computation
10.1504/ijbic.2018.092799,An evolutionary approach to schedule deadline constrained bag of tasks in a cloud,S. Sindhu and Saswati Mukherjee,2018,3,International Journal of Bio-Inspired Computation
10.1504/ijbic.2019.103602,Bio-inspired innovative green fault recovery modelling for macro-femtocell mobile network,Sourav Hati and bashis De and Anwesha Mukherjee,2019,0,International Journal of Bio-Inspired Computation
10.1504/ijbic.2010.032125,Bee colony optimisation algorithm with big valley landscape exploitation for job shop scheduling problems,Li Pei Wong and Chi Yung Puan and Malcolm Yoke Hean Low and Yi Wen Wong and Chin Soon Chong,2010,13,International Journal of Bio-Inspired Computation
10.1504/ijbic.2016.081325,Modified multi-objective firefly algorithm for task scheduling problem on heterogeneous systems,R. Eswari and S. Nickolas,2016,7,International Journal of Bio-Inspired Computation
10.1504/ijbic.2017.085337,TRUST-TECH-enhanced differential evolution methodology for box-constrained nonlinear optimisation,Xuexia Zhang and Hsiao Dong Chiang and Weirong Chen,2017,2,International Journal of Bio-Inspired Computation
10.1504/ijbic.2010.037017,Modelling spatial self-organisation with swarm intelligence processes,Rawan Ghnemat and Cyrille Bertelle and Gerard H.E. Duchamp,2010,0,International Journal of Bio-Inspired Computation
10.1504/ijbic.2017.087918,An adaptive coevolutionary memetic algorithm for examination timetabling problems,Yu Lei and Maoguo Gong and Licheng Jiao and Jiao Shi and Yu Zhou,2017,3,International Journal of Bio-Inspired Computation
10.1504/ijbic.2009.022776,Fusion of clonal selection algorithm and harmony search method in optimisation of fuzzy classification systems,Xiaolei Wang and Xiao Zhi Gao and Seppo J. Ovaska,2009,41,International Journal of Bio-Inspired Computation
10.1504/ijbic.2016.10004304,Hybrid Symbiotic Organisms Search Algorithm for Solving 0-1 Knapsack Problem,Yongquan Zhou,2016,2,International Journal of Bio-Inspired Computation
10.1504/ijbic.2014.066972,An innovative artificial immune optimisation algorithm for solving complex optimisation problems,Alireza Askarzadeh,2014,2,International Journal of Bio-Inspired Computation
10.1504/ijbic.2010.030039,A novel hybrid particle swarm optimisation method applied to economic dispatch,Tao Zhang and Jin ding Cai,2010,10,International Journal of Bio-Inspired Computation
10.1504/ijbic.2022.10049011,An improved chemical reaction optimisation algorithm for the 0-1 knapsack problem,Abubakar Bala and Hamza Onoruoiza Salami,2022,0,International Journal of Bio-Inspired Computation
10.1504/ijbic.2018.10017838,IP assignment for efficient NoC-based system design using multi-objective particle swarm optimisation,Maamar Bougherara and Rym Rahmoun and Amel Sadok and Nadia Nedjah and Luiza De Macedo Mourelle and Djamel Bennouar,2018,1,International Journal of Bio-Inspired Computation
10.1504/ijbic.2018.10017484,An adaptive Reinforcement Learning based Bat Algorithm for structural design problems,Xiao Zhi Gao and Han Xiong Li and Xian Bing Meng,2018,2,International Journal of Bio-Inspired Computation
10.1504/ijbic.2022.10047725,Pigeon-inspired optimisation-based cooperative target searching for multi-UAV in uncertain environment,Yong Liu and Yang Xu and Jiang Shao and Delin Luo and Sijie Li,2022,0,International Journal of Bio-Inspired Computation
10.1504/ijbic.2017.10002823,Dynamic evolution of government's public trust in online collective behaviour: a social computing approach,Jin Li and Jundong Hou and Renbin Xiao,2017,1,International Journal of Bio-Inspired Computation
10.1504/ijbic.2016.10004350,An Elite Opposition-Flower Pollination Algorithm for a 0-1 Knapsack Problem,Mohamed Abdel Basset and Yongquan Zhou,2016,0,International Journal of Bio-Inspired Computation
10.1504/ijbic.2016.10004307,A Mathematical Framework for Possibility Theory Based Hidden Markov Model,Neha Baranwal,2016,0,International Journal of Bio-Inspired Computation
10.1504/ijbic.2017.10004356,Using differential search algorithm for solving optimal frequency regulation problem in interconnected power system,Mohamed Boudour and Mohamed Menaa and Mourad Hasni and Nour El Yakine Kouba,2017,0,International Journal of Bio-Inspired Computation
10.1504/ijbic.2015.10004318,An Adaptive Coevolutionary Memetic Algorithm for Examination Timetabling Problems,Maoguo Gong,2015,0,International Journal of Bio-Inspired Computation
10.1504/ijbic.2016.10000416,A hybrid discrete firefly algorithm to solve flow shop scheduling problems to minimise total flow time,M. Geetha and M.K. Marichelvam,2016,0,International Journal of Bio-Inspired Computation
10.1504/ijbic.2016.10002270,Modified multi-objective firefly algorithm for task scheduling problem on heterogeneous systems,S. Nickolas and R. Eswari,2016,0,International Journal of Bio-Inspired Computation
10.1504/ijbic.2020.10028001,Quantum inspired monarch butterfly optimisation for UCAV path planning navigation problem,Xiang Jun Zhao and Mei Lu and Jiao Hong Yi,2020,0,International Journal of Bio-Inspired Computation
10.1504/ijbic.2017.10004416,A Meta-heuristic Learning Approach for the Non-Intrusive Detection of Impersonation Attacks in Social Networks,Sancho Salcedo Sanz and Miren Nekane Bilbao and Sergio Gil Lopez and Esther Villar Rodriguez and Javier Del Ser,2017,0,International Journal of Bio-Inspired Computation
10.1504/ijbic.2017.10004418,Robust Variant of Artificial Bee Colony (JA-ABC4b) Algorithm,Abdul Gani Abro and Junita Mohamad Saleh and Noorazliza Sulaiman,2017,0,International Journal of Bio-Inspired Computation
10.1504/ijbic.2019.10021677,Cloud service composition using an inverted ant colony optimisation algorithm,Nima Jafari Navimipour and Saied Asghari,2019,1,International Journal of Bio-Inspired Computation
10.1504/ijbic.2021.10035658,A modified machine learning classification for dental age assessment with effectual ACM-JO based segmentation,Hemalatha Balan,2021,0,International Journal of Bio-Inspired Computation
10.1504/ijbic.2016.10004298,A Novel Artificial Bee Colony Optimizer with Dynamic Population Size for Multi-level Threshold Image Segmentation,Xingwei Wang and Lianbo Ma and Hai Shen,2016,0,International Journal of Bio-Inspired Computation
10.1504/ijbic.2016.10002269,Slow feature action prototypes effect assessment in mechanism for recognition of biological movement ventral stream,Bardia Yousefi and Chu Kiong Loo,2016,0,International Journal of Bio-Inspired Computation
10.1504/ijbic.2021.10037534,Classification of diversified web crawler accesses inspired by biological adaptation,Masayuki Murata and Naomi Kuze and Shu Ishikura and Daiki Chiba and Takeshi Yagi,2021,0,International Journal of Bio-Inspired Computation
10.1504/ijbic.2021.10043012,Modelling the green supply chain of hotels based on front-back stage decoupling: perspective of ant colony labour division,Changbing Jiang and Chonghuan Xu and Shufang Li and Tinggui Chen and Ruolan Li and Jue Chen,2021,0,International Journal of Bio-Inspired Computation
10.1504/ijbic.2019.10021706,Cuckoo search algorithm with different distribution strategy,Fei Xue and Hengliang Tang,2019,1,International Journal of Bio-Inspired Computation
10.1504/ijbic.2017.10004005,Bio-inspired parallel computing of representative geometrical objects of holes of binary 2D-images,Miguel A. Gutiérrez Naranjo and Ainhoa Berciano and Daniel Díaz Pernil and Francisco Peña Cantillana,2017,0,International Journal of Bio-Inspired Computation
10.1504/ijbic.2016.10004295,Optimal Power Flow using Clustered Adaptive Teaching Learning Based Optimization,Surender Reddy Salkuti,2016,0,International Journal of Bio-Inspired Computation
10.1504/ijbic.2021.10043758,Perfectly convergent particle swarm optimisation in multidimensional space,Uma Nangia and Devinder Kumar and N.K. Jain,2021,0,International Journal of Bio-Inspired Computation
10.1504/ijbic.2017.10004333,Using the metaheuristic methods for real-time optimization of dynamic school bus routing problem and an application,Ozkan Unsal and Tuncay Yigit and Omer Deperlioglu,2017,0,International Journal of Bio-Inspired Computation
10.1504/ijbic.2020.10032004,Nanoindentation analysis comparing dragonfly-inspired biomimetic micro-aerial vehicle (BMAV) wings,Elham Montazer and Nik Nazri Nik Ghazali and Erfan Salami and Thomas A. Ward,2020,0,International Journal of Bio-Inspired Computation
10.1504/ijbic.2019.10025524,A memetic imperialist competitive algorithm with chaotic maps for multi-layer neural network training,Seyed Jalaleddin Mousavirad and Azam Asilian Bidgoli and Hossein Ebrahimpour Komleh and Gerald Schaefer,2019,1,International Journal of Bio-Inspired Computation
10.1504/ijbic.2020.10027567,NSGA-III algorithm with maximum ranking strategy for many-objective optimisation,Fei Xue and Di Wu,2020,0,International Journal of Bio-Inspired Computation
10.1504/ijbic.2020.10033321,Forward feature extraction from imbalanced microarray datasets using wrapper based incremental genetic algorithm,V. Devisurya and N. Anitha and R. Sivaraj and R. Devi Priya,2020,0,International Journal of Bio-Inspired Computation
10.1504/ijbic.2020.10031126,Bio-inspired parameter-less heuristic for NP-hard (complete) discrete problems,Manal Zettam,2020,0,International Journal of Bio-Inspired Computation
10.1504/ijbic.2021.10043756,Performance assessment of biogeography-based multi-objective algorithm for frequency assignment problem,Karima Benatchba and Malika Bessedik and Leila Hamdad and Asma Daoudi,2021,0,International Journal of Bio-Inspired Computation
10.1504/ijbic.2020.10027530,Dynamic economic emission dispatch problem with renewable integration focusing on deficit scenario in India,Rengaraj Ramasubbu and Hithu Anand,2020,0,International Journal of Bio-Inspired Computation
10.1504/ijbic.2021.10040613,Binary fireworks algorithm application for optimal schedule of electric vehicle reserve in traditional and restructured electricity markets,Vishu Gupta and Rajesh Kumar and Bijaya Ketan Panigrahi and Srikanth Reddy Konda and Lokesh Kumar Panwar,2021,0,International Journal of Bio-Inspired Computation
10.1504/ijbic.2022.10045417,An adaptive ant colony optimisation for improved lane detection in intelligent automobile vehicles,Muhammed Bashir Mu'azu and Olubukola Ishola Oyenike and Ime Jarlath Umoh and Bashir Olaniyi Sadiq and Ahmed Tijani Salawudeen,2022,0,International Journal of Bio-Inspired Computation
10.1504/ijbic.2021.10037538,Join query optimisation in the distributed databases using a hybrid harmony search and artificial bee colony algorithm,Manizheh Yazdani and Nima Jafari Navimipour,2021,0,International Journal of Bio-Inspired Computation
10.1504/ijbic.2021.10038738,Application of Constriction Coefficient Based Particle Swarm Optimization and Gravitational Search Algorithm for Solving Practical Engineering Design Problems,P. Shanthi Bala and Sajad Ahmad Rather,2021,0,International Journal of Bio-Inspired Computation
10.1504/ijbic.2021.10035834,Expediting population diversification in evolutionary computation with quantum algorithm,Chang Wook Ahn and Jun Suk Kim,2021,0,International Journal of Bio-Inspired Computation
10.1504/ijbic.2020.10035953,Top-Down modulated model for object recognition in different categorization levels,Abbas Nowzari Dalini and Mohammad Ganjtabesh and Fatemeh Sharifizadeh,2020,0,International Journal of Bio-Inspired Computation
10.1504/ijbic.2021.10043013,A novel oversampling technique based on the manifold distance for class imbalance learning,Fengzhen Tang and Shengxiang Yang and Jian Cheng and Lingkai Yang and Botao Jiao and Yinan Guo,2021,0,International Journal of Bio-Inspired Computation
10.1504/ijbic.2016.10000256,Applying the ant colony optimisation algorithm to the capacitated multi-depot vehicle routing problem,Jan Mazal and Petr Stodola,2016,24,International Journal of Bio-Inspired Computation
10.1504/ijbic.2018.091748,Automatic diagnosis of pulmonary nodules using a hierarchical extreme learning machine model,Rui Hao and Zilin Qiang and Yan Qiang and Lei Ge and Juanjuan Zhao,2018,1,International Journal of Bio-Inspired Computation
10.1504/ijbic.2012.047239,Slime mould computes planar shapes,Andrew Adamatzky,2012,19,International Journal of Bio-Inspired Computation
10.1504/ijbic.2017.085899,Network size and topology impact on trust-based ranking,Vincenza Carchiolo and Alessandro Longheu and Michele Malgeri and Giuseppe Mangioni,2017,2,International Journal of Bio-Inspired Computation
10.1504/ijbic.2017.087922,A clustering algorithm based on elitist evolutionary approach,Lydia Boudjeloud Assala and Ta Minh Thuy,2017,1,International Journal of Bio-Inspired Computation
10.1504/ijbic.2015.067987,Swarm intelligence approaches for cover scheduling problem in wireless sensor networks,Vuyyuru Gopinadh and Alok Singh,2015,9,International Journal of Bio-Inspired Computation
10.1504/ijbic.2019.098407,Intelligent swarm firefly algorithm for the prediction of China's national electricity consumption,Guangfeng Zhang and Yi Chen and Yun Li and Hongnian Yu and osheng Hu and Shaomin Wu,2019,8,International Journal of Bio-Inspired Computation
10.1504/ijbic.2012.049890,Reasoning with disposition using DNA tweezers,Kumar Sankar Ray and Mandrita Mondal,2012,1,International Journal of Bio-Inspired Computation
10.1504/ijbic.2017.085894,Extending the SACOC algorithm through the Nyström method for dense manifold data analysis,Héctor D. Menéndez and Fernando E.B. Otero and David Camacho,2017,3,International Journal of Bio-Inspired Computation
10.1504/ijbic.2010.036158,Correlation based feature selection method,K. Michalak and H. Kwasnicka,2010,25,International Journal of Bio-Inspired Computation
10.1504/ijbic.2018.091233,An alternative approach for particle swarm optimisation using serendipity,Fábio Augusto Procópio Paiva and Josè Alfredo Ferreira Costa and Cláudio Rodrigues Muniz Silva,2018,2,International Journal of Bio-Inspired Computation
10.1504/ijbic.2013.053039,Bacteria foraging optimisation algorithm for optimal FIR filter design,Suman Kumar Saha and Rajib Kar and Durbadal Mandal and Sakti Prasad Ghoshal,2013,22,International Journal of Bio-Inspired Computation
10.1504/ijbic.2021.114089,A modified machine learning classification for dental age assessment with effectual ACM-JO based segmentation,B. Hemalatha and N. Rajkumar,2021,3,International Journal of Bio-Inspired Computation
10.1504/ijbic.2020.112353,Application an improved swarming optimisation in attribute reduction,Yi Zhang and Xingjuan Cai and Honglie Zhu and Yong Xu,2020,4,International Journal of Bio-Inspired Computation
10.1504/ijbic.2022.10048845,Data-driven artificial bee colony algorithm based on radial basis function neural network,Luqi Zhang and Tingyu Ye and Wenjun Wang and Hui Wang and Tao Zeng and Jia Zhao,2022,0,International Journal of Bio-Inspired Computation
10.1504/ijbic.2019.097723,A novel artificial bee colony optimiser with dynamic population size for multi-level threshold image segmentation,Lianbo Ma and Xingwei Wang and Hai Shen and Min Huang,2019,8,International Journal of Bio-Inspired Computation
10.1504/ijbic.2022.10052594,Optimised coordinated control of hybrid AC/DC microgrids along PV-wind-battery: a hybrid based model,S. Shobana and B.K. Gnanavel,2022,0,International Journal of Bio-Inspired Computation
10.1504/ijbic.2022.10052580,A parallel algorithm to solve the multiple travelling salesmen problem based on molecular computing model,Zhaocai Wang and Dangwei Wang and Anjun Deng and Tunhua Wu,2022,0,International Journal of Bio-Inspired Computation
10.1504/ijbic.2018.090093,Iterative sequential bat algorithm for free-form rational Bézier surface reconstruction,Andrès Iglesias and Akemi Gálvez and Marta Collantes,2018,12,International Journal of Bio-Inspired Computation
10.1504/ijbic.2018.092807,Preselection via classification: a case study on global optimisation,Jinyuan Zhang and Aimin Zhou and Guixu Zhang,2018,7,International Journal of Bio-Inspired Computation
10.1504/ijbic.2021.118092,Fittest survival: an enhancement mechanism for Monte Carlo tree search,Jiajia Zhang and Xiaozhen Sun and Dandan Zhang and Xuan Wang and Shuhan Qi and Tao Qian,2021,1,International Journal of Bio-Inspired Computation
10.1504/ijbic.2019.101152,Markov approach for quantifying the software code coverage using genetic algorithm in software testing,M. Boopathi and R. Sujatha and C. Senthil Kumar and S. Narasimman and A. Rajan,2019,5,International Journal of Bio-Inspired Computation
10.1504/ijbic.2014.062634,Ant colony optimisation for resource searching in dynamic peer-to-peer grids,Kamil Krynicki and Javier Jaen and Jose A. Mocholí,2014,12,International Journal of Bio-Inspired Computation
10.1504/ijbic.2015.067981,New progresses in swarm intelligence-based computation,Haibin Duan and Qinan Luo,2015,40,International Journal of Bio-Inspired Computation
10.1504/ijbic.2019.097724,Multi-swarm cooperative multi-objective bacterial foraging optimisation,Ben Niu and Jing Liu and Lijing Tan,2019,8,International Journal of Bio-Inspired Computation
10.1504/ijbic.2022.127505,Techno-economic analysis of novel multi-objective soft computing technique,Gourab Das,2022,0,International Journal of Bio-Inspired Computation
10.1504/ijbic.2014.065002,Modified random localisation-based DE for static economic power dispatch with generator constraints,Pravesh Kumar and Millie Pant,2014,8,International Journal of Bio-Inspired Computation
10.1504/ijbic.2010.030043,Robust decoupling control of BTT vehicle based on PSO,Zhi xiang Deng and Yong ji Wang and Fan Gu and Chuan feng Li,2010,8,International Journal of Bio-Inspired Computation
10.1504/ijbic.2015.069291,Improved genetic algorithms for solving the optimisation tasks for design of access control schemes in computer networks,Igor Kotenko and Igor Saenko,2015,11,International Journal of Bio-Inspired Computation
