DOI,Título,Autores,Año,Citas,Revista
10.1007/s10845-010-0461-9,Developing a varietal GA with ESMA strategy for solving the pick and place problem in printed circuit board assembly line,Pei-Chann Chang and Wei-Hsiu Huang and Ching-Jung Ting,2012,11,Journal of Intelligent Manufacturing
10.1007/s10845-013-0759-5,Key characteristics-based sensor distribution in multi-station assembly processes,Nagesh Shukla and Dariusz Ceglarek and Manoj K. Tiwari,2015,20,Journal of Intelligent Manufacturing
10.1007/s10845-016-1288-9,Integrating part modeling and assembly modeling from the perspective of process,Zhi-Jia Xu and Pan Wang and Qing-Hui Wang and Jing-Rong Li,2019,5,Journal of Intelligent Manufacturing
10.1007/s10845-015-1067-z,An optimizing model to solve the nesting problem of rectangle pieces based on genetic algorithm,Hongtao Tang and Xixing Li and Shunsheng Guo and Shuwei Liu and Li Li and Lang Huang,2017,8,Journal of Intelligent Manufacturing
10.1007/s10845-013-0839-6,Learning and reuse of engineering ramp-up strategies for modular assembly systems,Daniele Scrimieri and Robert F. Oates and Svetan M. Ratchev,2015,12,Journal of Intelligent Manufacturing
10.1007/s10845-014-0885-8,A quantitative estimation technique for welding quality using local mean decomposition and support vector machine,Kuanfang He and Xuejun Li,2016,32,Journal of Intelligent Manufacturing
10.1007/s10845-012-0634-9,A capacity allocation and expansion model for TFT-LCD multi-site manufacturing,Tzu-Li Chen and Yin-Yann Chen and Hao-Chun Lu,2013,15,Journal of Intelligent Manufacturing
10.1007/s10845-013-0831-1,Multi-responses optimization of ultrasonic machining process,R. Teimouri and H. Baseri and Rasoul Moharami,2015,24,Journal of Intelligent Manufacturing
10.1007/s10845-014-0925-4,Parameter optimization of advanced machining processes using cuckoo optimization algorithm and hoopoe heuristic,Mohamed Arezki Mellal and Edward J. Williams,2016,44,Journal of Intelligent Manufacturing
10.1007/s10845-019-01491-y,Shop floor data-driven spatial–temporal verification for manual assembly planning,Wei Fang and Lianyu Zheng,2020,3,Journal of Intelligent Manufacturing
10.1007/s10845-009-0374-7,An adaptive multi-population genetic algorithm to solve the multi-objective group scheduling problem in hybrid flexible flowshop with sequence-dependent setup times,M. Zandieh and N. Karimi,2011,52,Journal of Intelligent Manufacturing
10.1007/s10845-017-1354-y,The impact of information sharing on bullwhip effect reduction in a supply chain,Kiyoung Jeong and Jae-Dong Hong,2019,26,Journal of Intelligent Manufacturing
10.1007/s10845-015-1096-7,Expectation effect of perceptual experience in sensory modality transitions: modeling with information theory,Hideyoshi Yanagisawa and Kenji Takatsuji,2017,6,Journal of Intelligent Manufacturing
10.1007/s10845-016-1258-2,BIOSOARM: a bio-inspired self-organising architecture for manufacturing cyber-physical shopfloors,João Dias-Ferreira and Luis Ribeiro and Hakan Akillioglu and Pedro Neves and Mauro Onori,2018,26,Journal of Intelligent Manufacturing
10.1007/s10845-007-0061-5,Editorial,Luis M. Camarinha-Matos,2007,16,Journal of Intelligent Manufacturing
10.1007/s10845-021-01819-7,An assembly timing planning method based on knowledge and mixed integer linear programming,Jiahui Qian and Zhijing Zhang and Lingling Shi and Dan Song,2023,1,Journal of Intelligent Manufacturing
10.1007/s10845-021-01822-y,Predicting the quality of a machined workpiece with a variational autoencoder approach,Antoine Proteau and Antoine Tahan and Ryad Zemouri and Marc Thomas,2023,7,Journal of Intelligent Manufacturing
10.1007/s10845-010-0382-7,Optimization process planning using hybrid genetic algorithm and intelligent search for job shop machining,Mojtaba Salehi and Ardeshir Bahreininejad,2011,38,Journal of Intelligent Manufacturing
10.1007/s10845-013-0736-z,A cost-based module mining method for the assemble-to-order strategy,Chieh-Yuan Tsai and Chih-Jung Chen and Yu-Ting Lo,2014,6,Journal of Intelligent Manufacturing
10.1007/s10845-020-01669-9,On-line prediction of ultrasonic elliptical vibration cutting surface roughness of tungsten heavy alloy based on deep learning,Yanan Pan and Renke Kang and Zhigang Dong and Wenhao Du and Sen Yin and Yan Bao,2022,20,Journal of Intelligent Manufacturing
10.1007/s10845-020-01606-w,Skill transfer support model based on deep learning,Kung-Jeng Wang and Diwanda Ageng Rizqi and Hong-Phuc Nguyen,2021,18,Journal of Intelligent Manufacturing
10.1007/s10845-015-1042-8,Advanced manufacturing systems: socialization characteristics and trends,F. Tao and Y. Cheng and L. Zhang and A. Y. C. Nee,2017,211,Journal of Intelligent Manufacturing
10.1007/s10845-008-0207-0,Rolling-horizon and fix-and-relax heuristics for the multi-product multi-level capacitated lotsizing problem with sequence-dependent setups,M. Mohammadi and S. M. T. Fatemi Ghomi and B. Karimi and S. A. Torabi,2010,52,Journal of Intelligent Manufacturing
10.1007/s10845-012-0626-9,A GEP-based reactive scheduling policies constructing approach for dynamic flexible job shop scheduling problem with job release dates,Li Nie and Liang Gao and Peigen Li and Xinyu Li,2013,90,Journal of Intelligent Manufacturing
10.1023/a:1019984626631,n.m.,C. K. Kwong and H. Bai,2002,258,Journal of Intelligent Manufacturing
10.1007/s10845-015-1084-y,Optimisation of distributed manufacturing flexible job shop scheduling by using hybrid genetic algorithms,Hao-Chin Chang and Tung-Kuan Liu,2017,69,Journal of Intelligent Manufacturing
10.1007/s10845-015-1080-2,Correlation-aware QoS modeling and manufacturing cloud service composition,Hong Jin and Xifan Yao and Yong Chen,2017,112,Journal of Intelligent Manufacturing
10.1007/s10845-023-02099-z,A novel approach for tool condition monitoring based on transfer learning of deep neural networks using time–frequency images,Yao Li and Zhengcai Zhao and Yucan Fu and Qingliang Chen,2023,0,Journal of Intelligent Manufacturing
10.1007/s10845-022-02044-6,In-situ prediction of machining errors of thin-walled parts: an engineering knowledge based sparse Bayesian learning approach,Hao Sun and Shengqiang Zhao and Fangyu Peng and Rong Yan and Lin Zhou and Teng Zhang and Chi Zhang,2022,0,Journal of Intelligent Manufacturing
10.1007/s10845-017-1387-2,A Cloud-based solution/reference architecture for establishing collaborative networked organizations,Mohammad Reza Mollahoseini Ardakani and Seyyed Mohsen Hashemi and Mohammadreza Razzazi,2019,6,Journal of Intelligent Manufacturing
10.1007/s10845-009-0244-3,A new bottleneck detecting approach to productivity improvement of knowledgeable manufacturing system,Hong-Sen Yan and Yu-Wei An and Wen-Wu Shi,2010,10,Journal of Intelligent Manufacturing
10.1007/s10845-011-0600-y,Competence maps using agglomerative hierarchical clustering,Ahmad Barirani and Bruno Agard and Catherine Beaudry,2013,11,Journal of Intelligent Manufacturing
10.1007/s10845-012-0653-6,Test-driven forensic analysis of satellite automotive navigation systems,Kyung-Soo Lim and Changhoon Lee and Jong Hyuk Park and Sang-Jin Lee,2014,5,Journal of Intelligent Manufacturing
10.1007/s10845-021-01738-7,Synthetic image data augmentation for fibre layup inspection processes: Techniques to enhance the data set,Sebastian Meister and Nantwin Möller and Jan Stüve and Roger M. Groves,2021,15,Journal of Intelligent Manufacturing
10.1007/s10845-012-0718-6,Vector optimization of laser solid freeform fabrication system using a hierarchical mutable smart bee-fuzzy inference system and hybrid NSGA-II/self-organizing map,Alireza Fathi and Ahmad Mozaffari,2014,35,Journal of Intelligent Manufacturing
10.1007/s10845-019-01503-x,Formal modeling of cyber-physical resource scheduling in IIoT cloud environments,Shashi Bhushan Jha and Radu F. Babiceanu and Remzi Seker,2020,13,Journal of Intelligent Manufacturing
10.1007/s10845-009-0373-8,A simulated annealing algorithm approach to hybrid flow shop scheduling with sequence-dependent setup times,H. S. Mirsanei and M. Zandieh and M. J. Moayed and M. R. Khabbazi,2011,58,Journal of Intelligent Manufacturing
10.1007/s10845-008-0081-9,Artificial neural network models for the prediction of surface roughness in electrical discharge machining,Angelos P. Markopoulos and Dimitrios E. Manolakos and Nikolaos M. Vaxevanidis,2008,102,Journal of Intelligent Manufacturing
10.1007/s10845-021-01806-y,An imbalanced data learning method for tool breakage detection based on generative adversarial networks,Shixu Sun and Xiaofeng Hu and Yingchao Liu,2022,4,Journal of Intelligent Manufacturing
10.1007/s10845-022-01948-7,A novel vision-based method for loosening detection of marked T-junction pipe fittings integrating GAN-based segmentation and SVM-based classification algorithms,Xinjian Deng and Jianhua Liu and Hao Gong and Jiayu Huang,2022,1,Journal of Intelligent Manufacturing
10.1023/a:1013629013031,n.m.,Pitipong Veerakamolmal and Surendra M. Gupta,2002,48,Journal of Intelligent Manufacturing
10.1007/s10845-022-01976-3,Cascaded foreign object detection in manufacturing processes using convolutional neural networks and synthetic data generation methodology,Jixiang Tang and Huan Zhou and Tiankui Wang and Zhenxun Jin and Youli Wang and Xuanyin Wang,2022,2,Journal of Intelligent Manufacturing
10.1007/s10845-013-0818-y,A self-adaptation scheme for workflow management in multi-agent systems,Fu-Shiung Hsieh and Jim-Bon Lin,2016,24,Journal of Intelligent Manufacturing
10.1007/s10845-011-0539-z,An agent-based system for orchestration support of web service-enabled devices in discrete manufacturing systems,Vladimir Villaseñor Herrera and Axel Vidales Ramos and José L. Martínez Lastra,2012,12,Journal of Intelligent Manufacturing
10.1007/s10845-009-0338-y,Developing a framework for performance analysis of a production process controlled by Kanban and CONWIP,Yaghoub Khojasteh-Ghamari,2012,14,Journal of Intelligent Manufacturing
10.1023/b:jims.0000042665.10086.cf,A simulated annealing algorithm for multi-agent systems: a job-shop scheduling application,M. Emin Aydin and Terence C. Fogarty,2004,45,Journal of Intelligent Manufacturing
10.1023/a:1011208828486,n.m.,Fadi Sandakly and João Garcia and Paulo Ferreira and Patrice Poyet,2001,15,Journal of Intelligent Manufacturing
10.1007/s10845-022-02019-7,GPyro: uncertainty-aware temperature predictions for additive manufacturing,Iason Sideris and Francesco Crivelli and Markus Bambach,2023,0,Journal of Intelligent Manufacturing
10.1007/s10845-022-01982-5,Hybrid algorithm based on reinforcement learning for smart inventory management,Carlos Cuartas and Jose Aguilar,2023,0,Journal of Intelligent Manufacturing
10.1007/s10845-016-1232-z,Inventory management for a remanufacture-to-order production with multi-components (parts),Fei Zhang and Zailin Guan and Li Zhang and Yanyan Cui and Pengxing Yi and Saif Ullah,2019,9,Journal of Intelligent Manufacturing
10.1007/s10845-022-02002-2,Smart retrofitting in maintenance: a systematic literature review,David Sanchez-Londono and Giacomo Barbieri and Luca Fumagalli,2023,1,Journal of Intelligent Manufacturing
10.1007/s10845-008-0142-0,A new multi-agent system framework for tacit knowledge management in manufacturing supply chains,Khalid Al-Mutawah and Vincent Lee and Yen Cheung,2009,43,Journal of Intelligent Manufacturing
10.1023/a:1011222808912,n.m.,Dursun Delen and David B. Pratt and Manjunath Kamath,2001,3,Journal of Intelligent Manufacturing
10.1007/s10845-021-01754-7,Machine learning in continuous casting of steel: a state-of-the-art survey,David Cemernek and Sandra Cemernek and Heimo Gursch and Ashwini Pandeshwar and Thomas Leitner and Matthias Berger and Gerald Klösch and Roman Kern,2022,11,Journal of Intelligent Manufacturing
10.1007/s10845-022-01981-6,Deep generative model with time series-image encoding for manufacturing fault detection in die casting process,Jiyoung Song and Young Chul Lee and Jeongsu Lee,2022,2,Journal of Intelligent Manufacturing
10.1007/s10845-021-01890-0,Comparison of algorithms for error prediction in manufacturing with automl and a cost-based metric,Alexander Gerling and Holger Ziekow and Andreas Hess and Ulf Schreier and Christian Seiffer and Djaffar Ould Abdeslam,2022,3,Journal of Intelligent Manufacturing
10.1007/s10845-019-01531-7,Machine learning applied in production planning and control: a state-of-the-art in the era of industry 4.0,Juan Pablo Usuga Cadavid and Samir Lamouri and Bernard Grabot and Robert Pellerin and Arnaud Fortin,2020,105,Journal of Intelligent Manufacturing
10.1007/s10845-020-01599-6,Deep convolutional neural network aided optimization for cold spray 3D simulation based on molecular dynamics,Zhenxing Cheng and Hu Wang and Gui-Rong Liu,2021,6,Journal of Intelligent Manufacturing
10.1007/s10845-015-1095-8,Product attributes and user experience design: how to convey product information through user-centered service,Chiuhsiang Joe Lin and Lai-Yu Cheng,2017,13,Journal of Intelligent Manufacturing
10.1007/s10845-019-01476-x,Segmentation-based deep-learning approach for surface-defect detection,Domen Tabernik and Samo Šela and Jure Skvarč and Danijel Skočaj,2020,269,Journal of Intelligent Manufacturing
10.1007/s10845-018-1419-6,An upgraded firefly algorithm with feasibility-based rules for constrained engineering optimization problems,Ivona Brajević and Jelena Ignjatović,2019,31,Journal of Intelligent Manufacturing
10.1007/s10845-014-0903-x,A multi-stage control chart pattern recognition scheme based on independent component analysis and support vector machine,Ling-Jing Kao and Tian-Shyug Lee and Chi-Jie Lu,2016,28,Journal of Intelligent Manufacturing
10.1007/s10845-016-1290-2,Product design and manufacturing process based ontology for manufacturing knowledge reuse,Peter Chhim and Ratna Babu Chinnam and Noureddin Sadawi,2019,48,Journal of Intelligent Manufacturing
10.1007/s10845-020-01670-2,A steel surface defect inspection approach towards smart industrial monitoring,Ruiyang Hao and Bingyu Lu and Ying Cheng and Xiu Li and Biqing Huang,2021,36,Journal of Intelligent Manufacturing
10.1007/s10845-020-01724-5,A digital twin emulator of a modular production system using a data-driven hybrid modeling and simulation approach,Konstantinos Mykoniatis and Gregory A. Harris,2021,24,Journal of Intelligent Manufacturing
10.1007/s10845-021-01750-x,Remaining useful life estimation via transformer encoder enhanced by a gated convolutional unit,Yu Mo and Qianhui Wu and Xiu Li and Biqing Huang,2021,40,Journal of Intelligent Manufacturing
10.1007/s10845-021-01833-9,Correction to: A data-driven method for performance analysis and improvement in production systems with quality inspection,Jun-Qiang Wang and Yun-Lei Song and Peng-Hao Cui and Yang Li,2023,1,Journal of Intelligent Manufacturing
10.1007/s10845-017-1294-6,A novel differential evolution algorithm for solving constrained engineering optimization problems,Ali Wagdy Mohamed,2018,92,Journal of Intelligent Manufacturing
10.1007/s10845-009-0356-9,An artificial neural network method for remaining useful life prediction of equipment subject to condition monitoring,Zhigang Tian,2012,225,Journal of Intelligent Manufacturing
10.1007/s10845-015-1039-3,An effective and distributed particle swarm optimization algorithm for flexible job-shop scheduling problem,Maroua Nouiri and Abdelghani Bekrar and Abderezak Jemai and Smail Niar and Ahmed Chiheb Ammari,2018,222,Journal of Intelligent Manufacturing
10.1007/s10845-013-0776-4,QCs-linkage model based quality problem processing framework: a Chinese experience in complex product development,Gui-jiang Duan and Yang Wang,2015,8,Journal of Intelligent Manufacturing
10.1007/s10845-021-01878-w,Automated surface defect detection framework using machine vision and convolutional neural networks,Swarit Anand Singh and K. A. Desai,2023,11,Journal of Intelligent Manufacturing
10.1023/b:jims.0000010073.54241.e7,Knowledge discovery from industrial databases,Christine Gertosio and Alan Dussauchoy,2004,25,Journal of Intelligent Manufacturing
10.1007/s10845-015-1163-0,Prototyping strategies for multisensory product experience engineering,Francesco Ferrise and Serena Graziosi and Monica Bordegoni,2017,19,Journal of Intelligent Manufacturing
10.1007/s10845-013-0751-0,A correlation-driven optimal service selection approach for virtual enterprise establishment,Quanwang Wu and Qingsheng Zhu and Mingqiang Zhou,2014,40,Journal of Intelligent Manufacturing
10.1007/s10845-008-0122-4,Improved control and simulation models of a tricycle collaborative robot,Z. M. Bi and Sherman Y. T. Lang and Lihui Wang,2008,17,Journal of Intelligent Manufacturing
10.1007/s10845-022-02030-y,State identification of a 5-axis ultra-precision CNC machine tool using energy consumption data assisted by multi-output densely connected 1D-CNN model,Zhicheng Xu and Vignesh Selvaraj and Sangkee Min,2022,1,Journal of Intelligent Manufacturing
10.1023/a:1011201009821,n.m.,Ming-Hung Lin and Li-Chen Fu,2001,12,Journal of Intelligent Manufacturing
10.1007/s10845-008-0083-7,Probability based vehicle fault diagnosis: Bayesian network method,Yingping Huang and Ross McMurran and Gunwant Dhadyalla and R. Peter Jones,2008,54,Journal of Intelligent Manufacturing
10.1007/s10845-005-5511-3,Mapping Product Design Specification for Mass Customization,Rajeev Krishnapillai and Abe Zeid,2006,27,Journal of Intelligent Manufacturing
10.1007/s10845-009-0294-6,A two-stage genetic algorithm for multi-objective job shop scheduling problems,Voratas Kachitvichyanukul and Siriwan Sitthitham,2011,34,Journal of Intelligent Manufacturing
10.1007/s10845-010-0493-1,Extended value network modelling and simulation for mass customization implementation,Joanna Daaboul and Alain Bernard and Florent Laroche,2012,17,Journal of Intelligent Manufacturing
10.1007/s10845-016-1267-1,Assessing the cost structure of component reuse in a product family for remanufacturing,Wenyuan Wang and Daniel Y. Mo and Yue Wang and Mitchell M. Tseng,2019,15,Journal of Intelligent Manufacturing
10.1007/s10845-008-0082-8,Simulation based optimization of a train maintenance facility,Yasmina Hani and Lionel Amodeo and Farouk Yalaoui and Haoxun Chen,2008,17,Journal of Intelligent Manufacturing
10.1007/s10845-011-0580-y,Dynamic scheduling for multi-site companies: a decisional approach based on reinforcement multi-agent learning,N. Aissani and A. Bekrar and D. Trentesaux and B. Beldjilali,2012,44,Journal of Intelligent Manufacturing
10.1007/s10845-012-0708-8,Optimizing bi-objective imperfect preventive maintenance model for series-parallel system using established hybrid genetic algorithm,Chung-Ho Wang and Sheng-Wang Tsai,2014,29,Journal of Intelligent Manufacturing
10.1007/s10845-018-1450-7,"Joint optimization of capacity, production and maintenance planning of leased machines",Zied Hajej and Nidhal Rezg and Tarek Askri,2020,4,Journal of Intelligent Manufacturing
10.1007/s10845-010-0457-5,Soft computing based on interval valued fuzzy ANP-A novel methodology,Behnam Vahdani and Hasan Hadipour and Reza Tavakkoli-Moghaddam,2012,23,Journal of Intelligent Manufacturing
10.1007/s10845-021-01852-6,A hybrid prognosis approach for life prediction of gears subjected to progressive pitting failure mode,Pradeep Kundu and Makarand S.Kulkarni and Ashish K.Darpe,2023,2,Journal of Intelligent Manufacturing
10.1007/s10845-014-0959-7,A modified particle swarm optimization algorithm to mixed-model two-sided assembly line balancing,Yılmaz Delice and Emel Kızılkaya Aydoğan and Uğur Özcan and Mehmet Sıtkı İlkay,2017,101,Journal of Intelligent Manufacturing
10.1007/s10845-015-1033-9,A new model for single machine scheduling with uncertain processing time,Kai Hu and Xingfang Zhang and Mitsuo Gen and Jungbok Jo,2017,18,Journal of Intelligent Manufacturing
10.1007/s10845-018-1458-z,Solar cell surface defect inspection based on multispectral convolutional neural network,Haiyong Chen and Yue Pang and Qidi Hu and Kun Liu,2020,70,Journal of Intelligent Manufacturing
10.1007/s10845-008-0236-8,Optimization of parts scheduling in multiple cells considering intercell move using scatter search approach,Jiafu Tang and Xiaoqing Wang and Iko Kaku and Kai-leung Yung,2010,38,Journal of Intelligent Manufacturing
10.1007/s10845-022-01987-0,Evaluation of the reliability of resistance spot welding control via on-line monitoring of dynamic resistance,Sergey Butsykin and Anton Gordynets and Alexey Kiselev and Mikhail Slobodyan,2022,1,Journal of Intelligent Manufacturing
10.1007/s10845-017-1356-9,Correlation analysis among audible sound emissions and machining parameters in hardened steel turning,Edielson P. Frigieri and Carlos A. Ynoguti and Anderson P. Paiva,2019,8,Journal of Intelligent Manufacturing
10.1007/s10845-005-7022-7,An autonomous decentralized supply chain planning system for multi-stage production processes,Tatsushi Nishi and Masami Konishi and Shinji Hasebe,2005,25,Journal of Intelligent Manufacturing
10.1023/a:1013693828052,n.m.,Miran Brezocnik and Joze Balic and Karl Kuzman,2002,13,Journal of Intelligent Manufacturing
10.1007/s10845-009-0248-z,RETRACTED ARTICLE: An integrated parallel GNFS algorithm for integer factorization based on Linbox Montgomery’s block Lanczos method over GF(2),Laurence T. Yang and Li Xu and Jong Hyuk Park and Sajid Hussain,2009,0,Journal of Intelligent Manufacturing
10.1007/s10845-023-02073-9,Task allocation model for human-robot collaboration with variable cobot speed,Maurizio Faccio and Irene Granata and Riccardo Minto,2023,0,Journal of Intelligent Manufacturing
10.1023/a:1008959706859,n.m.,Keith Williamson and Michael Healy,2000,6,Journal of Intelligent Manufacturing
10.1007/s10845-009-0377-4,e-Supply network coordination: the design of intelligent agents for buyer-supplier dynamic negotiations,Shima Mohebbi and Rasoul Shafaei,2012,16,Journal of Intelligent Manufacturing
10.1007/s10845-021-01761-8,A fast method for monitoring molten pool in infrared image streams using gravitational superpixels.,Angel-Iván García-Moreno,2022,3,Journal of Intelligent Manufacturing
10.1007/s10845-022-02010-2,Optimisation-driven design to explore and exploit the process–structure–property–performance linkages in digital manufacturing,Iñigo Flores Ituarte and Suraj Panicker and Hari P. N. Nagarajan and Eric Coatanea and David W. Rosen,2023,1,Journal of Intelligent Manufacturing
10.1007/s10845-021-01851-7,Simulation and deep reinforcement learning for adaptive dispatching in semiconductor manufacturing systems,Ahmed H. Sakr and Ayman Aboelhassan and Soumaya Yacout and Samuel Bassetto,2023,2,Journal of Intelligent Manufacturing
10.1007/s10845-021-01868-y,Application of artificial intelligence techniques in incremental forming: a state-of-the-art review,Aniket Nagargoje and Pavan Kumar Kankar and Prashant Kumar Jain and Puneet Tandon,2023,3,Journal of Intelligent Manufacturing
10.1007/s10845-021-01844-6,Method for fusion of neighborhood rough set and XGBoost in welding process decision-making,Kainan Guan and Guang Yang and Liang Du and Zhengguang Li and Xinhua Yang,2023,0,Journal of Intelligent Manufacturing
10.1007/s10845-021-01836-6,Probabilistic predictive control of porosity in laser powder bed fusion,Paromita Nath and Sankaran Mahadevan,2023,2,Journal of Intelligent Manufacturing
10.1007/s10845-013-0797-z,Choosing reverse channels under collection responsibility sharing in a closed-loop supply chain with re-manufacturing,Yuan Shi and Jiajia Nie and Ting Qu and Lap-Keung Chu and Domenic Sculli,2015,36,Journal of Intelligent Manufacturing
10.1023/b:jims.0000010075.60589.58,Discovering subproblem prioritization rules for shifting bottleneck algorithms,Vince Osisek and Haldun Aytug,2004,14,Journal of Intelligent Manufacturing
10.1007/s10845-007-0029-5,Designing cellular manufacturing systems under dynamic and uncertain conditions,Nima Safaei and Mohammad Saidi-Mehrabad and Masoud Babakhani,2007,19,Journal of Intelligent Manufacturing
10.1007/s10845-005-4827-3,A parametric model for cell formation and exceptional elements? problems with fuzzy parameters,Feyzan Arikan and Z�lal G�ng�r,2005,21,Journal of Intelligent Manufacturing
10.1007/s10845-020-01654-2,Approach to derive golden paths based on machine sequence patterns in multistage manufacturing process,Chang-Ho Lee and Dong-Hee Lee and Young-Mok Bae and Seung-Hyun Choi and Ki-Hun Kim and Kwang-Jae Kim,2022,3,Journal of Intelligent Manufacturing
10.1007/s10845-020-01596-9,"Sequential graph-based routing algorithm for electrical harnesses, tubes, and hoses in a commercial vehicle",Saekyeol Kim and Taehyeok Choi and Shinyu Kim and Taejoon Kwon and Tae Hee Lee and Kwangrae Lee,2021,9,Journal of Intelligent Manufacturing
10.1007/s10845-015-1151-4,A modal interval based method for dynamic decision model considering uncertain quality of used products in remanufacturing,Min Huang and Pengxing Yi and Tielin Shi and Lijun Guo,2018,16,Journal of Intelligent Manufacturing
10.1007/s10845-022-01920-5,Layer-by-layer model-based adaptive control for wire arc additive manufacturing of thin-wall structures,Haochen Mu and Joseph Polden and Yuxing Li and Fengyang He and Chunyang Xia and Zengxi Pan,2022,4,Journal of Intelligent Manufacturing
10.1023/a:1024649709582,n.m.,E. Pérez and F. Herrera and C. Hernández,2003,30,Journal of Intelligent Manufacturing
10.1007/s10845-018-1392-0,Materials informatics,Seeram Ramakrishna and Tong-Yi Zhang and Wen-Cong Lu and Quan Qian and Jonathan Sze Choong Low and Jeremy Heiarii Ronald Yune and Daren Zong Loong Tan and Stéphane Bressan and Stefano Sanvito and Surya R. Kalidindi,2019,68,Journal of Intelligent Manufacturing
10.1007/s10845-012-0673-2,Affective and cognitive design for mass personalization: status and prospect,Feng Zhou and Yangjian Ji and Roger Jianxin Jiao,2013,86,Journal of Intelligent Manufacturing
