DOI,Título,Autores,Año,Citas,Revista
10.1016/j.imavis.2015.09.003,"L2,1-based regression and prediction accumulation across views for robust facial landmark detection",Brais Martinez and Michel F. Valstar,2016,18,Image and Vision Computing
10.1016/j.imavis.2022.104483,MEmoR: A Multimodal Emotion Recognition using affective biomarkers for smart prediction of emotional health for people analytics in smart industries,Akshi Kumar and Kapil Sharma and Aditi Sharma,2022,2,Image and Vision Computing
10.1016/j.imavis.2009.06.012,Adaptive pyramid mean shift for global real-time visual tracking,Shu-Xiao Li and Hong-Xing Chang and Cheng-Fei Zhu,2010,45,Image and Vision Computing
10.1016/j.imavis.2014.04.002,Covariance descriptor based on bio-inspired features for person re-identification and face verification,Bingpeng Ma and Yu Su and Frédéric Jurie,2014,211,Image and Vision Computing
10.1016/j.imavis.2009.09.010,Online kernel density estimation for interactive learning,M. Kristan and D. Skočaj and A. Leonardis,2010,22,Image and Vision Computing
10.1016/j.imavis.2012.06.001,Multi-view structure-from-motion for hybrid camera scenarios,Y. Bastanlar and A. Temizel and Y. Yardimci and P. Sturm,2012,14,Image and Vision Computing
10.1016/j.imavis.2021.104335,IRANet: Identity-relevance aware representation for cloth-changing person re-identification,Wei Shi and Hong Liu and Mengyuan Liu,2022,4,Image and Vision Computing
10.1016/j.imavis.2021.104291,Multi-Tier Attention Network using Term-weighted Question Features for Visual Question Answering,Sruthy Manmadhan and Binsu C. Kovoor,2021,2,Image and Vision Computing
10.1016/j.imavis.2006.01.014,Speeding up the similarity search in high-dimensional image database by multiscale filtering and dynamic programming,Shyi-Chyi Cheng and Tian-Luu Wu,2006,1,Image and Vision Computing
10.1016/j.imavis.2017.02.005,Estimation of measurement uncertainty in stereo vision system,W. Sankowski and M. Włodarczyk and D. Kacperski and K. Grabowski,2017,26,Image and Vision Computing
10.1016/j.imavis.2016.08.013,Canonical image selection based on human affects in photographic images,Eun Yi Kim and Eunjeong Ko,2016,1,Image and Vision Computing
10.1016/j.imavis.2006.12.014,Multi-modal tracking using texture changes,Christopher Kemp and Tom Drummond,2008,6,Image and Vision Computing
10.1016/s0262-8856(00)00069-x,Fuzzy expert system for foot CT image segmentation,S Hirano and Y Hata,2001,7,Image and Vision Computing
10.1016/j.imavis.2018.06.007,Proximity-Aware Hierarchical Clustering of unconstrained faces,Wei-An Lin and Jun-Cheng Chen and Rajeev Ranjan and Ankan Bansal and Swami Sankaranarayanan and Carlos D. Castillo and Rama Chellappa,2018,5,Image and Vision Computing
10.1016/j.imavis.2019.07.005,Semi-dense and robust image registration by shift adapted weighted aggregation and variational completion,Julia Navarro and Antoni Buades,2019,6,Image and Vision Computing
10.1016/j.imavis.2019.06.010,A survey on freehand sketch recognition and retrieval,Xianlin Zhang and Xueming Li and Yang Liu and Fangxiang Feng,2019,8,Image and Vision Computing
10.1016/j.imavis.2011.10.005,The road to intelligence,Maria Petrou,2012,2,Image and Vision Computing
10.1016/j.imavis.2006.07.019,Algorithms for the computation of the Minkowski functionals of deterministic and random polyconvex sets,R. Guderlei and S. Klenk and J. Mayer and V. Schmidt and E. Spodarev,2007,15,Image and Vision Computing
10.1016/j.imavis.2012.10.002,Fusion of facial expressions and EEG for implicit affective tagging,Sander Koelstra and Ioannis Patras,2013,150,Image and Vision Computing
10.1016/j.imavis.2019.05.006,"Multi-frame stereo matching with edges, planes, and superpixels",Tianfan Xue and Andrew Owens and Daniel Scharstein and Michael Goesele and Richard Szeliski,2019,13,Image and Vision Computing
10.1016/j.imavis.2020.103915,Anomaly detection in surveillance video based on bidirectional prediction,Dongyue Chen and Pengtao Wang and Lingyi Yue and Yuxin Zhang and Tong Jia,2020,30,Image and Vision Computing
10.1016/j.imavis.2008.04.004,Approximate graph edit distance computation by means of bipartite graph matching,Kaspar Riesen and Horst Bunke,2009,450,Image and Vision Computing
10.1016/s0262-8856(02)00149-x,Mirror symmetry⇒2-view stereo geometry,Alexandre R.J. François and Gérard G. Medioni and Roman Waupotitsch,2003,32,Image and Vision Computing
10.1016/j.imavis.2008.06.015,Automatic soccer players tracking in goal scenes by camera motion elimination,Seyed Hossein Khatoonabadi and Mohammad Rahmati,2009,40,Image and Vision Computing
10.1016/j.imavis.2017.07.003,"3D visual perception for self-driving cars using a multi-camera system: Calibration, mapping, localization, and obstacle detection",Christian Häne and Lionel Heng and Gim Hee Lee and Friedrich Fraundorfer and Paul Furgale and Torsten Sattler and Marc Pollefeys,2017,121,Image and Vision Computing
10.1016/s0262-8856(20)30093-7,Editorial Board,,2020,0,Image and Vision Computing
10.1016/j.imavis.2014.04.004,Morphological analysis for investigating artistic images,Antonio Monroy and Peter Bell and Björn Ommer,2014,4,Image and Vision Computing
10.1016/j.imavis.2012.05.005,Most cited paper award,Gail M. Rodney,2012,0,Image and Vision Computing
10.1016/j.imavis.2005.07.010,Hand tracking in bimanual movements,Atid Shamaie and Alistair Sutherland,2005,9,Image and Vision Computing
10.1016/j.imavis.2011.01.004,Most cited paper award,Gail M. Rodney,2011,0,Image and Vision Computing
10.1016/j.imavis.2004.01.002,Automatic 3D model reconstruction based on novel pose estimation and integration techniques,Soon-Yong Park and Murali Subbarao,2004,14,Image and Vision Computing
10.1016/j.imavis.2009.12.004,Color filter array design using random patterns with blue noise chromatic spectra,Laurent Condat,2010,16,Image and Vision Computing
10.1016/j.imavis.2021.104160,Single-shot cuboids: Geodesics-based end-to-end Manhattan aligned layout estimation from spherical panoramas,Nikolaos Zioulis and Federico Alvarez and Dimitrios Zarpalas and Petros Daras,2021,6,Image and Vision Computing
10.1016/j.imavis.2019.07.007,Learning deep features for online person tracking using non-overlapping cameras: A survey,Neeti Narayan and Nishant Sankaran and Srirangaraj Setlur and Venu Govindaraju,2019,5,Image and Vision Computing
10.1016/j.imavis.2007.10.007,Independent component analysis-based defect detection in patterned liquid crystal display surfaces,Chi-Jie Lu and Du-Ming Tsai,2008,44,Image and Vision Computing
10.1016/j.imavis.2017.06.003,Fine-grained categorization via CNN-based automatic extraction and integration of object-level and part-level features,Ting Sun and Lin Sun and Dit-Yan Yeung,2017,7,Image and Vision Computing
10.1016/j.imavis.2007.12.005,An extended difference expansion algorithm for reversible watermarking,Hsien-Wen Tseng and Chin-Chen Chang,2008,26,Image and Vision Computing
10.1016/j.imavis.2014.02.003,Online parameter tuning for object tracking algorithms,Duc Phu Chau and Monique Thonnat and François Brémond and Etienne Corvée,2014,9,Image and Vision Computing
10.1016/j.imavis.2005.06.012,Self-organizing shape description for tracking and classifying multiple interacting objects,L. Marcenaro and L. Marchesotti and C.S. Regazzoni,2006,11,Image and Vision Computing
10.1016/j.imavis.2007.04.002,Automatic selection of MRF control parameters by reactive tabu search,U. Castellani and A. Fusiello and R. Gherardi and V. Murino,2007,9,Image and Vision Computing
10.1016/j.imavis.2004.03.005,Localization of acupoints on a head based on a 3D virtual body,Lei Zheng and Binjie Qin and Tiange Zhuang and Ulf Tiede and Karl Heinz Höhne,2005,8,Image and Vision Computing
10.1016/j.imavis.2007.11.006,WITHDRAWN: Stereo Retinex,Weihua Xiong and Brian Funt,2007,0,Image and Vision Computing
10.1016/s0262-8856(01)00056-7,Announcement,,2001,0,Image and Vision Computing
10.1016/j.imavis.2018.08.001,"Exploiting feature representations through similarity learning, post-ranking and ranking aggregation for person re-identification",Julio C.S. Jacques and Xavier Baró and Sergio Escalera,2018,3,Image and Vision Computing
10.1016/j.imavis.2007.05.001,Region saliency as a measure for colour segmentation stability,Gunther Heidemann,2008,9,Image and Vision Computing
10.1016/j.imavis.2008.05.006,An extension of min/max flow framework,Hongchuan Yu and Mohammed Bennamoun and Chin-Seng Chua,2009,1,Image and Vision Computing
10.1016/j.imavis.2017.01.007,Editorial for the Special Issue on the Best of FG 2015,,2017,0,Image and Vision Computing
10.1016/j.imavis.2005.05.012,Empirical mode decomposition synthesis of fractional processes in 1D- and 2D-space,Éric Deléchelle and Jean-Claude Nunes and Jacques Lemoine,2005,13,Image and Vision Computing
10.1016/j.imavis.2007.07.008,Random-bit sequence generation from image data,Yas Abbas Alsultanny,2008,6,Image and Vision Computing
10.1016/s0262-8856(18)30083-0,Editorial Board,,2018,0,Image and Vision Computing
10.1016/s0262-8856(07)00021-2,Contents continued from Outside back cover,,2007,0,Image and Vision Computing
10.1016/s0262-8856(00)00033-0,,Lynn Abbott,2000,0,Image and Vision Computing
10.1016/s0262-8856(99)00055-4,Recognition of JPEG compressed face images based on statistical methods,S. Eickeler and S. Müller and G. Rigoll,2000,92,Image and Vision Computing
10.1016/j.imavis.2019.09.003,Combining Landsat images with historic records to estimate the live coral cover of Luhuitou fringing reef in Northern South China Sea,Rongyong Huang and Kefu Yu and Xueyong Huang and Wencai Zou and Yinghui Wang,2019,1,Image and Vision Computing
10.1016/j.imavis.2014.02.012,Global registration of large collections of range images with an improved Optimization-on-a-Manifold approach,Francesco Bonarrigo and Alberto Signoroni,2014,2,Image and Vision Computing
10.1016/s0262-8856(02)00025-2,Corresponding dynamic appearances,Shaogang Gong and Alexandra Psarrou and Sami Romdhani,2002,6,Image and Vision Computing
10.1016/j.imavis.2007.08.004,A distance-based separator representation for pattern classification,Frank Y. Shih and Kai Zhang,2008,12,Image and Vision Computing
10.1016/j.imavis.2008.07.008,Block Wiener-based image registration for moving target indication,Lance M. Kaplan and Nasser M. Nasrabadi,2009,5,Image and Vision Computing
10.1016/s0262-8856(02)00027-6,Quadtree representations for storage and manipulation of clusters of images,Maude Manouvrier and Marta Rukoz and Geneviève Jomier,2002,15,Image and Vision Computing
10.1016/j.imavis.2010.03.005,Optimal non-iterative pose estimation via convex relaxation,Hatem Hmam and Jijoong Kim,2010,26,Image and Vision Computing
10.1016/j.imavis.2006.07.025,Product quality on-line inspecting for the pressed protuberant character on a metal tag,Cao Jian-Hai and Lu Chang-Hou and Shi Chun-Yi,2007,4,Image and Vision Computing
10.1016/j.imavis.2017.09.007,Texture features for object salience,Kasim Terzić and Sai Krishna and J.M.H. du Buf,2017,3,Image and Vision Computing
10.1016/j.imavis.2015.11.009,A framework for semantic people description in multi-camera surveillance systems,Zhi Zhou and Yue Wang and Eam Khwang Teoh,2016,5,Image and Vision Computing
10.1016/j.imavis.2019.01.002,Feature Detection Performance Based Benchmarking of Motion Deblurring Methods: Applications to Vision for Legged Robots,Gokhan Koray Gultekin and Afsar Saranli,2019,4,Image and Vision Computing
10.1016/j.imavis.2016.04.012,Robust face alignment and tracking by combining local search and global fitting,Jongju Shin and Daijin Kim,2016,4,Image and Vision Computing
10.1016/s0262-8856(99)00010-4,The role of perceptual contrast non-linearities in image transform quantization,J. Malo and F. Ferri and J. Albert and J. Soret and J.M. Artigas,2000,16,Image and Vision Computing
10.1016/s0262-8856(99)00049-9,High-level feature based range image segmentation,Xiaoyi Jiang and H. Bunke and U. Meier,2000,28,Image and Vision Computing
10.1016/j.imavis.2006.02.023,Face authentication using speed fractal technique,Andrea F. Abate and Riccardo Distasi and Michele Nappi and Daniel Riccio,2006,7,Image and Vision Computing
10.1016/j.imavis.2005.07.020,An image zooming technique based on vector quantization approximation,Chin-Chen Chang and Yung-Chen Chou and Yuan-Hui Yu and Kai-Jung Shih,2005,27,Image and Vision Computing
10.1016/j.imavis.2009.04.015,Video synchronization and its application to object transfer,Xiaochun Cao and Lin Wu and Jiangjian Xiao and Hassan Foroosh and Jigui Zhu and Xiaohong Li,2010,9,Image and Vision Computing
10.1016/s0262-8856(18)30010-6,Editorial Board,,2018,0,Image and Vision Computing
10.1016/j.imavis.2005.04.001,Optimizing parameters of a motion detection system by means of a distributed genetic algorithm,Alessandro Bevilacqua,2005,5,Image and Vision Computing
10.1016/j.imavis.2020.103914,Digital video intrusion intelligent detection method based on narrowband Internet of Things and its application,Aimin Yang and Huixiang Liu and Yongjie Chen and Chunying Zhang and Ke Yang,2020,6,Image and Vision Computing
10.1016/j.imavis.2016.11.006,Photometric stereo with only two images: A theoretical study and numerical resolution,Yvain Quéau and Roberto Mecca and Jean-Denis Durou and Xavier Descombes,2017,12,Image and Vision Computing
10.1016/j.imavis.2014.08.015,A local approach for 3D object recognition through a set of size functions,Mohammed Ayoub Alaoui Mhamdi and Djemel Ziou,2014,6,Image and Vision Computing
10.1016/j.imavis.2003.09.009,An integrated surveillance system—human tracking and view synthesis using multiple omni-directional vision sensors,Kim C Ng and Hiroshi Ishiguro and Mohan Trivedi and Takushi Sogo,2004,19,Image and Vision Computing
10.1016/j.imavis.2006.05.014,Fast Zernike wavelet moments for Farsi character recognition,Ali Broumandnia and Jamshid Shanbehzadeh,2007,54,Image and Vision Computing
10.1016/j.imavis.2012.08.004,WITHDRAWN: Video-based descriptors for object recognition,Taehee Lee and Stefano Soatto,2012,1,Image and Vision Computing
10.1016/j.imavis.2008.06.003,Automated encoding of footwear patterns for fast indexing,Maria Pavlou and Nigel M. Allinson,2009,26,Image and Vision Computing
10.1016/j.imavis.2021.104182,Camera pose estimation in multi-view environments: From virtual scenarios to the real world,Jorge L. Charco and Angel D. Sappa and Boris X. Vintimilla and Henry O. Velesaca,2021,4,Image and Vision Computing
10.1016/j.imavis.2013.10.007,Direct model based visual tracking and pose estimation using mutual information,Guillaume Caron and Amaury Dame and Eric Marchand,2014,48,Image and Vision Computing
10.1016/j.imavis.2022.104617,Human object interaction detection: Design and survey,Maya Antoun and Daniel Asmar,2023,0,Image and Vision Computing
10.1016/j.imavis.2022.104611,Face reenactment via generative landmark guidance,Chen Hu and Xianghua Xie and Lin Wu,2023,0,Image and Vision Computing
10.1016/s0262-8856(99)00066-9,Primitive spatial relations based on SKIZ,S.-R. Jan and Y.-C. Hsueh,2000,4,Image and Vision Computing
10.1016/s0262-8856(99)00065-7,Uncalibrated Euclidean reconstruction: a review,A. Fusiello,2000,70,Image and Vision Computing
10.1016/j.imavis.2003.09.008,Multi-view calibration from planar motion trajectories,Christopher Jaynes,2004,10,Image and Vision Computing
10.1016/j.imavis.2021.104121,Novel features for art movement classification of portrait paintings,Shao Liu and Jiaqi Yang and Sos S. Agaian and Changhe Yuan,2021,7,Image and Vision Computing
10.1016/j.imavis.2018.05.002,Gait recognition in the wild using shadow silhouettes,Tanmay Tulsidas Verlekar and Luís Ducla Soares and Paulo Lobato Correia,2018,11,Image and Vision Computing
10.1016/j.imavis.2005.09.001,Synthesis of image deformation strategies,Kanti V. Mardia and José M. Angulo and Arnaldo Goitía,2006,6,Image and Vision Computing
10.1016/j.imavis.2017.01.001,Robust uncalibrated stereo rectification with constrained geometric distortions (USR-CGD),Hyunsuk Ko and Han Suk Shim and Ouk Choi and C.-C. Jay Kuo,2017,11,Image and Vision Computing
10.1016/j.imavis.2007.12.007,A stratified self-calibration method for circular motion in spite of varying intrinsic parameters,Y. Li and Y.S. Hung and Sukhan Lee,2008,6,Image and Vision Computing
10.1016/j.imavis.2017.02.007,Robust pedestrian detection under deformation using simple boosted features,Hak-Kyoung Kim and Daijin Kim,2017,8,Image and Vision Computing
10.1016/j.imavis.2011.12.013,Computer vision needs a core and foundations,A.L. Yuille,2012,2,Image and Vision Computing
10.1016/j.imavis.2014.08.009,Adaptive visual tracking using the prioritized Q-learning algorithm: MDP-based parameter learning approach,Sarang Khim and Sungjin Hong and Yoonyoung Kim and Phill kyu Rhee,2014,4,Image and Vision Computing
10.1016/j.imavis.2008.07.014,A parallel algorithm to skeletonize the distance transform of 3D objects,Carlo Arcelli and Gabriella Sanniti di Baja and Luca Serino,2009,8,Image and Vision Computing
10.1016/j.imavis.2011.08.003,Video-based descriptors for object recognition,Taehee Lee and Stefano Soatto,2011,16,Image and Vision Computing
10.1016/j.imavis.2008.01.009,Automatic object and image alignment using Fourier Descriptors,Weisheng Duan and Falko Kuester and Jean-Luc Gaudiot and Omar Hammami,2008,16,Image and Vision Computing
10.1016/s0262-8856(02)00042-2,Using distance transforms to decompose 3D discrete objects,Stina Svensson and G. Sanniti di Baja,2002,28,Image and Vision Computing
10.1016/j.imavis.2007.08.018,Robust point correspondence matching and similarity measuring for 3D models by relative angle-context distributions,Jun Feng and Horace H.S. Ip and Lap Yi Lai and Alf Linney,2008,23,Image and Vision Computing
10.1016/s0262-8856(03)00092-1,Extraction of digital elevation models from satellite stereo images through stereo matching based on epipolarity and scene geometry,Hae-Yeoun Lee and Taejung Kim and Wonkyu Park and Heung Kyu Lee,2003,39,Image and Vision Computing
10.1016/j.imavis.2020.103974,Adversarial sliced Wasserstein domain adaptation networks,Yun Zhang and Nianbin Wang and Shaobin Cai,2020,5,Image and Vision Computing
10.1016/j.imavis.2006.04.008,Novel target segmentation and tracking based on fuzzy membership distribution for vision-based target tracking system,Byung-Gyu Kim and Dong-Jo Park,2006,19,Image and Vision Computing
10.1016/j.imavis.2014.02.015,Iterative Grassmannian optimization for robust image alignment,Jun He and Dejiao Zhang and Laura Balzano and Tao Tao,2014,36,Image and Vision Computing
10.1016/j.imavis.2008.07.001,A customized Gabor filter for unsupervised color image segmentation,Jesmin F. Khan and Reza R. Adhami and Sharif M.A. Bhuiyan,2009,34,Image and Vision Computing
10.1016/s0262-8856(00)00053-6,A hierarchical approach to elastic registration based on mutual information,B Likar and F Pernuš,2001,145,Image and Vision Computing
10.1016/j.imavis.2006.12.011,Vehicle detection from high-resolution satellite imagery using morphological shared-weight neural networks,Xiaoying Jin and Curt H. Davis,2007,62,Image and Vision Computing
10.1016/s0262-8856(02)00012-4,Critical motion sequences for the self-calibration of cameras and stereo systems with variable focal length,Peter Sturm,2002,57,Image and Vision Computing
10.1016/j.imavis.2020.103955,CrossFusion net: Deep 3D object detection based on RGB images and point clouds in autonomous driving,Dza-Shiang Hong and Hung-Hao Chen and Pei-Yung Hsiao and Li-Chen Fu and Siang-Min Siao,2020,5,Image and Vision Computing
10.1016/j.imavis.2021.104264,Omnidirectional stereo depth estimation based on spherical deep network,Ming Li and Xuejiao Hu and Jingzhao Dai and Yang Li and Sidan Du,2021,2,Image and Vision Computing
10.1016/j.imavis.2020.104093,Unsupervised face Frontalization for pose-invariant face recognition,Yanfei Liu and Junhua Chen,2021,7,Image and Vision Computing
10.1016/j.imavis.2020.103971,The effect of image recognition traffic prediction method under deep learning and naive Bayes algorithm on freeway traffic safety,Jingxuan Yao and Yuntao Ye,2020,12,Image and Vision Computing
10.1016/j.imavis.2017.01.012,Video-based emotion recognition in the wild using deep transfer learning and score fusion,Heysem Kaya and Furkan Gürpınar and Albert Ali Salah,2017,152,Image and Vision Computing
10.1016/j.imavis.2008.08.007,Aircraft recognition in infrared image using wavelet moment invariants,Feng Zhang and Shang-qian Liu and Da-bao Wang and Wei Guan,2009,49,Image and Vision Computing
10.1016/s0262-8856(03)00097-0,Corner detection and matching for visual tracking during power line inspection,Ian Golightly and Dewi Jones,2003,62,Image and Vision Computing
10.1016/j.imavis.2018.02.002,Reading car license plates using deep neural networks,Hui Li and Peng Wang and Mingyu You and Chunhua Shen,2018,76,Image and Vision Computing
10.1016/s0262-8856(99)00040-2,A review on strategies for recognizing natural objects in colour images of outdoor scenes,J Batlle and A Casals and J Freixenet and J Martı́,2000,44,Image and Vision Computing
10.1016/j.imavis.2014.02.001,A survey of approaches and trends in person re-identification,Apurva Bedagkar-Gala and Shishir K. Shah,2014,311,Image and Vision Computing
10.1016/j.imavis.2006.03.005,A Markov random field image segmentation model for color textured images,Zoltan Kato and Ting-Chuen Pong,2006,133,Image and Vision Computing
10.1016/j.imavis.2012.09.004,Toward designing intelligent PDEs for computer vision: An optimal control approach,Risheng Liu and Zhouchen Lin and Wei Zhang and Kewei Tang and Zhixun Su,2013,18,Image and Vision Computing
10.1016/j.imavis.2015.04.005,Visual tracking based on online sparse feature learning,Zelun Wang and Jinjun Wang and Shun Zhang and Yihong Gong,2015,8,Image and Vision Computing
10.1016/j.imavis.2012.06.002,Filling the gap in quality assessment of video object tracking,Pedro Carvalho and Jaime S. Cardoso and Luís Corte-Real,2012,8,Image and Vision Computing
10.1016/j.imavis.2016.02.005,Deep and fast: Deep learning hashing with semi-supervised graph construction,Jingkuan Song and Lianli Gao and Fuhao Zou and Yan Yan and Nicu Sebe,2016,22,Image and Vision Computing
10.1016/j.imavis.2017.12.003,Distances evolution analysis for online and off-line human object interaction recognition,Meng Meng and Hassen Drira and Jacques Boonaert,2018,15,Image and Vision Computing
10.1016/j.imavis.2015.02.002,Stabilization of panoramic videos from mobile multi-camera platforms,Ameer Hamza and Rehan Hafiz and Muhammad M. Khan and Yongju Cho and Jihun Cha,2015,13,Image and Vision Computing
10.1016/j.imavis.2010.04.004,A new wavelet-based fuzzy single and multi-channel image denoising,Jamal Saeedi and Mohammad Hassan Moradi and Karim Faez,2010,31,Image and Vision Computing
10.1016/j.imavis.2008.07.013,Sharpness preserving image enlargement by using self-decomposed codebook and Mahalanobis distance,Hideaki Kawano and Noriaki Suetake and Byungki Cha and Takashi Aso,2009,11,Image and Vision Computing
10.1016/s0262-8856(99)00059-1,Active vision-based face authentication,M Tistarelli and E Grosso,2000,31,Image and Vision Computing
10.1016/j.imavis.2006.02.004,Line cluster detection using a variant of the Hough transform for culture row localisation,V. Leemans and M.-F. Destain,2006,37,Image and Vision Computing
10.1016/s0262-8856(00)00070-6,Knowledge-based enhancement of megavoltage images in radiation therapy using a hybrid neuro-fuzzy system,H.R. Tizhoosh and G. Krell and B. Michaelis,2001,5,Image and Vision Computing
10.1016/j.imavis.2017.08.008,Pairwise registration in indoor environments using adaptive combination of 2D and 3D cues,Juan Carlos Perafan Villota and Felipe Leno da Silva and Ricardo de Souza Jacomini and Anna Helena Reali Costa,2018,3,Image and Vision Computing
10.1016/j.imavis.2008.04.015,Efficient illumination independent appearance-based face tracking,José M. Buenaposada and Enrique Muñoz and Luis Baumela,2009,11,Image and Vision Computing
10.1016/j.imavis.2007.11.008,A morphological image processing method for locating myosin filaments in muscle electron micrographs,B. Bödvarsson and S. Klim and M. Mørkebjerg and S. Mortensen and C.H. Yoon and J. Chen and J.R. Maclaren and P.K. Luther and J.M. Squire and P.J. Bones and R.P. Millane,2008,7,Image and Vision Computing
10.1016/j.imavis.2021.104327,"A survey of methods, datasets and evaluation metrics for visual question answering",Himanshu Sharma and Anand Singh Jalal,2021,6,Image and Vision Computing
10.1016/j.imavis.2012.10.006,Integration of 3D and multispectral data for cultural heritage applications: Survey and perspectives,Camille Simon Chane and Alamin Mansouri and Franck S. Marzani and Frank Boochs,2013,52,Image and Vision Computing
10.1016/j.imavis.2020.104057,Cross-database and cross-attack Iris presentation attack detection using micro stripes analyses,Meiling Fang and Naser Damer and Fadi Boutros and Florian Kirchbuchner and Arjan Kuijper,2021,10,Image and Vision Computing
10.1016/j.imavis.2003.12.004,Contour and boundary detection improved by surround suppression of texture edges,Cosmin Grigorescu and Nicolai Petkov and Michel A. Westenberg,2004,165,Image and Vision Computing
10.1016/j.imavis.2020.103983,Non-local attention association scheme for online multi-object tracking,Haidong Wang and Saizhou Wang and Jingyi Lv and Chenming Hu and Zhiyong Li,2020,5,Image and Vision Computing
10.1016/j.imavis.2018.04.003,Lane estimation by particle-filtering combined with likelihood computation of line boundaries and motion compensation,Jeong Min Park and Joon Woong Lee,2018,5,Image and Vision Computing
10.1016/j.imavis.2013.08.003,A new level set method for inhomogeneous image segmentation,Fangfang Dong and Zengsi Chen and Jinwei Wang,2013,68,Image and Vision Computing
