DOI,Título,Autores,Año,Citas,Revista
10.1016/j.imavis.2010.04.005,Adjacency stable connected operators and set levelings,Jose Crespo,2010,5,Image and Vision Computing
10.1016/s0262-8856(01)00072-5,conferenceannouncement,,2001,0,Image and Vision Computing
10.1016/s0262-8856(03)00204-x,Colourful E-Products,,2003,0,Image and Vision Computing
10.1016/j.imavis.2007.01.003,On the Bayes fusion of visual features,Xiaojin Shi and Roberto Manduchi,2007,5,Image and Vision Computing
10.1016/s0262-8856(17)30195-6,Editorial Boad,,2018,0,Image and Vision Computing
10.1016/s0262-8856(03)00225-7,,T COOTES and C TAYLOR,2003,0,Image and Vision Computing
10.1016/s0262-8856(00)00109-8,Learning environmental features for pose estimation,R Sim and G Dudek,2001,24,Image and Vision Computing
10.1016/j.imavis.2006.08.006,A visual landmark framework for mobile robot navigation,J.B. Hayet and F. Lerasle and M. Devy,2007,35,Image and Vision Computing
10.1016/s0262-8856(99)00063-3,Detecting changes in aerial views of man-made structures,A Huertas and R Nevatia,2000,27,Image and Vision Computing
10.1016/j.imavis.2017.09.001,Guest editorial: Multimodal sentiment analysis and mining in the wild,Mohammad Soleymani and Björn Schuller and Shih-Fu Chang,2017,3,Image and Vision Computing
10.1016/s0262-8856(02)00111-7,Perceptual primitives from an extended 4D Hough transform,Marı́a J. Carreira and Majid Mirmehdi and Barry T. Thomas and Marta Penas,2002,8,Image and Vision Computing
10.1016/j.imavis.2006.07.006,3D registration of partially overlapping surfaces using a volumetric approach,Gaoyu Xiao and S.H. Ong and K.W.C. Foong,2007,10,Image and Vision Computing
10.1016/j.imavis.2006.02.006,Neural classifier for micro work piece recognition,Gengis K. Toledo and Ernst Kussul and Tatiana Baidyk,2006,7,Image and Vision Computing
10.1016/s0262-8856(01)00074-9,Conference Announcement,,2001,0,Image and Vision Computing
10.1016/s0262-8856(03)00117-3,Correcting image distortion in the X-ray digital tomosynthesis system for PCB solder joint inspection,Young Jun Roh and Won Shik Park and Hyungsuck Cho,2003,15,Image and Vision Computing
10.1016/j.imavis.2012.02.005,Shape from pairwise silhouettes for plan-view map generation,Rafael Muñoz-Salinas and E. Yeguas-Bolivar and L. Díaz-Más and Rafael Medina-Carnicer,2012,1,Image and Vision Computing
10.1016/j.imavis.2015.11.003,Multi-view facial landmark detection by using a 3D shape model,Jan Čech and Vojtěch Franc and Michal Uřičář and Jiří Matas,2016,11,Image and Vision Computing
10.1016/j.imavis.2016.08.007,Discriminative transfer learning with sparsity regularization for single-sample face recognition,Junlin Hu,2017,18,Image and Vision Computing
10.1016/s0262-8856(22)00153-6,Editorial Board,,2022,0,Image and Vision Computing
10.1016/j.imavis.2020.104038,Expression recognition with deep features extracted from holistic and part-based models,S.L. Happy and Antitza Dantcheva and François Bremond,2021,3,Image and Vision Computing
10.1016/j.imavis.2006.06.012,Defining and computing stable representations of volume shapes from discrete trace using volume primitives: Application to 3D image analysis in soil science,Olivier Monga,2007,10,Image and Vision Computing
10.1016/j.imavis.2015.04.001,A stereo matching approach based on particle filters and scattered control landmarks,Stylianos Ploumpis and Angelos Amanatiadis and Antonios Gasteratos,2015,18,Image and Vision Computing
10.1016/j.imavis.2018.03.002,Development and utilization of a disgusting image dataset to understand and predict visual disgust,Sang-Il Oh and Hang-Bong Kang,2018,2,Image and Vision Computing
10.1016/j.imavis.2014.09.004,Discrete area filters in accurate detection of faces and facial features,Jacek Naruniec,2014,6,Image and Vision Computing
10.1016/j.imavis.2014.02.005,A unified approach to the recognition of complex actions from sequences of zone-crossings,Gerard Sanromà and Luis Patino and Gertjan Burghouts and Klamer Schutte and James Ferryman,2014,9,Image and Vision Computing
10.1016/j.imavis.2013.10.003,Keyword spotting in unconstrained handwritten Chinese documents using contextual word model,Liang Huang and Fei Yin and Qing-Hu Chen and Cheng-Lin Liu,2013,8,Image and Vision Computing
10.1016/j.imavis.2015.03.001,Local color transformation analysis for sudden illumination change detection,Francisco Javier López-Rubio and Ezequiel López-Rubio,2015,9,Image and Vision Computing
10.1016/j.imavis.2012.07.006,Recognition of occluded objects by reducing feature interactions,Kah Bin Lim and Jia Yun Wu,2012,0,Image and Vision Computing
10.1016/j.imavis.2017.05.001,3D facial shape reconstruction using macro- and micro-level features from high resolution facial images,Jaeik Jo and Hyunjun Kim and Jaihie Kim,2017,4,Image and Vision Computing
10.1016/j.imavis.2012.04.002,Compact and adaptive spatial pyramids for scene recognition,Noha M. Elfiky and Jordi Gonzàlez and F. Xavier Roca,2012,10,Image and Vision Computing
10.1016/s0262-8856(02)00087-2,Classifying human endothelial cells based on individual granulometric size distributions,V. Zapater and L. Martı́nez-Costa and G. Ayala,2002,6,Image and Vision Computing
10.1016/j.imavis.2016.04.014,Discovering object aspects from video,Anestis Papazoglou and Luca Del Pero and Vittorio Ferrari,2016,1,Image and Vision Computing
10.1016/j.imavis.2016.11.009,Robust scene matching method based on sparse representation and iterative correction,Sai Yang and Bo Xiao and Liping Yan and Yuanqing Xia and Mengyin Fu and Yang Liu,2017,8,Image and Vision Computing
10.1016/s0262-8856(03)00058-1,Automatic target segmentation using PMMW imagery,Mark R. Stevens and Magnús Snorrason,2003,2,Image and Vision Computing
10.1016/j.imavis.2007.09.001,Corrigendum to “EM enhancement of 3D head pose estimated by point at infinity” [Image Vis. Comput. 25 (2007) 1864–1874],Jian-Gang Wang and Eric Sung,2008,0,Image and Vision Computing
10.1016/j.imavis.2009.05.003,A new method for the registration of three-dimensional point-sets: The Gaussian Fields framework,Faysal Boughorbel and Muharrem Mercimek and Andreas Koschan and Mongi Abidi,2010,29,Image and Vision Computing
10.1016/j.imavis.2006.06.004,A new adaptive vertex-based binary shape coding technique,Chung-Ming Kuo and Chaur-Heh Hsieh and Yong-Ren Huang,2007,6,Image and Vision Computing
10.1016/j.imavis.2022.104416,Editorial Board,,2022,0,Image and Vision Computing
10.1016/j.imavis.2016.07.003,Randomized time warping for motion recognition,Chendra Hadi Suryanto and Jing-Hao Xue and Kazuhiro Fukui,2016,9,Image and Vision Computing
10.1016/j.imavis.2013.10.006,Tracking in dense crowds using prominence and neighborhood motion concurrence,Haroon Idrees and Nolan Warner and Mubarak Shah,2014,26,Image and Vision Computing
10.1016/j.imavis.2015.06.009,Ordered trajectories for human action recognition with large number of classes,O.V. Ramana Murthy and Roland Goecke,2015,12,Image and Vision Computing
10.1016/j.imavis.2006.02.012,Measuring the performance of face localization systems,Yann Rodriguez and Fabien Cardinaux and Samy Bengio and Johnny Mariéthoz,2006,31,Image and Vision Computing
10.1016/s0262-8856(00)00089-5,Vector processing of wavelet coefficients for robust image denoising,M.E. Zervakis and V. Sundararajan and K.K. Parhi,2001,5,Image and Vision Computing
10.1016/j.imavis.2007.10.002,Automatic face authentication with self compensation,Tzung-Han Lin and Wen-Pin Shih,2008,0,Image and Vision Computing
10.1016/j.imavis.2012.12.001,Two-layer dual gait generative models for human motion estimation from a single camera,Xin Zhang and Guoliang Fan and Li-shan Chou,2013,1,Image and Vision Computing
10.1016/s0262-8856(19)30004-6,Editorial Board,,2019,0,Image and Vision Computing
10.1016/j.imavis.2005.10.001,Collecting highly reproducible images to support dermatological medical diagnosis,David Delgado Gomez and Jens Michael Carstensen and Bjarne K. Ersbøll,2006,4,Image and Vision Computing
10.1016/j.imavis.2006.07.014,Using resolution pyramids for watershed image segmentation,Maria Frucci and Giuliana Ramella and Gabriella Sanniti di Baja,2007,20,Image and Vision Computing
10.1016/j.imavis.2016.08.005,Plant cell tracking using Kalman filter based local graph matching,Min Liu and Yue He and Yangliu Wei and Peng Xiang,2017,18,Image and Vision Computing
10.1016/j.imavis.2006.12.015,Rotation-invariant and scale-invariant Gabor features for texture image retrieval,Ju Han and Kai-Kuang Ma,2007,216,Image and Vision Computing
10.1016/j.imavis.2019.10.008,Salient object detection via double random walks with dual restarts,Jiaxing Yang and Xiang Fang and Lihe Zhang and Huchuan Lu and Guohua Wei,2020,3,Image and Vision Computing
10.1016/s0262-8856(03)00156-2,Advert,,2003,0,Image and Vision Computing
10.1016/j.imavis.2015.09.001,Investigating new calibration methods without feature detection for TOF cameras,Rudi Penne and Carolina Raposo and Luc Mertens and Bart Ribbens and Helder Araújo,2015,6,Image and Vision Computing
10.1016/s0262-8856(02)00060-4,Transforming pixel signatures into an improved metric space,A.S. Holmes and C.J. Rose and C.J. Taylor,2002,11,Image and Vision Computing
10.1016/s0262-8856(01)00095-6,Multi-modal gray-level histogram modeling and decomposition,Jeng-Horng Chang and Kuo-Chin Fan and Yang-Lang Chang,2002,43,Image and Vision Computing
10.1016/s0262-8856(02)00044-6,Finding connected components in digital images by aggressive reuse of labels,Vikrant Khanna and Phalguni Gupta and C.J. Hwang,2002,17,Image and Vision Computing
10.1016/j.imavis.2017.11.003,Robust discriminative tracking via structured prior regularization,Yuanhao Yu and Qingsong Wu and T. Kirubarajan and Yasuo Uehara,2018,3,Image and Vision Computing
10.1016/j.imavis.2012.09.009,Salient object detection: From pixels to segments,Victoria Yanulevskaya and Jasper Uijlings and Jan-Mark Geusebroek,2013,8,Image and Vision Computing
10.1016/j.imavis.2008.04.013,A novel pixon-representation for image segmentation based on Markov random field,Lei Lin and Litao Zhu and Faguo Yang and Tianzi Jiang,2008,15,Image and Vision Computing
10.1016/s0262-8856(02)00020-3,An indexing scheme for efficient data-driven verification of 3D pose hypotheses,Michael Boshra and Hong Zhang,2002,1,Image and Vision Computing
10.1016/j.imavis.2013.08.002,A new evaluation measure for color image segmentation based on genetic programming approach,Hakime Vojodi and Ali Fakhari and Amir Masoud Eftekhari Moghadam,2013,14,Image and Vision Computing
10.1016/s0262-8856(02)00052-5,Performing automatic target detection with evolvable finite state automata,Karl Benson,2002,2,Image and Vision Computing
10.1016/j.imavis.2016.05.010,Fixing the root node: Efficient tracking and detection of 3D human pose through local solutions,Ben Daubney and Xianghua Xie and Jingjing Deng and Neil Mac Parthaláin and Reyer Zwiggelaar,2016,1,Image and Vision Computing
10.1016/j.imavis.2009.02.012,Exploratory learning structures in artificial cognitive systems,Michael Felsberg and Johan Wiklund and Gösta Granlund,2009,7,Image and Vision Computing
10.1016/j.imavis.2006.07.007,Efficient predictive model of zero quantized DCT coefficients for fast video encoding,Hanli Wang and Sam Kwong and Chi-Wah Kok,2007,16,Image and Vision Computing
10.1016/j.imavis.2017.02.006,A multi-model restoration algorithm for recovering blood vessels in skin images,Xiaojie Li and Adams Wai Kin Kong,2017,1,Image and Vision Computing
10.1016/s0262-8856(01)00089-0,Cluster validation using legacy delineations,Mingqin Liu and Ashok Samal,2002,5,Image and Vision Computing
10.1016/j.imavis.2012.12.003,Homeomorphic Manifold Analysis (HMA): Generalized separation of style and content on manifolds,Ahmed Elgammal and Chan-Su Lee,2013,15,Image and Vision Computing
10.1016/s0262-8856(21)00059-7,Editorial Board,,2021,0,Image and Vision Computing
10.1016/s0262-8856(19)30440-8,Editorial Board,,2019,0,Image and Vision Computing
10.1016/j.imavis.2010.12.001,A graphical model based solution to the facial feature point tracking problem,Serhan Coşar and Müjdat Çetin,2011,9,Image and Vision Computing
10.1016/j.imavis.2004.02.001,Assessing the performance of corner detectors for point feature tracking applications,P. Tissainayagam and D. Suter,2004,84,Image and Vision Computing
10.1016/j.imavis.2009.10.009,Active contours with selective local or global segmentation: A new formulation and level set method,Kaihua Zhang and Lei Zhang and Huihui Song and Wengang Zhou,2010,554,Image and Vision Computing
10.1016/j.imavis.2017.07.005,Ego-Lane Analysis System (ELAS): Dataset and algorithms,Rodrigo F. Berriel and Edilson de Aguiar and Alberto F. de Souza and Thiago Oliveira-Santos,2017,34,Image and Vision Computing
10.1016/j.imavis.2018.09.016,A comprehensive review of fruit and vegetable classification techniques,Khurram Hameed and Douglas Chai and Alexander Rassau,2018,87,Image and Vision Computing
10.1016/s0262-8856(99)00056-6,Wavelet packet analysis for face recognition,C. Garcia and G. Zikos and G. Tziritas,2000,100,Image and Vision Computing
10.1016/j.imavis.2006.08.003,Finger identification and hand posture recognition for human–robot interaction,Xiaoming Yin and Ming Xie,2007,42,Image and Vision Computing
10.1016/j.imavis.2018.06.005,Benchmark database for fine-grained image classification of benthic macroinvertebrates,Jenni Raitoharju and Ekaterina Riabchenko and Iftikhar Ahmad and Alexandros Iosifidis and Moncef Gabbouj and Serkan Kiranyaz and Ville Tirronen and Johanna Ärje and Salme Kärkkäinen and Kristian Meissner,2018,19,Image and Vision Computing
10.1016/j.imavis.2019.08.004,Dilated Light-Head R-CNN using tri-center loss for driving behavior recognition,Mingqi Lu and Yaocong Hu and Xiaobo Lu,2019,4,Image and Vision Computing
10.1016/j.imavis.2014.12.003,Robust regional bounding spherical descriptor for 3D face recognition and emotion analysis,Yue Ming,2015,35,Image and Vision Computing
10.1016/j.imavis.2014.04.016,Generic polar harmonic transforms for invariant image representation,Thai V. Hoang and Salvatore Tabbone,2014,15,Image and Vision Computing
10.1016/j.imavis.2009.02.004,3D Mesh decomposition using Reeb graphs,Stefano Berretti and Alberto Del Bimbo and Pietro Pala,2009,38,Image and Vision Computing
10.1016/j.imavis.2020.104046,Deep learning-based object detection in low-altitude UAV datasets: A survey,Payal Mittal and Raman Singh and Akashdeep Sharma,2020,79,Image and Vision Computing
10.1016/j.imavis.2012.02.009,Visual SLAM: Why filter?,Hauke Strasdat and J.M.M. Montiel and Andrew J. Davison,2012,283,Image and Vision Computing
10.1016/j.imavis.2020.104005,Spectral regularization for combating mode collapse in GANs,Kanglin Liu and Guoping Qiu and Wenming Tang and Fei Zhou,2020,2,Image and Vision Computing
10.1016/j.imavis.2007.05.002,Image interpolation using interpolative classified vector quantization,Sung-Ho Hong and Rae-Hong Park and Seungjoon Yang and Jun-Yong Kim,2008,17,Image and Vision Computing
10.1016/j.imavis.2022.104549,SiaTrans: Siamese transformer network for RGB-D salient object detection with depth image classification,XingZhao Jia and ChangLei DongYe and YanJun Peng,2022,1,Image and Vision Computing
10.1016/j.imavis.2022.104465,Handcrafted localized phase features for human action recognition,Seyed Mostafa Hejazi and Charith Abhayaratne,2022,2,Image and Vision Computing
10.1016/j.imavis.2016.11.003,On robust optical flow estimation on image sequences with differently exposed frames using primal–dual optimization,Tomas Bengtsson and Tomas McKelvey and Konstantin Lindström,2017,4,Image and Vision Computing
10.1016/j.imavis.2004.06.010,Shortest routes on varying height surfaces using gray-level distance transforms,Leena Ikonen and Pekka Toivanen,2005,31,Image and Vision Computing
10.1016/j.imavis.2015.04.007,Visual tracking of non-rigid objects with partial occlusion through elastic structure of local patches and hierarchical diffusion,Kwang Moo Yi and Hawook Jeong and Soo Wan Kim and Shimin Yin and Songhwai Oh and Jin Young Choi,2015,3,Image and Vision Computing
10.1016/s0262-8856(99)00067-0,On the gray-scale inverse Hough transform,A.L Kesidis and N Papamarkos,2000,20,Image and Vision Computing
10.1016/j.imavis.2011.01.007,Real-time stereo on GPGPU using progressive multi-resolution adaptive windows,Yong Zhao and Gabriel Taubin,2011,15,Image and Vision Computing
10.1016/j.imavis.2005.09.015,Sliding window based approach for document image mosaicing,P. Shivakumara and G. Hemantha Kumar and D.S. Guru and P. Nagabhushan,2006,6,Image and Vision Computing
10.1016/j.imavis.2013.02.004,Stable and fast techniques for unambiguous compound phase coding,Andrea Torsello and Andrea Albarelli and Emanuele Rodolà,2013,0,Image and Vision Computing
10.1016/j.imavis.2010.01.016,Shape from incomplete silhouettes based on the reprojection error,Gloria Haro and Montse Pardàs,2010,11,Image and Vision Computing
10.1016/j.imavis.2017.08.009,A further study of low resolution androgenic hair patterns as a soft biometric trait,Frodo Kin Sun Chan and Adams Wai Kin Kong,2018,5,Image and Vision Computing
10.1016/j.imavis.2006.01.028,Vector quantization and fuzzy ranks for image reconstruction,Stefano Rovetta and Francesco Masulli,2007,4,Image and Vision Computing
10.1016/j.imavis.2016.08.004,Lessons from collecting a million biometric samples,P. Jonathon Phillips and Patrick J. Flynn and Kevin W. Bowyer,2017,3,Image and Vision Computing
10.1016/s0262-8856(99)00028-1,PGSD: an accurate 3D vision system using a projected grid for surface descriptions,L. Guisser and R. Payrissat and S. Castan,2000,9,Image and Vision Computing
10.1016/j.imavis.2008.12.001,A spatially distributed model for foreground segmentation,Patrick Dickinson and Andrew Hunter and Kofi Appiah,2009,18,Image and Vision Computing
10.1016/j.imavis.2013.12.001,Two-dimensional multi-pixel anisotropic Gaussian filter for edge-line segment (ELS) detection,Jian-Lei Liu and Da-Zheng Feng,2014,14,Image and Vision Computing
10.1016/j.imavis.2004.02.008,Practical generation of video textures using the auto-regressive process,Neill Campbell and Colin Dalton and David Gibson and David Oziem and Barry Thomas,2004,9,Image and Vision Computing
10.1016/j.imavis.2011.06.005,Comments on “Generalised finite Radon transform for N×N images”,Artyom M. Grigoryan and Nan Du,2011,3,Image and Vision Computing
10.1016/j.imavis.2010.08.008,Edge detection in the feature space,Zhengchun Lin and Jinshan Jiang and Zhiyan Wang,2011,8,Image and Vision Computing
10.1016/j.imavis.2012.06.012,Low-rank matrix decomposition in L1-norm by dynamic systems,Yiguang Liu and Bingbing Liu and Yifei Pu and Xiaohui Chen and Hong Cheng,2012,6,Image and Vision Computing
10.1016/j.imavis.2015.05.001,Approaches for automatic low-dimensional human shape refinement with priors or generic cues using RGB-D data,Mehmet Kemal Kocamaz and Christopher Rasmussen,2015,1,Image and Vision Computing
10.1016/j.imavis.2011.01.002,Reverse caricatures effects on three-dimensional facial reconstructions,Jobany Rodriguez and Ricardo Gutierrez-Osuna,2011,2,Image and Vision Computing
10.1016/j.imavis.2005.10.003,Simultaneous pose recovery and camera registration from multiple views of a walking person,Tomas Izo and W. Eric L. Grimson,2007,2,Image and Vision Computing
10.1016/j.imavis.2014.10.009,Fitting multiple projective models using clustering-based Markov chain Monte Carlo inference,George Terzakis and Phil F. Culverhouse and Guido Bugmann and Robert Sutton,2015,0,Image and Vision Computing
10.1016/j.imavis.2016.04.016,Towards a mean body for apparel design,J. Domingo and A. Simó and M.V. Ibáñez and E. Dura and G. Ayala and S. Alemany,2016,1,Image and Vision Computing
10.1016/j.imavis.2012.11.002,On growth and formlets: Sparse multi-scale coding of planar shape,James H. Elder and Timothy D. Oleskiw and Alex Yakubovich and Gabriel Peyré,2013,10,Image and Vision Computing
10.1016/j.imavis.2005.03.003,Effective pose estimation from point pairs,Zhiguang Zhong and Jianqiang Yi and Dongbin Zhao and Yiping Hong,2005,4,Image and Vision Computing
10.1016/j.imavis.2014.01.002,Exploring album structure for face recognition in online social networks,Jason Hochreiter and Zhongkai Han and Syed Zain Masood and Spencer Fonte and Marshall Tappen,2014,1,Image and Vision Computing
10.1016/j.imavis.2014.10.008,Multiview stereo and silhouette fusion via minimizing generalized reprojection error,Zhaoxin Li and Kuanquan Wang and Wenyan Jia and Hsin-Chen Chen and Wangmeng Zuo and Deyu Meng and Mingui Sun,2015,3,Image and Vision Computing
10.1016/j.imavis.2014.06.007,Automatic sub-category partitioning and parts localization for learning a robust object model,Linjia Sun and Xiaohui Liang and Qinping Zhao,2014,0,Image and Vision Computing
10.1016/s0262-8856(19)30040-x,Editorial Board,,2019,0,Image and Vision Computing
10.1016/j.imavis.2005.12.013,A comparison between BEM and FEM for elastic registration of medical images,E. Gladilin and V. Pekar and K. Rohr and H.S. Stiehl,2006,2,Image and Vision Computing
10.1016/s0262-8856(03)00120-3,Multiresolution genetic clustering algorithm for texture segmentation,Chang-Tsun Li and Randy Chiao,2003,10,Image and Vision Computing
10.1016/j.imavis.2005.06.005,Motion detection and tracking using belief indicators for an automatic visual-surveillance system,Cina Motamed,2006,16,Image and Vision Computing
10.1016/s0262-8856(22)00190-1,Editorial Board,,2022,0,Image and Vision Computing
10.1016/j.imavis.2018.01.002,Multidimensional directional steerable filters — Theory and application to 3D flow estimation,Dimitrios S. Alexiadis and Nikolaos Mitianoudis and Tania Stathaki,2018,2,Image and Vision Computing
10.1016/j.imavis.2021.104302,Editorial Board,,2021,0,Image and Vision Computing
10.1016/s0262-8856(22)00012-9,Editorial Board,,2022,0,Image and Vision Computing
10.1016/j.imavis.2008.03.008,Efficient 3D characterization of raised topological defects in smooth specular coatings,Pradeep Gnanaprakasam and Johné M. Parker and Subburengan Ganapathiraman and Zhen Hou,2009,2,Image and Vision Computing
10.1016/j.imavis.2003.07.007,ABI: analogy-based indexing for content image retrieval,Maurizio Cibelli and Michele Nappi and Maurizio Tucci,2004,0,Image and Vision Computing
10.1016/j.imavis.2017.01.008,Special issue on Best of Biometrics 2015,Massimo Tistarelli and Ross Beveridge and Patrick Flynn and Michele Nappi,2017,0,Image and Vision Computing
10.1016/j.imavis.2016.03.012,Combining forces: Data fusion across man and machine for biometric analysis,Sarah V. Stevenage and Richard M. Guest,2016,1,Image and Vision Computing
10.1016/j.imavis.2021.104146,Exploring region relationships implicitly: Image captioning with visual relationship attention,Zongjian Zhang and Qiang Wu and Yang Wang and Fang Chen,2021,19,Image and Vision Computing
10.1016/s0262-8856(00)00037-8,A computational approach to color adaptation effects,D. Marini and A. Rizzi,2000,77,Image and Vision Computing
10.1016/j.imavis.2021.104216,Spatiotemporal module for video saliency prediction based on self-attention,Yuhao Wang and Zhuoran Liu and Yibo Xia and Chunbo Zhu and Danpei Zhao,2021,5,Image and Vision Computing
10.1016/j.imavis.2016.03.013,Is automatic facial expression recognition of emotions coming to a dead end? The rise of the new kids on the block,Hatice Gunes and Hayley Hung,2016,25,Image and Vision Computing
10.1016/j.imavis.2020.103979,Collaborative representation of blur invariant deep sparse features for periocular recognition from smartphones,Kiran Raja and Raghavendra Ramachandra and Christoph Busch,2020,12,Image and Vision Computing
10.1016/j.imavis.2008.06.001,Fuzzy rough sets hybrid scheme for motion and scene complexity adaptive deinterlacing,Gwanggil Jeon and Marco Anisetti and Donghyung Kim and Valerio Bellandi and Ernesto Damiani and Jechang Jeong,2009,37,Image and Vision Computing
10.1016/j.imavis.2006.04.002,Robust multiple objects tracking using image segmentation and trajectory estimation scheme in video frames,Ying-Tung Hsiao and Cheng-Long Chuang and Yen-Ling Lu and Joe-Air Jiang,2006,22,Image and Vision Computing
10.1016/j.imavis.2009.10.011,Adaptive wavelet-Galerkin methods for limited angle tomography,Xiaoqiang Lu and Yi Sun and Gangfeng Bai,2010,15,Image and Vision Computing
10.1016/j.imavis.2022.104566,A controllable face forgery framework to enrich face-privacy-protection datasets,Jiachen Yang and Yong Zhu and Shuai Xiao and Guipeng Lan and Yang Li,2022,1,Image and Vision Computing
10.1016/s0262-8856(03)00086-6,Editorial,Richard Bowden,2003,0,Image and Vision Computing
10.1016/j.imavis.2003.12.006,"Improving accuracy, robustness and computational efficiency in 3D computer vision",S. Crossley and N.L. Seed and N.A. Thacker and P.A. Ivey,2004,2,Image and Vision Computing
10.1016/j.imavis.2020.103930,Multi-depth dilated network for fashion landmark detection with batch-level online hard keypoint mining,Qirong Bu and Kai Zeng and Rui Wang and Jun Feng,2020,3,Image and Vision Computing
10.1016/j.imavis.2013.12.010,A measure of information gained through biometric systems,Kenta Takahashi and Takao Murakami,2014,17,Image and Vision Computing
10.1016/s0262-8856(01)00066-x,Detection of arbitrary planar shapes with 3D pose,J.R. Cózar and N. Guil and E.L. Zapata,2001,5,Image and Vision Computing
10.1016/s0262-8856(22)00208-6,Editorial Board,,2022,0,Image and Vision Computing
10.1016/s0262-8856(02)00088-4,Optimal projection of 2-D displacements for 3-D translational motion estimation,Christophe Garcia and Georgios Tziritas,2002,6,Image and Vision Computing
10.1016/j.imavis.2017.11.005,Primal-dual optimization strategies in Huber- L 1 optical flow with temporal subspace constraints for non-rigid sequence registration,Monica Hernandez,2018,4,Image and Vision Computing
