DOI,Título,Autores,Año,Citas,Revista
10.1007/s41066-021-00283-1,A new similarity measure between picture fuzzy sets with applications to pattern recognition and clustering problems,Rakhi Gupta and Satish Kumar,2022,4,Granular Computing
10.1007/s41066-021-00259-1,Generalized intuitionistic fuzzy c-means clustering algorithm using an adaptive intuitionistic fuzzification technique,Meenakshi Kaushal and Q. M. Danish Lohani,2022,3,Granular Computing
10.1007/s41066-019-00184-4,A series of generalized induced Einstein aggregation operators and their application to group decision-making process based on Pythagorean fuzzy numbers,Khaista Rahman,2021,15,Granular Computing
10.1007/s41066-021-00253-7,Novel score functions of generalized orthopair fuzzy membership grades with application to multiple attribute decision making,Feng Feng and Yujuan Zheng and Bingzhen Sun and Muhammad Akram,2022,46,Granular Computing
10.1007/s41066-021-00304-z,Pythagorean fuzzy entropy measure-based complex proportional assessment technique for solving multi-criteria healthcare waste treatment problem,Rishikesh Chaurasiya and Divya Jain,2022,10,Granular Computing
10.1007/s41066-018-00143-5,Intuitionistic high-order fuzzy time series forecasting method based on pi-sigma artificial neural networks trained by artificial bee colony,Erol Egrioglu and Ufuk Yolcu and Eren Bas,2019,38,Granular Computing
10.1007/s41066-019-00155-9,Barriers analysis for reverse logistics in Thailand’s palm oil industry using fuzzy multi-criteria decision-making method for prioritizing the solutions,Patchara Phochanikorn and Chunqiao Tan and Wen Chen,2020,19,Granular Computing
10.1007/s41066-018-0079-4,Correction to: A unified method of defuzzification for type-2 fuzzy numbers with its application to multiobjective decision making,Animesh Biswas and Arnab Kumar De,2018,0,Granular Computing
10.1007/s41066-018-0134-1,A new box selection criterion in interval Bernstein global optimization algorithm for MINLPs,Bhagyesh V. Patil and Ahmed Zidna,2020,0,Granular Computing
10.1007/s41066-016-0028-z,Approximation performance of the nonlinear hybrid fuzzy system based on variable universe,Guijun Wang and Yu Li and Xiaoping Li,2017,13,Granular Computing
10.1007/s41066-019-00207-0,Overlapping community detection in social networks with Voronoi and tolerance neighborhood-based method,Kushagra Trivedi and Sheela Ramanna,2021,0,Granular Computing
10.1007/s41066-016-0030-5,Fuzzy higher type information granules from an uncertainty measurement,Mauricio A. Sanchez and Juan R. Castro and Oscar Castillo and Olivia Mendoza and Antonio Rodriguez-Diaz and Patricia Melin,2017,56,Granular Computing
10.1007/s41066-020-00222-6,Data-Driven Granular Computing Systems and Applications,Ruidan Su and George Panoutsos and Xiaodong Yue,2021,2,Granular Computing
10.1007/s41066-019-00158-6,Multiple classifiers fusion and CNN feature extraction for handwritten digits recognition,Hui-huang Zhao and Han Liu,2020,50,Granular Computing
10.1007/s41066-017-0065-2,Multi-task learning for intelligent data processing in granular computing context,Han Liu and Mihaela Cocea and Weili Ding,2018,23,Granular Computing
10.1007/s41066-022-00339-w,Preferred hospitalization of COVID-19 patients using intuitionistic fuzzy set-based matching approach,Amalendu Si and Sujit Das and Samarjit Kar,2022,0,Granular Computing
10.1007/s41066-018-0088-3,Linguistic dynamic multicriteria decision making using symbolic linguistic computing models,Yeleny Zulueta-Veliz and Pedro J. Sanchez,2018,11,Granular Computing
10.1007/s41066-022-00347-w,"Realistic solution of fuzzy critical path problems, case study: the airport’s cargo ground operation systems",Fazlollah Abbasi and Tofigh Allahviranloo,2022,0,Granular Computing
10.1007/s41066-023-00372-3,Algebraic structure through interval-valued fuzzy signature based on interval-valued fuzzy sets,Sangeetha Palanisamy and Jayaraman Periyasamy,2023,0,Granular Computing
10.1007/s41066-021-00255-5,Fuzzy risk analysis using a new technique of ranking of generalized trapezoidal fuzzy numbers,Kartik Patra,2022,5,Granular Computing
10.1007/s41066-019-00192-4,Fuzzy decision making for medical diagnosis using arithmetic of generalised parabolic fuzzy numbers,Palash Dutta and Dhanesh Doley,2021,7,Granular Computing
10.1007/s41066-019-00173-7,An incremental attribute reduction approach based on knowledge granularity for incomplete decision systems,Chucai Zhang and Jianhua Dai,2020,7,Granular Computing
10.1007/s41066-018-00151-5,Neighborhood attribute reduction approach to partially labeled data,Keyu Liu and Eric C. C. Tsang and Jingjing Song and Hualong Yu and Xiangjian Chen and Xibei Yang,2020,7,Granular Computing
10.1007/s41066-021-00311-0,A perceptual computer for hierarchical portfolio selection based on interval type-2 fuzzy sets,Mohsen Karimi and Hooman Tahayori and Kayvan Tirdad and Alireza Sadeghian,2023,3,Granular Computing
10.1007/s41066-022-00318-1,Multiple attribute group decision-making based on novel probabilistic ordered weighted cosine similarity operators with Pythagorean fuzzy information,R. Verma and A. Mittal,2023,1,Granular Computing
10.1007/s41066-021-00298-8,Characterization of lattice-valued multiset finite automata,M. K. Dubey and Anand P. Singh and Mallika Dhingra,2022,2,Granular Computing
10.1007/s41066-022-00338-x,Developing a novel stock index trend predictor model by integrating multiple criteria decision-making with an optimized online sequential extreme learning machine,Sidharth Samal and Rajashree Dash,2022,1,Granular Computing
10.1007/s41066-021-00293-z,The differences between the horizontal membership function used in multidimensional fuzzy arithmetic and the inverse membership function used in gradual arithmetic,Andrzej Piegat and Marcin Pluciński,2022,0,Granular Computing
10.1007/s41066-021-00271-5,Basic type dominance and its use in measure-modeled uncertainty in decision making,Ronald R. Yager,2022,2,Granular Computing
10.1007/s41066-018-00153-3,Goal programming models for incomplete interval additive reciprocal preference relations with permutations,Mao-Jie Huang and Fang Liu and Ya-Nan Peng and Qin Yu,2020,8,Granular Computing
10.1007/s41066-016-0032-3,Granular computing: from granularity optimization to multi-granularity joint problem solving,Guoyin Wang and Jie Yang and Ji Xu,2017,80,Granular Computing
10.1007/s41066-018-0116-3,A visual analytics with evidential inference for big data: case study of chemical vapor deposition in solar company,Yu-Chien Ko and Yang-Yin Ting and Hamido Fujita,2019,8,Granular Computing
10.1007/s41066-021-00290-2,Q-rung orthopair fuzzy Frank aggregation operators and its application in multiple attribute decision-making with unknown attribute weights,Mijanur Rahaman Seikh and Utpal Mandal,2022,17,Granular Computing
10.1007/s41066-016-0036-z,Concept lattice reduction using different subset of attributes as information granules,Prem Kumar Singh and Cherukuri Aswani Kumar,2017,30,Granular Computing
10.1007/s41066-020-00251-1,A method for solving linear difference equation in Gaussian fuzzy environments,Mostafijur Rahaman and Sankar Prasad Mondal and Ebrahem A. Algehyne and Amiya Biswas and Shariful Alam,2022,8,Granular Computing
10.1007/s41066-020-00234-2,Discretized sequential pattern mining for behaviour classification,Scott Buffett,2021,1,Granular Computing
10.1007/s41066-019-00208-z,Gradual interval arithmetic and fuzzy interval arithmetic,Reda Boukezzoula and Laurent Foulloy and Didier Coquin and Sylvie Galichet,2021,7,Granular Computing
10.1007/s41066-015-0006-x,Managing multi-granularity linguistic information in qualitative group decision making: an overview,Zeshui Xu and Hai Wang,2016,144,Granular Computing
10.1007/s41066-018-0100-y,Portfolio optimization with perception-based risk measures in dynamic fuzzy asset management,Yuji Yoshida,2019,4,Granular Computing
10.1007/s41066-016-0037-y,Type-2 fuzzy linear systems,Marzieh Najariyan and Mehran Mazandarani and Robert John,2017,25,Granular Computing
10.1007/s41066-019-00187-1,A new approach of cubic interval-valued intuitionistic fuzzy subsemigroup and ideals,A. B. Azim and A. Ali and S. Ali and A. Fahmi and A. Siddiqa,2021,2,Granular Computing
10.1007/s41066-017-0043-8,Fuzzy information granulation towards interpretable sentiment analysis,Han Liu and Mihaela Cocea,2017,39,Granular Computing
10.1007/s41066-017-0038-5,GIFIHIA operator and its application to the selection of cold chain logistics enterprises,Shanshan Meng and Nan Liu and Yingdong He,2017,20,Granular Computing
10.1007/s41066-018-0113-6,Granule description based on positive and negative attributes,Huilai Zhi and Jinhai Li,2019,11,Granular Computing
10.1007/s41066-020-00224-4,Decision-making approach based on Pythagorean Dombi fuzzy soft graphs,Muhammad Akram and Gulfam Shahzadi,2021,12,Granular Computing
10.1007/s41066-023-00365-2,Fuzzy topological indices with application to cybercrime problem,Uzma Ahmad and Nasir Kaleem Khan and Arsham Borumand Saeid,2023,0,Granular Computing
10.1007/s41066-023-00368-z,Training Sigma-Pi neural networks with the grey wolf optimization algorithm,Cansu Sarıkaya and Eren Bas and Erol Egrioglu,2023,0,Granular Computing
10.1007/s41066-022-00357-8,Concept-wise granular computing for explainable artificial intelligence,Antonio Luca Alfeo and Mario G. C. A. Cimino and Guido Gagliardi,2022,0,Granular Computing
10.1007/s41066-018-0083-8,Induction of shadowed sets from fuzzy sets,Adeku Musa Ibrahim and Tamunokuro Opubo William-West,2019,11,Granular Computing
10.1007/s41066-019-00197-z,Three-way clustering method for incomplete information system based on set-pair analysis,Chunying Zhang and Ruiyan Gao and Hao Qin and Xiaoze Feng,2021,7,Granular Computing
10.1007/s41066-018-0111-8,Multi-granulation fuzzy decision-theoretic rough sets and bipolar-valued fuzzy decision-theoretic rough sets and their applications,Prasenjit Mandal and A. S. Ranadive,2019,9,Granular Computing
10.1007/s41066-018-0135-0,The paradigm of induced ordered weighted averaging aggregation process with application in uncertain linguistic evaluation,Lesheng Jin and Radko Mesiar and Ronald R. Yager,2020,5,Granular Computing
10.1007/s41066-020-00245-z,Rough approximation models via graphs based on neighborhood systems,Abd El Fattah El Atik and Ashraf Nawar and Mohammed Atef,2021,23,Granular Computing
10.1007/s41066-020-00229-z,A hybrid decision-making model under q-rung orthopair fuzzy Yager aggregation operators,Muhammad Akram and Gulfam Shahzadi,2021,40,Granular Computing
10.1007/s41066-019-00166-6,New approach to multiple attribute group decision-making based on Pythagorean fuzzy Einstein hybrid geometric operator,Khaista Rahman and Asad Ali,2020,21,Granular Computing
10.1007/s41066-021-00282-2,An approach to decision-making via picture fuzzy soft graphs,P. Chellamani and D. Ajay and Said Broumi and T. Antony Alphonse Ligori,2022,5,Granular Computing
10.1007/s41066-016-0034-1,Granular computing-based approach for classification towards reduction of bias in ensemble learning,Han Liu and Mihaela Cocea,2017,37,Granular Computing
10.1007/s41066-019-00163-9,Granular computing-based multi-level interactive attention networks for targeted sentiment analysis,Haihui Li and Ting Yuan and Haiming Wu and Yun Xue and Xiaohui Hu,2020,4,Granular Computing
10.1007/s41066-018-0133-2,"Optimization of type-1, interval type-2 and general type-2 fuzzy inference systems using a hierarchical genetic algorithm for modular granular neural networks",Patricia Melin and Daniela Sánchez,2019,14,Granular Computing
10.1007/s41066-018-0120-7,A new fuzzy learning vector quantization method for classification problems based on a granular approach,Jonathan Amezcua and Patricia Melin,2019,14,Granular Computing
10.1007/s41066-020-00219-1,Some novel aggregation operators for cubic picture fuzzy information: application in multi-attribute decision support problem,Shahzaib Ashraf and Saleem Abdullah and n.m. Muneeza,2021,7,Granular Computing
10.1007/s41066-019-00176-4,Novel distance measures for Pythagorean fuzzy sets with applications to pattern recognition problems,P. A. Ejegwa and J. A. Awolola,2021,37,Granular Computing
10.1007/s41066-019-00170-w,A novel equilibrium solution concept for intuitionistic fuzzy bi-matrix games considering proportion mix of possibility and necessity expectations,Imran Khan and Aparna Mehra,2020,11,Granular Computing
10.1007/s41066-018-0082-9,Generalized interval-valued Pythagorean fuzzy aggregation operators and their application to group decision-making,Khaista Rahman and Saleem Abdullah,2019,40,Granular Computing
10.1007/s41066-019-00156-8,Improved composite relation for pythagorean fuzzy sets and its application to medical diagnosis,Paul Augustine Ejegwa,2020,51,Granular Computing
10.1007/s41066-023-00362-5,Domination in Pythagorean fuzzy graphs,Sadegh Banitalebi and Rajab Ali Borzooei,2023,1,Granular Computing
10.1007/s41066-021-00277-z,Bipolarity in multi-way fuzzy context and its analysis using m-way granulation,Prem Kumar Singh,2022,4,Granular Computing
10.1007/s41066-018-0103-8,Multiple-criteria decision-making for service quality selection based on Shapley COPRAS method under hesitant fuzzy sets,Arunodaya Raj Mishra and Pratibha Rani and Kamal Raj Pardasani,2019,52,Granular Computing
10.1007/s41066-018-0094-5,A rough multi-objective genetic algorithm for uncertain constrained multi-objective solid travelling salesman problem,Samir Maity and Arindam Roy and Manoanjan Maiti,2019,7,Granular Computing
10.1007/s41066-018-0085-6,A fuzzy rough multi-objective multi-item inventory model with both stock-dependent demand and holding cost rate,Totan Garai and Dipankar Chakraborty and Tapan Kumar Roy,2019,15,Granular Computing
10.1007/s41066-017-0056-3,Moderator intuitionistic fuzzy sets with applications in multi-criteria decision-making,Bhagawati Prasad Joshi,2018,27,Granular Computing
10.1007/s41066-018-00149-z,Distance and similarity measures for Pythagorean fuzzy sets,Paul Augustine Ejegwa,2020,54,Granular Computing
10.1007/s41066-018-0140-3,Novel distance measures for cubic intuitionistic fuzzy sets and their applications to pattern recognitions and medical diagnosis,Harish Garg and Gagandeep Kaur,2020,30,Granular Computing
10.1007/s41066-018-0090-9,Multi-granulation interval-valued fuzzy probabilistic rough sets and their corresponding three-way decisions based on interval-valued fuzzy preference relations,Prasenjit Mandal and A. S. Ranadive,2019,31,Granular Computing
10.1007/s41066-019-00180-8,Complex multi-fuzzy context analysis at different granulation,Prem Kumar Singh,2021,5,Granular Computing
10.1007/s41066-019-00182-6,Deep multiple classifier fusion for traffic scene recognition,Fangyu Wu and Shiyang Yan and Jeremy S. Smith and Bailing Zhang,2021,4,Granular Computing
10.1007/s41066-016-0029-y,Shadowed sets of dynamic fuzzy sets,Mingjie Cai and Qingguo Li and Guangming Lang,2017,44,Granular Computing
10.1007/s41066-021-00284-0,New concepts of inverse fuzzy mixed graphs and its application,Soumitra Poulik and Ganesh Ghorai,2022,9,Granular Computing
10.1007/s41066-018-00150-6,Examining stock index return with pattern recognition model based on cumulative probability-based granulating method by expert knowledge,Tai-Liang Chen and Feng-Yu Chen,2019,1,Granular Computing
10.1007/s41066-018-0128-z,Extended Gustafson–Kessel granular hotspot detection,Ferdinando Di Martino and Salvatore Sessa,2020,2,Granular Computing
10.1007/s41066-022-00353-y,Analysis of incommensurate multi-order fuzzy fractional differential equations under strongly generalized fuzzy Caputo’s differentiability,Muhammad Akram and Ghulam Muhammad,2022,3,Granular Computing
10.1007/s41066-021-00260-8,Multi-attribute decision-making with q-rung picture fuzzy information,Muhammad Akram and Gulfam Shahzadi and José Carlos R. Alcantud,2022,27,Granular Computing
10.1007/s41066-017-0075-0,Decision making under measure-based granular uncertainty,Ronald R. Yager,2018,15,Granular Computing
10.1007/s41066-019-00165-7,"A four-way decision-making approach using interval-valued fuzzy sets, rough set and granular computing: a new approach in data classification and decision-making",Pritpal Singh and Yo-Ping Huang,2020,13,Granular Computing
10.1007/s41066-018-00144-4,Hesitant fuzzy set based computational method for financial time series forecasting,Kamlesh Bisht and Sanjay Kumar,2019,21,Granular Computing
10.1007/s41066-021-00262-6,Fully fuzzy linear systems with trapezoidal and hexagonal fuzzy numbers,Abdelhalim Ziqan and Sabreen Ibrahim and Mohammad Marabeh and Ammar Qarariyah,2022,1,Granular Computing
10.1007/s41066-021-00301-2,Signed distance-based closeness coefficients approach for solving inverse non-linear programming models for multiple criteria group decision-making using interval Type-2 pythagorean fuzzy numbers,Muhammad Touqeer and Rimsha Umer and Ali Ahmadian and Soheil Salahshour and Mehdi Salimi,2022,3,Granular Computing
10.1007/s41066-019-00196-0,Dynamic risk-sensitive fuzzy asset management with coherent risk measures derived from decision maker’s utility,Yuji Yoshida,2021,6,Granular Computing
10.1007/s41066-020-00211-9,Set-theoretic models of three-way decision,Yiyu Yao,2021,43,Granular Computing
10.1007/s41066-019-00193-3,An approach to merge domain ontologies using granular computing,M. Priya and Ch. Aswani Kumar,2021,6,Granular Computing
10.1007/s41066-018-00146-2,Granular computing in machine learning,Degang Chen and Weihua Xu and Jinhai Li,2019,3,Granular Computing
10.1007/s41066-018-00147-1,Interval methods for robust gain scheduling controllers,Julia Kersten and Andreas Rauh and Harald Aschemann,2020,9,Granular Computing
10.1007/s41066-018-0117-2,Object and attribute oriented m-polar fuzzy concept lattice using the projection operator,Prem Kumar Singh,2019,10,Granular Computing
10.1007/s41066-019-00198-y,Measures and approximations using empirical structures,Ivo Düntsch and Günther Gediga and Hui Wang,2021,0,Granular Computing
10.1007/s41066-016-0022-5,The development of granular rule-based systems: a study in structural model compression,Sharifah Sakinah Syed Ahmad and Witold Pedrycz,2017,42,Granular Computing
10.1007/s41066-020-00214-6,A hybrid decision-making framework using rough mF bipolar soft environment,Muhammad Akram and Ghous Ali and Muhammad Shabir,2021,14,Granular Computing
10.1007/s41066-019-00204-3,A survey on granular computing and its uncertainty measure from the perspective of rough set theory,Yunlong Cheng and Fan Zhao and Qinghua Zhang and Guoyin Wang,2021,8,Granular Computing
10.1007/s41066-022-00342-1,Variable precision multi-granulation covering rough intuitionistic fuzzy sets,Zhan-ao Xue and Meng-meng Jing and Yong-xiang Li and Yu Zheng,2022,0,Granular Computing
10.1007/s41066-017-0058-1,Distance-based information granularity in neighborhood-based granular space,Bing Huang and Huaxiong Li,2018,11,Granular Computing
10.1007/s41066-017-0068-z,A unified method of defuzzification for type-2 fuzzy numbers with its application to multiobjective decision making,Animesh Biswas and Arnab Kumar De,2018,14,Granular Computing
10.1007/s41066-018-0127-0,Learning quasi-identifiers for privacy-preserving exchanges: a rough set theory approach,C. Wafo Soh and L. L. Njilla and K. K. Kwiat and C. A. Kamhoua,2020,6,Granular Computing
10.1007/s41066-022-00336-z,A new nonlinear causality test based on single multiplicative neuron model artificial neural network: a case study for Turkey’s macroeconomic indicators,Erol Egrioglu and Eren Bas and Turan Cansu and M. Akif Kara,2023,0,Granular Computing
10.1007/s41066-022-00335-0,Dynamic customer segmentation: a case study using the modified dynamic fuzzy c-means clustering algorithm,M. Sivaguru,2023,1,Granular Computing
10.1007/s41066-016-0035-0,A granular computing framework for approximate reasoning in situation awareness,Giuseppe D’Aniello and Angelo Gaeta and Vincenzo Loia and Francesco Orciuoli,2017,27,Granular Computing
10.1007/s41066-017-0063-4,Non-linear interval-valued fuzzy numbers and their application in difference equations,Sankar Prasad Mondal and Manimohan Mandal and Debasish Bhattacharya,2018,12,Granular Computing
10.1007/s41066-019-00157-7,Weighted-fuzzy-relations time series for forecasting information technology maintenance cost,Jing-Rong Chang and Pei-Yu Yu,2019,10,Granular Computing
10.1007/s41066-018-0099-0,The determination of three-way decisions with decision-theoretic rough sets considering the loss function evaluated by multiple experts,Kobina Agbodah,2019,16,Granular Computing
10.1007/s41066-020-00247-x,Topological approaches to rough approximations based on closure operators,Mostafa K. El-Bably and Kamel K. Fleifel and O. A. Embaby,2022,12,Granular Computing
10.1007/s41066-017-0070-5,A multi-granularity collective behavior analysis approach for online social networks,Qun Liu and Qiuxia Liu and Lili Yang and Guoyin Wang,2018,6,Granular Computing
10.1007/s41066-015-0007-9,"Granular meta-clustering based on hierarchical, network, and temporal connections",Pawan Lingras and Farhana Haider and Matt Triff,2016,69,Granular Computing
10.1007/s41066-018-0102-9,An extension of VIKOR method for multi-attribute decision-making under Pythagorean hesitant fuzzy setting,Muhammad Sajjad Ali Khan and Saleem Abdullah and Asad Ali and Fazli Amin,2019,37,Granular Computing
10.1007/s41066-021-00263-5,Generalized hesitant fuzzy knowledge measure with its application to multi-criteria decision-making,Surender Singh and Abdul Haseeb Ganie,2022,6,Granular Computing
10.1007/s41066-019-00201-6,Three-way decision models and its optimization based on Dempster–Shafer evidence theory and rough sets,Chunying Zhang and Xiaoze Feng and Ruiyan Gao,2021,2,Granular Computing
10.1007/s41066-019-00181-7,A deep learning approach for financial market prediction: utilization of Google trends and keywords,Min-Hsuan Fan and Mu-Yen Chen and En-Chih Liao,2021,13,Granular Computing
10.1007/s41066-021-00273-3,Multiple attribute decision-making based on cubical fuzzy aggregation operators,Asghar Khan and Asmat Ullah Jan and Fazli Amin and Aurang Zeb,2022,2,Granular Computing
10.1007/s41066-022-00345-y,Winsorized dendritic neuron model artificial neural network and a robust training algorithm with Tukey’s biweight loss function based on particle swarm optimization,Erol Egrioglu and Eren Bas and Ozlem Karahasan,2022,2,Granular Computing
10.1007/s41066-016-0024-3,Robust decision making using intuitionistic fuzzy numbers,Sujit Das and Samarjit Kar and Tandra Pal,2017,68,Granular Computing
10.1007/s41066-022-00329-y,Multi-criteria decision making based on novel fuzzy knowledge measures,Rajesh Joshi,2023,2,Granular Computing
10.1007/s41066-019-00203-4,Decision-making with measure modeled uncertain payoffs and multiple goals,Ronald R. Yager,2020,5,Granular Computing
10.1007/s41066-021-00307-w,Aggregation operators of Pythagorean fuzzy bi-polar soft sets with application in multiple attribute decision making,Aurang Zeb and Asghar Khan and Muhammad Fayaz and Muhammad Izhar,2022,3,Granular Computing
10.1007/s41066-020-00216-4,A mathematical model for solving fuzzy integer linear programming problems with fully rough intervals,El-Saeed Ammar and Abdusalam Emsimir,2021,8,Granular Computing
10.1007/s41066-020-00226-2,Event abstraction in process mining: literature review and taxonomy,Sebastiaan J. van Zelst and Felix Mannhardt and Massimiliano de Leoni and Agnes Koschmider,2021,32,Granular Computing
10.1007/s41066-017-0059-0,Some new operations over the generalized intuitionistic fuzzy sets and their application to decision-making process,Ezzatallah Baloui Jamkhaneh and Harish Garg,2018,51,Granular Computing
10.1007/s41066-017-0054-5,Solving different practical granular problems under the same system of equations,Andrzej Piegat and Marek Landowski,2018,8,Granular Computing
10.1007/s41066-022-00346-x,Multi-attribute group decision-making based on probabilistic dual hesitant fuzzy Maclaurin symmetric mean operators,Qasim Noor and Tabasam Rashid and Ismat Beg,2022,0,Granular Computing
10.1007/s41066-019-00164-8,Shape recognition through multi-level fusion of features and classifiers,Xinming Wang and Weili Ding and Han Liu and Xiangsheng Huang,2020,4,Granular Computing
10.1007/s41066-015-0003-0,"Granular computing, computational intelligence, and the analysis of non-geometric input spaces",Lorenzo Livi and Alireza Sadeghian,2016,93,Granular Computing
10.1007/s41066-018-0109-2,Computing with words for student strategy evaluation in an examination,Prashant K. Gupta and Pranab K. Muhuri,2019,8,Granular Computing
10.1007/s41066-022-00341-2,A solution algorithm for finding the best and the worst fuzzy compromise solutions of fuzzy rough linear programming problem with triangular fuzzy rough number coefficients,Gizem Temelcan,2022,0,Granular Computing
10.1007/s41066-021-00276-0,The solution techniques for linear and quadratic equations with coefficients as Cauchy neutrosphic numbers,Mostafijur Rahaman and Sankar Prasad Mondal and Banashree Chatterjee and Shariful Alam,2022,1,Granular Computing
10.1007/s41066-018-0077-6,Entropy of interval-valued intuitionistic hesitant fuzzy set and its application to group decision making problems,Dheeraj Kumar Joshi and Sanjay Kumar,2018,23,Granular Computing
10.1007/s41066-016-0018-1,A neurofuzzy algorithm for learning from complex granules,Bruno Apolloni and Simone Bassis and Jacopo Rota and Gian Luca Galliani and Matteo Gioia and Luca Ferrari,2016,50,Granular Computing
10.1007/s41066-018-0104-7,Granular cognitive maps: a review,Rafael Falcon and Gonzalo Nápoles and Rafael Bello and Koen Vanhoof,2019,5,Granular Computing
10.1007/s41066-018-0086-5,Emergency decision-making combining cumulative prospect theory and group decision-making,Wenjing Liu and Lei Li,2019,33,Granular Computing
