DOI,Título,Autores,Año,Citas,Revista
10.3390/a11040034,Failure Mode and Effects Analysis Considering Consensus and Preferences Interdependence,Jianghong Zhu and Rui Wang and Yanlai Li,2018,12,Algorithms
10.3390/a11060080,Scheduling a Single Machine with Primary and Secondary Objectives,Nodari Vakhania,2018,7,Algorithms
10.3390/a15090299,Artificial Intelligence Algorithms for Treatment of Diabetes,Mudassir M. Rashid and Mohammad Reza Askari and Canyu Chen and Yueqing Liang and Kai Shu and Ali Cinar,2022,1,Algorithms
10.3390/a15080275,New Step Size Control Algorithm for Semi-Implicit Composition ODE Solvers,Petr Fedoseev and Dmitriy Pesterev and Artur Karimov and Denis Butusov,2022,1,Algorithms
10.3390/a9040076,A Procedure for Identification of Appropriate State Space and ARIMA Models Based on Time-Series Cross-Validation,Patrícia Ramos and José Oliveira,2016,11,Algorithms
10.3390/a15020069,Approximation of the Riesz–Caputo Derivative by Cubic Splines,Francesca Pitolli and Chiara Sorgentone and Enza Pellegrino,2022,6,Algorithms
10.3390/a16030142,Automatic Generation of Literary Sentences in French,Luis-Gil Moreno-Jiménez and Juan-Manuel Torres-Moreno and Roseli Suzi. Wedemann,2023,0,Algorithms
10.3390/a16030145,Special Issue on Supervised and Unsupervised Classification Algorithms—Foreword from Guest Editors,Laura Antonelli and Mario Rosario Guarracino,2023,0,Algorithms
10.3390/a11100145,Reducing the Operational Cost of Cloud Data Centers through Renewable Energy,Demetrio Laganà and Carlo Mastroianni and Michela Meo and Daniela Renga,2018,22,Algorithms
10.3390/a10020068,An Easily Understandable Grey Wolf Optimizer and Its Application to Fuzzy Controller Tuning,Radu-Emil Precup and Radu-Codrut David and Alexandra-Iulia Szedlak-Stinean and Emil M. Petriu and Florin Dragan,2017,43,Algorithms
10.3390/a14030079,An Improved Greedy Heuristic for the Minimum Positive Influence Dominating Set Problem in Social Networks,Salim Bouamama and Christian Blum,2021,9,Algorithms
10.3390/a14100297,Improving the Robustness of AI-Based Malware Detection Using Adversarial Machine Learning,Shruti Patil and Vijayakumar Varadarajan and Devika Walimbe and Siddharth Gulechha and Sushant Shenoy and Aditya Raina and Ketan Kotecha,2021,5,Algorithms
10.3390/a12110240,Tensor-Based Algorithms for Image Classification,Stefan Klus and Patrick Gelß,2019,9,Algorithms
10.3390/a15020049,Using Explainable Machine Learning to Explore the Impact of Synoptic Reporting on Prostate Cancer,Femke M. Janssen and Katja K. H. Aben and Berdine L. Heesterman and Quirinus J. M. Voorham and Paul A. Seegers and Arturo Moncada-Torres,2022,3,Algorithms
10.3390/a11070094,Tensor Completion Based on Triple Tubal Nuclear Norm,Dongxu Wei and Andong Wang and Xiaoqin Feng and Boyu Wang and Bo Wang,2018,12,Algorithms
10.3390/a16030156,A New Third-Order Family of Multiple Root-Findings Based on Exponential Fitted Curve,Vinay Kanwar and Alicia Cordero and Juan R. Torregrosa and Mithil Rajput and Ramandeep Behl,2023,0,Algorithms
10.3390/a8020292,Training Artificial Neural Networks by a Hybrid PSO-CS Algorithm,Jeng-Fung Chen and Quang Do and Ho-Nien Hsieh,2015,48,Algorithms
10.3390/a15040130,Machine Learning Algorithms: An Experimental Evaluation for Decision Support Systems,Hugo Silva and Jorge Bernardino,2022,0,Algorithms
10.3390/a8030529,A Parallel Search Strategy Based on Sparse Representation for Infrared Target Tracking,Zhen Shi and Chang'an Wei and Ping Fu and Shouda Jiang,2015,2,Algorithms
10.3390/a15060192,Constructing the Neighborhood Structure of VNS Based on Binomial Distribution for Solving QUBO Problems,Dhidhi Pambudi and Masaki Kawamura,2022,0,Algorithms
10.3390/a12070131,Aiding Dictionary Learning Through Multi-Parametric Sparse Representation,Florin Stoican and Paul Irofti,2019,4,Algorithms
10.3390/a12060113,Surrogate-Based Robust Design for a Non-Smooth Radiation Source Detection Problem,Răzvan Ştefănescu and Jason Hite and Jared Cook and Ralph C. Smith and John Mattingly,2019,1,Algorithms
10.3390/a5040629,Testing Goodness of Fit of Random Graph Models,Villõ Csiszár and Péter Hussami and János Komlós and Tamás Móri and Lídia Rejtõ and Gábor Tusnády,2012,2,Algorithms
10.3390/a15050153,Process Mining in Clinical Practice: Model Evaluations in the Central Venous Catheter Installation Training,Gopi Battineni and Nalini Chintalapudi and Gregory Zacharewicz,2022,0,Algorithms
10.3390/a15010020,MINC-NRL: An Information-Based Approach for Community Detection,Yinan Chen and Chuanpeng Wang and Dong Li,2022,2,Algorithms
10.3390/a14060175,Approximation Algorithms for Sorting λ-Permutations by λ-Operations,Guilherme Henrique Santos Miranda and Alexsandro Oliveira Alexandrino and Carla Negri Lintzmayer and Zanoni Dias,2021,1,Algorithms
10.3390/a11080119,An Opportunistic Network Routing Algorithm Based on Cosine Similarity of Data Packets between Nodes,Yucheng Lin and Zhigang Chen and Jia Wu and Leilei Wang,2018,6,Algorithms
10.3390/a12110227,Facial Expression Recognition Based on Auxiliary Models,Yingying Wang and Yibin Li and Yong Song and Xuewen Rong,2019,8,Algorithms
10.3390/a14060168,Guaranteed Diversity and Optimality in Cost Function Network Based Computational Protein Design Methods,Manon Ruffini and Jelena Vucinic and Simon de de Givry and George Katsirelos and Sophie Barbe and Thomas Schiex,2021,5,Algorithms
10.3390/a15070220,Optimal Algorithms for Sorting Permutations with Brooms,Indulekha Sadanandan and Bhadrachalam Chitturi,2022,1,Algorithms
10.3390/a14070209,Containment Control of First-Order Multi-Agent Systems under PI Coordination Protocol,Mingyang Huang and Chenglin Liu and Liang Shan,2021,1,Algorithms
10.3390/a16010060,Iterative Image Reconstruction Algorithm with Parameter Estimation by Neural Network for Computed Tomography,Takeshi Kojima and Tetsuya Yoshinaga,2023,0,Algorithms
10.3390/a14040121,Security Audit of a Blockchain-Based Industrial Application Platform,Jan Stodt and Daniel Schönle and Christoph Reich and Fatemeh Ghovanlooy Ghajar and Dominik Welte and Axel Sikora,2021,9,Algorithms
10.3390/a15090300,Correlation Analysis of Factors Affecting Firm Performance and Employees Wellbeing: Application of Advanced Machine Learning Analysis,Jozsef Pap and Csaba Mako and Miklos Illessy and Zef Dedaj and Sina Ardabili and Bernat Torok and Amir Mosavi,2022,2,Algorithms
10.3390/a13070173,Modeling Hourly Soil Temperature Using Deep BiLSTM Neural Network,Cong Li and Yaonan Zhang and Xupeng Ren,2020,14,Algorithms
10.3390/a4040307,A Catalog of Self-Affine Hierarchical Entropy Functions,John Kieffer,2011,0,Algorithms
10.3390/a13110297,A Novel Multi-Dimensional Composition Method Based on Time Series Similarity for Array Pulse Wave Signals Detecting,Hongjie Zou and Yitao Zhang and Jun Zhang and Chuanglu Chen and Xingguang Geng and Shaolong Zhang and Haiying Zhang,2020,1,Algorithms
10.3390/a12120259,The Research of Improved Active Disturbance Rejection Control Algorithm for Particleboard Glue System Based on Neural Network State Observer,Peiyu Wang and Chunrui Zhang and Liangkuan Zhu and Chengcheng Wang,2019,2,Algorithms
10.3390/a8020280,Model Equivalence-Based Identification Algorithm for Equation-Error Systems with Colored Noise,Dandan Meng and Feng Ding,2015,11,Algorithms
10.3390/a15080293,Defending against FakeBob Adversarial Attacks in Speaker Verification Systems with Noise-Adding,Zesheng Chen and Li-Chi Chang and Chao Chen and Guoping Wang and Zhuming Bi,2022,0,Algorithms
10.3390/a15080295,"QFC: A Parallel Software Tool for Feature Construction, Based on Grammatical Evolution",Ioannis G. Tsoulos,2022,1,Algorithms
10.3390/a14010011,A Bayesian Nonparametric Learning Approach to Ensemble Models Using the Proper Bayesian Bootstrap,Marta Galvani and Chiara Bardelli and Silvia Figini and Pietro Muliere,2021,2,Algorithms
10.3390/a16010039,Fuzzy Algorithmic Modeling of Economics and Innovation Process Dynamics Based on Preliminary Component Allocation by Singular Spectrum Analysis Method,Alexey F. Rogachev and Alexey B. Simonov and Natalia V. Ketko and Natalia N. Skiter,2023,0,Algorithms
10.3390/a13080184,Iterative Algorithm for Solving Scalar Fractional Differential Equations with Riemann–Liouville Derivative and Supremum,Ravi Agarwal and Snezhana Hristova and Donal O’Regan and Kremena Stefanova,2020,2,Algorithms
10.3390/a5040398,Better Metrics to Automatically Predict the Quality of a Text Summary,Peter A. Rankel and John M. Conroy and Judith D. Schlesinger,2012,7,Algorithms
10.3390/a14100285,Efficient and Portable Distribution Modeling for Large-Scale Scientific Data Processing with Data-Parallel Primitives,Hao-Yi Yang and Zhi-Rong Lin and Ko-Chih Wang,2021,0,Algorithms
10.3390/a11120212,Evaluating Algorithm Efficiency for Optimizing Experimental Designs with Correlated Data,Lazarus Mramba and Salvador Gezan,2018,0,Algorithms
10.3390/a9020032,Uniform vs. Nonuniform Membership for Mildly Context-Sensitive Languages: A Brief Survey,Henrik Björklund and Martin Berglund and Petter Ericson,2016,2,Algorithms
10.3390/a2010247,Self-organization of Dynamic Distributed Computational Systems Applying Principles of Integrative Activity of Brain Neuronal Assemblies,Eugene Burmakin and Alexander Fingelkurts and Andrew Fingelkurts,2009,3,Algorithms
10.3390/a15110411,Special Issue “1st Online Conference on Algorithms (IOCA2021)”,Frank Werner,2022,0,Algorithms
10.3390/a15040113,An LSM-Tree Index for Spatial Data,Junjun He and Huahui Chen,2022,1,Algorithms
10.3390/a15060200,MedicalSeg: A Medical GUI Application for Image Segmentation Management,Christian Mata and Josep Munuera and Alain Lalande and Gilberto Ochoa-Ruiz and Raul Benitez,2022,1,Algorithms
10.3390/a10040116,Remote Sensing Image Enhancement Based on Non-Local Means Filter in NSCT Domain,Liangliang Li and Yujuan Si and Zhenhong Jia,2017,7,Algorithms
10.3390/a14060187,Using Machine Learning for Quantum Annealing Accuracy Prediction,Aaron Barbosa and Elijah Pelofske and Georg Hahn and Hristo N. Djidjev,2021,3,Algorithms
10.3390/a12110244,A Novel Multi-Objective Five-Elements Cycle Optimization Algorithm,Chunling Ye and Zhengyan Mao and Mandan Liu,2019,4,Algorithms
10.3390/a15120454,An Effective Atrial Fibrillation Detection from Short Single-Lead Electrocardiogram Recordings Using MCNN-BLSTM Network,Hongpo Zhang and Hongzhuang Gu and Junli Gao and Peng Lu and Guanhe Chen and Zongmin Wang,2022,0,Algorithms
10.3390/a15120453,Packet-Level and Flow-Level Network Intrusion Detection Based on Reinforcement Learning and Adversarial Training,Bin Yang and Muhammad Haseeb Arshad and Qing Zhao,2022,0,Algorithms
10.3390/a15120443,Classification of Skin Lesions Using Weighted Majority Voting Ensemble Deep Learning,Damilola A. Okuboyejo and Oludayo O. Olugbara,2022,0,Algorithms
10.3390/a15110433,Unrelated Parallel Machine Scheduling with Job and Machine Acceptance and Renewable Resource Allocation,Alexandru-Liviu Olteanu and Marc Sevaux and Mohsen Ziaee,2022,0,Algorithms
10.3390/a14100289,Comparing Commit Messages and Source Code Metrics for the Prediction Refactoring Activities,Priyadarshni Suresh Sagar and Eman Abdulah AlOmar and Mohamed Wiem Mkaouer and Ali Ouni and Christian D. Newman,2021,6,Algorithms
10.3390/a14110313,Matheuristics and Column Generation for a Basic Technician Routing Problem,Nicolas Dupin and Rémi Parize and El-Ghazali Talbi,2021,3,Algorithms
10.3390/a14080227,A Modified Liu and Storey Conjugate Gradient Method for Large Scale Unconstrained Optimization Problems,Zabidin Salleh and Ghaliah Alhamzi and Ibitsam Masmali and Ahmad Alhawarat,2021,1,Algorithms
10.3390/a13010027,A Matheuristic for Joint Optimal Power and Scheduling Assignment in DVB-T2 Networks,Fabio D’Andreagiovanni and Hicham Lakhlef and Antonella Nardin,2020,2,Algorithms
10.3390/a12110231,A GA-SA Hybrid Planning Algorithm Combined with Improved Clustering for LEO Observation Satellite Missions,Xiangyu Long and Shufan Wu and Xiaofeng Wu and Yixin Huang and Zhongcheng Mu,2019,2,Algorithms
10.3390/a15060208,Eyes versus Eyebrows: A Comprehensive Evaluation Using the Multiscale Analysis and Curvature-Based Combination Methods in Partial Face Recognition,Regina Lionnie and Catur Apriono and Dadang Gunawan,2022,1,Algorithms
10.3390/a12050108,Real-Time Arm Gesture Recognition Using 3D Skeleton Joint Data,Georgios Paraskevopoulos and Evaggelos Spyrou and Dimitrios Sgouropoulos and Theodoros Giannakopoulos and Phivos Mylonas,2019,4,Algorithms
10.3390/a13020047,"Accelerating Binary String Comparisons with a Scalable, Streaming-Based System Architecture Based on FPGAs",Sarah Pilz and Florian Porrmann and Martin Kaiser and Jens Hagemeyer and James M. Hogan and Ulrich Rückert,2020,8,Algorithms
10.3390/a13020031,Constrained Connectivity in Bounded X-Width Multi-Interface Networks,Alessandro Aloisio and Alfredo Navarra,2020,4,Algorithms
10.3390/a10040136,Detecting Composite Functional Module in miRNA Regulation and mRNA Interaction Network,Yi Yang and Chu Pan,2017,0,Algorithms
10.3390/a11050066,Single Machine Scheduling Problem with Interval Processing Times and Total Completion Time Objective,Yuri Sotskov and Natalja Egorova,2018,6,Algorithms
10.3390/a14050135,Analysis of Data Presented by Multisets Using a Linguistic Approach,Liliya A. Demidova and Julia S. Sokolova,2021,0,Algorithms
10.3390/a11010005,Approaches to Multiple-Attribute Decision-Making Based on Pythagorean 2-Tuple Linguistic Bonferroni Mean Operators,Xiyue Tang and Yuhan Huang and Guiwu Wei,2018,7,Algorithms
10.3390/a13080191,Faster Algorithms for Mining Shortest-Path Distances from Massive Time-Evolving Graphs,Mattia D’Emidio,2020,1,Algorithms
10.3390/a14050131,Adding Matrix Control: Insertion-Deletion Systems with Substitutions III,Martin Vu and Henning Fernau,2021,1,Algorithms
10.3390/a13090231,A Class of Spline Functions for Solving 2-Order Linear Differential Equations with Boundary Conditions,Chengzhi Liu and Xuli Han and Juncheng Li,2020,0,Algorithms
10.3390/a13090236,Special Issue “New Frontiers in Parameterized Complexity and Algorithms”: Foreward by the Guest Editors,Neeldhara Misra and Frances Rosamond and Meirav Zehavi,2020,0,Algorithms
10.3390/a15070238,Research on Network Attack Traffic Detection HybridAlgorithm Based on UMAP-RF,Xiaoyu Du and Cheng Cheng and Yujing Wang and Zhijie Han,2022,0,Algorithms
10.3390/a15060184,Bounding the Zeros of Polynomials Using the Frobenius Companion Matrix Partitioned by the Cartesian Decomposition,Mohammad W. Alomari and Christophe Chesneau,2022,1,Algorithms
10.3390/a15080281,Automated Pixel-Level Deep Crack Segmentation on Historical Surfaces Using U-Net Models,Esraa Elhariri and Nashwa El-Bendary and Shereen A. Taie,2022,0,Algorithms
10.3390/a15080257,Anomaly Detection for Service-Oriented Business Processes Using Conformance Analysis,Zeeshan Tariq and Darryl Charles and Sally McClean and Ian McChesney and Paul Taylor,2022,0,Algorithms
10.3390/a13080199,Scalable Block Preconditioners for Linearized Navier-Stokes Equations at High Reynolds Number,Filippo Zanetti and Luca Bergamaschi,2020,2,Algorithms
10.3390/a8030723,A Comparative Study of Modern Heuristics on the School Timetabling Problem,Iosif Katsaragakis and Ioannis Tassopoulos and Grigorios Beligiannis,2015,9,Algorithms
10.3390/a13110292,Editorial for the Special Issue on “Algorithms for Graphs and Networks”,Rhyd Lewis,2020,0,Algorithms
10.3390/a12100216,Adaptive Clustering via Symmetric Nonnegative Matrix Factorization of the Similarity Matrix,Paola Favati and Grazia Lotti and Ornella Menchi and Francesco Romani,2019,1,Algorithms
10.3390/a13110305,Searching via Nonlinear Quantum Walk on the 2D-Grid,Giuseppe Di Molfetta and Basile Herzog,2020,0,Algorithms
10.3390/a12050094,A Cyclical Non-Linear Inertia-Weighted Teaching–Learning-Based Optimization Algorithm,Zongsheng Wu and Ru Xue,2019,2,Algorithms
10.3390/a1010001,Editor's Foreword,Kazuo Iwama,2008,0,Algorithms
10.3390/a14020063,Molecular Subtyping and Outlier Detection in Human Disease Using the Paraclique Algorithm,Ronald D. Hagan and Michael A. Langston,2021,0,Algorithms
10.3390/a13060147,Local Comparison between Two Ninth Convergence Order Algorithms for Equations,Samundra Regmi and Ioannis K. Argyros and Santhosh George,2020,0,Algorithms
10.3390/a13050114,Automobile Fine-Grained Detection Algorithm Based on Multi-Improved YOLOv3 in Smart Streetlights,Fan Yang and Deming Yang and Zhiming He and Yuanhua Fu and Kui Jiang,2020,1,Algorithms
10.3390/a9010005,A Family of Iterative Methods for Solving Systems of Nonlinear Equations Having Unknown Multiplicity,Fayyaz Ahmad and S. Serra-Capizzano and Malik Ullah and A. Al-Fhaid,2016,1,Algorithms
10.3390/a5010158,An Integer Programming Approach to Solving Tantrix on Fixed Boards,Fumika Kino and Yushi Uno,2012,2,Algorithms
10.3390/a11100164,"Learning Representations of Natural Language Texts with Generative Adversarial Networks at Document, Sentence, and Aspect Level",Aggeliki Vlachostergiou and George Caridakis and Phivos Mylonas and Andreas Stafylopatis,2018,7,Algorithms
10.3390/a5020289,Modeling and Performance Analysis to Predict the Behavior of a Divisible Load Application in a Cloud Computing Environment,Leila Ismail and Liren Zhang,2012,3,Algorithms
10.3390/a10010004,Dependent Shrink of Transitions for Calculating Firing Frequencies in Signaling Pathway Petri Net Model,Atsushi Mizuta and Qi-Wei Ge and Hiroshi Matsuno,2017,2,Algorithms
10.3390/a14120368,Adaptive and Lightweight Abnormal Node Detection via Biological Immune Game in Mobile Multimedia Networks,Yajing Zhang and Kai Wang and Jinghui Zhang,2021,0,Algorithms
10.3390/a10010029,Stable Analysis of Compressive Principal Component Pursuit,Qingshan You and Qun Wan,2017,0,Algorithms
10.3390/a11020021,Research on Degeneration Model of Neural Network for Deep Groove Ball Bearing Based on Feature Fusion,Lijun Zhang and Junyu Tao,2018,5,Algorithms
10.3390/a9040062,Noise Reduction of Steel Cord Conveyor Belt Defect Electromagnetic Signal by Combined Use of Improved Wavelet and EMD,Hong-Wei Ma and Hong-Wei Fan and Qing-Hua Mao and Xu-Hui Zhang and Wang Xing,2016,7,Algorithms
10.3390/a10010023,"An Architectural Based Framework for the Distributed Collection, Analysis and Query from Inhomogeneous Time Series Data Sets and Wearables for Biofeedback Applications",James Lee and David Rowlands and Nicholas Jackson and Raymond Leadbetter and Tomohito Wada and Daniel James,2017,0,Algorithms
10.3390/a8030656,Fifth-Order Iterative Method for Solving Multiple Roots of the Highest Multiplicity of Nonlinear Equation,Juan Liang and Xiaowu Li and Zhinan Wu and Mingsheng Zhang and Lin Wang and Feng Pan,2015,2,Algorithms
10.3390/a12070138,A Quantum-Behaved Neurodynamic Approach for Nonconvex Optimization with Constraints,Zheng Ji and Xu Cai and Xuyang Lou,2019,0,Algorithms
10.3390/a14060171,Adaptive Versioning in Transactional Memory Systems,Pavan Poudel and Gokarna Sharma,2021,0,Algorithms
10.3390/a13050122,Incremental FPT Delay,Arne Meier,2020,0,Algorithms
10.3390/a6030512,Extraction and Segmentation of Sputum Cells for Lung Cancer Early Diagnosis,Fatma Taher and Naoufel Werghi and Hussain Al-Ahmad and Christian Donner,2013,14,Algorithms
10.3390/a11120205,Optimal Sliding Mode Control for an Active Suspension System Based on a Genetic Algorithm,Chen Zhou and Xinhui Liu and Wei Chen and Feixiang Xu and Bingwei Cao,2018,24,Algorithms
10.3390/a15030078,Deterministic Approximate EM Algorithm; Application to the Riemann Approximation EM and the Tempered EM,Thomas Lartigue and Stanley Durrleman and Stéphanie Allassonnière,2022,4,Algorithms
10.3390/a12110226,Multiple-Attribute Decision Making ELECTRE II Method under Bipolar Fuzzy Model,n.m. Shumaiza and Muhammad Akram and Ahmad N. Al-Kenani,2019,30,Algorithms
10.3390/a13070169,TBRNet: Two-Stream BiLSTM Residual Network for Video Action Recognition,Xiao Wu and Qingge Ji,2020,7,Algorithms
10.3390/a13020038,Multi-Loop Model Reference Proportional Integral Derivative Controls: Design and Performance Evaluations,Baris Baykant Alagoz and Aleksei Tepljakov and Eduard Petlenkov and Celaleddin Yeroglu,2020,7,Algorithms
10.3390/a12080154,A Survey of Convolutional Neural Networks on Edge with Reconfigurable Computing,Mário P. Véstias,2019,62,Algorithms
10.3390/a13040079,About Granular Rough Computing—Overview of Decision System Approximation Techniques and Future Perspectives,Piotr Artiemjew,2020,2,Algorithms
10.3390/a13030057,Time Series Clustering Model based on DTW for Classifying Car Parks,Taoying Li and Xu Wu and Junhe Zhang,2020,4,Algorithms
10.3390/a14020055,Optimal Clustering in Stable Instances Using Combinations of Exact and Noisy Ordinal Queries,Enrico Bianchi and Paolo Penna,2021,1,Algorithms
10.3390/a12040086,Kalman-Filter-Based Tension Control Design for Industrial Roll-to-Roll System,Hyeongjin Hwang and Jehwon Lee and Sangjune Eum and Kanghyun Nam,2019,2,Algorithms
10.3390/a11120201,A Fast Approach to Texture-Less Object Detection Based on Orientation Compressing Map and Discriminative Regional Weight,Hancheng Yu and Haibao Qin and Maoting Peng,2018,0,Algorithms
10.3390/a11110181,Measuring the Impact of Financial News and Social Media on Stock Market Modeling Using Time Series Mining Techniques,Foteini Kollintza-Kyriakoulia and Manolis Maragoudakis and Anastasia Krithara,2018,4,Algorithms
10.3390/a15020046,"Test and Validation of the Surrogate-Based, Multi-Objective GOMORS Algorithm against the NSGA-II Algorithm in Structural Shape Optimization",Yannis Werner and Tim van Hout and Vijey Subramani Raja Gopalan and Thomas Vietor,2022,0,Algorithms
10.3390/a15040108,Trinity: Neural Network Adaptive Distributed Parallel Training Method Based on Reinforcement Learning,Yan Zeng and Jiyang Wu and Jilin Zhang and Yongjian Ren and Yunquan Zhang,2022,0,Algorithms
10.3390/a10040137,Weakly Coupled Distributed Calculation of Lyapunov Exponents for Non-Linear Dynamical Systems,Jorge Hernández-Gómez and Carlos Couder-Castañeda and Israel Herrera-Díaz and Norberto Flores-Guzmán and Enrique Gómez-Cruz,2017,0,Algorithms
10.3390/a8041210,Numerical Properties of Different Root-Finding Algorithms Obtained for Approximating Continuous Newton’s Method,José Gutiérrez,2015,5,Algorithms
10.3390/a15110432,Automatic Fault Detection and Diagnosis in Cellular Networks and Beyond 5G: Intelligent Network Management,Arun Kumar Sangaiah and Samira Rezaei and Amir Javadpour and Farimasadat Miri and Weizhe Zhang and Desheng Wang,2022,0,Algorithms
10.3390/a15110402,Domination and Independent Domination in Extended Supergrid Graphs,Jong-Shin Chen and Ruo-Wei Hung and Fatemeh Keshavarz-Kohjerdi and Yung-Fa Huang,2022,0,Algorithms
10.3390/a15110406,Stable Evaluation of 3D Zernike Moments for Surface Meshes,Jérôme Houdayer and Patrice Koehl,2022,0,Algorithms
10.3390/a15110425,Consistency and Convergence Properties of 20 Recent and Old Numerical Schemes for the Diffusion Equation,Ádám Nagy and János Majár and Endre Kovács,2022,0,Algorithms
10.3390/a16010005,Visual Assessment of Cluster Tendency with Variations of Distance Measures,Guzel Shkaberina and Natalia Rezova and Elena Tovbis and Lev Kazakovtsev,2022,0,Algorithms
10.3390/a9010016,Multiband and Lossless Compression of Hyperspectral Images,Raffaele Pizzolante and Bruno Carpentieri,2016,9,Algorithms
10.3390/a12030058,A Selectable Sloppy Heap,Adrian Dumitrescu,2019,4,Algorithms
10.3390/a15020068,Whispered Speech Conversion Based on the Inversion of Mel Frequency Cepstral Coefficient Features,Qiang Zhu and Zhong Wang and Yunfeng Dou and Jian Zhou,2022,0,Algorithms
10.3390/a14110331,A Mathematical Model of Universal Basic Income and Its Numerical Simulations,Maria Letizia Bertotti,2021,0,Algorithms
10.3390/a14030080,D2D Assisted Cellular Networks in Licensed and Unlicensed Spectrum: Matching-Iteration-Based Joint User Access and Resource Allocation,Qiuqi Han and Guangyuan Zheng and Chen Xu,2021,1,Algorithms
10.3390/a9010007,An Effective and Efficient MapReduce Algorithm for Computing BFS-Based Traversals of Large-Scale RDF Graphs,Alfredo Cuzzocrea and Mirel Cosulschi and Roberto de Virgilio,2016,4,Algorithms
10.3390/a14110321,Path Planning of a Mechanical Arm Based on an Improved Artificial Potential Field and a Rapid Expansion Random Tree Hybrid Algorithm,Qingni Yuan and Junhui Yi and Ruitong Sun and Huan Bai,2021,0,Algorithms
10.3390/a14090253,The Power of Human–Algorithm Collaboration in Solving Combinatorial Optimization Problems,Tapani Toivonen and Markku Tukiainen,2021,0,Algorithms
10.3390/a5010056,Application of Genetic Control with Adaptive Scaling Scheme to Signal Acquisition in Global Navigation Satellite System Receiver,Chung-Liang Chang and Ho-Nien Shou,2012,0,Algorithms
10.3390/a12050096,Triplet Loss Network for Unsupervised Domain Adaptation,Imad Eddine Ibrahim Bekkouch and Youssef Youssry and Rustam Gafarov and Adil Khan and Asad Masood Khattak,2019,9,Algorithms
10.3390/a2010046,A Novel Block-based Watermarking Scheme Using the SVD Transform,Alessandro Basso and Francesco Bergadano and Davide Cavagnino and Victor Pomponiu and Annamaria Vernone,2009,25,Algorithms
10.3390/a11050058,Computing Fault-Containment Times of Self-Stabilizing Algorithms Using Lumped Markov Chains,Volker Turau,2018,4,Algorithms
10.3390/a5040449,Forecasting the Unit Cost of a Product with Some Linear Fuzzy Collaborative Forecasting Models,Toly Chen,2012,5,Algorithms
10.3390/a6040871,Sparse Signal Recovery from Fixed Low-Rank Subspace via Compressive Measurement,Jun He and Ming-Wei Gao and Lei Zhang and Hao Wu,2013,2,Algorithms
10.3390/a9010009,NBTI-Aware Transient Fault Rate Analysis Method for Logic Circuit Based on Probability Voltage Transfer Characteristics,Zhiming Yang and Junbao Li and Yang Yu and Xiyuan Peng,2016,0,Algorithms
10.3390/a8030562,Modeling Documents with Event Model,Longhui Wang and Guoguang Zhao and Donghong Sun,2015,1,Algorithms
