DOI,Título,Autores,Año,Citas,Revista
10.1007/s00146-021-01186-0,Sensorimotor debilities in digital cultures,Simon Penny,2022,1,AI &amp; SOCIETY
10.1007/s00146-022-01620-x,Think Differently We Must! An AI Manifesto for the Future,Emma Dahlin,2023,0,AI &amp; SOCIETY
10.1007/s00146-017-0770-z,Reflections on James Bond of AI,Urjit A. Yajnik,2018,0,AI &amp; SOCIETY
10.1007/s00146-006-0067-0,Guest Editorial,Parthasarathi Banerjee,2006,0,AI &amp; SOCIETY
10.1007/s00146-018-0839-3,Anonymity and commitment: how do Kierkegaard and Dreyfus fare in the era of Facebook and “post-truth”?,Soraj Hongladarom,2019,0,AI &amp; SOCIETY
10.1007/s00146-003-0292-8,Concepts and Transformation: The International Journal of Action Research and Organisational Renewal,Richard Ennals,2004,0,AI &amp; SOCIETY
10.1007/s00146-018-0797-9,From Bacteria to Bach and Back,Simon Penny,2019,0,AI &amp; SOCIETY
10.1007/s00146-003-0251-4,Quality in the present and future decades,Yoshio Kondo,2003,2,AI &amp; Society
10.1007/s00146-013-0489-4,Comparing designers’ and listeners’ experiences,Iain McGregor,2014,1,AI &amp; SOCIETY
10.1007/s00146-018-0836-6,Limiting the discourse of computer and robot anthropomorphism in a research group,Matthew J. Cousineau,2019,2,AI &amp; SOCIETY
10.1007/s00146-022-01483-2,Barry Sandywell. Dictionary of Visual Discourse. A Dialectical Lexicon of Terms; Routledge: London and New York. 2011. 722 pages. ISBN 9781138102408,Jan Kyrre Berg Olsen Friis,2022,0,AI &amp; SOCIETY
10.1007/s00146-016-0670-7,Call for papers: Ethicomp/CEPE 2017,,2016,0,AI &amp; SOCIETY
10.1007/s00146-007-0123-4,Using gestures to convey internal mental models and index multimedia content,Pratik Biswas and Renate Fruchter,2007,1,AI &amp; SOCIETY
10.1007/s00146-007-0110-9,Methodologies for agent systems development: underlying assumptions and implications for design,Panayiotis Koutsabasis and John Darzentas,2009,2,AI &amp; SOCIETY
10.1007/s00146-022-01410-5,The ethical imperative to identify and address data and intelligence asymmetries,Stefaan G. Verhulst,2022,0,AI &amp; SOCIETY
10.1007/s00146-013-0505-8,Emerging capital market efficiency: a comparative analysis of weak-form efficiency in Romania and Hungary in the context of the global financial crisis,Felicia Ramona Birău,2015,3,AI &amp; SOCIETY
10.1007/s00146-021-01324-8,Wonders without number: the information economy of data and its subjects,Alan F. Blackwell,2022,2,AI &amp; SOCIETY
10.1007/s00146-014-0539-6,Crime detection and criminal identification in India using data mining techniques,Devendra Kumar Tayal and Arti Jain and Surbhi Arora and Surbhi Agarwal and Tushar Gupta and Nikhil Tyagi,2015,59,AI &amp; SOCIETY
10.1007/s00146-021-01325-7,Artificial virtuous agents: from theory to machine implementation,Jakob Stenseke,2021,3,AI &amp; SOCIETY
10.1007/s00146-014-0552-9,Special issue: Shikakeology: From framework to implementation,Naohiro Matsumura and Renate Fruchter,2015,0,AI &amp; SOCIETY
10.1007/s00146-014-0577-0,Special issue: AI and next generation supply networks,,2014,0,AI &amp; SOCIETY
10.1007/s00146-015-0600-0,Histories and futures,Richard Ennals,2016,0,AI &amp; SOCIETY
10.1007/s00146-009-0226-1,Beyond the financial crisis: a way forward with development paradigm,Zhouying Jin and Ying Bai,2009,0,AI &amp; SOCIETY
10.1007/bf01205446,Databases are us,Victoria Vesna,2000,2,AI &amp; Society
10.1007/s00146-007-0086-5,Tacit knowledge and risks,Bo Göranzon,2007,1,AI &amp; SOCIETY
10.1007/s00146-022-01387-1,Actionable ethics,Karamjit S. Gill,2022,1,AI &amp; SOCIETY
10.1007/s00146-017-0787-3,Social intelligence: How to integrate research? A mechanistic perspective,Marcin Miłkowski,2019,0,AI &amp; SOCIETY
10.1007/s00146-007-0098-1,Technology of culture: the roadmap of a journey undertaken,Parthasarathi Banerjee,2007,2,AI &amp; SOCIETY
10.1007/bf01205445,Database aesthetics,Victoria Vesna,2000,1,AI &amp; Society
10.1007/s00146-021-01371-1,Digital cultural heritage standards: from silo to semantic web,Brenda O’Neill and Larry Stapleton,2022,1,AI &amp; SOCIETY
10.1007/s00146-021-01345-3,Vi/vi/sec/tion of industrial design. Gui Bonsiepe and the formulation of the interface concept. Intec Chile 1972. Document of the beginning of a paradigm shift in the interaction design disciplines,David Maulén de los Reyes,2022,0,AI &amp; SOCIETY
10.1007/s00146-021-01350-6,Why did cybernetics disappear from Latin America?,David Maulén de los Reyes,2022,0,AI &amp; SOCIETY
10.1007/s00146-021-01373-z,"Using Linked Data to create provenance-rich metadata interlinks: the design and evaluation of the NAISC-L interlinking framework for libraries, archives and museums",Lucy McKenna and Christophe Debruyne and Declan O’Sullivan,2022,0,AI &amp; SOCIETY
10.1007/s00146-021-01349-z,Jaime Garretón’s cybernetic theory of the city and its system: a missing link in contemporary urban theory,Claudio Araneda,2022,0,AI &amp; SOCIETY
10.1007/s00146-022-01505-z,Weaving science and digital media: postphenomenology’s expanding hermeneutics,William A. Hanff,2022,0,AI &amp; SOCIETY
10.1007/s00146-021-01352-4,The Cybernetics of political communications and social transformation in Colombia: the case of the National Audit Office (1995–1998),Raúl Espejo,2022,0,AI &amp; SOCIETY
10.1007/s00146-022-01463-6,Toward trustworthy programming for autonomous concurrent systems,Lavindra de Silva and Alan Mycroft,2022,0,AI &amp; SOCIETY
10.1007/s00146-021-01244-7,The dissolution of the condicio humana,Tim Rein,2021,0,AI &amp; SOCIETY
10.1007/s00146-018-0842-8,Machine intelligence: a chimera,Mihai Nadin,2019,4,AI &amp; SOCIETY
10.1007/bf01205744,A review of government support for new forms of working,Maeve Gallagher,2001,1,AI &amp; Society
10.1007/s00146-021-01199-9,The ethical application of biometric facial recognition technology,Marcus Smith and Seumas Miller,2022,18,AI &amp; SOCIETY
10.1007/s00146-018-0830-z,Where and when AI and CI meet: exploring the intersection of artificial and collective intelligence towards the goal of innovating how we govern,Stefaan G. Verhulst,2018,13,AI &amp; SOCIETY
10.1007/s00146-021-01162-8,Excavating AI: the politics of images in machine learning training sets,Kate Crawford and Trevor Paglen,2021,31,AI &amp; SOCIETY
10.1007/s00146-005-0003-8,Leonardo’s choice: the ethics of artists working with genetic technologies,Carol Gigliotti,2006,12,AI &amp; SOCIETY
10.1007/s00146-020-00987-z,"Institutions and other things: critical hermeneutics, postphenomenology and material engagement theory",Tailer G. Ransom and Shaun Gallagher,2020,3,AI &amp; SOCIETY
10.1007/s00146-022-01527-7,Governing algorithms from the South: a case study of AI development in Africa,Yousif Hassan,2022,0,AI &amp; SOCIETY
10.1007/s00146-017-0749-9,EEG efficient classification of imagined right and left hand movement using RBF kernel SVM and the joint CWT_PCA,Rihab Bousseta and Salma Tayeb and Issam El Ouakouak and Mourad Gharbi and Fakhita Regragui and Majid Mohamed Himmi,2018,5,AI &amp; SOCIETY
10.1007/s00146-022-01394-2,"Reducing the contingency of the world: magic, oracles, and machine-learning technology",Simon Larsson and Martin Viktorelius,2022,1,AI &amp; SOCIETY
10.1007/s00146-020-01106-8,‘Pretending to favour the public’: how Facebook’s declared democratising ideals are reversed by its practices,Orysia Hrudka,2020,3,AI &amp; SOCIETY
10.1007/s00146-007-0153-y,Ethical regulations on robotics in Europe,Michael Nagenborg and Rafael Capurro and Jutta Weber and Christoph Pingel,2008,37,AI &amp; SOCIETY
10.1007/s00146-020-00956-6,Big tech and societal sustainability: an ethical framework,Bernard Arogyaswamy,2020,8,AI &amp; SOCIETY
10.1007/s00146-003-0272-z,Action research?a European dimension,Francesco Garibaldo and Lauge Baungaard Rasmussen,2004,2,AI &amp; Society
10.1007/s00146-003-0293-7,"Ethics, science, and the mechanisation of the world picture",Howard Rosenbrock,2004,3,AI &amp; Society
10.1007/s00146-014-0558-3,A journey from Island of knowledge to mutual understanding in global business meetings,Renate Fruchter and Leonard Medlock,2015,7,AI &amp; SOCIETY
10.1007/s00146-018-0803-2,Using Dreyfus’ legacy to understand justice in algorithm-based processes,David Casacuberta and Ariel Guersenzvaig,2019,2,AI &amp; SOCIETY
10.1007/s00146-009-0201-x,Designing convivial digital cities: a social intelligence design approach,Patrice Caire,2009,5,AI &amp; SOCIETY
10.1007/s00146-022-01518-8,Maximizing team synergy in AI-related interdisciplinary groups: an interdisciplinary-by-design iterative methodology,Piercosma Bisconti and Davide Orsitto and Federica Fedorczyk and Fabio Brau and Marianna Capasso and Lorenzo De Marinis and Hüseyin Eken and Federica Merenda and Mirko Forti and Marco Pacini and Claudia Schettini,2022,0,AI &amp; SOCIETY
10.1007/s00146-022-01591-z,Toward safe AI,Andres Morales-Forero and Samuel Bassetto and Eric Coatanea,2022,0,AI &amp; SOCIETY
10.1007/s00146-017-0746-z,The quest for appropriate models of human-likeness: anthropomorphism in media equation research,Nils Klowait,2018,8,AI &amp; SOCIETY
10.1007/s00146-007-0141-2,Self-efficacy and learning experience of information education: in case of junior high school,Jun Moriyama and Yasushi Kato and Yoshika Aoki and Akihito Kito and Maryam Behnoodi and Youichi Miyagawa and Masashi Matsuura,2009,4,AI &amp; SOCIETY
10.1007/s00146-020-00952-w,Material hermeneutic of digital technologies in the age of AI,Galit Wellner,2020,3,AI &amp; SOCIETY
10.1007/s00146-022-01575-z,Can we design artificial persons without being manipulative?,Maciej Musiał,2022,0,AI &amp; SOCIETY
10.1007/s00146-017-0714-7,"The art, poetics, and grammar of technological innovation as practice, process, and performance",Mark Coeckelbergh,2018,4,AI &amp; SOCIETY
10.1007/s00146-009-0245-y,Exploring sociality and engagement in play through game-control distribution,Marco C. Rozendaal and Bram A. L. Braat and Stephan A. G. Wensveen,2010,7,AI &amp; SOCIETY
10.1007/s00146-019-00916-9,Artificial intelligence assistants and risk: framing a connectivity risk narrative,Martin Cunneen and Martin Mullins and Finbarr Murphy,2020,7,AI &amp; SOCIETY
10.1007/s00146-020-01133-5,"Drones, robots and perceived autonomy: implications for living human beings",Stephen J. Cowley and Rasmus Gahrn-Andersen,2022,3,AI &amp; SOCIETY
10.1007/s00146-020-01130-8,Making the black box society transparent,Daniel Innerarity,2021,7,AI &amp; SOCIETY
10.1007/s00146-020-00977-1,Artificial virtue: the machine question and perceptions of moral character in artificial moral agents,Patrick Gamez and Daniel B. Shank and Carson Arnold and Mallory North,2020,22,AI &amp; SOCIETY
10.1007/s00146-020-01101-z,Mindset matters: how mindset affects the ability of staff to anticipate and adapt to Artificial Intelligence (AI) future scenarios in organisational settings,Elissa Farrow,2021,3,AI &amp; SOCIETY
10.1007/s00146-015-0604-9,"Language and technology: maps, bridges, and pathways",Mark Coeckelbergh,2017,16,AI &amp; SOCIETY
10.1007/s00146-014-0569-0,Speak to me and I tell you who you are! A language-attitude study in a cultural-heritage application,Brigitte Krenn and Stephanie Schreitter and Friedrich Neubarth,2017,3,AI &amp; SOCIETY
10.1007/s00146-014-0556-5,Shikakeology: designing triggers for behavior change,Naohiro Matsumura and Renate Fruchter and Larry Leifer,2015,19,AI &amp; SOCIETY
10.1007/s00146-013-0526-3,Considerations about the relationship between animal and machine ethics,Oliver Bendel,2016,7,AI &amp; SOCIETY
10.1007/s00146-017-0776-6,Collective intelligence for the common good: cultivating the seeds for an intentional collaborative enterprise,Douglas Schuler and Anna De Liddo and Justin Smith and Fiorella De Cindio,2018,7,AI &amp; SOCIETY
10.1007/s00146-017-0763-y,Towards a unified framework for developing ethical and practical Turing tests,Balaji Srinivasan and Kushal Shah,2019,2,AI &amp; SOCIETY
10.1007/s00146-014-0536-9,Regulatory compliance of business processes,Jie Jiang and Huib Aldewereld and Virginia Dignum and Shuzheng Wang and Ziv Baida,2015,5,AI &amp; SOCIETY
10.1007/s00146-011-0341-7,Aesthetic strategies in sonification,Florian Grond and Thomas Hermann,2012,12,AI &amp; SOCIETY
10.1007/s00146-018-0822-z,Transitions in human–computer interaction: from data embodiment to experience capitalism,Tony D. Sampson,2019,3,AI &amp; SOCIETY
10.1007/s00146-005-0025-2,"Combining ergonomics, culture and scenario for the design of a cooperation platform",Nicolas Grégori and Jean-Charles Hautecouverture and François Charoy and Claude Godart,2006,1,AI &amp; SOCIETY
10.1007/s00146-022-01523-x,Artificial intelligence and economic planning,Robert Gmeiner and Mario Harper,2022,2,AI &amp; SOCIETY
10.1007/s00146-009-0234-1,A different way of seeing: Albert Borgmann’s philosophy of technology and human–computer interaction,Daniel Fallman,2010,16,AI &amp; SOCIETY
10.1007/s00146-022-01535-7,Training philosopher engineers for better AI,Brian Ball and Alexandros Koliousis,2022,0,AI &amp; SOCIETY
10.1007/s00146-020-01135-3,Ethical encounters,Karamjit S. Gill,2021,2,AI &amp; SOCIETY
10.1007/s00146-011-0366-y,Special issue on social impact of AI: killer robots or friendly fridges,Greg Michaelson and Ruth Aylett,2011,1,AI &amp; SOCIETY
10.1007/s00146-020-00963-7,Material hermeneutics and Heelan’s philosophy of technoscience,Babette Babich,2020,1,AI &amp; SOCIETY
10.1007/s00146-021-01247-4,Aligning artificial intelligence with human values: reflections from a phenomenological perspective,Shengnan Han and Eugene Kelly and Shahrokh Nikou and Eric-Oluf Svee,2022,4,AI &amp; SOCIETY
10.1007/s00146-014-0562-7,Game-based education for disaster prevention,Meng-Han Tsai and Ming-Chang Wen and Yu-Lien Chang and Shih-Chung Kang,2015,23,AI &amp; SOCIETY
10.1007/s00146-017-0783-7,"GRASP agents: social first, intelligent later",Gert Jan Hofstede,2019,9,AI &amp; SOCIETY
10.1007/s00146-010-0312-4,"Intermediaries: reflections on virtual humans, gender, and the Uncanny Valley",Claude Draude,2011,12,AI &amp; SOCIETY
10.1007/bf01205743,The relevance of software rights: An anthology of the divergence of sociopolitical doctrines,Mikko Siponen,2001,5,AI &amp; Society
10.1007/s00146-009-0253-y,Aurama: caregiver awareness for living independently with an augmented picture frame display,Pavan Dadlani and Alexander Sinitsyn and Willem Fontijn and Panos Markopoulos,2010,27,AI &amp; SOCIETY
10.1007/s00146-021-01313-x,Interdependence as the key for an ethical artificial autonomy,Filippo Pianca and Vieri Giuliano Santucci,2022,3,AI &amp; SOCIETY
10.1007/s00146-009-0252-z,The design and evaluation of interactive systems with perceived social intelligence: five challenges,William Green and Boris de Ruyter,2010,7,AI &amp; SOCIETY
10.1007/s00146-020-01088-7,Encountering ethics through design: a workshop with nonhuman participants,Anuradha Reddy and Iohanna Nicenboim and James Pierce and Elisa Giaccardi,2021,2,AI &amp; SOCIETY
10.1007/s00146-017-0762-z,“When words become unclear”: unmasking ICT through visual methodologies in participatory ICT4D,Caitlin M. Bentley and David Nemer and Sara Vannini,2019,6,AI &amp; SOCIETY
10.1007/s00146-022-01466-3,Empathetic AI for ethics-in-the-small,Vivek Nallur and Graham Finlay,2022,0,AI &amp; SOCIETY
10.1007/s00146-018-0866-0,Artificial intelligence: looking though the Pygmalion Lens,Karamjit S. Gill,2018,6,AI &amp; SOCIETY
10.1007/s00146-007-0140-3,‘Social’ systems: designing digital systems that support social intelligence,Thomas Erickson,2009,25,AI &amp; SOCIETY
10.1007/s00146-009-0248-8,Incremental learning of gestures for human–robot interaction,Shogo Okada and Yoichi Kobayashi and Satoshi Ishibashi and Toyoaki Nishida,2010,9,AI &amp; SOCIETY
10.1007/s00146-007-0127-0,How relative absolute can be: SUMI and the impact of the nature of the task in measuring perceived software usability,Humberto Cavallin and W. Mike Martin and Ann Heylighen,2007,11,AI &amp; SOCIETY
10.1007/s00146-014-0549-4,"Social media analytics: a survey of techniques, tools and platforms",Bogdan Batrinca and Philip C. Treleaven,2015,294,AI &amp; SOCIETY
10.1007/s00146-014-0546-7,Paradox of choice and consumer nonpurchase behavior,Keita Kinjo and Takeshi Ebina,2015,13,AI &amp; SOCIETY
10.1007/s00146-009-0239-9,Hegel and the extended mind,Anthony Crisafi and Shaun Gallagher,2010,11,AI &amp; SOCIETY
10.1007/s00146-021-01246-5,From Blade Runners to Tin Kickers: what the governance of artificial intelligence safety needs to learn from air crash investigators,Carl Macrae,2021,1,AI &amp; SOCIETY
10.1007/s00146-021-01234-9,Will Big Data and personalized medicine do the gender dimension justice?,Antonio Carnevale and Emanuela A. Tangari and Andrea Iannone and Elena Sartini,2021,1,AI &amp; SOCIETY
10.1007/s00146-020-01104-w,The political choreography of the Sophia robot: beyond robot rights and citizenship to political performances for the social robotics market,Jaana Parviainen and Mark Coeckelbergh,2021,15,AI &amp; SOCIETY
10.1007/s00146-021-01330-w,Caring in the in-between: a proposal to introduce responsible AI and robotics to healthcare,Núria Vallès-Peris and Miquel Domènech,2021,1,AI &amp; SOCIETY
10.1007/s00146-020-01027-6,Artificial intelligence and moral rights,Martin Miernicki and Irene Ng,2021,3,AI &amp; SOCIETY
10.1007/s00146-021-01154-8,The ethics of algorithms: key problems and solutions,Andreas Tsamados and Nikita Aggarwal and Josh Cowls and Jessica Morley and Huw Roberts and Mariarosaria Taddeo and Luciano Floridi,2022,71,AI &amp; SOCIETY
10.1007/s00146-022-01619-4,Equal accuracy for Andrew and Abubakar—detecting and mitigating bias in name-ethnicity classification algorithms,Lena Hafner and Theodor Peter Peifer and Franziska Sofia Hafner,2023,0,AI &amp; SOCIETY
10.1007/s00146-007-0155-9,Learning robots interacting with humans: from epistemic risk to responsibility,Matteo Santoro and Dante Marino and Guglielmo Tamburrini,2008,20,AI &amp; SOCIETY
10.1007/s00146-022-01499-8,Artificial intelligence with American values and Chinese characteristics: a comparative analysis of American and Chinese governmental AI policies,Emmie Hine and Luciano Floridi,2022,2,AI &amp; SOCIETY
10.1007/s00146-022-01532-w,AI employment decision-making: integrating the equal opportunity merit principle and explainable AI,Gary K Y Chan,2022,0,AI &amp; SOCIETY
10.1007/s00146-012-0412-4,Zarathustra and beyond: exploring culture and values online,Larry Stapleton,2013,8,AI &amp; SOCIETY
10.1007/s00146-020-01085-w,Artificial intelligence in medicine and the disclosure of risks,Maximilian Kiener,2021,20,AI &amp; SOCIETY
10.1007/s00146-009-0191-8,Rapid prototyping of social group dynamics in multiagent systems,Matthias Rehm and Birgit Endrass,2009,9,AI &amp; SOCIETY
10.1007/s00146-010-0316-0,"Killers, fridges, and slaves: a legal journey in robotics",Ugo Pagallo,2011,20,AI &amp; SOCIETY
10.1007/s00146-021-01179-z,In search of the moral status of AI: why sentience is a strong argument,Martin Gibert and Dominic Martin,2022,8,AI &amp; SOCIETY
10.1007/s00146-019-00894-y,Are automated vehicles safer than manually driven cars?,Lionel P. Robert,2019,7,AI &amp; SOCIETY
10.1007/s00146-020-01089-6,Making moral machines: why we need artificial moral agents,Paul Formosa and Malcolm Ryan,2021,12,AI &amp; SOCIETY
10.1007/s00146-021-01369-9,Finding light in dark archives: using AI to connect context and content in email,Stephanie Decker and David A. Kirsch and Santhilata Kuppili Venkata and Adam Nix,2022,2,AI &amp; SOCIETY
10.1007/s00146-020-01110-y,AI transparency: a matter of reconciling design with critique,Tomasz Hollanek,2020,6,AI &amp; SOCIETY
10.1007/s00146-016-0672-5,Sentiment analysis on social campaign “Swachh Bharat Abhiyan” using unigram method,Devendra K. Tayal and Sumit K. Yadav,2017,20,AI &amp; SOCIETY
10.1007/s00146-016-0651-x,Artificial super intelligence: beyond rhetoric,Karamjit S. Gill,2016,14,AI &amp; SOCIETY
10.1007/s00146-014-0567-2,‘What I see is not what you get’: why culture-specific behaviours for virtual characters should be user-tested across cultures,Nick Degens and Birgit Endrass and Gert Jan Hofstede and Adrie Beulens and Elisabeth André,2017,11,AI &amp; SOCIETY
10.1007/s00146-019-00891-1,AI and the path to envelopment: knowledge as a first step towards the responsible regulation and use of AI-powered machines,Scott Robbins,2020,24,AI &amp; SOCIETY
10.1007/s00146-019-00928-5,Behavioural artificial intelligence: an agenda for systematic empirical studies of artificial inference,Tore Pedersen and Christian Johansen,2020,5,AI &amp; SOCIETY
10.1007/s00146-013-0456-0,Comparative analysis of machine learning techniques in prognosis of type II diabetes,Abid Sarwar and Vinod Sharma,2014,18,AI &amp; SOCIETY
10.1007/s00146-020-01142-4,"Autonomous Reboot: Kant, the categorical imperative, and contemporary challenges for machine ethicists",Jeffrey White,2022,3,AI &amp; SOCIETY
10.1007/s00146-015-0623-6,Special issue on: Going beyond the laboratory—reconsidering the ELS implications of autonomous robots,Gesa Lindemann and Hironori Matsuzaki and Ilona Straub,2016,6,AI &amp; SOCIETY
10.1007/s00146-009-0202-9,Knowledge management in construction companies in the UK,Reza Esmi and Richard Ennals,2009,19,AI &amp; SOCIETY
10.1007/s00146-017-0777-5,The Fourth Industrial Revolution and implications for innovative cluster policies,Sang-Chul Park,2018,42,AI &amp; SOCIETY
10.1007/s00146-020-00992-2,"The Chinese approach to artificial intelligence: an analysis of policy, ethics, and regulation",Huw Roberts and Josh Cowls and Jessica Morley and Mariarosaria Taddeo and Vincent Wang and Luciano Floridi,2021,109,AI &amp; SOCIETY
10.1007/s00146-017-0768-6,The problem of machine ethics in artificial intelligence,Rajakishore Nath and Vineet Sahu,2020,22,AI &amp; SOCIETY
10.1007/s00146-021-01189-x,Moral zombies: why algorithms are not moral agents,Carissa Véliz,2021,22,AI &amp; SOCIETY
10.1007/s00146-018-0846-4,Legal framework for small autonomous agricultural robots,Subhajit Basu and Adekemi Omotubora and Matt Beeson and Charles Fox,2020,24,AI &amp; SOCIETY
10.1007/s00146-021-01269-y,Correction to: Introduction: special issue—critical robotics research,Sofia Serholt and Sara Ljungblad and Niamh Ní Bhroin,2021,3,AI &amp; SOCIETY
10.1007/s00146-016-0667-2,The case of classroom robots: teachers’ deliberations on the ethical tensions,Sofia Serholt and Wolmet Barendregt and Asimina Vasalou and Patrícia Alves-Oliveira and Aidan Jones and Sofia Petisca and Ana Paiva,2017,65,AI &amp; SOCIETY
10.1007/s00146-021-01209-w,Robots beyond Science Fiction: mutual learning in human–robot interaction on the way to participatory approaches,Astrid Weiss and Katta Spiel,2022,7,AI &amp; SOCIETY
10.1007/s00146-020-00978-0,"Artificial intelligence vs COVID-19: limitations, constraints and pitfalls",Wim Naudé,2020,172,AI &amp; SOCIETY
10.1007/s00146-007-0152-z,From the ethics of technology towards an ethics of knowledge policy: implications for robotics,René von Schomberg,2008,7,AI &amp; SOCIETY
10.1007/s00146-021-01220-1,Prolegomena to social studies of digital innovation,Jadranka Švarc,2022,2,AI &amp; SOCIETY
10.1007/s00146-003-0276-8,Action research through a European perspective?based on Scandinavian and Italian traditions,Lauge Baungaard Rasmussen and Francesco Garibaldo,2004,1,AI &amp; Society
10.1007/s00146-005-0030-5,Preliminary comments on the amalgamation of togetherness and distance,Colin T. Schmidt,2006,2,AI &amp; SOCIETY
10.1007/s00146-007-0175-5,Networks with attitudes,Paul Skokowski,2009,0,AI &amp; SOCIETY
10.1007/s00146-020-01122-8,Intelligent inspection robotics: an open innovation project,Bahadur Ibrahimov,2021,0,AI &amp; SOCIETY
10.1007/s00146-012-0408-0,Cultural visions of technology,Lauge Baungaard Rasmussen,2013,2,AI &amp; SOCIETY
10.1007/s00146-020-01001-2,Eric T. Meyer and Ralph Schroeder: Knowledge machines: digital transformations of the sciences and humanities,Stacey O. Irwin,2020,0,AI &amp; SOCIETY
10.1007/s00146-006-0064-3,"Technique without theory or theory from technique? An examination of practical, philosophical, and foundational issues in data mining",A. R. Korukonda,2007,2,AI &amp; SOCIETY
10.1007/s00146-015-0641-4,"IEEE RO-MAN 2016 Call for Papers, Workshops, and Tutorials",,2016,1,AI &amp; SOCIETY
10.1007/s00146-017-0788-2,Augmented societies with mirror worlds,Alessandro Ricci and Luca Tummolini and Cristiano Castelfranchi,2019,6,AI &amp; SOCIETY
10.1007/s00146-019-00888-w,Black-box artificial intelligence: an epistemological and critical analysis,Manuel Carabantes,2020,26,AI &amp; SOCIETY
10.1007/s00146-022-01404-3,Meta-narratives on machinic otherness: beyond anthropocentrism and exoticism,Min-Sun Kim,2022,3,AI &amp; SOCIETY
10.1007/s00146-011-0318-6,"Networks of small enterprises, architecture of governance and incentive alignment: some cases from India",Pradip Kumar Biswas,2011,2,AI &amp; SOCIETY
10.1007/s00146-019-00884-0,From judgment to calculation: the phenomenology of embodied skill,Karamjit S. Gill,2019,3,AI &amp; SOCIETY
10.1007/s00146-020-01018-7,The intelligent machine: a new metaphor through which to understand both corporations and AI,Migle Laukyte,2021,2,AI &amp; SOCIETY
10.1007/s00146-005-0019-0,Computers and knowledge: a dialogical approach,Christian Brassac,2006,1,AI &amp; SOCIETY
10.1007/s00146-008-0180-3,Software agents and robots in mental therapy: psychological and sociological perspectives,Tatsuya Nomura,2009,3,AI &amp; SOCIETY
10.1007/s00146-013-0451-5,Citizens and netizens: a contemplation on ubiquitous technology,Karamjit S. Gill,2013,1,AI &amp; SOCIETY
10.1007/s00146-018-0847-3,"Simon Penny (2018): Making sense: cognition, computing, art and embodiment",Karamjit S. Gill,2019,1,AI &amp; SOCIETY
10.1007/s00146-016-0664-5,Designing a ‘concept of operations’ architecture for next-generation multi-organisational service networks,Tomás Seosamh Harrington and Jagjit Singh Srai,2016,9,AI &amp; SOCIETY
