DOI,Título,Autores,Año,Citas,Revista
10.1080/19462166.2015.1107134,Probabilistic abstract argumentation: an investigation with Boltzmann machines,Régis Riveret and Dimitrios Korkinof and Moez Draief and Jeremy Pitt,2015,6,Argument &amp; Computation
10.3233/aac-170028,Rhetorical figures as argument schemes – The proleptic suite,Ashley Rose Mehlenbacher,2017,7,Argument &amp; Computation
10.1080/19462166.2013.794163,Polarisation assessment in an intelligent argumentation system using fuzzy clustering algorithm for collaborative decision support,Ravi Santosh Arvapally and Xiaoqing (Frank) Liu,2013,3,Argument &amp; Computation
10.1080/19462166.2014.885083,Trust and argumentation in multi-agent systems,Andrew Koster,2014,1,Argument &amp; Computation
10.1080/19462166.2012.729861,A corpus-based deconstructive strategy for critically engaging with arguments,Kieran O'Halloran,2013,1,Argument &amp; Computation
10.3233/aac-170020,Finding enthymemes in real-world texts: A feasibility study,Olesya Razuvayevskaya and Simone Teufel,2017,2,Argument &amp; Computation
10.3233/aac-190479,Similarity notions in bipolar abstract argumentation,Paola Daniela Budán and Melisa Gisselle Escañuela Gonzalez and Maximiliano Celmo David Budán and Maria Vanina Martinez and Guillermo Ricardo Simari,2020,3,Argument &amp; Computation
10.1080/19462160903494584,Why argue? Towards a cost–benefit analysis of argumentation,Fabio Paglieri and Cristiano Castelfranchi,2010,34,Argument &amp; Computation
10.3233/aac-190471,Structural constraints for dynamic operators in abstract argumentation,Johannes P. Wallner,2020,4,Argument &amp; Computation
10.3233/aac-210018,Revisiting initial sets in abstract argumentation,Matthias Thimm,2022,0,Argument &amp; Computation
10.3233/aac-210002,Strong admissibility for abstract dialectical frameworks,Atefeh Keshavarzi Zafarghandi and Rineke Verbrugge and Bart Verheij,2022,0,Argument &amp; Computation
10.3233/aac-170032,Towards a framework for computational persuasion with applications in behaviour change1,Anthony Hunter,2018,19,Argument &amp; Computation
10.1080/19462166.2012.704397,"Temporal, numerical and meta-level dynamics in argumentation networks",H. Barringer and D. M. Gabbay and J. Woods,2012,15,Argument &amp; Computation
10.3233/aac-210555,A computational model of argumentation schemes for multi-agent systems,Alison R. Panisson and Peter McBurney and Rafael H. Bordini,2021,1,Argument &amp; Computation
10.3233/aac-170025,Argumentation mining: How can a machine acquire common sense and world knowledge?,Marie-Francine Moens,2018,16,Argument &amp; Computation
10.1080/19462166.2014.1002536,Sequent-based logical argumentation,Ofer Arieli and Christian Straßer,2015,20,Argument &amp; Computation
10.3233/aac-200903,Rationality and maximal consistent sets for a fragment of ASPIC + without undercut,Jesse Heyninck and Christian Straßer,2021,3,Argument &amp; Computation
10.3233/aac-210027,A concurrent language for modelling agents arguing on a shared argumentation space,Steafano Bistarelli and Carlo Taticchi,2023,0,Argument &amp; Computation
10.3233/aac-210028,Argumentation frameworks with necessities and their relationship with logic programs,Farid Nouioua and Sara Boutouhami,2023,0,Argument &amp; Computation
10.3233/aac-170027,Ontological representations of rhetorical figures for argument mining,Jelena Mitrović and Cliff O’Reilly and Miljana Mladenović and Siegfried Handschuh,2017,5,Argument &amp; Computation
10.3233/aac-200504,Recognizing rhetoric in science policy arguments,Nancy L. Green,2020,3,Argument &amp; Computation
