DOI,Título,Autores,Año,Citas,Revista
10.14201/adcaij202110401418,Proposed Hybrid model for Sentiment Classification using CovNet-DualLSTM Techniques,"Roop Ranjan, A K Daniel",n.m.,1,ADCAIJ: Advances in Distributed Computing and Artificial Intelligence Journal
10.14201/adcaij2020924968,Influence of Pre-Processing Strategies on the Performance of ML Classifiers Exploiting TF-IDF and BOW Features,"Amit Purushottam Pimpalkar, R. Jeberson Retna Raj",n.m.,17,ADCAIJ: Advances in Distributed Computing and Artificial Intelligence Journal
10.14201/adcaij2021103293305,Projects Distribution Algorithms for Regional Development,Mahdi Jemmali,n.m.,5,ADCAIJ: Advances in Distributed Computing and Artificial Intelligence Journal
10.14201/adcaij.27885,FBCHS: Fuzzy Based Cluster Head Selection Protocol to Enhance Network Lifetime of WSN,"Vipul Narayan, Daniel A. K.",n.m.,0,ADCAIJ: Advances in Distributed Computing and Artificial Intelligence Journal
10.14201/adcaij.2022113,n.m.,,n.m.,0,ADCAIJ: Advances in Distributed Computing and Artificial Intelligence Journal
10.14201/adcaij2019844981,NorMAS-ML: Supporting the Modeling of Normative Multi-agent Systems,"Emmanuel Savio Silva Freire, Mariela Inés Cortés, Robert Marinho Da Rocha Júnior, Ênyo José Tavares Gonçalves, Gustavo Augusto Campos De Lima",n.m.,2,ADCAIJ: Advances in Distributed Computing and Artificial Intelligence Journal
10.14201/adcaij2021102123136,Machine Learning Based Hand Gesture Recognition via EMG Data,"Zehra Karapinar Senturk, Melahat Sevgul Bakay",n.m.,0,ADCAIJ: Advances in Distributed Computing and Artificial Intelligence Journal
