DOI,Título,Autores,Año,Citas,Revista
10.14201/adcaij2021104321337,Taking FANET to Next Level,"Altaf Hussain, Habib Ullah Khan, Shah Nazir, Ijaz Ullah, Tariq Hussain",n.m.,0,ADCAIJ: Advances in Distributed Computing and Artificial Intelligence Journal
10.14201/adcaij2015431930,Monitoring and analysis of vital signs of a patient through a multi-agent application system,"Daniel Hernández De La Iglesia, Gabriel Villarrubia González, Alberto López Barriuso, Álvaro Lozano Murciego, Jorge Revuelta Herrero",n.m.,7,ADCAIJ: Advances in Distributed Computing and Artificial Intelligence Journal
10.14201/adcaij201544,n.m.,,n.m.,0,ADCAIJ: Advances in Distributed Computing and Artificial Intelligence Journal
10.14201/adcaij2019811318,Algorithm Analysis in Multi-agent Systems,"Laura Pacheco, Naiara Sánchez, Antoni Tur, David Tellez De Meneses",n.m.,0,ADCAIJ: Advances in Distributed Computing and Artificial Intelligence Journal
10.14201/adcaij202093,n.m.,,n.m.,0,ADCAIJ: Advances in Distributed Computing and Artificial Intelligence Journal
10.14201/adcaij2014385673,Formal Language Decomposition into Semantic Primes,"Johannes FÄhndrich, Sebastian Ahrndt, Sahin Albayrak",n.m.,2,ADCAIJ: Advances in Distributed Computing and Artificial Intelligence Journal
10.14201/adcaij20143219,Using multi-objective optimization to design parameters in electro-discharge machining by wire,"Carlos Alberto Ochoa, Lourdes Yolanda Margain, Francisco Javier Ornelas, Sandra Guadalupe Jiménez, Teresa Guadalupe Padilla",n.m.,0,ADCAIJ: Advances in Distributed Computing and Artificial Intelligence Journal
10.14201/adcaij201871,n.m.,,n.m.,0,ADCAIJ: Advances in Distributed Computing and Artificial Intelligence Journal
10.14201/adcaij2013257585,An Architecture for Agent’s Risk Perception,"Nuno Trindade, Luis Antunes",n.m.,4,ADCAIJ: Advances in Distributed Computing and Artificial Intelligence Journal
10.14201/adcaij2012114352,Trust and Normative Control in Multi-Agent Systems,"Joana Urbano, Henrique Lopes Cardoso, Ana Paula Rocha, Eugénio Oliveira",n.m.,4,ADCAIJ: Advances in Distributed Computing and Artificial Intelligence Journal
10.14201/adcaij2020945570,Agent organisations: from independent agents to virtual organisations and societies of agents,"Jose Alberto Maestro-Prieto, Sara Rodríguez, Roberto Casado, Juan Manuel Corchado",n.m.,0,ADCAIJ: Advances in Distributed Computing and Artificial Intelligence Journal
10.14201/adcaij201764514,Using trust degree for agents in order to assign spots in a Smart Parking,"Lucas Fernando Souza De Castro, Gleifer Vaz Alves, André Pinz Borges",n.m.,0,ADCAIJ: Advances in Distributed Computing and Artificial Intelligence Journal
10.14201/adcaij2017631727,Organisational Metamodel for Large-Scale Multi-Agent Systems: First Steps Towards Modelling Organisation Dynamics,Bogdan OkreŠa Ðuri?,n.m.,8,ADCAIJ: Advances in Distributed Computing and Artificial Intelligence Journal
10.14201/adcaij201874,n.m.,,n.m.,0,ADCAIJ: Advances in Distributed Computing and Artificial Intelligence Journal
10.14201/adcaij201981,n.m.,,n.m.,0,ADCAIJ: Advances in Distributed Computing and Artificial Intelligence Journal
10.14201/adcaij2014395364,Picture models for 2-scene comics creating system,"Miki UENO, Naoki MORI, Keinosuke MATSUMOTO",n.m.,0,ADCAIJ: Advances in Distributed Computing and Artificial Intelligence Journal
10.14201/adcaij201438,n.m.,,n.m.,0,ADCAIJ: Advances in Distributed Computing and Artificial Intelligence Journal
10.14201/2013171922,User-centric cognitive assessment. Evaluation of attention in special working centres: from paper to Kinect,"Anna Vilaro, Pilar Orero",n.m.,1,ADCAIJ: Advances in Distributed Computing and Artificial Intelligence Journal
10.14201/adcaij2016547184,Planning large systems with MDPs: case study of inland waterways supervision,"Guillaume Desquesnes, Guillaume Lozenguez, Arnaud Doniec, Éric Duviella",n.m.,3,ADCAIJ: Advances in Distributed Computing and Artificial Intelligence Journal
10.14201/adcaij20154483101,A drug identification system for intoxicated drivers based on a systematic review,"Alfonso González, Juan Ramos, Juan F. De Paz",n.m.,0,ADCAIJ: Advances in Distributed Computing and Artificial Intelligence Journal
10.14201/adcaij2014322652,Service-Oriented Architectures: from Design to Production exploiting Workflow Patterns,"Saverio Giallorenzo, Maurizio Gabbrielli, Fabrizio Montesi",n.m.,0,ADCAIJ: Advances in Distributed Computing and Artificial Intelligence Journal
10.14201/adcaij201981512,Learning process: Multi-Agent Tutoring System,"Manuel Pérez-Moríñigo, Víctor Merchán-Montero, José Luis Martín-Pérez",n.m.,0,ADCAIJ: Advances in Distributed Computing and Artificial Intelligence Journal
10.14201/adcaij2018733146,An empirical approach for software reengineering process with relation to quality assurance mechanism,"Muhammad Muzammul, Muhammad Awais",n.m.,0,ADCAIJ: Advances in Distributed Computing and Artificial Intelligence Journal
10.14201/adcaij2014396570,Mobility Integration of ERP systems,"Álvaro LOZANO, Gabriel VILLARRUBIA, Alberto LÓPEZ",n.m.,0,ADCAIJ: Advances in Distributed Computing and Artificial Intelligence Journal
10.14201/adcaij2015415464,Bridging the gap between human knowledge and machine learning,"Juan Carlos Alvarado-Pérez, Diego H. Peluffo-Ordóñez, Roberto Therón",n.m.,17,ADCAIJ: Advances in Distributed Computing and Artificial Intelligence Journal
10.14201/adcaij20198497116,Stock Market Prediction Using Machine Learning(ML)Algorithms,"Muhammad Umer, Muhammad Awais, Muhammad Muzammul",n.m.,9,ADCAIJ: Advances in Distributed Computing and Artificial Intelligence Journal
10.14201/adcaij201211922,Real-Time Activity Recognition and Assistance in Smart Classrooms,"Vasileios Efthymiou, Maria Koutraki, Grigoris Antoniou",n.m.,2,ADCAIJ: Advances in Distributed Computing and Artificial Intelligence Journal
10.14201/adcaij2016541942,Relationships between Specified and Underspecified Quantification by the Theory of Acyclic Recursion,Roussanka Loukanova,n.m.,3,ADCAIJ: Advances in Distributed Computing and Artificial Intelligence Journal
10.14201/adcaij2019811926,CTRANSPORT: Multi-agent-based simulation,"Pedro Sánchez, Denis Pato, Gabriel Martín",n.m.,0,ADCAIJ: Advances in Distributed Computing and Artificial Intelligence Journal
10.14201/adcaij2017635774,Collaborative Computer-Assisted Cognitive Rehabilitation System,"Miguel Oliver, José Pascual Molina, Antonio Fernández-Caballero, Pascual González",n.m.,6,ADCAIJ: Advances in Distributed Computing and Artificial Intelligence Journal
10.14201/adecaij20131,Control Prosody using Multi-Agent System,"Kenji Matsui, Kenta Kimura, Alberto Pérez",n.m.,2,ADCAIJ: Advances in Distributed Computing and Artificial Intelligence Journal
10.14201/adcaij2012131110,AMADEUS: an adaptive multi-agent system to learn a user’s recurring actions in ambient systems,"Valérian Guivarch, Valérie Camps, André Péninou",n.m.,7,ADCAIJ: Advances in Distributed Computing and Artificial Intelligence Journal
10.14201/adcaij202094,n.m.,,n.m.,0,ADCAIJ: Advances in Distributed Computing and Artificial Intelligence Journal
10.14201/adcaij201764,n.m.,,n.m.,0,ADCAIJ: Advances in Distributed Computing and Artificial Intelligence Journal
10.14201/adcaij2019835165,The importance of development of control processes and methods for urban bus services,"Eduardo Facchini, Eduardo Mario Dias",n.m.,0,ADCAIJ: Advances in Distributed Computing and Artificial Intelligence Journal
10.14201/adcaij202092522,Digital Information Needs for Understanding Cell Divisions in the Human Body,"n.m. Amani Jamal, n.m. Asmaa Munshi, Nahla Aljojo, n.m. Talal Qadah, n.m. Azida Zainol",n.m.,1,ADCAIJ: Advances in Distributed Computing and Artificial Intelligence Journal
10.14201/adcaij201652101108,Discovering the Network Topology: An Efficient Approach for SDN,"Leonardo Ochoa-Aday, Cristina Cervelló-Pastor, Adriana Fernández-Fernández",n.m.,13,ADCAIJ: Advances in Distributed Computing and Artificial Intelligence Journal
10.14201/adcaij201654118,Real Time Analytics for Characterizing the Computer User's State,"Davide Carneiro, Daniel Araújo, André Pimenta, Paulo Novais",n.m.,8,ADCAIJ: Advances in Distributed Computing and Artificial Intelligence Journal
10.14201/adcaij2012122134,E-learning Platforms and E-learning Students: Building the Bridge to Success,"Manuel Rodrigues, Sérgio Gonçalves, Florentino Fdez-Riverola",n.m.,3,ADCAIJ: Advances in Distributed Computing and Artificial Intelligence Journal
10.14201/adcaij2019843340,Multi-agent system for anomaly detection in Industry 4.0 using Machine Learning techniques,Nuria Mateos García,n.m.,6,ADCAIJ: Advances in Distributed Computing and Artificial Intelligence Journal
10.14201/adcaij2015427388,An approach for discovering keywords from Spanish tweets using Wikipedia,"Daniel Ayala, Juan C. Roldán, David Ruiz, Fernando O. Gallego",n.m.,1,ADCAIJ: Advances in Distributed Computing and Artificial Intelligence Journal
10.14201/adcaij201543110,A Gene Selection Approach based on Clustering for Classification Tasks in Colon Cancer,"José Antonio Castellanos Garzón, Juan Ramos González",n.m.,10,ADCAIJ: Advances in Distributed Computing and Artificial Intelligence Journal
10.14201/adcaij2018717789,An extension of local mesh peak valley edge based feature descriptor for image retrieval in bio-medical images,"Varun Srivastava, Ravindra Purwar",n.m.,4,ADCAIJ: Advances in Distributed Computing and Artificial Intelligence Journal
10.14201/adcaij2014321725,Android Malware Detection Using Kullback-Leibler Divergence,"Vanessa N. Cooper, Hisham M. Haddad, Hossain Shahriar",n.m.,2,ADCAIJ: Advances in Distributed Computing and Artificial Intelligence Journal
10.14201/adcaij2017611319,Integrating Smart Resources in ROS-based systems to distribute services,"Eduardo Munera, Jose-Luis Poza-Lujan, Juan-Luis Posadas-Yagüe, Jose-Enrique Simó-Ten, Francisco Blanes",n.m.,2,ADCAIJ: Advances in Distributed Computing and Artificial Intelligence Journal
10.14201/adcaij20121118,Applying a text mining framework to the extraction of numerical parameters from scientific literature in the biotechnology domain,"André Santos, Regina Nogueira, Anália Lourenço",n.m.,3,ADCAIJ: Advances in Distributed Computing and Artificial Intelligence Journal
10.14201/adcaij2015445968,Wireless controller and smartphone based interaction system for electric bicycles.,"Jorge Revuelta Herrero, Gabriel Villarrubia, Alberto L. Barriuso, Daniel Hernández, Álvaro Lozano, Marco Antonio De La Serna González",n.m.,3,ADCAIJ: Advances in Distributed Computing and Artificial Intelligence Journal
10.14201/adcaij20121314954,Network Management using Multi-Agents System,"Gustavo Isaza, Maria H. Mejía, Luis Fernando Castillo, Adriana Morales, Nestor Duque",n.m.,7,ADCAIJ: Advances in Distributed Computing and Artificial Intelligence Journal
10.14201/adcaij.28331,Artificial Intelligence (AI) in Advertising,"Metin Argan, Halime Dinç, Sabri Kaya, Mehpare Tokay Argan",n.m.,0,ADCAIJ: Advances in Distributed Computing and Artificial Intelligence Journal
10.14201/adcaij2016533142,Accelerometer vs. Electromyogram in Activity Recognition,"Heli Koskimaki, Pekka Siirtola",n.m.,8,ADCAIJ: Advances in Distributed Computing and Artificial Intelligence Journal
10.14201/adcai201982518,Learning Representations from Spatio-Temporal Distance Maps for 3D Action Recognition with Convolutional Neural Networks,"M. NAVEENKUMAR, S. DOMNIC",n.m.,2,ADCAIJ: ADVANCES IN DISTRIBUTED COMPUTING AND ARTIFICIAL INTELLIGENCE JOURNAL
10.14201/adcaij202094530,"Methods for Assessing, Predicting, and Improving Data Veracity: A survey",Fatmah Assiri,n.m.,3,ADCAIJ: Advances in Distributed Computing and Artificial Intelligence Journal
10.14201/adcaij201872515,Development of a Middleware between SUMO simulation tool and JaCaMo framework,"Alexis Van Haare Heijmeijer, Gleifer Vaz Alves",n.m.,4,ADCAIJ: Advances in Distributed Computing and Artificial Intelligence Journal
10.14201/adcaij20209495106,Blockchain: a brief review of Agri-Food Supply Chain Solutions and Opportunities,"Javier Parra Domínguez, Pedro Roseiro",n.m.,6,ADCAIJ: Advances in Distributed Computing and Artificial Intelligence Journal
10.14201/adcaij2016535561,Review of the Main Security Problems with Multi-Agent Systems used in E-commerce Applications,"Alfonso González Briones, Pablo Chamoso, Alberto Barriuso",n.m.,17,ADCAIJ: Advances in Distributed Computing and Artificial Intelligence Journal
10.14201/adcaij2019836777,ck-NN: A Clustered k-Nearest Neighbours Approach for Large-Scale Classification,"Rafi Ullah, Ayaz H. Khan, S.M. Emaduddin",n.m.,1,ADCAIJ: Advances in Distributed Computing and Artificial Intelligence Journal
10.14201/adcaij2017637584,A review of the applications of the Block-chain technology in smart devices and dis-tributed renewable energy grids,"Sergii Kushch, Francisco Prieto Castrillo",n.m.,13,ADCAIJ: Advances in Distributed Computing and Artificial Intelligence Journal
10.14201/adcaij.27533,Time-Windowed Vehicle Routing Problem: Tabu Search Algorithm Approach,"Hasibe Berfu Demir, Ebru Pekel Özmen, Sakir Esnaf",n.m.,0,ADCAIJ: Advances in Distributed Computing and Artificial Intelligence Journal
10.14201/adcaij2018742734,Semantic and Lexical Text Analyzer,"Marcos Servet, David Martín, Daniel Pérez",n.m.,0,ADCAIJ: Advances in Distributed Computing and Artificial Intelligence Journal
10.14201/adcaij2019823349,An Intelligent Multi-Resolutional and Rotational Invariant Texture Descriptor for Image Retrieval Systems,"Shefali Dhingra, Poonam Bansal",n.m.,0,ADCAIJ: Advances in Distributed Computing and Artificial Intelligence Journal
10.14201/adcaij2014326570,Mobility Integration of ERP systems,"Álvaro Lozano, Gabriel Villarrubia, Alberto López",n.m.,0,ADCAIJ: Advances in Distributed Computing and Artificial Intelligence Journal
10.14201/adcaij20154299112,Measuring the differences between human-human and human-machine dialogs,"David Griol, José Molina",n.m.,4,ADCAIJ: Advances in Distributed Computing and Artificial Intelligence Journal
10.14201/adcaij2015420124,Simulation of Road Traffic Applying Model-Driven Engineering,"Alberto Fernández-Isabel, Rubén Fuentes-Fernández",n.m.,6,ADCAIJ: Advances in Distributed Computing and Artificial Intelligence Journal
10.14201/adcaij201543,n.m.,,n.m.,0,ADCAIJ: Advances in Distributed Computing and Artificial Intelligence Journal
10.14201/adcaij202091,n.m.,,n.m.,0,ADCAIJ: Advances in Distributed Computing and Artificial Intelligence Journal
10.14201/adecaij2013173140,Online Adapting the Magnitude of Target Birth Intensity in the PHD Filter,"Tiancheng Li, Shudong Sun",n.m.,4,ADCAIJ: Advances in Distributed Computing and Artificial Intelligence Journal
10.14201/adcaij202092,n.m.,,n.m.,0,ADCAIJ: Advances in Distributed Computing and Artificial Intelligence Journal
10.14201/adcaij2012116475,Real-time Identification of Respiratory Movements through a Microphone,"Juan Castro, Pere Marti-Puig",n.m.,3,ADCAIJ: Advances in Distributed Computing and Artificial Intelligence Journal
10.14201/adcaij2014387491,"Impact of the Mobility Models, Route and Link connectivity on the performance of Position based routing protocols","Adam Macintosh, Ming Feisiyau, Mohammed Ghavami",n.m.,2,ADCAIJ: Advances in Distributed Computing and Artificial Intelligence Journal
10.14201/adcaij201872,n.m.,,n.m.,0,ADCAIJ: Advances in Distributed Computing and Artificial Intelligence Journal
10.14201/adcaij201654,n.m.,,n.m.,0,ADCAIJ: Advances in Distributed Computing and Artificial Intelligence Journal
10.14201/adcaij2020926977,Local binary pattern for the evaluation of surface quality of dissimilar Friction Stir Welded Ultrafine Grained 1050 and 6061-T6 Aluminium Alloys,Akshansh Mishra,n.m.,2,ADCAIJ: Advances in Distributed Computing and Artificial Intelligence Journal
10.14201/adcaij201434,n.m.,,n.m.,0,ADCAIJ: Advances in Distributed Computing and Artificial Intelligence Journal
10.14201/adcaij20121311125,User-independent accelerometer-based gesture recognition for mobile devices,"Xian Wang, Paula Tarrío, Ana María Bernardos, Eduardo Metola, José Ramón Casar",n.m.,3,ADCAIJ: Advances in Distributed Computing and Artificial Intelligence Journal
10.14201/adcaij2021101,n.m.,,n.m.,0,ADCAIJ: Advances in Distributed Computing and Artificial Intelligence Journal
10.14201/adcaij201871512,The delimitation of freedom of speech on the Internet: the confrontation of rights and digital censorship,"Francisco José Aranda Serna, Javier Belda Iniesta",n.m.,1,ADCAIJ: Advances in Distributed Computing and Artificial Intelligence Journal
10.14201/adcaij2018725369,Customized normalization clustering meth-odology for consumers with heterogeneous characteristics,"Catarina Ribeiro, Tiago Pinto, Zita Vale, Jose Baptista",n.m.,2,ADCAIJ: Advances in Distributed Computing and Artificial Intelligence Journal
10.14201/adcaij2017645569,Predicting Plan Failure by Monitoring Action Sequences and Duration,"Giovani Parente Farias, Ramon Fraga Pereira, Lucas Hilgert, Felipe Meneguzzi, Renata Vieira, Rafael Heitor Bordini",n.m.,2,ADCAIJ: Advances in Distributed Computing and Artificial Intelligence Journal
10.14201/adcaij2017627184,Predicting Plan Failure by Monitoring Action Sequences and Duration,"Giovani Parente Farias, Ramon Fraga Pereira, Lucas W. Hilgert, Felipe Meneguzzi, Renata Vieira, Rafael H. Bordini",n.m.,2,ADCAIJ: Advances in Distributed Computing and Artificial Intelligence Journal
10.14201/acaij2017615972,Modeling and simulation of bus assem-bling process using DES/ABS approach,"Pawel Pawlewski, Kamila Kluska",n.m.,2,ADCAIJ: Advances in Distributed Computing and Artificial Intelligence Journal
10.14201/adcaij201762517,A Multi-Agent Extension of a Hierarchical Task Network Planning Formalism,"Rafael Cauê Cardoso, Rafael Heitor Bordini",n.m.,15,ADCAIJ: Advances in Distributed Computing and Artificial Intelligence Journal
10.14201/adcaij2018711328,Secure data access control with perception reasoning,"Abdul Mateen, Abdul Rauf, Abdul Hanan Abdullah, Mahmood Ashraf",n.m.,3,ADCAIJ: Advances in Distributed Computing and Artificial Intelligence Journal
10.14201/adcaij2017613140,Kernel-based framework for spectral dimensionality reduction and clustering formulation: A theoretical study,"Xiomara Patricia Blanco Valencia, M. A. Becerra, A. E. Castro Ospina, M. Ortega Adarme, D. Viveros Melo, D. H. Peluffo Ordóñez",n.m.,4,ADCAIJ: Advances in Distributed Computing and Artificial Intelligence Journal
10.14201/adcaij201761932,"An Analysis of Software Agents, Environ-ments and Applications School (WESAAC): Retrospective, Relevance, and Trends","Enyo Gonçalves, Mariela Cortés, Marcos De Oliveira, Nécio Veras, Mário FalcÃo, Jaelson Castro",n.m.,5,ADCAIJ: Advances in Distributed Computing and Artificial Intelligence Journal
10.14201/adcaij201873514,RANSOMWARE - KIDNAPPING PERSONAL DATA FOR RANSOM AND THE INFORMATION AS HOSTAGE,"Márcio Ricardo Ferreira, Cynthia Kawakami",n.m.,1,ADCAIJ: Advances in Distributed Computing and Artificial Intelligence Journal
10.14201/adcaij2018722742,Robust and adaptive chatter free formation control of wheeled mobile robots with uncertainties,"Maximilian Jaderson De Melo, Mauricio Begnini, Heber Rabelo Da Silva, Marcelo Christiano Da França Júnior",n.m.,2,ADCAIJ: Advances in Distributed Computing and Artificial Intelligence Journal
10.14201/adcaij2021104435452,EpilNet: A Novel Approach to IoT based Epileptic Seizure Prediction and Diagnosis System using Artificial Intelligence,"Shivam Gupta, Virender Ranga, Priyansh Agrawal",n.m.,1,ADCAIJ: Advances in Distributed Computing and Artificial Intelligence Journal
10.14201/adcaij20211011532,An Interactive Mobile Application to Request the Help of the Nearest First Aider by the Injured,"Areej Alshutayria, Nahla Aljojo, Basma Alharbia, Ameen Banjarb, Atheer Alshehria, Mashaiel Alargoubia, Ola Barradha, Rahaf Helabia",n.m.,2,ADCAIJ: Advances in Distributed Computing and Artificial Intelligence Journal
10.14201/adcaij201541,n.m.,,n.m.,0,ADCAIJ: Advances in Distributed Computing and Artificial Intelligence Journal
10.14201/adcaij2014266577,An Integrated System for Disabled People Developed with the Agent Platform PANGEA,"Carolina Zato, Gabriel Villarrubia, Javier Bajo, Juan Manuel Corchado",n.m.,0,ADCAIJ: Advances in Distributed Computing and Artificial Intelligence Journal
10.14201/adcaij20121312734,Firearm Classification using Neural Networks on Ring of Firing Pin Impression Images,"SAADI Bin Ahmad Kamaruddin, Nor AZURA MD Ghanib, Choong-Yeun Liong, Abdul AZIZ Jemain",n.m.,3,ADCAIJ: Advances in Distributed Computing and Artificial Intelligence Journal
10.14201/adcaij201324,n.m.,,n.m.,0,ADCAIJ: Advances in Distributed Computing and Artificial Intelligence Journal
10.14201/adcaij2014384655,Smart device definition and application on embedded system: performance and optimi-zation on a RGBD sensor,"Jose-Luis Jiménez-García, David Baselga-Masia, Jose-Luis Poza-Luján, Eduardo Munera, Juan-Luis Posadas-Yagüe, José-Enrique Simó-Ten",n.m.,3,ADCAIJ: Advances in Distributed Computing and Artificial Intelligence Journal
10.14201/adcai2019821932,Segmentation and detection of cattle branding images using CNN and SVM classification,"Carlos SILVA, Juliano WEBER, Bruno BELLONI",n.m.,0,ADCAIJ: ADVANCES IN DISTRIBUTED COMPUTING AND ARTIFICIAL INTELLIGENCE JOURNAL
10.14201/adcaij2014345866,The Effect of Training Data Selection on Face Recognition in Surveillance Application,"Jamal Ahmad Dargham, Ali Chekima, Ervin Gubin Moung, Sigeru Omatu",n.m.,3,ADCAIJ: Advances in Distributed Computing and Artificial Intelligence Journal
10.14201/adcaij2013245559,Platform image processing to study the structural properties of retinal vessel,"Gabino Verde, Luis García-Ortiz, Carolina Zato, Juan Francisco De Paz, Sara Rodríguez, Miguel Ángel Merchán",n.m.,0,ADCAIJ: Advances in Distributed Computing and Artificial Intelligence Journal
10.14201/adcaij2012115361,Picture information shared conversation agent: Pictgent,"Miki Ueno, Naoki Mori, Keinosuke Matsumoto",n.m.,2,ADCAIJ: Advances in Distributed Computing and Artificial Intelligence Journal
10.14201/adcaij2018736398,JAMDER: JADE to MULTI-Agent Systems Development Resource,"Yrleyjander S. Lopes, Mariela I. Cortés, Enyo José Tavares Gonçalves, Robson Oliveira",n.m.,3,ADCAIJ: Advances in Distributed Computing and Artificial Intelligence Journal
10.14201/adcaij2018734762,Design of CNN architecture for Hindi Characters,"Madhuri Yadav, Ravindra Kr Purwar, Anchal Jain",n.m.,1,ADCAIJ: Advances in Distributed Computing and Artificial Intelligence Journal
10.14201/adcaij201542,n.m.,,n.m.,0,ADCAIJ: Advances in Distributed Computing and Artificial Intelligence Journal
10.14201/adcaij20121315568,"Design Smart Games with requirements, generate them with a Click, and revise them with a GUIs","Vincenza Cofini, Fernando De La Prieta, Tania Di Mascio, Rosella Gennari, Pierpaolo Vittorini",n.m.,7,ADCAIJ: Advances in Distributed Computing and Artificial Intelligence Journal
10.14201/adcaij2022111,n.m.,,n.m.,0,ADCAIJ: Advances in Distributed Computing and Artificial Intelligence Journal
10.14201/adcaij2019831326,LSTM Based Lip Reading Approach for Devanagiri Script,"Mahesh S Patil, Satyadhyan Chickerur, Anand Meti, Priyanka M Nabapure, Sunaina Mahindrakar, Sonali Naik, Soumya Kanyal",n.m.,2,ADCAIJ: Advances in Distributed Computing and Artificial Intelligence Journal
10.14201/adcaij2014261527,Designing a Web Spam Classifier Based on Feature Fusion in the Layered Multi-Population Genetic Programming Framework,"Amir Hosein Keyhanipour, Behzad Moshiri",n.m.,2,ADCAIJ: Advances in Distributed Computing and Artificial Intelligence Journal
10.14201/adcaij201325116,A Distributed and Collaborative Intelligent System for Medical Diagnosis,"Naoufel Khayati, Wided Lejouad-Chaari",n.m.,2,ADCAIJ: Advances in Distributed Computing and Artificial Intelligence Journal
10.14201/adcaij201982,n.m.,,n.m.,0,ADCAIJ: Advances in Distributed Computing and Artificial Intelligence Journal
10.14201/adcaij2018727180,The value of our personal data in the Big Data and the Internet of all Things Era,Anahiby Anyel Becerril,n.m.,6,ADCAIJ: Advances in Distributed Computing and Artificial Intelligence Journal
10.14201/adcaij20209199112,Intelligent Dolls and robots for the treatment of elderly people with dementia,"Sergio Márquez Sánchez, n.m. Sara Mora-Simon, n.m. Jorge Herrera-Santos, n.m. Ana Olga Roncero, n.m. Juan M. Corchado",n.m.,6,ADCAIJ: Advances in Distributed Computing and Artificial Intelligence Journal
10.14201/adcaij2014262936,Irrigation System through Intelligent Agents Implemented with Arduino Technology,"Rodolfo Salazar, José Carlos Rangel, Cristian Pinzón, Abel Rodríguez",n.m.,8,ADCAIJ: Advances in Distributed Computing and Artificial Intelligence Journal
10.14201/adcaij2015431118,Analysis and visualization of social user communities,"Daniel López Sánchez, Jorge Revuelta, Fernando De La Prieta, Cach Dang",n.m.,5,ADCAIJ: Advances in Distributed Computing and Artificial Intelligence Journal
10.14201/adcaij2016511122,On Chinese and Western Family Trees: Mechanism and Performance,"Elton S Siqueira, Patrick Cisuaka Kabongo, Tiancheng Li, Carla D. Castanho, Li Weigang",n.m.,1,ADCAIJ: Advances in Distributed Computing and Artificial Intelligence Journal
10.14201/10.14201/adcaij2021103,n.m.,,n.m.,0,ADCAIJ: Advances in Distributed Computing and Artificial Intelligence Journal
10.14201/adcaij2021104339359,The Approach of Data Mining,"Altaf Hussain, Ijaz Ullah, Tariq Hussain",n.m.,1,ADCAIJ: Advances in Distributed Computing and Artificial Intelligence Journal
10.14201/adcaij2018714148,Sentiment Analysis from Facebook Comments using Automatic Coding in NVivo 11,"Sameerchand Pudaruth, Sharmila Moheeputh, Narmeen Permessur, Adeelah Chamroo",n.m.,16,ADCAIJ: Advances in Distributed Computing and Artificial Intelligence Journal
