DOI,Título,Autores,Año,Citas,Revista
10.1007/s41066-021-00266-2,An indirect weak transitivity standard for inconsistent multiplicative reciprocal preference relations,Jibin Lan and Zhang Chen and Fang Liu,2022,1,Granular Computing
10.1007/s41066-018-0081-x,Multi-granularity unbalanced linguistic group decision-making with incomplete weight information based on VIKOR method,Jun Liu and Yingying Liang,2018,16,Granular Computing
10.1007/s41066-017-0061-6,Several hybrid aggregation operators for triangular intuitionistic fuzzy set and their application in multi-criteria decision making,Tahir Mahmood and Peide Liu and Jun Ye and Qaisar Khan,2018,31,Granular Computing
10.1007/s41066-023-00367-0,Multi-attribute decision making based on the q-rung orthopair fuzzy Yager power weighted geometric aggregation operator of q-rung orthopair fuzzy values,Chirag Dhankhar and Kamal Kumar,2023,0,Granular Computing
10.1007/s41066-022-00326-1,An improved $$A^*$$ search algorithm for the shortest path under interval-valued Pythagorean fuzzy environment,K. Vidhya and A. Saraswathi,2023,0,Granular Computing
10.1007/s41066-015-0011-0,A triarchic theory of granular computing,Yiyu Yao,2016,186,Granular Computing
10.1007/s41066-020-00241-3,Interpretation of exact solution for fuzzy fractional non-homogeneous differential equation under the Riemann–Liouville sense and its application on the inventory management control problem,Mostafijur Rahaman and Sankar Prasad Mondal and Shariful Alam and Najeeb Alam Khan and Amiya Biswas,2021,14,Granular Computing
10.1007/s41066-020-00228-0,Multiple-attribute decision-making based on picture fuzzy Archimedean power Maclaurin symmetric mean operators,Yuchu Qin and Xiaolan Cui and Meifa Huang and Yanru Zhong and Zhemin Tang and Peizhi Shi,2021,7,Granular Computing
10.1007/s41066-019-00174-6,Grey relational analysis method for SVTrNN based multi-attribute decision making with partially known or completely unknown weight information,Bibhas C. Giri and Mahatab Uddin Molla and Pranab Biswas,2020,8,Granular Computing
10.1007/s41066-020-00239-x,Projected decision background based on q-rung orthopair triangular fuzzy aggregation operators,Aliya Fahmi and Muhammad Aslam,2021,3,Granular Computing
10.1007/s41066-021-00264-4,Generalized similarity measures under linguistic q-rung orthopair fuzzy environment with application to multiple attribute decision-making,Rajkumar Verma,2022,4,Granular Computing
10.1007/s41066-020-00240-4,Multi-criteria decision making based on ranking of neutrosophic trapezoidal fuzzy numbers,M. Suresh and K. Arun Prakash and S. Vengataasalam,2021,3,Granular Computing
10.1007/s41066-019-00159-5,Group decision making under social influences based on information entropy,Shuli Liu and Bin Wang and Jing Liu,2020,14,Granular Computing
10.1007/s41066-020-00227-1,A new approach to similarity measure for generalized trapezoidal fuzzy numbers and its application to fuzzy risk analysis,Sanjib Sen and Kartik Patra and Shyamal Kumar Mondal,2021,6,Granular Computing
10.1007/s41066-021-00285-z,Few samples learning based on granular neural networks,Yapeng Liu and Mingli Song,2022,1,Granular Computing
10.1007/s41066-021-00291-1,Threshold graphs under picture Dombi fuzzy information,Muhammad Akram and Uzma Ahmad and n.m. Rukhsar,2022,6,Granular Computing
10.1007/s41066-020-00221-7,Knowledge measure and entropy: a complementary concept in fuzzy theory,Vikas Arya and Satish Kumar,2021,18,Granular Computing
10.1007/s41066-022-00322-5,Multiple attribute group decision-making based on generalized interval-valued Pythagorean fuzzy Einstein geometric aggregation operators,Khaista Rahman,2023,2,Granular Computing
10.1007/s41066-022-00330-5,Extended MULTIMOORA method based on 2-tuple linguistic Pythagorean fuzzy sets for multi-attribute group decision-making,Muhammad Akram and Ayesha Khan and Uzma Ahmad,2023,9,Granular Computing
10.1007/s41066-021-00299-7,Multiattribute decision-making by logarithmic operational laws in interval neutrosophic environments,Tipu Sultan Haque and Avishek Chakraborty and Hussam Alrabaiah and Shariful Alam,2022,2,Granular Computing
10.1007/s41066-022-00327-0,Interval neutrosophic matrix game-based approach to counter cybersecurity issue,Mijanur Rahaman Seikh and Shibaji Dutta,2023,0,Granular Computing
10.1007/s41066-020-00223-5,Complex Pythagorean Dombi fuzzy graphs for decision making,Muhammad Akram and Ayesha Khan,2021,20,Granular Computing
10.1007/s41066-020-00230-6,Noise-resistant fuzzy clustering algorithm,S. Askari,2021,4,Granular Computing
10.1007/s41066-020-00233-3,Extension of Einstein geometric operators to multi-attribute decision making under q-rung orthopair fuzzy information,Muhammad Akram and Gulfam Shahzadi and Xindong Peng,2021,28,Granular Computing
10.1007/s41066-020-00213-7,Complex fuzzy ordered weighted quadratic averaging operators,Muhammad Akram and Ayesha Bashir,2021,20,Granular Computing
10.1007/s41066-022-00321-6,Multicriteria group decision making based on projection measures on complex Pythagorean fuzzy sets,J. Aldring and D. Ajay,2023,4,Granular Computing
10.1007/s41066-018-0112-7,Multi-level granularity in formal concept analysis,Jianjun Qi and Ling Wei and Qing Wan,2019,17,Granular Computing
10.1007/s41066-017-0048-3,DGCC: data-driven granular cognitive computing,Guoyin Wang,2017,43,Granular Computing
10.1007/s41066-018-0106-5,Type-2 fuzzy reliability–redundancy allocation problem and its solution using particle-swarm optimization algorithm,Zubair Ashraf and Pranab K. Muhuri and Q. M. Danish Lohani and Mukul Lata Roy,2019,18,Granular Computing
10.1007/s41066-020-00215-5,Generalized triparametric correlation coefficient for Pythagorean fuzzy sets with application to MCDM problems,P. A. Ejegwa,2021,32,Granular Computing
10.1007/s41066-020-00252-0,Intuitionistic fuzzy scale-invariant entropy with correlation coefficients-based VIKOR approach for multi-criteria decision-making,Rakhi Gupta and Satish Kumar,2022,12,Granular Computing
10.1007/s41066-021-00309-8,Multicriteria decision-making based on distance measures and knowledge measures of Fermatean fuzzy sets,Abdul Haseeb Ganie,2022,7,Granular Computing
10.1007/s41066-020-00250-2,Competition graphs with complex intuitionistic fuzzy information,Muhammad Akram and Aqsa Sattar and Arsham Borumand Saeid,2022,9,Granular Computing
10.1007/s41066-021-00286-y,Multiple attribute group decision-making based on generalized aggregation operators under linguistic interval-valued Pythagorean fuzzy environment,Rajkumar Verma and Nikunj Agarwal,2022,5,Granular Computing
10.1007/s41066-023-00364-3,Analytical solution of the Atangana–Baleanu–Caputo fractional differential equations using Pythagorean fuzzy sets,Muhammad Akram and Ghulam Muhammad and Daud Ahmad,2023,1,Granular Computing
10.1007/s41066-016-0023-4,An overview of interval-valued intuitionistic fuzzy information aggregations and applications,Zeshui Xu and Xunjie Gou,2017,77,Granular Computing
10.1007/s41066-018-0141-2,Correction to: Interactive granular computing,Andrzej Skowron and Andrzej Jankowski and Soma Dutta,2019,0,Granular Computing
10.1007/s41066-016-0033-2,Erratum to: Membership grade mining of mutually inverse fuzzy implication propositions,Xunwei Zhou,2017,2,Granular Computing
10.1007/s41066-018-0131-4,An extension approach of TOPSIS method with OWAD operator for multiple criteria decision-making,Xinwang Liu and Li Wang,2020,17,Granular Computing
10.1007/s41066-022-00314-5,Multicriteria decision-making based on the confidence level Q-rung orthopair normal fuzzy aggregation operator,Manish Kumar and S. K. Gupta,2023,3,Granular Computing
10.1007/s41066-022-00319-0,Multi-attribute group decision making based on T-spherical fuzzy soft rough average aggregation operators,Muhammad Akram and Alessio Martino,2023,9,Granular Computing
10.1007/s41066-019-00175-5,Arithmetic operations on normal semi elliptic intuitionistic fuzzy numbers and their application in decision-making,Palash Dutta and Bornali Saikia,2021,25,Granular Computing
10.1007/s41066-018-0132-3,Hybrid models for decision-making based on rough Pythagorean fuzzy bipolar soft information,Muhammad Akram and Ghous Ali,2020,55,Granular Computing
10.1007/s41066-020-00220-8,Intuitionistic fuzzy time series functions approach for time series forecasting,Eren Bas and Ufuk Yolcu and Erol Egrioglu,2021,22,Granular Computing
10.1007/s41066-019-00189-z,Multi-criteria decision making under uncertainty via the operations of generalized intuitionistic fuzzy numbers,Palash Dutta,2021,8,Granular Computing
10.1007/s41066-018-0139-9,Probabilistic decision making based on rough sets in interval-valued fuzzy information systems,Derong Shi and Xiaoyan Zhang,2019,4,Granular Computing
10.1007/s41066-018-0080-y,Evacuation strategy of emergent event in metro station based on the ELECTRE method,Yanlan Mei and Kefan Xie,2018,4,Granular Computing
10.1007/s41066-022-00348-9,Improving quantum genetic optimization through granular computing,Giovanni Acampora and Autilia Vitiello,2022,1,Granular Computing
10.1007/s41066-022-00359-6,Multi-criteria group decision-making based on an integrated PROMETHEE approach with 2-tuple linguistic Fermatean fuzzy sets,Muhammad Akram and Rabia Bibi,2023,0,Granular Computing
10.1007/s41066-021-00297-9,A Pi-Sigma artificial neural network based on sine cosine optimization algorithm,Eren Bas and Erol Egrioglu and Ozlem Karahasan,2022,3,Granular Computing
10.1007/s41066-017-0055-4,Approximation of nonlinear discrete-time system using FA-based neural network,Uday Pratap Singh and Sanjeev Jain and Akhilesh Tiwari and Rajeev Kumar Singh,2018,7,Granular Computing
10.1007/s41066-018-0118-1,Hesitant bipolar-valued fuzzy sets and bipolar-valued hesitant fuzzy sets and their applications in multi-attribute group decision making,Prasenjit Mandal and A. S. Ranadive,2019,26,Granular Computing
10.1007/s41066-015-0014-x,Solving equations (and systems of equations) under uncertainty: how different practical problems lead to different mathematical and computational formulations,Vladik Kreinovich,2016,42,Granular Computing
10.1007/s41066-019-00172-8,A three-way decision method in a fuzzy condition decision information system and its application in credit card evaluation,Zhaowen Li and Dan Huang,2020,5,Granular Computing
10.1007/s41066-018-00148-0,Fuzzy rough soft set and its application to lattice,Susanta Bera and Sankar Kumar Roy,2020,5,Granular Computing
10.1007/s41066-022-00315-4,Enhancing drug–drug interaction prediction by three-way decision and knowledge graph embedding,Xinkun Hao and Qingfeng Chen and Haiming Pan and Jie Qiu and Yuxiao Zhang and Qian Yu and Zongzhao Han and Xiaojing Du,2023,1,Granular Computing
10.1007/s41066-021-00302-1,Portfolio selection by cumulative prospect theory and its comparison with mean-variance model,Sweksha Srivastava and Abha Aggarwal and Aparna Mehra,2022,2,Granular Computing
10.1007/s41066-021-00269-z,Applications of a picture fuzzy correlation coefficient in pattern analysis and decision-making,Surender Singh and Abdul Haseeb Ganie,2022,6,Granular Computing
10.1007/s41066-019-00171-9,An improved random forests approach for interactive lobar segmentation on emphysema detection,Qiang Li and Lei Chen and Xiangju Li and Shuyue Xia and Yan Kang,2020,5,Granular Computing
10.1007/s41066-020-00248-w,Medical diagnostic process based on modified composite relation on pythagorean fuzzy multi-sets,P. A. Ejegwa and C. Jana and M. Pal,2022,5,Granular Computing
10.1007/s41066-022-00324-3,Feature ranking based on an improved granular neural network,Mingli Song and Liansheng Hu and Shuang Feng and Yongbin Wang,2023,3,Granular Computing
10.1007/s41066-022-00333-2,Picture fuzzy soft $$\sigma$$-algebra and picture fuzzy soft measure and their applications to multi-criteria decision-making,Khalid Naeem and Samet Memiş,2023,0,Granular Computing
10.1007/s41066-021-00261-7,Multi-criteria decision making based on intuitionistic cubic fuzzy numbers,n.m. Muneeza and Saleem Abdullah and Muhammad Qiyas and Muhammad Ali Khan,2022,5,Granular Computing
10.1007/s41066-022-00355-w,Correlation coefficients for T-spherical fuzzy sets and their applications in pattern analysis and multi-attribute decision-making,Muhammad Saad and Ayesha Rafiq,2022,2,Granular Computing
10.1007/s41066-022-00354-x,Multicriteria decision-making based on the degree and distance-based indices of fuzzy graphs,Uzma Ahmad and Muhammad Sabir,2022,2,Granular Computing
10.1007/s41066-019-00160-y,Multi-granular-based n-valued neutrosophic context analysis,Prem Kumar Singh,2020,11,Granular Computing
10.1007/s41066-018-0091-8,Some induced aggregation operators based on interval-valued Pythagorean fuzzy numbers,Khaista Rahman and Saleem Abdullah and Asad Ali,2019,19,Granular Computing
10.1007/s41066-020-00232-4,Spatial and temporal reasoning with granular computing and three way formal concept analysis,Angelo Gaeta and Vincenzo Loia and Francesco Orciuoli and Mimmo Parente,2021,5,Granular Computing
10.1007/s41066-015-0005-y,Enforcing situation awareness with granular computing: a systematic overview and new perspectives,Vincenzo Loia and Giuseppe D’Aniello and Angelo Gaeta and Francesco Orciuoli,2016,82,Granular Computing
10.1007/s41066-021-00292-0,Mehar approach for solving matrix games with triangular dual hesitant fuzzy payoffs,M. G. Brikaa and Zhoushun Zheng and El-Saeed Ammar,2022,1,Granular Computing
10.1007/s41066-020-00242-2,Multi-criteria decision making problem for evaluating ERP system using entropy weighting approach and q-rung orthopair fuzzy TODIM,Vikas Arya and Satish Kumar,2021,13,Granular Computing
10.1007/s41066-019-00179-1,Rough set approach to non-cooperative continuous differential games,M. G. Brikaa and Zhoushun Zheng and El-Saeed Ammar,2021,6,Granular Computing
10.1007/s41066-021-00265-3,Particle swarm optimization and intuitionistic fuzzy set-based novel method for fuzzy time series forecasting,Manish Pant and Sanjay Kumar,2022,10,Granular Computing
10.1007/s41066-018-0108-3,Attribute reduction based on the Boolean matrix,Yunpeng Shi and Yang Huang and Changzhong Wang and Qiang He,2019,6,Granular Computing
10.1007/s41066-018-0096-3,Quasiconvex possibility distribution with application in decision-making,Lesheng Jin and Jian Wang and Gang Qian,2019,3,Granular Computing
10.1007/s41066-021-00300-3,"Fuzzy time series forecasting based on hesitant fuzzy sets, particle swarm optimization and support vector machine-based hybrid method",Manish Pant and Sanjay Kumar,2022,10,Granular Computing
10.1007/s41066-021-00257-3,Recurrent fuzzy time series functions approaches for forecasting,Erol Egrioglu and Robert Fildes and Eren Baş,2022,15,Granular Computing
10.1007/s41066-017-0062-5,Trapezium cloud TOPSIS method with interval-valued intuitionistic hesitant fuzzy linguistic information,Dheeraj Kumar Joshi and Sanjay Kumar,2018,29,Granular Computing
10.1007/s41066-022-00334-1,Enhanced intuitionistic fuzzy similarity operators with applications in emergency management and pattern recognition,Paul Augustine Ejegwa and Sesugh Ahemen,2023,2,Granular Computing
10.1007/s41066-019-00195-1,VGHC: a variable granularity hierarchical clustering for community detection,Jie Chen and Yang Li and Xuejie Yang and Shu Zhao and Yanping Zhang,2021,4,Granular Computing
10.1007/s41066-022-00332-3,Extended CODAS method for multi-attribute group decision-making based on 2-tuple linguistic Fermatean fuzzy Hamacher aggregation operators,Muhammad Akram and Zohra Niaz and Feng Feng,2022,7,Granular Computing
10.1007/s41066-020-00225-3,A novel approach of linguistic intuitionistic cubic hesitant variables and their application in decision making,Muhammad Qiyas and Saleem Abdullah and n.m. Muneeza,2021,6,Granular Computing
10.1007/s41066-018-0115-4,Type 1 fuzzy function approach based on ridge regression for forecasting,Eren Bas and Erol Egrioglu and Ufuk Yolcu and Crina Grosan,2019,17,Granular Computing
10.1007/s41066-016-0021-6,Rule-based systems: a granular computing perspective,Han Liu and Alexander Gegov and Mihaela Cocea,2016,91,Granular Computing
10.1007/s41066-019-00209-y,Intuitionistic fuzzy Dombi aggregation operators and their application to multiple attribute decision-making,Mijanur Rahaman Seikh and Utpal Mandal,2021,50,Granular Computing
10.1007/s41066-018-0129-y,"Multi-objective capacitated transportation: a problem of parameters estimation, goodness of fit and optimization",Srikant Gupta and Irfan Ali and Sachin Chaudhary,2020,5,Granular Computing
10.1007/s41066-018-0097-2,Granular computing-based approach of rule learning for binary classification,Han Liu and Mihaela Cocea,2019,17,Granular Computing
10.1007/s41066-019-00194-2,A multi-granular network representation learning method,Jie Chen and Ziwei Du and Xian Sun and Shu Zhao and Yanping Zhang,2021,2,Granular Computing
10.1007/s41066-015-0002-1,Interactive granular computing,Andrzej Skowron and Andrzej Jankowski and Soma Dutta,2016,125,Granular Computing
10.1007/s41066-021-00294-y,Novel similarity measures between picture fuzzy sets and their applications to pattern recognition and medical diagnosis,Rajkumar Verma and Barkha Rohtagi,2022,6,Granular Computing
10.1007/s41066-020-00218-2,Picture fuzzy Choquet integral-based VIKOR for multicriteria group decision-making problems,Akanksha Singh and Sanjay Kumar,2021,22,Granular Computing
10.1007/s41066-017-0047-4,Probabilistic linguistic TODIM approach for multiple attribute decision-making,Peide Liu and Xinli You,2017,61,Granular Computing
10.1007/s41066-021-00270-6,Multiattribute decision-making under Fermatean fuzzy bipolar soft framework,Ghous Ali and Masfa Nasrullah Ansari,2022,26,Granular Computing
10.1007/s41066-017-0071-4,An integrated ANP-VIKOR methodology for sustainable supplier selection with interval type-2 fuzzy sets,Kuan Liu and Yanwu Liu and Jindong Qin,2018,45,Granular Computing
