DOI,Título,Autores,Año,Citas,Revista
10.3390/a7030456,A Fovea Localization Scheme Using Vessel Origin-Based Parabolic Model,Chun-Yuan Yu and Chen-Chung Liu and Shyr-Shen Yu,2014,4,Algorithms
10.3390/a15100342,A Hybrid Clustering Approach Based on Fuzzy Logic and Evolutionary Computation for Anomaly Detection,Shakhnaz Akhmedova and Vladimir Stanovov and Yukihiro Kamiya,2022,0,Algorithms
10.3390/a15060211,Optimizing Cybersecurity Investments over Time,Alessandro Mazzoccoli and Maurizio Naldi,2022,1,Algorithms
10.3390/a15110413,AMR-Assisted Order Picking: Models for Picker-to-Parts Systems in a Two-Blocks Warehouse,Giulia Pugliese and Xiaochen Chou and Dominic Loske and Matthias Klumpp and Roberto Montemanni,2022,0,Algorithms
10.3390/a14120342,An O(log2N) Fully-Balanced Resampling Algorithm for Particle Filters on Distributed Memory Architectures,Alessandro Varsi and Simon Maskell and Paul G. Spirakis,2021,1,Algorithms
10.3390/a8030712,Gradient-Based Iterative Identification for Wiener Nonlinear Dynamic Systems with Moving Average Noises,Lincheng Zhou and Xiangli Li and Huigang Xu and Peiyi Zhu,2015,4,Algorithms
10.3390/a11020016,A Novel Spectrum Scheduling Scheme with Ant Colony Optimization Algorithm,Liping Liu and Ning Wang and Zhigang Chen and Lin Guo,2018,2,Algorithms
10.3390/a15070252,Informer-WGAN: High Missing Rate Time Series Imputation Based on Adversarial Training and a Self-Attention Mechanism,Yufan Qian and Limei Tian and Baichen Zhai and Shufan Zhang and Rui Wu,2022,0,Algorithms
10.3390/a15080274,A Neural Network Approach for the Analysis of Reproducible Ribo–Seq Profiles,Giorgia Giacomini and Caterina Graziani and Veronica Lachi and Pietro Bongini and Niccolò Pancino and Monica Bianchini and Davide Chiarugi and Angelo Valleriani and Paolo Andreini,2022,0,Algorithms
10.3390/a3010063,Interactive Compression of Digital Data,Bruno Carpentieri,2010,1,Algorithms
10.3390/a9010012,Integrating Pareto Optimization into Dynamic Programming,Thomas Gatter and Robert Giegerich and Cédric Saule,2016,5,Algorithms
10.3390/a15090298,Optimal Design Parameters for Hybrid DC Circuit Breakers Using a Multi-Objective Genetic Algorithm,Van-Vinh Nguyen and Nhat-Tung Nguyen and Quang-Thuan Nguyen and Van-Hai Bui and Wencong Su,2022,0,Algorithms
10.3390/a9010018,"Constructing Frozen Jacobian Iterative Methods for Solving Systems of Nonlinear Equations, Associated with ODEs and PDEs Using the Homotopy Method",Uswah Qasim and Zulifqar Ali and Fayyaz Ahmad and Stefano Serra-Capizzano and Malik Zaka Ullah and Mir Asma,2016,4,Algorithms
10.3390/a2010429,Protein-Protein Interaction Analysis by Docking,Florian Fink and Stephan Ederer and Wolfram Gronwald,2009,2,Algorithms
10.3390/a14050148,Disjoint Tree Mergers for Large-Scale Maximum Likelihood Tree Estimation,Minhyuk Park and Paul Zaharias and Tandy Warnow,2021,5,Algorithms
10.3390/a15040125,Computational Approaches for Grocery Home Delivery Services,Christian Truden and Kerstin Maier and Anna Jellen and Philipp Hungerländer,2022,3,Algorithms
10.3390/a10020041,RST Resilient Watermarking Scheme Based on DWT-SVD and Scale-Invariant Feature Transform,Yunpeng Zhang and Chengyou Wang and Xiao Zhou,2017,8,Algorithms
10.3390/a2041350,CADrx for GBM Brain Tumors: Predicting Treatment Response from Changes in Diffusion-Weighted MRI,Jing Huo and Kazunori Okada and Hyun Kim and Whitney Pope and Jonathan Goldin and Jeffrey Alger and Matthew Brown,2009,6,Algorithms
10.3390/a13100253,The Use of an Exact Algorithm within a Tabu Search Maximum Clique Algorithm,Derek H. Smith and Roberto Montemanni and Stephanie Perkins,2020,5,Algorithms
10.3390/a15120464,Error Investigation on Wi-Fi RTT in Commercial Consumer Devices,Yinhuan Dong and Duanxu Shi and Tughrul Arslan and Yunjie Yang,2022,0,Algorithms
10.3390/a11050074,Using Metaheuristics on the Multi-Depot Vehicle Routing Problem with Modified Optimization Criterion,Petr Stodola,2018,24,Algorithms
10.3390/a11010009,Application of a Hybrid Model Based on a Convolutional Auto-Encoder and Convolutional Neural Network in Object-Oriented Remote Sensing Classification,Wei Cui and Qi Zhou and Zhendong Zheng,2018,20,Algorithms
10.3390/a14020043,An FPTAS for Dynamic Multiobjective Shortest Path Problems,Pedro Maristany de las Casas and Ralf Borndörfer and Luitgard Kraus and Antonio Sedeño-Noda,2021,2,Algorithms
10.3390/a12010017,Shadowed Type-2 Fuzzy Systems for Dynamic Parameter Adaptation in Harmony Search and Differential Evolution Algorithms,Oscar Castillo and Patricia Melin and Fevrier Valdez and Jose Soria and Emanuel Ontiveros-Robles and Cinthia Peraza and Patricia Ochoa,2019,30,Algorithms
10.3390/a15060196,Process Mining the Performance of a Real-Time Healthcare 4.0 Systems Using Conditional Survival Models,Adele H. Marshall and Aleksandar Novakovic,2022,0,Algorithms
10.3390/a13030071,Two-Step Classification with SVD Preprocessing of Distributed Massive Datasets in Apache Spark,Athanasios Alexopoulos and Georgios Drakopoulos and Andreas Kanavos and Phivos Mylonas and Gerasimos Vonitsanos,2020,7,Algorithms
10.3390/a14020029,Particle Swarm Optimization Based on a Novel Evaluation of Diversity,Haohao Zhou and Xiangzhi Wei,2021,3,Algorithms
10.3390/a10010008,Modeling Delayed Dynamics in Biological Regulatory Networks from Time Series Data,Emna Ben Abdallah and Tony Ribeiro and Morgan Magnin and Olivier Roux and Katsumi Inoue,2017,3,Algorithms
10.3390/a13120325,Fuzzy-Based Multivariate Analysis for Input Modeling of Risk Assessment in Wind Farm Projects,Emad Mohamed and Parinaz Jafari and Simaan AbouRizk,2020,2,Algorithms
10.3390/a14030092,An Automatic Participant Detection Framework for Event Tracking on Twitter,Nicholas Mamo and Joel Azzopardi and Colin Layfield,2021,1,Algorithms
10.3390/a2010470,Semi-empirical Algorithm for the Retrieval of Ecology-Relevant Water Constituents in Various Aquatic Environments,Anton Korosov and Dmitry Pozdnyakov and Are Folkestad and Lasse Pettersson and Kai Sørensen and Robert Shuchman,2009,20,Algorithms
10.3390/a11100160,Modeling and Evaluation of Power-Aware Software Rejuvenation in Cloud Systems,Sharifeh Fakhrolmobasheri and Ehsan Ataie and Ali Movaghar,2018,5,Algorithms
10.3390/a13100255,A Weighted Ensemble Learning Algorithm Based on Diversity Using a Novel Particle Swarm Optimization Approach,Gui-Rong You and Yeou-Ren Shiue and Wei-Chang Yeh and Xi-Li Chen and Chih-Ming Chen,2020,2,Algorithms
10.3390/a14110318,Using Decision Trees and Random Forest Algorithms to Predict and Determine Factors Contributing to First-Year University Students’ Learning Performance,Thao-Trang Huynh-Cam and Long-Sheng Chen and Huynh Le,2021,6,Algorithms
10.3390/a16010031,Optimization of Linear Quantization for General and Effective Low Bit-Width Network Compression,Wenxin Yang and Xiaoli Zhi and Weiqin Tong,2023,0,Algorithms
10.3390/a15060193,A Survey on Network Optimization Techniques for Blockchain Systems,Robert Antwi and James Dzisi Gadze and Eric Tutu Tchao and Axel Sikora and Henry Nunoo-Mensah and Andrew Selasi Agbemenu and Kwame Opunie-Boachie Obour Agyekum and Justice Owusu Agyemang and Dominik Welte and Eliel Keelson,2022,3,Algorithms
10.3390/a15100372,An Application of a Decision Support System Enabled by a Hybrid Algorithmic Framework for Production Scheduling in an SME Manufacturer,Athanasios C. Spanos and Sotiris P. Gayialis and Evripidis P. Kechagias and Georgios A. Papadopoulos,2022,0,Algorithms
10.3390/a15100376,"Listening to the City, Attentively: A Spatio-Temporal Attention-Boosted Autoencoder for the Short-Term Flow Prediction Problem",Stefano Fiorini and Michele Ciavotta and Andrea Maurino,2022,1,Algorithms
10.3390/a10020071,Bayesian and Classical Estimation of Stress-Strength Reliability for Inverse Weibull Lifetime Models,Qixuan Bi and Wenhao Gui,2017,6,Algorithms
10.3390/a13030073,Classical and Deep Learning Paradigms for Detection and Validation of Key Genes of Risky Outcomes of HCV,Nagwan M. Abdel Samee,2020,5,Algorithms
10.3390/a13050124,A Novel Method for Inference of Chemical Compounds of Cycle Index Two with Desired Properties Based on Artificial Neural Networks and Integer Programming,Jianshen Zhu and Chenxi Wang and Aleksandar Shurbevski and Hiroshi Nagamochi and Tatsuya Akutsu,2020,8,Algorithms
10.3390/a13040076,Experiments-Based Comparison of Different Power Controllers for a Solid Oxide Fuel Cell Against Model Imperfections and Delay Phenomena,Wiebke Frenkel and Andreas Rauh and Julia Kersten and Harald Aschemann,2020,9,Algorithms
10.3390/a14110327,Hybrid Multiagent Collaboration for Time-Critical Tasks: A Mathematical Model and Heuristic Approach,Yifeng Zhou and Kai Di and Haokun Xing,2021,1,Algorithms
10.3390/a15060180,Data Preprocessing Method and API for Mining Processes from Cloud-Based Application Event Logs,Najah Mary El-Gharib and Daniel Amyot,2022,0,Algorithms
10.3390/a14060165,An Efficient Convolutional Blind Source Separation Algorithm for Speech Signals under Chaotic Masking,Shiyu Guo and Mengna Shi and Yanqi Zhou and Jiayin Yu and Erfu Wang,2021,1,Algorithms
10.3390/a15060188,Lessons for Data-Driven Modelling from Harmonics in the Norwegian Grid,Volker Hoffmann and Bendik Nybakk Torsæter and Gjert Hovland Rosenlund and Christian Andre Andresen,2022,0,Algorithms
10.3390/a7020189,Faster and Simpler Approximation of Stable Matchings,Katarzyna Paluch,2014,22,Algorithms
10.3390/a15060190,A Missing Data Reconstruction Method Using an Accelerated Least-Squares Approximation with Randomized SVD,Siriwan Intawichai and Saifon Chaturantabut,2022,0,Algorithms
10.3390/a13080192,Local-Topology-Based Scaling for Distance Preserving Dimension Reduction Method to Improve Classification of Biomedical Data-Sets,Karaj Khosla and Indra Prakash Jha and Ajit Kumar and Vibhor Kumar,2020,1,Algorithms
10.3390/a12070129,A Hyper Heuristic Algorithm to Solve the Low-Carbon Location Routing Problem,Chunmiao Zhang and Yanwei Zhao and Longlong Leng,2019,7,Algorithms
10.3390/a4020075,Approximating the Minimum Tour Cover of a Digraph,Viet Hung Nguyen,2011,2,Algorithms
10.3390/a15070224,Quantum Computing Approaches for Mission Covering Optimization,Massimiliano Cutugno and Annarita Giani and Paul Alsing and Laura Wessing and Austar Schnore,2022,0,Algorithms
10.3390/a15090297,SepFree NMF: A Toolbox for Analyzing the Kinetics of Sequential Spectroscopic Data,Renata Sechi and Konstantin Fackeldey and Surahit Chewle and Marcus Weber,2022,0,Algorithms
10.3390/a15070241,Topology Optimisation under Uncertainties with Neural Networks,Martin Eigel and Marvin Haase and Johannes Neumann,2022,1,Algorithms
10.3390/a11050062,A Feature-Weighted SVR Method Based on Kernel Space Feature,Minghua Xie and Decheng Wang and Lili Xie,2018,2,Algorithms
10.3390/a12090189,Parameterised Enumeration for Modification Problems,Nadia Creignou and Raïda Ktari and Arne Meier and Julian-Steffen Müller and Frédéric Olive and Heribert Vollmer,2019,6,Algorithms
10.3390/a16020069,RUemo—The Classification Framework for Russia-Ukraine War-Related Societal Emotions on Twitter through Machine Learning,Piyush Vyas and Gitika Vyas and Gaurav Dhiman,2023,0,Algorithms
10.3390/a16020062,Multi-Guide Set-Based Particle Swarm Optimization for Multi-Objective Portfolio Optimization,Kyle Erwin and Andries Engelbrecht,2023,0,Algorithms
10.3390/a15030077,Prediction of Injuries in CrossFit Training: A Machine Learning Perspective,Serafeim Moustakidis and Athanasios Siouras and Konstantinos Vassis and Ioannis Misiris and Elpiniki Papageorgiou and Dimitrios Tsaopoulos,2022,2,Algorithms
10.3390/a10040113,Scale Reduction Techniques for Computing Maximum Induced Bicliques,Shahram Shahinpour and Shirin Shirvani and Zeynep Ertem and Sergiy Butenko,2017,8,Algorithms
10.3390/a13080194,Graph Planarity by Replacing Cliques with Paths,Patrizio Angelini and Peter Eades and Seok-Hee Hong and Karsten Klein and Stephen Kobourov and Giuseppe Liotta and Alfredo Navarra and Alessandra Tappini,2020,6,Algorithms
10.3390/a15120471,A Proposal of Printed Table Digitization Algorithm with Image Processing,Chenrui Shi and Nobuo Funabiki and Yuanzhi Huo and Mustika Mentari and Kohei Suga and Takashi Toshida,2022,0,Algorithms
10.3390/a12070145,A Study on Sensitive Bands of EEG Data under Different Mental Workloads,Hongquan Qu and Zhanli Fan and Shuqin Cao and Liping Pang and Hao Wang and Jie Zhang,2019,2,Algorithms
10.3390/a14090260,Comparison of Profit-Based Multi-Objective Approaches for Feature Selection in Credit Scoring,Naomi Simumba and Suguru Okami and Akira Kodaka and Naohiko Kohtake,2021,3,Algorithms
10.3390/a8030754,Modified Classical Graph Algorithms for the DNA Fragment Assembly Problem,Guillermo Mallén-Fullerton and J. Quiroz-Ibarra and Antonio Miranda and Guillermo Fernández-Anaya,2015,7,Algorithms
10.3390/a15120463,Numerical Integration Schemes Based on Composition of Adjoint Multistep Methods,Dmitriy Pesterev and Olga Druzhina and Alexander Pchelintsev and Erivelton Nepomuceno and Denis Butusov,2022,1,Algorithms
10.3390/a11060081,A Randomized Algorithm for Optimal PID Controllers,Yossi Peretz,2018,7,Algorithms
10.3390/a15100365,Enhanced Maximum Power Point Techniques for Solar Photovoltaic System under Uniform Insolation and Partial Shading Conditions: A Review,Laxman Bhukya and Narender Reddy Kedika and Surender Reddy Salkuti,2022,2,Algorithms
10.3390/a14030090,"Space-Efficient, Fast and Exact Routing in Time-Dependent Road Networks",Ben Strasser and Dorothea Wagner and Tim Zeitz,2021,5,Algorithms
10.3390/a12070132,Drum Water Level Control Based on Improved ADRC,Cuiping Pu and Yicheng Zhu and Jianbo Su,2019,5,Algorithms
10.3390/a14020062,k-Circle Formation and k-epf by Asynchronous Robots,Subhash Bhagat and Bibhuti Das and Abhinav Chakraborty and Krishnendu Mukhopadhyaya,2021,4,Algorithms
10.3390/a16010015,Improvement of Ant Colony Algorithm Performance for the Job-Shop Scheduling Problem Using Evolutionary Adaptation and Software Realization Heuristics,Pavel V. Matrenin,2022,0,Algorithms
10.3390/a16010016,A General Computational Approach for Counting Labeled Graphs,Ravi Goyal and Victor De Gruttola,2022,0,Algorithms
10.3390/a12020029,A Distributed Execution Pipeline for Clustering Trajectories Based on a Fuzzy Similarity Relation,Soufiane Maguerra and Azedine Boulmakoul and Lamia Karim and Hassan Badir,2019,3,Algorithms
10.3390/a6010060,Tractabilities and Intractabilities on Geometric Intersection Graphs,Ryuhei Uehara,2013,8,Algorithms
10.3390/a6010001,Maximum Disjoint Paths on Edge-Colored Graphs: Approximability and Tractability,Paola Bonizzoni and Riccardo Dondi and Yuri Pirola,2012,9,Algorithms
10.3390/a15020034,Convex Neural Networks Based Reinforcement Learning for Load Frequency Control under Denial of Service Attacks,Fancheng Zeng and Guanqiu Qi and Zhiqin Zhu and Jian Sun and Gang Hu and Matthew Haner,2022,2,Algorithms
10.3390/a10030099,Hybrid Learning for General Type-2 TSK Fuzzy Logic Systems,Mauricio Sanchez and Juan Castro and Violeta Ocegueda-Miramontes and Leticia Cervantes,2017,14,Algorithms
10.3390/a12080171,An Application of Manifold Learning in Global Shape Descriptors,Fereshteh S. Bashiri and Reihaneh Rostami and Peggy Peissig and Roshan M. D’Souza and Zeyun Yu,2019,3,Algorithms
10.3390/a16010019,Improved Anomaly Detection by Using the Attention-Based Isolation Forest,Lev Utkin and Andrey Ageev and Andrei Konstantinov and Vladimir Muliukha,2022,0,Algorithms
10.3390/a11010003,Analytic Combinatorics for Computing Seeding Probabilities,Guillaume Filion,2018,4,Algorithms
10.3390/a2041368,"Methodology, Algorithms, and Emerging Tool for Automated Design of Intelligent Integrated Multi-Sensor Systems",Kuncup Iswandy and Andreas König,2009,12,Algorithms
10.3390/a14060159,Circle-U-Net: An Efficient Architecture for Semantic Segmentation,Feng Sun and Ajith Kumar V and Guanci Yang and Ansi Zhang and Yiyun Zhang,2021,10,Algorithms
10.3390/a11080122,Efficient Model-Based Object Pose Estimation Based on Multi-Template Tracking and PnP Algorithms,Chi-Yi Tsai and Kuang-Jui Hsu and Humaira Nisar,2018,8,Algorithms
10.3390/a15050149,Extreme Learning Machine Enhanced Gradient Boosting for Credit Scoring,Yao Zou and Changchun Gao,2022,2,Algorithms
10.3390/a9030057,Uniform Page Migration Problem in Euclidean Space,Amanj Khorramian and Akira Matsubayashi,2016,2,Algorithms
10.3390/a8020336,MAKHA—A New Hybrid Swarm Intelligence Global Optimization Algorithm,Ahmed Khalil and Seif-Eddeen Fateen and Adrián Bonilla-Petriciolet,2015,8,Algorithms
10.3390/a14100292,Utilizing the Particle Swarm Optimization Algorithm for Determining Control Parameters for Civil Structures Subject to Seismic Excitation,Courtney A. Peckens and Andrea Alsgaard and Camille Fogg and Mary C. Ngoma and Clara Voskuil,2021,1,Algorithms
10.3390/a11040044,Safe Path Planning of Mobile Robot Based on Improved A* Algorithm in Complex Terrains,Hong-Mei Zhang and Ming-Long Li and Le Yang,2018,33,Algorithms
10.3390/a11040054,Dual Market Facility Network Design under Bounded Rationality,D. Mogale and Geet Lahoti and Shashi Jha and Manish Shukla and Narasimha Kamath and Manoj Tiwari,2018,11,Algorithms
10.3390/a14110330,Autoencoder-Based Reduced Order Observer Design for a Class of Diffusion-Convection-Reaction Systems,Alexander Schaum,2021,1,Algorithms
10.3390/a14030082,Identifying and Ranking Influential Nodes in Complex Networks Based on Dynamic Node Strength,Xu Li and Qiming Sun,2021,6,Algorithms
10.3390/a16020082,Process Mining IPTV Customer Eye Gaze Movement Using Discrete-Time Markov Chains,Zhi Chen and Shuai Zhang and Sally McClean and Fionnuala Hart and Michael Milliken and Brahim Allan and Ian Kegel,2023,0,Algorithms
10.3390/a16020084,About the Performance of a Calculus-Based Approach to Building Model Functions in a Derivative-Free Trust-Region Algorithm,Warren Hare and Gabriel Jarry-Bolduc,2023,0,Algorithms
10.3390/a14010021,Dynamic Shortest Paths Methods for the Time-Dependent TSP,Christoph Hansknecht and Imke Joormann and Sebastian Stiller,2021,6,Algorithms
10.3390/a2010398,A Sensor-Based Learning Algorithm for the Self-Organization of Robot Behavior,Frank Hesse and Georg Martius and Ralf Der and J. Michael Herrmann,2009,10,Algorithms
10.3390/a16010036,A Symbolic Method for Solving a Class of Convolution-Type Volterra–Fredholm–Hammerstein Integro-Differential Equations under Nonlocal Boundary Conditions,Efthimios Providas and Ioannis Nestorios Parasidis,2023,0,Algorithms
10.3390/a12050099,Evolutionary Machine Learning for Multi-Objective Class Solutions in Medical Deformable Image Registration,Kleopatra Pirpinia and Peter A. N. Bosman and Jan-Jakob Sonke and Marcel van Herk and Tanja Alderliesten,2019,5,Algorithms
10.3390/a16010037,Ant-Balanced Multiple Traveling Salesmen: ACO-BmTSP,Sílvia de Castro Pereira and Eduardo J. Solteiro Pires and Paulo B. de Moura Oliveira,2023,0,Algorithms
10.3390/a16020065,Online Batch Selection for Enhanced Generalization in Imbalanced Datasets,George Ioannou and Georgios Alexandridis and Andreas Stafylopatis,2023,0,Algorithms
10.3390/a12070135,Breast Microcalcification Detection Algorithm Based on Contourlet and ASVM,n.m. Cai and n.m. Liu and n.m. Luo and n.m. Du and n.m. Tang,2019,2,Algorithms
10.3390/a14080242,Data Mining Algorithms for Smart Cities: A Bibliometric Analysis,Anestis Kousis and Christos Tjortjis,2021,8,Algorithms
10.3390/a11020018,A New Greedy Insertion Heuristic Algorithm with a Multi-Stage Filtering Mechanism for Energy-Efficient Single Machine Scheduling Problems,Hongliang Zhang and Youcai Fang and Ruilin Pan and Chuanming Ge,2018,9,Algorithms
10.3390/a10020059,Contradiction Detection with Contradiction-Specific Word Embedding,Luyang Li and Bing Qin and Ting Liu,2017,11,Algorithms
10.3390/a12070139,A Credit Rating Model in a Fuzzy Inference System Environment,n.m. Yazdi and n.m. Hanne and n.m. Wang and n.m. Wee,2019,4,Algorithms
10.3390/a13070156,Generalized Polynomial Chaos Expansion for Fast and Accurate Uncertainty Quantification in Geomechanical Modelling,Claudia Zoccarato and Laura Gazzola and Massimiliano Ferronato and Pietro Teatini,2020,7,Algorithms
10.3390/a14030091,UAV Formation Shape Control via Decentralized Markov Decision Processes,Md Ali Azam and Hans D. Mittelmann and Shankarachary Ragi,2021,11,Algorithms
10.3390/a12080152,Bicriteria Vehicle Routing Problem with Preferences and Timing Constraints in Home Health CareServices,Syrine Roufaida Ait Haddadene and Nacima Labadie and Caroline Prodhon,2019,12,Algorithms
10.3390/a15010017,Analog Circuit Fault Diagnosis Using a Novel Variant of a Convolutional Neural Network,Liang Han and Feng Liu and Kaifeng Chen,2022,2,Algorithms
10.3390/a15010021,Graph Based Feature Selection for Reduction of Dimensionality in Next-Generation RNA Sequencing Datasets,Consolata Gakii and Paul O. Mireji and Richard Rimiru,2022,4,Algorithms
10.3390/a13120335,From Trees to Barcodes and Back Again: Theoretical and Statistical Perspectives,Lida Kanari and Adélie Garin and Kathryn Hess,2020,4,Algorithms
10.3390/a12120268,Construction Method of Probabilistic Boolean Networks Based on Imperfect Information,Katsuaki Umiji and Koichi Kobayashi and Yuh Yamashita,2019,2,Algorithms
10.3390/a2020808,"Failure Assessment of Layered Composites Subject to Impact Loadings: a Finite Element, Sigma-Point Kalman Filter Approach",Stefano Mariani,2009,6,Algorithms
10.3390/a6020245,Fast Rescheduling of Multiple Workflows to Constrained Heterogeneous Resources Using Multi-Criteria Memetic Computing,Wilfried Jakob and Sylvia Strack and Alexander Quinte and Günther Bengel and Karl-Uwe Stucky and Wolfgang Süß,2013,9,Algorithms
10.3390/a14080249,Myocardial Infarction Quantification from Late Gadolinium Enhancement MRI Using Top-Hat Transforms and Neural Networks,Ezequiel de la Rosa and Désiré Sidibé and Thomas Decourselle and Thibault Leclercq and Alexandre Cochet and Alain Lalande,2021,4,Algorithms
10.3390/a16020085,"Detection of Cyberattacks and Anomalies in Cyber-Physical Systems: Approaches, Data Sources, Evaluation",Olga Tushkanova and Diana Levshun and Alexander Branitskiy and Elena Fedorchenko and Evgenia Novikova and Igor Kotenko,2023,0,Algorithms
10.3390/a15080277,Solar Photovoltaic Integration in Monopolar DC Networks via the GNDO Algorithm,Oscar Danilo Montoya and Walter Gil-González and Luis Fernando Grisales-Noreña,2022,6,Algorithms
10.3390/a14070205,Iterative Solution of Linear Matrix Inequalities for the Combined Control and Observer Design of Systems with Polytopic Parameter Uncertainty and Stochastic Noise,Andreas Rauh and Robert Dehnert and Swantje Romig and Sabine Lerch and Bernd Tibken,2021,6,Algorithms
10.3390/a16020087,From Iris Image to Embedded Code: System of Methods,Ivan Matveev and Ilia Safonov,2023,0,Algorithms
10.3390/a16020086,Efficient Online Engagement Analytics Algorithm Toolkit That Can Run on Edge,Saw Thiha and Jay Rajasekera,2023,0,Algorithms
10.3390/a13090226,Spatially Adaptive Regularization in Image Segmentation,Laura Antonelli and Valentina De Simone and Daniela di Serafino,2020,7,Algorithms
10.3390/a15100383,Distributed Fuzzy Cognitive Maps for Feature Selection in Big Data Classification,K. Haritha and M. V. Judy and Konstantinos Papageorgiou and Vassilis C. Georgiannis and Elpiniki Papageorgiou,2022,1,Algorithms
10.3390/a14060163,A New Hyper-Parameter Optimization Method for Power Load Forecast Based on Recurrent Neural Networks,Yaru Li and Yulai Zhang and Yongping Cai,2021,6,Algorithms
10.3390/a2010158,A Survey on Position-Based Routing Algorithms in Wireless Sensor Networks,Zhang Jin and Yu Jian-Ping and Zhou Si-Wang and Lin Ya-Ping and Li Guang,2009,26,Algorithms
10.3390/a13050117,A Novel Hybrid Metaheuristic Algorithm for Optimization of Construction Management Site Layout Planning,Doddy Prayogo and Min-Yuan Cheng and Yu-Wei Wu and A. A. N. Perwira Redi and Vincent F. Yu and Satria Fadil Persada and Reny Nadlifatin,2020,7,Algorithms
10.3390/a10020070,An Improved Brain-Inspired Emotional Learning Algorithm for Fast Classification,Ying Mei and Guanzheng Tan and Zhentao Liu,2017,24,Algorithms
10.3390/a15040117,Performance of Parallel K-Means Algorithms in Java,Libero Nigro,2022,2,Algorithms
10.3390/a10030076,A Genetic Algorithm Using Triplet Nucleotide Encoding and DNA Reproduction Operations for Unconstrained Optimization Problems,Wenke Zang and Weining Zhang and Wenqian Zhang and Xiyu Liu,2017,7,Algorithms
10.3390/a11050069,A Multi-Stage Algorithm for a Capacitated Vehicle Routing Problem with Time Constraints,Lucia Cassettari and Melissa Demartini and Roberto Mosca and Roberto Revetria and Flavio Tonelli,2018,12,Algorithms
10.3390/a3020183,Integrating New Technologies and Existing Tools to Promote Programming Learning,Álvaro Santos and Anabela Gomes and António José Mendes,2010,25,Algorithms
10.3390/a5010076,"Visualization, Band Ordering and Compression of Hyperspectral Images",Raffaele Pizzolante and Bruno Carpentieri,2012,17,Algorithms
10.3390/a15010005,Deep Transfer Learning for Parkinson’s Disease Monitoring by Image-Based Representation of Resting-State EEG Using Directional Connectivity,Emad Arasteh and Ailar Mahdizadeh and Maryam Mirian and Soojin Lee and Martin McKeown,2021,3,Algorithms
10.3390/a15080282,Techniques and Paradigms in Modern Game AI Systems,Yunlong Lu and Wenxin Li,2022,0,Algorithms
10.3390/a10020069,Cross-Language Plagiarism Detection System Using Latent Semantic Analysis and Learning Vector Quantization,Anak Agung Putri Ratna and Prima Dewi Purnamasari and Boma Anantasatya Adhi and F. Astha Ekadiyanto and Muhammad Salman and Mardiyah Mardiyah and Darien Jonathan Winata,2017,5,Algorithms
10.3390/a14030095,Towards Understanding Clustering Problems and Algorithms: An Instance Space Analysis,Luiz Henrique dos Santos Fernandes and Ana Carolina Lorena and Kate Smith-Miles,2021,5,Algorithms
