DOI,Título,Autores,Año,Citas,Revista
10.1007/s00146-003-0252-3,A commentary on developing work and quality improvement strategies II,Xavier Tort-Martorell,2003,0,AI &amp; Society
10.1007/s00146-017-0700-0,Humans as relational selves,Nicole Dewandre,2019,1,AI &amp; SOCIETY
10.1007/s00146-011-0331-9,"Apostrophe, witnessing and its essentially theatrical modes of address: Maria Dermôut on Pattimura and Kara Walker on the New Orleans flooding",Frans-Willem Korsten,2012,0,AI &amp; SOCIETY
10.1007/s00146-021-01300-2,Digital wormholes,Elizabeth O’Neill,2021,0,AI &amp; SOCIETY
10.1007/s00146-003-0268-8,Technology for teams: the use of agent technology for self-organisation,Philippa Collins,2004,0,AI &amp; SOCIETY
10.1007/s00146-018-0856-2,Digital hermeneutics: from interpreting with machines to interpretational machines,Alberto Romele and Marta Severo and Paolo Furia,2020,13,AI &amp; SOCIETY
10.1007/s00146-007-0087-4,From Taylorism to competence-based production,Peter Brödner,2007,6,AI &amp; SOCIETY
10.1007/s00146-020-00965-5,AI in the headlines: the portrayal of the ethical issues of artificial intelligence in the media,Leila Ouchchy and Allen Coin and Veljko Dubljević,2020,41,AI &amp; SOCIETY
10.1007/s00146-013-0440-8,Detection of dental abnormalities using SVM and PSVM,M. Arulselvi and V. Ramalingam and S. Palanivel,2014,0,AI &amp; SOCIETY
10.1007/s00146-022-01448-5,Watch out! Cities as data engines,Fabio Duarte and Barbro Fröding,2022,0,AI &amp; SOCIETY
10.1007/s00146-004-0311-4,"David N. Snowden, Elizabeth F. Churchill and Emmanuel Frécon (eds): Inhabited information spaces: living with your data CSCW series",Richard Ennals,2005,0,AI &amp; SOCIETY
10.1007/s00146-009-0258-6,Using mixed methods to discover emergent patterns of local eDemocracy,Andy Williamson,2010,1,AI &amp; SOCIETY
10.1007/s00146-020-01068-x,"Computers do not think, they are oriented in thought",Attay Kremer,2021,0,AI &amp; SOCIETY
10.1007/s00146-021-01320-y,Blue collar with tie: a human-centered reformulation of the ironies of automation,Norman Meisinger,2022,0,AI &amp; SOCIETY
10.1007/s00146-009-0247-9,Multi-interfaces approach to situated knowledge management for complex instruments: first step toward industrial deployment,Loic Merckel and Toyoaki Nishida,2010,4,AI &amp; SOCIETY
10.1007/s00146-009-0263-9,"Participation, animation, design: a tripartite approach to urban community networking",Marcus Foth,2010,3,AI &amp; SOCIETY
10.1007/s00146-022-01520-0,Street pavement classification based on navigation through street view imagery,Rafael G. de Mesquita and Tsang I. Ren and Carlos A. B. Mello and Miguel L. P. C. Silva,2022,0,AI &amp; SOCIETY
10.1007/s00146-021-01315-9,Reflections on epistemological aspects of artificial intelligence during the COVID-19 pandemic,Angela A. R. de Sá and Jairo D. Carvalho and Eduardo L. M. Naves,2021,1,AI &amp; SOCIETY
10.1007/s00146-020-01061-4,"Causality, poetics, and grammatology: the role of computation in machine seeing",Iain Emsley,2021,0,AI &amp; SOCIETY
10.1007/s00146-012-0376-4,Older workers: a suitable case for circles?,Richard Ennals and Anne Inga Hilsen,2012,0,AI &amp; SOCIETY
10.1007/s00146-011-0343-5,What NMSAT says about sonification,Jerome Joy,2012,1,AI &amp; SOCIETY
10.1007/s00146-012-0405-3,The New Mind: thinking beyond the head,Riccardo Manzotti and Robert Pepperell,2013,5,AI &amp; SOCIETY
10.1007/s00146-021-01213-0,Socially robotic: making useless machines,Ceyda Yolgormez and Joseph Thibodeau,2022,2,AI &amp; SOCIETY
10.1007/s00146-018-0850-8,Should I kill or rather not?,Luis Moniz Pereira,2019,3,AI &amp; SOCIETY
10.1007/s00146-022-01512-0,"The imitation game, the “child machine,” and the fathers of AI",Teresa Heffernan,2022,0,AI &amp; SOCIETY
10.1007/s00146-015-0628-1,Legal regulations and public policies for next-generation robots in Japan,Tomoko Nambu,2016,6,AI &amp; SOCIETY
10.1007/s00146-012-0401-7,Society under threat… but not from AI,Ajit Narayanan,2013,3,AI &amp; SOCIETY
10.1007/s00146-013-0454-2,"The “New Mind” revisited, or minding the content/vehicle distinction: a response to Manzotti and Pepperell",Andreas Elpidorou,2013,0,AI &amp; SOCIETY
10.1007/s00146-011-0322-x,"Using bill boards as medium of communication, projection, and expression of African cultural values: the case of Ghanaian “sign boards”",Michael Baffoe and Lewis Asimeng-Boahene,2012,1,AI &amp; SOCIETY
10.1007/s00146-013-0447-1,An argumentation model of forensic evidence in fine art attribution,Douglas Walton,2013,1,AI &amp; SOCIETY
10.1007/s00146-011-0355-1,“Walk on the Sun”: an interactive image sonification exhibit,Marty Quinn,2012,1,AI &amp; SOCIETY
10.1007/s00146-021-01237-6,Correction to: On the hermeneutics of screen time,Jesper Aagaard and Emma Steninge and Yibin Zhang,2021,0,AI &amp; SOCIETY
10.1007/s00146-012-0384-4,Collaboration and collaborative advantage: a case of SQC concept promotion in Nepal,Dinesh P. Chapagain,2012,0,AI &amp; SOCIETY
10.1007/s00146-007-0125-2,System design of “Ba”-like stages for improvisational acts via Leibnizian space–time and Peirce’s existential graph concepts,Osamu Katai and Katsushi Minamizono and Takayuki Shiose and Hiroshi Kawakami,2007,6,AI &amp; SOCIETY
10.1007/s00146-020-01109-5,Recontextualising partisan outrage online: analysing the public negotiation of Trump support among American conservatives in 2016,Anthony Kelly,2020,1,AI &amp; SOCIETY
10.1007/s00146-013-0534-3,Effects of lying in practical Turing tests,Kevin Warwick and Huma Shah,2016,11,AI &amp; SOCIETY
10.1007/s00146-022-01540-w,The rise of machine learning in the academic social sciences,Charles Rahal and Mark Verhagen and David Kirk,2022,0,AI &amp; SOCIETY
10.1007/s00146-004-0301-6,S-Conart: an interaction method that facilitates concept articulation in shopping online,Hiroko Shoji and Koichi Hori,2005,8,AI &amp; SOCIETY
10.1007/s00146-020-01080-1,Machine invention systems: a (r)evolution of the invention process?,Dragos-Cristian Vasilescu and Michael Filzmoser,2021,2,AI &amp; SOCIETY
10.1007/s00146-022-01513-z,Using artificial intelligence to prevent crime: implications for due process and criminal justice,Kelly Blount,2022,0,AI &amp; SOCIETY
10.1007/s00146-022-01503-1,Everyday data cultures: beyond Big Critique and the technological sublime,Jean Burgess,2022,0,AI &amp; SOCIETY
10.1007/s00146-021-01174-4,Development and implementation processes of digitalization in engineer-to-order manufacturing: enablers and barriers,Sylvi Thun and Ottar Bakås and Tore Christian Bjørsvik Storholmen,2022,2,AI &amp; SOCIETY
10.1007/s00146-014-0545-8,"Brain–computer interfaces and dualism: a problem of brain, mind, and body",Joseph Lee,2016,6,AI &amp; SOCIETY
10.1007/s00146-007-0176-4,An exploratory study for analyzing interactional processes of group discussion: the case of a focus group interview,Kana Suzuki and Ikuyo Morimoto and Etsuo Mizukami and Hiroko Otsuka and Hitoshi Isahara,2009,3,AI &amp; SOCIETY
10.1007/bf01205451,"Paris R�seau, Paris network",Karen O'Rourke,2000,0,AI &amp; Society
10.1007/s00146-022-01420-3,Technological mediation and 3D visualizations in construction engineering practice,Hans Voordijk and Léon olde Scholtenhuis,2022,0,AI &amp; SOCIETY
10.1007/s00146-013-0479-6,Adopting a musical intelligence and e-Learning approach to improve the English language pronunciation of Chinese students,Luqi Wu and Michael McMahon,2014,0,AI &amp; SOCIETY
10.1007/bf01205511,The culture of the artificial,Massimo Negrotti,2000,0,AI &amp; Society
10.1007/s00146-022-01574-0,A machine learning approach to recognize bias and discrimination in job advertisements,Richard Frissen and Kolawole John Adebayo and Rohan Nanda,2022,0,AI &amp; SOCIETY
10.1007/s00146-022-01592-y,Characterizing the perception of urban spaces from visual analytics of street-level imagery,Frederico Freitas and Todd Berreth and Yi-Chun Chen and Arnav Jhala,2022,0,AI &amp; SOCIETY
10.1007/s00146-022-01610-z,Privacy preserving or trapping?,Xiao-yu Sun and Bin Ye,2022,0,AI &amp; SOCIETY
10.1007/s001460200028,"Multimedia Archiving of Technological Change in a Traditional Creative Industry: A Case Study of the Dhokra Artisans of Bankura, West Bengal",David Smith and Rajesh Kochhar,2002,1,AI &amp; SOCIETY
10.1007/s00146-003-0269-7,Action research?Scandinavian experiences,Lauge Baungaard Rasmussen,2004,14,AI &amp; Society
10.1007/s00146-017-0786-4,The change of signaling conventions in social networks,Roland Mühlenbernd,2019,1,AI &amp; SOCIETY
10.1007/s00146-020-00938-8,Digitally fabricated aesthetic enhancements and enrichments,Margarita Benitez and Markus Vogl,2021,1,AI &amp; SOCIETY
10.1007/s00146-018-0873-1,Artifictional intelligence: against humanity’s surrender to computers,Karamjit S. Gill,2019,2,AI &amp; SOCIETY
10.1007/s00146-009-0205-6,Wendell Wallach and Colin Allen: Moral machines: teaching robots right from wrong,Richard Ennals,2009,0,AI &amp; SOCIETY
10.1007/s00146-022-01485-0,Thinking about the mind-technology problem,Manh-Tung Ho,2022,0,AI &amp; SOCIETY
10.1007/s00146-022-01492-1,Anthropomorphization and beyond: conceptualizing humanwashing of AI-enabled machines,Gabriela Scorici and Mario D. Schultz and Peter Seele,2022,0,AI &amp; SOCIETY
10.1007/s00146-020-01103-x,In and out of Wonderland: a criti/chromatic stroll across postdigital culture,Stamatia Portanova,2021,0,AI &amp; SOCIETY
10.1007/s00146-007-0084-7,The meaning of silence,Richard Ennals,2007,1,AI &amp; SOCIETY
10.1007/s00146-009-0261-y,Nature and roles for community networks in the information society,Fiorella de Cindio and Laura Anna Ripamonti,2010,3,AI &amp; SOCIETY
10.1007/s00146-020-00969-1,A strategic health initiative: context for Coronavirus,Richard Ennals,2020,1,AI &amp; SOCIETY
10.1007/s00146-018-0857-1,Call for papers,,2018,0,AI &amp; SOCIETY
10.1007/s00146-003-0274-x,A changing society and problems of method: a politically committed research type,Vittorio Capecchi,2004,2,AI &amp; Society
10.1007/s00146-011-0317-7,Searle’s wager,Neil Levy,2011,3,AI &amp; SOCIETY
10.1007/s00146-017-0741-4,Nothing but a human,Francesco Garibaldo and Emilio Rebecchi,2018,0,AI &amp; SOCIETY
10.1007/s00146-017-0728-1,Economic language and economy change: with implications for cyber-physical systems,Alan Cottey,2018,5,AI &amp; SOCIETY
10.1007/s00146-006-0063-4,Knowledge community: integrating ICT into social development in developing economies,Keyoor Purani and Satish Nair,2007,8,AI &amp; SOCIETY
10.1007/bf01205518,A comparison between Maya hieroglyphs and computer icons,Paul Honeywill,2000,2,AI &amp; Society
10.1007/s00146-013-0496-5,Embodied cognition and the Orwell’s problem in cognitive science,V. Hari Narayanan,2015,1,AI &amp; SOCIETY
10.1007/s00146-015-0603-x,The European Union’s contributions to international stability: the role of education and study mobilities,Amy Stapleton and Mihaela Mecea and Lulzim Beqiri,2016,2,AI &amp; SOCIETY
10.1007/s00146-017-0737-0,A glance of cultural differences in the case of interactive device art installation idMirror,Maša Jazbec and Floris Erich Arden and Hiroo Iwata,2018,0,AI &amp; SOCIETY
10.1007/s00146-016-0681-4,S. P. Gill: Tacit engagement: beyond interaction,Kathleen Richardson,2019,1,AI &amp; SOCIETY
10.1007/s00146-022-01450-x,"Artificial intelligence in local governments: perceptions of city managers on prospects, constraints and choices",Tan Yigitcanlar and Duzgun Agdas and Kenan Degirmenci,2022,3,AI &amp; SOCIETY
10.1007/s00146-010-0274-6,Distributed cognition at the crime scene,Chris Baber,2010,10,AI &amp; SOCIETY
10.1007/s00146-015-0589-4,Beyond the age of innocence,Richard Ennals,2016,0,AI &amp; SOCIETY
10.1007/s00146-007-0165-7,Orchestration of network instruments: a way to de-emphasize the partition between incremental change and innovation?,Trond Haga,2009,6,AI &amp; SOCIETY
10.1007/s00146-007-0116-3,AI Bridges and Dreams,Alan Bundy,2007,0,AI &amp; SOCIETY
10.1007/s00146-007-0109-2,Artificial Intelligence: Cannibal or Missionary?,Margaret Boden,2007,0,AI &amp; SOCIETY
10.1007/s00146-007-0174-6,Software quality and group performance,Yuk Kuen Wong,2009,0,AI &amp; SOCIETY
10.1007/s00146-015-0634-3,From an engineers point of view: response to “Social interaction with robots—three questions”. In Gesa Lindemann (this volume),Atsuo Takanishi,2016,1,AI &amp; SOCIETY
10.1007/s00146-020-01045-4,Forbidden knowledge in machine learning reflections on the limits of research and publication,Thilo Hagendorff,2021,3,AI &amp; SOCIETY
10.1007/s00146-016-0656-5,Comparative foundations of Eastern and Western thought,Daniel Memmi,2017,1,AI &amp; SOCIETY
10.1007/s00146-015-0584-9,Erratum to: Culture of sedimentation in the human–technology interaction,Arun Kumar Tripathi,2016,1,AI &amp; SOCIETY
10.1007/s001460200029,"A Taxi Ride to Late Capitalism: Hypercapitalism, Imagination and Artificial Intelligence",Michael Punt,2002,1,AI &amp; SOCIETY
10.1007/s00146-017-0731-6,“Super-intelligent” machine: technological exuberance or the road to subjection,Peter Brödner,2018,8,AI &amp; SOCIETY
10.1007/s00146-010-0293-3,Machinic articulations: experiments in non-verbal explanation,Harry Smoak,2011,0,AI &amp; SOCIETY
10.1007/s00146-015-0607-6,Albert Borgmann: Real American ethics: taking responsibility for our country,Paul T. Durbin,2017,0,AI &amp; SOCIETY
10.1007/s00146-007-0090-9,Ethical robots: the future can heed us,Selmer Bringsjord,2008,27,AI &amp; SOCIETY
10.1007/s00146-021-01214-z,Can communication with social robots influence how children develop empathy? Best-evidence synthesis,Ekaterina Pashevich,2022,8,AI &amp; SOCIETY
10.1007/s00146-022-01596-8,Artificial intelligence in support of the circular economy: ethical considerations and a path forward,Huw Roberts and Joyce Zhang and Ben Bariach and Josh Cowls and Ben Gilburt and Prathm Juneja and Andreas Tsamados and Marta Ziosi and Mariarosaria Taddeo and Luciano Floridi,2022,0,AI &amp; SOCIETY
10.1007/s00146-022-01603-y,Street surface condition of wealthy and poor neighborhoods: the case of Los Angeles,Pooyan Doozandeh and Limeng Cui and Rui Yu,2022,0,AI &amp; SOCIETY
10.1007/s00146-017-0747-y,Rat running the G20: collective intelligence for navigating the disrupted city,Carlos Estrada-Grajales and Peta Mitchell and Marcus Foth and Christine Satchell,2018,1,AI &amp; SOCIETY
10.1007/s00146-021-01226-9,"Pasquale, Frank. New Laws of Robotics: Defending Human Expertise in the Age of AI. Cambridge, Massachusetts: The Belknap Press of Harvard University Press, 2020",Daryl Li,2021,0,AI &amp; SOCIETY
10.1007/bf01208710,Book reviews,Richard Ennals,2001,0,AI &amp; Society
10.1007/s00146-018-0815-y,Environmental monitoring using a robotized wireless sensor network,Sevil A. Ahmed and Vasil L. Popov and Andon V. Topalov and Nikola G. Shakev,2018,4,AI &amp; SOCIETY
10.1007/s00146-017-0744-1,Community Digital Storytelling for Collective Intelligence: towards a Storytelling Cycle of Trust,Sarah Copeland and Aldo de Moor,2018,11,AI &amp; SOCIETY
10.1007/s00146-017-0739-y,A classification of cultural engagements in community technology design: introducing a transcultural approach,Heike Winschiers-Theophilus and Tariq Zaman and Colin Stanley,2019,26,AI &amp; SOCIETY
10.1007/s00146-021-01206-z,A critique of robotics in health care,Arne Maibaum and Andreas Bischof and Jannis Hergesell and Benjamin Lipp,2022,17,AI &amp; SOCIETY
10.1007/s00146-017-0689-4,How to study public imagination of autonomous systems: the case of the Helsinki automated metro,Mikael Wahlström,2017,1,AI &amp; SOCIETY
10.1007/bf01206112,Three steps to ethnography: A discussion of interdisciplinary contributions,Duska Rosenberg,2001,0,AI &amp; Society
10.1007/s00146-003-0259-9,Intelligent advertising,Richard Adams,2004,17,AI &amp; Society
10.1007/s00146-020-01108-6,Labor for community on Facebook,Madeline Smith-Johnson,2020,2,AI &amp; SOCIETY
10.1007/s00146-008-0182-1,Empowering the users? A critical textual analysis of the role of users in open source software development,Netta Iivari,2009,12,AI &amp; SOCIETY
10.1007/s00146-017-0704-9,"Reflections on networks, human behaviour, and social dynamics in the digital age",Theodore Tsekeris and Charalambos Tsekeris and Ioannis Katerelos,2018,1,AI &amp; SOCIETY
10.1007/s00146-017-0715-6,"Cyberculture, symbiosis, and syncretism",Luís Moniz Pereira,2018,1,AI &amp; SOCIETY
10.1007/s00146-021-01341-7,Cybernetics and systems art in Latin America: the art and communication center (CAyC) and its pioneering art and technology network,José-Carlos Mariátegui,2022,0,AI &amp; SOCIETY
10.1007/s00146-021-01342-6,Waldemar Cordeiro and Arteônica: rewritings of digital art in Brazil and Latin America,Priscila Almeida Cunha Arantes,2022,0,AI &amp; SOCIETY
10.1007/s00146-021-01355-1,Conjectural artworks: seeing at and beyond Maturana and Varela’s visual thinking on life and cognition,Sergio Rodríguez Gómez,2022,0,AI &amp; SOCIETY
10.1007/s00146-021-01364-0,Managing and accessing web archives: Irish practitioners’ perspectives,Maria Ryan and Della Keating and Joanna Finegan,2022,0,AI &amp; SOCIETY
10.1007/s00146-021-01344-4,Cybernetics in Chile: a history with unexpected chapters,Juan-Carlos Letelier,2022,0,AI &amp; SOCIETY
10.1007/s00146-021-01323-9,Artificial intelligence ELSI score for science and technology: a comparison between Japan and the US,Tilman Hartwig and Yuko Ikkatai and Naohiro Takanashi and Hiromi M. Yokoyama,2022,1,AI &amp; SOCIETY
10.1007/s00146-007-0112-7,Engineering As An Art,HH Rosenbrock,2007,0,AI &amp; SOCIETY
10.1007/s00146-013-0452-4,Spoken query based word spotting in digitized Tamil documents,AN. Sigappi and S. Palanivel,2014,0,AI &amp; SOCIETY
10.1007/s00146-013-0455-1,Denying the content–vehicle distinction: a response to ‘The New Mind Revisited’,Riccardo Manzotti and Robert Pepperell,2013,1,AI &amp; SOCIETY
10.1007/s00146-011-0364-0,Governing industrial organizations through cognitive machines,Farley Simon Nobre,2012,1,AI &amp; SOCIETY
10.1007/s00146-009-0229-y,Kaj Elgstrand and Nils F. Petersson (editors): OSH for development,Richard Ennals,2010,0,AI &amp; SOCIETY
10.1007/s00146-009-0222-5,Deflating the overblown accounts of technology: a review of Don Ihde’s Ironic Technics,Robert Rosenberger,2010,3,AI &amp; SOCIETY
10.1007/s00146-017-0755-y,Uncommon voices of AI,Karamjit S. Gill,2017,6,AI &amp; SOCIETY
10.1007/s00146-017-0698-3,"E. M. Forster’s ‘The Machine Stops’: humans, technology and dialogue",Ana Cristina Zimmermann and W. John Morgan,2019,2,AI &amp; SOCIETY
10.1007/s00146-012-0423-1,Erratum to: Toward a comparative theory of agents,Rafael Capurro,2012,0,AI &amp; SOCIETY
10.1007/s00146-007-0119-0,Experiment in social intelligence design,Jeanne Cornillon and Duska Rosenberg,2007,1,AI &amp; SOCIETY
10.1007/s00146-022-01516-w,Algorithmic biases: caring about teens’ neurorights,José M. Muñoz and José Ángel Marinaro,2022,1,AI &amp; SOCIETY
10.1007/s00146-021-01370-2,Jumping into the artistic deep end: building the catalogue raisonné,Todd Dobbs and Aileen Benedict and Zbigniew Ras,2022,2,AI &amp; SOCIETY
10.1007/s00146-012-0407-1,Turing’s man: a dialogue,Helena Granström and Bo Göranzon,2013,0,AI &amp; SOCIETY
10.1007/s00146-013-0506-7,Strategic interventions to enhance competitiveness: a case of Surat zari industry in India,Renuka Garg and Manish Sidhpuria,2015,2,AI &amp; SOCIETY
10.1007/s00146-017-0769-5,"“Brexit for Beginners”, or “The Young Gentlemen of Etona”",Richard Ennals,2018,0,AI &amp; SOCIETY
10.1007/s00146-012-0388-0,So who am I really? Personal identity in the age of the Internet,Albert Borgmann,2013,4,AI &amp; SOCIETY
10.1007/s00146-009-0241-2,Steven Talbott: Devices of the soul: battling for ourselves in an age of machines,Albert Borgmann,2010,0,AI &amp; SOCIETY
10.1007/s00146-018-0849-1,Vulnerability under the gaze of robots: relations among humans and robots,Nicola Liberati and Shoji Nagataki,2019,6,AI &amp; SOCIETY
10.1007/s00146-022-01621-w,Developing a digital platform for community-led initiatives: from local agents′ needs to interface design,Oksana Tymoshchuk and Maria João Antunes and Ana Margarida Almeida and Paula Alexandra Silva and Luís Pedro and Fernando Ramos,2023,0,AI &amp; SOCIETY
10.1007/s00146-013-0492-9,"Social Presence and the void in distant relationships: How do people use communication technologies to turn absence into fondness of the heart, rather than drifting out of mind?",Daniel Gooch and Leon Watts,2014,8,AI &amp; SOCIETY
10.1007/s00146-007-0166-6,Virtual Links: intergenerational learning and experience sharing across age divides and distances,Anne Inga Hilsen and Richard Ennals,2009,8,AI &amp; SOCIETY
10.1007/s00146-013-0517-4,‘It is a beautiful experiment’: queer(y)ing the work of Alan Turing,G. S. Voss,2013,1,AI &amp; SOCIETY
10.1007/s00146-018-0818-8,Exploratory analysis of Sony AIBO users,Csaba Kertész and Markku Turunen,2019,7,AI &amp; SOCIETY
10.1007/s00146-020-01131-7,Utilizing Facebook for professional integration of three ethnic groups in Israel,Maayan Zhitomirsky-Geffet and Avraham Weic,2021,0,AI &amp; SOCIETY
10.1007/s00146-016-0644-9,Construction of national identity through a social network: a case study of ethnic networks of immigrants to Russia from Central Asia,Andrey P. Glukhov,2017,8,AI &amp; SOCIETY
10.1007/s00146-005-0026-1,"The Electronic Schoolbag, a CSCW workspace: presentation and evaluation",G. Chabert and J. Ch. Marty and B. Caron and T. Carron and L. Vignollet and C. Ferraris,2006,12,AI &amp; SOCIETY
10.1007/s00146-018-0800-5,"Hubert Dreyfus, the artificial and the perspective of a doubled philosophy",Massimo Negrotti,2019,0,AI &amp; SOCIETY
10.1007/s00146-022-01583-z,Human–computer interaction tools with gameful design for critical thinking the media ecosystem: a classification framework,Elena Musi and Lorenzo Federico and Gianni Riotta,2022,0,AI &amp; SOCIETY
10.1007/s00146-020-01139-z,"Technoevidence: the ""Turing limit"" 2020",John McClellan Marshall,2021,0,AI &amp; SOCIETY
10.1007/s00146-010-0273-7,Judgement aggregation and distributed thinking,Kai Spiekermann,2010,1,AI &amp; SOCIETY
10.1007/s00146-007-0095-4,Special issue on ethics and artificial agents,Steve Torrance,2008,2,AI &amp; SOCIETY
10.1007/s00146-020-00962-8,Self-building technologies,François Kammerer,2020,1,AI &amp; SOCIETY
10.1007/s00146-006-0073-2,Mind the gap: technology as soma,Stephen Thompson,2007,2,AI &amp; SOCIETY
10.1007/s00146-020-01046-3,Machine and person: reconstructing Harry Collins’s categories,Walter B. Gulick,2020,1,AI &amp; SOCIETY
10.1007/s00146-016-0668-1,Technological change,Mike Cooley,2017,0,AI &amp; SOCIETY
10.1007/s00146-015-0640-5,Engineering sustainable mHealth: the role of Action Research,Ulf Gerhardt and Rüdiger Breitschwerdt and Oliver Thomas,2017,1,AI &amp; SOCIETY
10.1007/s00146-022-01481-4,Responsibility of AI Systems,Mehdi Dastani and Vahid Yazdanpanah,2022,2,AI &amp; SOCIETY
10.1007/s00146-006-0032-y,AI &amp; Society Vol. 20.4,Victoria Vesna,2006,0,AI &amp; SOCIETY
10.1007/s00146-022-01408-z,Book review: Luca Possati (2021): “The algorithmic unconscious: how psychoanalysis helps in understanding AI” (Routledge),Marc Cheong,2022,0,AI &amp; SOCIETY
10.1007/s00146-018-0827-7,Introduction to The Last Dream by Joseph Weizenbaum,Bo Göranzon,2019,1,AI &amp; SOCIETY
10.1007/s00146-009-0223-4,Shihan de Silva Jayasuriya: African identity in Asia: cultural effects of forced migration,Richard Ennals,2009,0,AI &amp; SOCIETY
10.1007/s00146-013-0521-8,Digitally Mediated World,Karamjit S. Gill,2014,0,AI &amp; SOCIETY
10.1007/s00146-012-0383-5,Higher education in a state of crisis: a perspective from a Students’ Quality Circle,Rebekah Nahai and Sophie Österberg,2012,1,AI &amp; SOCIETY
10.1007/s00146-010-0308-0,Symbiotic technology for creating social innovation 30 years in the future,Shinichi Doi and Keiji Yamada,2011,4,AI &amp; SOCIETY
10.1007/s00146-017-0707-6,Marx’s concept of distributive justice: an exercise in the formal modeling of political principles,Antônio Carlos da Rocha Costa,2018,0,AI &amp; SOCIETY
10.1007/s00146-020-01136-2,There is no “I” in “AI”,Ashkan Farhadi,2021,0,AI &amp; SOCIETY
10.1007/s00146-005-0007-4,The call of the other 0.1%: genetic aesthetics and the new Moreaus,Susan McHugh,2006,2,AI &amp; SOCIETY
10.1007/bf01205520,The creative landscapes column: Metacognition,Bob Muller,2000,1,AI &amp; Society
10.1007/s00146-021-01235-8,Algorithmic abstractions of ‘fashion identity’ and the role of privacy with regard to algorithmic personalisation systems in the fashion domain,Daria Onitiu,2022,0,AI &amp; SOCIETY
10.1007/s00146-022-01582-0,Machine learning: can the automatic pilot transcend the toxic fog?,Karamjit S. Gill,2022,0,AI &amp; SOCIETY
10.1007/s00146-022-01414-1,"AI ethics inflation, Delphi and the restart of theory",Peter Seele,2022,0,AI &amp; SOCIETY
10.1007/s00146-014-0565-4,Information technology as social phenomenon,Daniel Memmi,2015,2,AI &amp; SOCIETY
10.1007/pl00022690,Creating Connectedness: The Role of Social Research in Innovation Policy,Bjo¨rn Gustavsen and Håkon Finne and Bo Oscarsson,2002,0,AI &amp; SOCIETY
10.1007/pl00022687,The Creative Landscapes Column: Epidemic,Bob Muller,2002,0,AI &amp; SOCIETY
10.1007/pl00022696,Entrepreneurial Innovations in Gujarat,Dhawal Mehta and Bhalchandra Joshi,2002,0,AI &amp; SOCIETY
10.1007/pl00022692,A Literature of Working Life,R. Ennals,2002,0,AI &amp; SOCIETY
10.1007/s00146-022-01421-2,Legal and ethical aspects of deploying artificial intelligence in climate-smart agriculture,Mahatab Uddin and Ataharul Chowdhury and Muhammad Ashad Kabir,2022,0,AI &amp; SOCIETY
10.1007/s00146-021-01276-z,Corporate responsibility for the termination of digital friends,Nick Munn and Dan Weijers,2022,2,AI &amp; SOCIETY
10.1007/s00146-007-0158-6,Scientific models and ethical issues in hybrid bionic systems research,Pericle Salvini and Edoardo Datteri and Cecilia Laschi and Paolo Dario,2008,6,AI &amp; SOCIETY
