DOI,Título,Autores,Año,Citas,Revista
10.3390/a15020061,"Finding Hamiltonian and Longest (s,t)-Paths of C-Shaped Supergrid Graphs in Linear Time",Fatemeh Keshavarz-Kohjerdi and Ruo-Wei Hung,2022,0,Algorithms
10.3390/a4040262,The Smallest Grammar Problem as Constituents Choice and Minimal Grammar Parsing,Rafael Carrascosa and François Coste and Matthias Gallé and Gabriel Infante-Lopez,2011,7,Algorithms
10.3390/a11090131,An efficient algorithm to determine probabilistic bisimulation,J.F. Groote and H.J. Rivera Verduzco and E.P. de Vink,2018,7,Algorithms
10.3390/a11050077,A Novel Design of Sparse Prototype Filter for Nearly Perfect Reconstruction Cosine-Modulated Filter Banks,Wei Xu and Yi Li and Jinghong Miao and Jiaxiang Zhao and Xin Gao,2018,3,Algorithms
10.3390/a13090237,A Simheuristic Algorithm for Solving the Stochastic Omnichannel Vehicle Routing Problem with Pick-up and Delivery,Leandro do C. Martins and Christopher Bayliss and Pedro J. Copado-Méndez and Javier Panadero and Angel A. Juan,2020,4,Algorithms
10.3390/a16010053,Investigating Novice Developers’ Code Commenting Trends Using Machine Learning Techniques,Tahira Niazi and Teerath Das and Ghufran Ahmed and Syed Muhammad Waqas and Sumra Khan and Suleman Khan and Ahmed Abdelaziz Abdelatif and Shaukat Wasi,2023,0,Algorithms
10.3390/a12120257,A General Integrated Method for Design Analysis and Optimization of Missile Structure,Xiaoguang Wang and Jun Yang and Jian Guo and Jun Guo,2019,1,Algorithms
10.3390/a6040618,Multi-Threading a State-of-the-Art Maximum Clique Algorithm,Ciaran McCreesh and Patrick Prosser,2013,24,Algorithms
10.3390/a5030364,Incremental Clustering of News Reports,Joel Azzopardi and Christopher Staff,2012,19,Algorithms
10.3390/a14050155,Energy-Efficient Power Allocation in Non-Linear Energy Harvesting Multiple Relay Systems,Huifang Pan and Qi Zhu,2021,1,Algorithms
10.3390/a8041035,Natalie 2.0: Sparse Global Network Alignment as a Special Case of Quadratic Assignment,Mohammed El-Kebir and Jaap Heringa and Gunnar Klau,2015,17,Algorithms
10.3390/a15100371,Topological Data Analysis in Time Series: Temporal Filtration and Application to Single-Cell Genomics,Baihan Lin,2022,1,Algorithms
10.3390/a2010582,Recent Advances in the Computational Discovery of Transcription Factor Binding Sites,Tung Nguyen and Ioannis Androulakis,2009,16,Algorithms
10.3390/a2031008,Automated Modelling of Evolving Discontinuities,Mehdi Nikbakht and Garth Wells,2009,4,Algorithms
10.3390/a13120312,Monitoring Blockchain Cryptocurrency Transactions to Improve the Trustworthiness of the Fourth Industrial Revolution (Industry 4.0),Kamyar Sabri-Laghaie and Saeid Jafarzadeh Ghoushchi and Fatemeh Elhambakhsh and Abbas Mardani,2020,6,Algorithms
10.3390/a11050061,Relaxed Data Types as Consistency Conditions †,Edward Talmage and Jennifer Welch,2018,2,Algorithms
10.3390/a14050147,Machine Learning Predicts Outcomes of Phase III Clinical Trials for Prostate Cancer,Felix D. Beacher and Lilianne R. Mujica-Parodi and Shreyash Gupta and Leonardo A. Ancora,2021,5,Algorithms
10.3390/a13010011,A Numerical Approach for the Filtered Generalized Čech Complex,Jesús F. Espinoza and Rosalía Hernández-Amador and Héctor A. Hernández-Hernández and Beatriz Ramonetti-Valencia,2020,3,Algorithms
10.3390/a16020089,Rapid Guessing in Low-Stakes Assessments: Finding the Optimal Response Time Threshold with Random Search and Genetic Algorithm,Okan Bulut and Guher Gorgun and Tarid Wongvorachan and Bin Tan,2023,0,Algorithms
10.3390/a15060217,An Online Algorithm for Routing an Unmanned Aerial Vehicle for Road Network Exploration Operations after Disasters under Different Refueling Strategies,Lorena Reyes-Rubiano and Jana Voegl and Patrick Hirsch,2022,0,Algorithms
10.3390/a14020030,A Novel Reduction Circuit Based on Binary Tree Path Partition on FPGAs,Linhuai Tang and Zhihong Huang and Gang Cai and Yong Zheng and Jiamin Chen,2021,0,Algorithms
10.3390/a2041503,Image Similarity to Improve the Classification of Breast Cancer Images,Dave Tahmoush,2009,2,Algorithms
10.3390/a13070160,Text Semantic Annotation: A Distributed Methodology Based on Community Coherence,Christos Makris and Georgios Pispirigos and Michael Angelos Simos,2020,1,Algorithms
10.3390/a3020125,Recognition of Pulmonary Nodules in Thoracic CT Scans Using 3-D Deformable Object Models of Different Classes,Hotaka Takizawa and Shinji Yamamoto and Tsuyoshi Shiina,2010,4,Algorithms
10.3390/a14020057,Smart Black Box 2.0: Efficient High-Bandwidth Driving Data Collection Based on Video Anomalies,Ryan Feng and Yu Yao and Ella Atkins,2021,0,Algorithms
10.3390/a14040115,Dynamic Initial Weight Assignment for MaxSAT,Abdelraouf Ishtaiwi and Qasem Abu Al-Haija,2021,0,Algorithms
10.3390/a14010027,A Memetic Algorithm for an External Depot Production Routing Problem,Bi Kouaï Bertin Kayé and Moustapha Diaby and Moussa Koivogui and Souleymane Oumtanaga,2021,0,Algorithms
10.3390/a12060121,Learning Output Reference Model Tracking for Higher-Order Nonlinear Systems with Unknown Dynamics,Mircea-Bogdan Radac and Timotei Lala,2019,7,Algorithms
10.3390/a1020100,Mathematical Programming in Computational Biology: an Annotated Bibliography,Giuseppe Lancia,2008,8,Algorithms
10.3390/a13030063,On a Hybridization of Deep Learning and Rough Set Based Granular Computing,Krzysztof Ropiak and Piotr Artiemjew,2020,5,Algorithms
10.3390/a8010003,Networked Control System Time-Delay Compensation Based on Time-Delay Prediction and Improved Implicit GPC,Zhong-Da Tian and Shu-Jiang Li and Yan-Hong Wang and Hong-Xia Yu,2015,16,Algorithms
10.3390/a14050132,Classification of Precursor MicroRNAs from Different Species Based on K-mer Distance Features,Malik Yousef and Jens Allmer,2021,0,Algorithms
10.3390/a12030057,"Parameter Estimation, Robust Controller Design and Performance Analysis for an Electric Power Steering System",Van Nguyen and Xuexun Guo and Chengcai Zhang and Xuan Tran,2019,4,Algorithms
10.3390/a14030071,On Computational Hardness of Multidimensional Subtraction Games,Vladimir Gurvich and Mikhail Vyalyi,2021,0,Algorithms
10.3390/a13060135,A Recursive Least-Squares Algorithm for the Identification of Trilinear Forms,Camelia Elisei-Iliescu and Laura-Maria Dogariu and Constantin Paleologu and Jacob Benesty and Andrei-Alexandru Enescu and Silviu Ciochină,2020,11,Algorithms
10.3390/a13110289,Algorithm for Mapping Kidney Tissue Water Content during Normothermic Machine Perfusion Using Hyperspectral Imaging,Wenke Markgraf and Jannis Lilienthal and Philipp Feistel and Christine Thiele and Hagen Malberg,2020,5,Algorithms
10.3390/a15120474,Pose-Based Gait Analysis for Diagnosis of Parkinson’s Disease,Tee Connie and Timilehin B. Aderinola and Thian Song Ong and Michael Kah Ong Goh and Bayu Erfianto and Bedy Purnama,2022,0,Algorithms
10.3390/a14050154,Accelerating In-Transit Co-Processing for Scientific Simulations Using Region-Based Data-Driven Analysis,Marcus Walldén and Masao Okita and Fumihiko Ino and Dimitris Drikakis and Ioannis Kokkinakis,2021,0,Algorithms
10.3390/a13040092,Deterministic Coresets for k-Means of Big Sparse Data,Artem Barger and Dan Feldman,2020,3,Algorithms
10.3390/a2010183,The Autonomous Stress Indicator for Remotely Monitoring Power System State and Watching for Potential Instability,Donald McGillis and Reginald Brearley and Khalil El Arroudi and Geza Joos,2009,0,Algorithms
10.3390/a11120190,Best Trade-Off Point Method for Efficient Resource Provisioning in Spark,Peter Nghiem,2018,0,Algorithms
10.3390/a15110396,Periodic and Non-Periodic Brainwaves Emerging via Stochastic Syncronization of Closed Loops of Firing Neurons,Piero Mazzetti and Anna Carbone,2022,0,Algorithms
10.3390/a15100375,Blocking Cyclic Job-Shop Scheduling Problems,Atabak Elmi and Dhananjay R. Thiruvady and Andreas T. Ernst,2022,0,Algorithms
10.3390/a7040608,High-Order Entropy Compressed Bit Vectors with Rank/Select,Kai Beskers and Johannes Fischer,2014,6,Algorithms
10.3390/a15110399,Design of HIFU Treatment Plans Using Thermodynamic Equilibrium Algorithm,Salman Lari and Sang Wook Han and Jong Uk Kim and Hyock Ju Kwon,2022,0,Algorithms
10.3390/a6010084,Dubins Traveling Salesman Problem with Neighborhoods: A Graph-Based Approach,Jason Isaacs and João Hespanha,2013,40,Algorithms
10.3390/a15050166,Efficient Machine Learning Models for Early Stage Detection of Autism Spectrum Disorder,Mousumi Bala and Mohammad Hanif Ali and Md. Shahriare Satu and Khondokar Fida Hasan and Mohammad Ali Moni,2022,2,Algorithms
10.3390/a13120318,Deep Feature Learning with Manifold Embedding for Robust Image Retrieval,Xin Chen and Ying Li,2020,2,Algorithms
10.3390/a12050106,An Introduction of NoSQL Databases Based on Their Categories and Application Industries,Jeang-Kuo Chen and Wei-Zhe Lee,2019,19,Algorithms
10.3390/a16020104,Quadratic Multilinear Discriminant Analysis for Tensorial Data Classification,Cristian Minoccheri and Olivia Alge and Jonathan Gryak and Kayvan Najarian and Harm Derksen,2023,0,Algorithms
10.3390/a11110180,Iterative Identification for Multivariable Systems with Time-Delays Based on Basis Pursuit De-Noising and Auxiliary Model,Junyao You and Yanjun Liu,2018,4,Algorithms
10.3390/a11020014,An Optimal Online Resource Allocation Algorithm for Energy Harvesting Body Area Networks,Guangyuan Wu and Zhigang Chen and Lin Guo and Jia Wu,2018,2,Algorithms
10.3390/a2041281,An Adaptive h-Refinement Algorithm for Local Damage Models,Jonathan Pitt and Francesco Costanzo,2009,1,Algorithms
10.3390/a2020764,"SDPhound, a Mutual Information-Based Method to Investigate Specificity-Determining Positions",Sara Bonella and Walter Rocchia and Pietro Amat and Riccardo Nifosí and Valentina Tozzini,2009,2,Algorithms
10.3390/a13110288,"Application of Bayesian Hierarchical Negative Binomial Finite Mixture Model for Cost-Benefit Analysis of Barriers Optimization, Accounting for Severe Heterogeneity",Mahdi Rezapour and Khaled Ksaibati,2020,2,Algorithms
10.3390/a8030514,On the Accessibility of Newton’s Method under a Hölder Condition on the First Derivative,José Ezquerro and Miguel Hernández-Verón,2015,3,Algorithms
10.3390/a9040074,An Optimization Algorithm for the Design of an Irregularly-Shaped Bridge Based on the Orthogonal Test and Analytic Hierarchy Process,Hanbing Liu and Xin He and Xianqiang Wang and Yubo Jiao and Gang Song,2016,1,Algorithms
10.3390/a12110238,Microscopic Object Recognition and Localization Based on Multi-Feature Fusion for In-Situ Measurement In Vivo,Shi-Xian Yan and Peng-Fei Zhao and Xin-Yu Gao and Qiao Zhou and Jin-Hai Li and Jie-Peng Yao and Zhi-Qiang Chai and Yang Yue and Zhong-Yi Wang and Lan Huang,2019,1,Algorithms
10.3390/a14030088,Union and Intersection Operators for Thick Ellipsoid State Enclosures: Application to Bounded-Error Discrete-Time State Observer Design,Andreas Rauh and Auguste Bourgois and Luc Jaulin,2021,7,Algorithms
10.3390/a15080285,Fast Conflict Detection for Multi-Dimensional Packet Filters,Chun-Liang Lee and Guan-Yu Lin and Yaw-Chung Chen,2022,0,Algorithms
10.3390/a12120256,Parameterized Algorithms in Bioinformatics: An Overview,Laurent Bulteau and Mathias Weller,2019,7,Algorithms
10.3390/a7030295,Solving the Examination Timetabling Problem in GPUs,Vasileios Kolonias and George Goulas and Christos Gogos and Panayiotis Alefragis and Efthymios Housos,2014,2,Algorithms
10.3390/a13030058,Kalman Filter-Based Online Identification of the Electric Power Characteristic of Solid Oxide Fuel Cells Aiming at Maximum Power Point Tracking,Andreas Rauh and Wiebke Frenkel and Julia Kersten,2020,9,Algorithms
10.3390/a15100343,Reasoning about Confidence in Goal Satisfaction,Malak Baslyman and Daniel Amyot and John Mylopoulos,2022,0,Algorithms
10.3390/a15090332,Tree-Based Classifier Ensembles for PE Malware Analysis: A Performance Revisit,Maya Hilda Lestari Louk and Bayu Adhi Tama,2022,1,Algorithms
10.3390/a1020130,Machine Learning: A Crucial Tool for Sensor Design,Weixiang Zhao and Abhinav Bhushan and Anthony Santamaria and Melinda Simon and Cristina Davis,2008,32,Algorithms
10.3390/a12090178,Adaptive-Size Dictionary Learning Using Information Theoretic Criteria,Bogdan Dumitrescu and Ciprian Doru Giurcăneanu,2019,4,Algorithms
10.3390/a15050159,SentenceLDA- and ConNetClus-Based Heterogeneous Academic Network Analysis for Publication Ranking,Jinsong Zhang and Bao Jin and Junyi Sha and Yan Chen and Yijin Zhang,2022,0,Algorithms
10.3390/a14110324,Feature Selection for High-Dimensional Datasets through a Novel Artificial Bee Colony Framework,Yuanzi Zhang and Jing Wang and Xiaolin Li and Shiguo Huang and Xiuli Wang,2021,2,Algorithms
10.3390/a15070254,LTU Attacker for Membership Inference,Joseph Pedersen and Rafael Muñoz-Gómez and Jiangnan Huang and Haozhe Sun and Wei-Wei Tu and Isabelle Guyon,2022,0,Algorithms
10.3390/a11060087,Special Issue on Algorithms for Scheduling Problems,Frank Werner and Larysa Burtseva and Yuri Sotskov,2018,2,Algorithms
10.3390/a15020043,Clustering with Nature-Inspired Algorithm Based on Territorial Behavior of Predatory Animals,Maciej Trzciński and Piotr A. Kowalski and Szymon Łukasik,2022,0,Algorithms
10.3390/a10010003,A Pilot-Pattern Based Algorithm for MIMO-OFDM Channel Estimation,Guomin Li and Guisheng Liao,2016,5,Algorithms
10.3390/a13120341,"Design Limitations, Errors and Hazards in Creating Decision Support Platforms with Large- and Very Large-Scale Data and Program Cores",Elias Koukoutsis and Constantin Papaodysseus and George Tsavdaridis and Nikolaos V. Karadimas and Athanasios Ballis and Eirini Mamatsi and Athanasios Rafail Mamatsis,2020,0,Algorithms
10.3390/a15050140,Real-Time Big Data Architecture for Processing Cryptocurrency and Social Media Data: A Clustering Approach Based on k-Means,Adrian Barradas and Acela Tejeda-Gil and Rosa-María Cantón-Croda,2022,0,Algorithms
10.3390/a14100286,Enhanced Hyper-Cube Framework Ant Colony Optimization for Combinatorial Optimization Problems,Ali Ahmid and Thien-My Dao and Ngan Van Le,2021,1,Algorithms
10.3390/a15090307,Traffic Demand Estimations Considering Route Trajectory Reconstruction in Congested Networks,Wenyun Tang and Jiahui Chen and Chao Sun and Hanbing Wang and Gen Li,2022,0,Algorithms
10.3390/a16020075,Intrusion Detection for Electric Vehicle Charging Systems (EVCS),Mohamed ElKashlan and Heba Aslan and Mahmoud Said Elsayed and Anca D. Jurcut and Marianne A. Azer,2023,0,Algorithms
10.3390/a14030070,EXPTIME Hardness of an n by n Custodian Capture Game,Fumitaka Ito and Masahiko Naito and Naoyuki Katabami and Tatsuie Tsukiji,2021,0,Algorithms
10.3390/a11100152,Accelerated Iterative Learning Control of Speed Ripple Suppression for a Seeker Servo Motor,Dongqi Ma and Hui Lin,2018,1,Algorithms
10.3390/a11090136,Mixed Order Fractional Observers for Minimal Realizations of Linear Time-Invariant Systems,Manuel Duarte-Mermoud and Javier Gallegos and Norelys Aguila-Camacho and Rafael Castro-Linares,2018,0,Algorithms
10.3390/a12010024,A Pricing Strategy of E-Commerce Advertising Cooperation in the Stackelberg Game Model with Different Market Power Structure,Ling Zhu and Jie Lin,2019,3,Algorithms
10.3390/a15100344,On an Optimal Quadrature Formula in a Hilbert Space of Periodic Functions,Kholmat Shadimetov and Abdullo Hayotov and Botir Abdikayimov,2022,0,Algorithms
10.3390/a13100242,A Compact FEM Implementation for Parabolic Integro-Differential Equations in 2D,Gujji Murali Mohan Reddy and Alan B. Seitenfuss and Débora de Oliveira Medeiros and Luca Meacci and Milton Assunção and Michael Vynnycky,2020,1,Algorithms
10.3390/a16010057,Extending Process Discovery with Model Complexity Optimization and Cyclic States Identification: Application to Healthcare Processes,Liubov O. Elkhovskaya and Alexander D. Kshenin and Marina A. Balakhontceva and Mikhail V. Ionov and Sergey V. Kovalchuk,2023,0,Algorithms
10.3390/a15060203,An Algorithm for the Closed-Form Solution of Certain Classes of Volterra–Fredholm Integral Equations of Convolution Type,Efthimios Providas,2022,1,Algorithms
10.3390/a9040072,Engineering a Combinatorial Laplacian Solver: Lessons Learned,Daniel Hoske and Dimitar Lukarski and Henning Meyerhenke and Michael Wegner,2016,6,Algorithms
10.3390/a14020049,A Novel Approach for Cognitive Clustering of Parkinsonisms through Affinity Propagation,Alessia Sarica and Maria Grazia Vaccaro and Andrea Quattrone and Aldo Quattrone,2021,6,Algorithms
10.3390/a16010022,Stochastic Local Community Detection in Networks,Hadi Papei and Yang Li,2023,0,Algorithms
10.3390/a14110309,A Parallel Algorithm for Dividing Octonions,Aleksandr Cariow and Janusz P. Paplinski,2021,0,Algorithms
10.3390/a11010006,A Novel Perceptual Hash Algorithm for Multispectral Image Authentication,Kaimeng Ding and Shiping Chen and Fan Meng,2018,16,Algorithms
10.3390/a5020176,Finding All Solutions and Instances of Numberlink and Slitherlink by ZDDs,Ryo Yoshinaka and Toshiki Saitoh and Jun Kawahara and Koji Tsuruma and Hiroaki Iwashita and Shin-ichi Minato,2012,16,Algorithms
10.3390/a13020030,Learning Manifolds from Dynamic Process Data,Frank Schoeneman and Varun Chandola and Nils Napp and Olga Wodo and Jaroslaw Zola,2020,2,Algorithms
10.3390/a16010043,The D-Bar Algorithm Fusing Electrical Impedance Tomography with A Priori Radar Data: A Hands-On Analysis,Jöran Rixen and Steffen Leonhardt and Jochen Moll and Duy Hai Nguyen and Chuong Ngo,2023,0,Algorithms
10.3390/a14070204,A Comparative Study of Block Incomplete Sparse Approximate Inverses Preconditioning on Tesla K20 and V100 GPUs,Wenpeng Ma and Wu Yuan and Xiazhen Liu,2021,0,Algorithms
10.3390/a15010002,Preconditioning the Quad Dominant Mesh Generator for Ship Structural Analysis,Luka Grubišić and Domagoj Lacmanović and Josip Tambača,2021,1,Algorithms
10.3390/a15030072,A Machine Learning Approach for Solving the Frozen User Cold-Start Problem in Personalized Mobile Advertising Systems,Iosif Viktoratos and Athanasios Tsadiras,2022,0,Algorithms
10.3390/a15080260,Hypothesis Testing Fusion for Nonlinearity Detection in Hedge Fund Price Returns,Jean-Marc Le Caillec,2022,0,Algorithms
10.3390/a13090221,EEG Feature Extraction Using Genetic Programming for the Classification of Mental States,Emigdio Z-Flores and Leonardo Trujillo and Pierrick Legrand and Frédérique Faïta-Aïnseba,2020,2,Algorithms
10.3390/a11060078,A Modified Artificial Bee Colony Algorithm Based on the Self-Learning Mechanism,Bao Pang and Yong Song and Chengjin Zhang and Hongling Wang and Runtao Yang,2018,6,Algorithms
10.3390/a15060178,A Data-Driven Fault Tree for a Time Causality Analysis in an Aging System,Kerelous Waghen and Mohamed-Salah Ouali,2022,0,Algorithms
10.3390/a15060187,Exploring the Suitability of Rule-Based Classification to Provide Interpretability in Outcome-Based Process Predictive Monitoring,Suhwan Lee and Marco Comuzzi and Nahyun Kwon,2022,0,Algorithms
10.3390/a10010017,A Preconditioned Iterative Method for Solving Systems of Nonlinear Equations Having Unknown Multiplicity,Fayyaz Ahmad and Toseef Bhutta and Umar Shoaib and Malik Zaka Ullah and Ali Alshomrani and Shamshad Ahmad and Shahid Ahmad,2017,3,Algorithms
10.3390/a10020060,"Correction: A No Reference Image Quality Assessment Metric Based on Visual Perception. Algorithms 2016, 9, 87",Yan Fu and Shengchun Wang,2017,0,Algorithms
10.3390/a14110317,A Real-Time Car Towing Management System Using ML-Powered Automatic Number Plate Recognition,Ahmed Abdelmoamen Ahmed and Sheikh Ahmed,2021,2,Algorithms
10.3390/a13120314,Efficient Approaches to the Mixture Distance Problem,Justie Su-Tzu Juan and Yi-Ching Chen and Chen-Hui Lin and Shu-Chuan Chen,2020,2,Algorithms
10.3390/a14120353,Hexadecimal Aggregate Approximation Representation and Classification of Time Series Data,Zhenwen He and Chunfeng Zhang and Xiaogang Ma and Gang Liu,2021,1,Algorithms
10.3390/a15100354,Coordinate Descent for Variance-Component Models,Anant Mathur and Sarat Moka and Zdravko Botev,2022,0,Algorithms
10.3390/a15100353,Using Explainable AI (XAI) for the Prediction of Falls in the Older Population,Yue Ting Tang and Roman Romero-Ortuno,2022,0,Algorithms
10.3390/a12090182,A Novel Hybrid Genetic-Whale Optimization Model for Ontology Learning from Arabic Text,n.m. Ghoniem and n.m. Alhelwa and n.m. Shaalan,2019,8,Algorithms
10.3390/a15100363,Joints Trajectory Planning of Robot Based on Slime Mould Whale Optimization Algorithm,Xinning Li and Qin Yang and Hu Wu and Shuai Tan and Qun He and Neng Wang and Xianhai Yang,2022,0,Algorithms
10.3390/a14010016,Adaptive Gene Level Mutation,Jalal Al-Afandi and András Horváth,2021,2,Algorithms
10.3390/a15040126,A Truly Robust Signal Temporal Logic: Monitoring Safety Properties of Interacting Cyber-Physical Systems under Uncertain Observation,Bernd Finkbeiner and Martin Fränzle and Florian Kohn and Paul Kröger,2022,1,Algorithms
10.3390/a15060179,Bounded-Error Parameter Estimation Using Integro-Differential Equations for Hindmarsh–Rose Model,Carine Jauberthie and Nathalie Verdière,2022,1,Algorithms
10.3390/a15080279,High-Fidelity Surrogate Based Multi-Objective Optimization Algorithm,Adel Younis and Zuomin Dong,2022,0,Algorithms
10.3390/a12120245,Observations on the Computation of Eigenvalue and Eigenvector Jacobians,Andrew J. Liounis and John A. Christian and Shane B. Robinson,2019,2,Algorithms
10.3390/a11050068,"Hybrid Flow Shop with Unrelated Machines, Setup Time, and Work in Progress Buffers for Bi-Objective Optimization of Tortilla Manufacturing",Victor Yaurima-Basaldua and Andrei Tchernykh and Francisco Villalobos-Rodríguez and Ricardo Salomon-Torres,2018,3,Algorithms
10.3390/a11010002,Models for Multiple Attribute Decision-Making with Dual Generalized Single-Valued Neutrosophic Bonferroni Mean Operators,Jie Wang and Xiyue Tang and Guiwu Wei,2018,18,Algorithms
10.3390/a11010007,Optimization Design by Genetic Algorithm Controller for Trajectory Control of a 3-RRR Parallel Robot,Lianchao Sheng and Wei Li,2018,19,Algorithms
10.3390/a12010019,Algorithm for Producing Rankings Based on Expert Surveys,Indra Overland and Javlon Juraev,2019,3,Algorithms
10.3390/a2010518,A Review of Closed-Loop Algorithms for Glycemic Control in the Treatment of Type 1 Diabetes,Joseph El Youssef and Jessica Castle and W. Kenneth Ward,2009,45,Algorithms
10.3390/a10040111,Game Theory-Inspired Evolutionary Algorithm for Global Optimization,Guanci Yang,2017,9,Algorithms
10.3390/a13050113,Goal Oriented Time Adaptivity Using Local Error Estimates,Peter Meisrimel and Philipp Birken,2020,1,Algorithms
10.3390/a11120197,Parametric Estimation in the Vasicek-Type Model Driven by Sub-Fractional Brownian Motion,Shengfeng Li and Yi Dong,2018,3,Algorithms
10.3390/a9040067,Comparison of Different Algorithms to Orthorectify WorldView-2 Satellite Imagery,Oscar Belfiore and Claudio Parente,2016,10,Algorithms
10.3390/a15070232,Generating Higher-Fidelity Synthetic Datasets with Privacy Guarantees,Aleksei Triastcyn and Boi Faltings,2022,0,Algorithms
10.3390/a15080286,"Temari Balls, Spheres, SphereHarmonic: From Japanese Folkcraft to Music",Maria Mannone and Takashi Yoshino,2022,0,Algorithms
10.3390/a15090333,Non-Interactive Decision Trees and Applications with Multi-Bit TFHE,Jestine Paul and Benjamin Hong Meng Tan and Bharadwaj Veeravalli and Khin Mi Mi Aung,2022,0,Algorithms
10.3390/a12120269,Application and Evaluation of Surrogate Models for Radiation Source Search,Jared A. Cook and Ralph C. Smith and Jason M. Hite and Razvan Stefanescu and John Mattingly,2019,4,Algorithms
10.3390/a14010025,Advanced Construction of the Dynamic Matrix in Numerically Efficient Fuzzy MPC Algorithms,Piotr M. Marusak,2021,3,Algorithms
10.3390/a15120452,Special Issue “Model Predictive Control: Algorithms and Applications”: Foreword by the Guest Editor,Maciej Ławryńczuk,2022,0,Algorithms
10.3390/a10030097,A Simplified Matrix Formulation for Sensitivity Analysis of Hidden Markov Models,Seifemichael B. Amsalu and Abdollah Homaifar and Albert Esterline,2017,3,Algorithms
10.3390/a10040130,2-Phase NSGA II: An Optimized Reward and Risk Measurements Algorithm in Portfolio Optimization,Seyedeh Eftekharian and Mohammad Shojafar and Shahaboddin Shamshirband,2017,12,Algorithms
10.3390/a13060151,Compression of Next-Generation Sequencing Data and of DNA Digital Files,Bruno Carpentieri,2020,2,Algorithms
10.3390/a9040085,A Differentiated Anonymity Algorithm for Social Network Privacy Preservation,Yuqin Xie and Mingchun Zheng,2016,5,Algorithms
10.3390/a16010003,Monte Carlo Simulation Affects Convergence of Differential Evolution: A Case of Optical Response Modeling,Denis D. Chesalin and Andrei P. Razjivin and Alexey S. Dorokhov and Roman Y. Pishchalnikov,2022,0,Algorithms
10.3390/a15040116,A Multitask Learning Framework for Abuse Detection and Emotion Classification,Yucheng Huang and Rui Song and Fausto Giunchiglia and Hao Xu,2022,1,Algorithms
10.3390/a15080258,Reducing the False Negative Rate in Deep Learning Based Network Intrusion Detection Systems,Jovana Mijalkovic and Angelo Spognardi,2022,5,Algorithms
10.3390/a13090227,An Image Hashing Algorithm for Authentication with Multi-Attack Reference Generation and Adaptive Thresholding,Ling Du and Zehong He and Yijing Wang and Xiaochao Wang and Anthony T. S. Ho,2020,3,Algorithms
10.3390/a12110239,A Hybrid Ontology-Based Recommendation System in e-Commerce,Márcio Guia and Rodrigo Rocha Silva and Jorge Bernardino,2019,11,Algorithms
10.3390/a13070161,CONDA-PM—A Systematic Review and Framework for Concept Drift Analysis in Process Mining,Ghada Elkhawaga and Mervat Abuelkheir and Sherif I. Barakat and Alaa M. Riad and Manfred Reichert,2020,7,Algorithms
10.3390/a13040096,A Hybrid Grasshopper Optimization Algorithm Applied to the Open Vehicle Routing Problem,Valeria Soto-Mendoza and Irma García-Calvillo and Efraín Ruiz-y-Ruiz and Jaime Pérez-Terrazas,2020,11,Algorithms
10.3390/a11100163,Airfoil Optimization Design Based on the Pivot Element Weighting Iterative Method,Xinqiang Liu and Weiliang He,2018,3,Algorithms
