DOI,Título,Autores,Año,Citas,Revista
10.3233/web-220048,The multi-dimensional power big data mining based on improved grey clustering algorithm,Hui Li and Guangqian Lu,2022,0,Web Intelligence
10.3233/web-190415,Improving collaborative filtering recommender system results and performance using satisfaction degree and emotions of users,Bushra Alhijawi,2019,4,Web Intelligence
10.3233/web-200438,Redundancy evaluation method of massive heterogeneous data in Internet of Things based on attributes and relations,Ying Li,2020,1,Web Intelligence
10.3233/web-170369,Mobile agents path planning based on an extension of Bug-Algorithms and applied to the pursuit-evasion game,Mohammed El Habib Souidi and Songhao Piao and Guo Li,2017,3,Web Intelligence
10.3233/web-160334,An automatic approach for tagging Web services using machine learning techniques1,Maria Lin and David W. Cheung,2016,2,Web Intelligence
10.3233/web-200441,Exploring propagation factors of social media moods for stock prices prediction,Hongxun Jiang and Xiaotong Wang and Mengjun Zhu,2020,0,Web Intelligence
10.3233/web-150314,Automatic generation of visual story for fairy tales with digital narrative,Cheng-Te Li and Chieh-Jen Huang and Man-Kwan Shan,2015,1,Web Intelligence
10.3233/web-210490,Big data clustering using fractional sail fish-sparse fuzzy C-means and particle whale optimization based MapReduce framework,Omkaresh Kulkarni and Ravi Sankar Vadali,2022,0,Web Intelligence
10.3233/web-210491,"A survey of semantic web (Web 3.0), its applications, challenges, future and its relation with Internet of things (IoT)",Adeem Ali Anwar,2022,0,Web Intelligence
10.3233/web-210468,Packet loss rate monitoring model of IoT based on differential evolution algorithm,Yinghua Feng and Wei Yang,2021,0,Web Intelligence
10.3233/web-150320,A BDI-based agent architecture for social competent agents,Inon Zuckerman and Meirav Hadad,2015,0,Web Intelligence
10.3233/web-220088,Research on agricultural product quality traceability system based on blockchain technology,Fang Zheng and Siyuan Huang and Xiong Zhou and Shujun Ta and Xujuan Zhou and Ka Ching Chan and Raj Gururajan,2023,0,Web Intelligence
10.3233/web-210487,An automatic classification method of library archives data based on data mining,Li Qiao,2022,0,Web Intelligence
10.3233/web-210485,Privacy protection data mining algorithm in blockchain based on decision tree classification,Yu Cao and Wei Wei and Jin Zhou,2022,0,Web Intelligence
10.3233/web-210458,Graph-based knowledge tracing: Modeling student proficiency using graph neural networks,Hiromi Nakagawa and Yusuke Iwasawa and Yutaka Matsuo,2021,1,Web Intelligence
10.3233/web-190412,The importance of unexpectedness: Discovering buzzing stories in anomalous temporal graphs,Francesco Bonchi and Ilaria Bordino and Francesco Gullo and Giovanni Stilo,2019,1,Web Intelligence
10.3233/web-150324,Top-N recommendations in the presence of sparsity: An NCD-based approach,Athanasios N. Nikolakopoulos and John D. Garofalakis,2015,3,Web Intelligence
10.3233/web-160332,A bottom-up search algorithm for size-constrained partitioning of modules to generate configurations in modular robots,Ayan Dutta and Prithviraj Dasgupta and Carl Nelson,2016,1,Web Intelligence
10.3233/web-220052,An early warning method of abnormal state of laboratory equipment based on Internet of things and running big data,Guokai Zheng and Luxia Yi,2023,0,Web Intelligence
10.3233/web-190406,A task scheduling algorithm based on priority list and task duplication in cloud computing environment,Xiaozhong Geng and Lan Yu and Jie Bao and Geji Fu,2019,7,Web Intelligence
10.3233/web-160345,A topic-based sentiment analysis model to predict stock market price movement using Weibo mood,Wenhao Chen and Yi Cai and Kinkeung Lai and Haoran Xie,2016,17,Web Intelligence
10.3233/web-210471,Advanced ant colony algorithm for high dimensional abnormal data mining in Internet of things,Huixian Wang and Hongjiang Zheng,2022,0,Web Intelligence
10.3233/web-200444,ITIL process management to mitigate operations risk in cloud architecture infrastructure for banking and financial services industry,Abhishek Mahalle and Jianming Yong and Xiaohui Tao,2020,1,Web Intelligence
10.3233/web-150322,Properties of a new adaptive sampling method with applications to scalable learning,Jianhua Chen,2015,0,Web Intelligence
10.3233/web-200430,Interactive minutes generation system based on hierarchical discussion structure,Hiroya Miura and Yoshinari Takegawa and Asuka Terai and Keiji Hirata,2020,0,Web Intelligence
10.3233/web-210475,Trust-based federated learning for network anomaly detection,Naiyue Chen and Yi Jin and Yinglong Li and Luxin Cai,2022,0,Web Intelligence
10.3233/web-150311,"Intelligent interaction, reasoning, and applications",Chao-Lin Liu and Mitsunori Matsushita and Yasufumi Takama and Min-Yuh Day and Vincent Shin-Mu Tseng,2015,0,Web Intelligence
10.3233/web-160331,Paraconsistent argumentation schemes1,Barbara Dunin-Kęplicz and Alina Strachocka,2016,3,Web Intelligence
10.3233/web-220044,Communication information exchange and transmission method of industrial Internet of things based on audio information hiding,Yinlei Tian and Haiyan Wang,2022,0,Web Intelligence
10.3233/web-190421,Proposal of grade training method for quality improvement in microtask crowdsourcing,Masayuki Ashikawa and Takahiro Kawamura and Akihiko Ohsuga,2019,0,Web Intelligence
10.3233/web-210466,Research on internal network data security monitoring method based on NB-IoT,Yuanyuan Li and Jidong Sha and Rongna Geng,2021,0,Web Intelligence
10.3233/web-190407,Design of complex wind power generation parameter control system based on embedded control combined with Internet of Things,Bin Dai,2019,0,Web Intelligence
10.3233/web-200426,2SRM: Learning social signals for predicting relevant search results,Ismail Badache,2020,1,Web Intelligence
10.3233/web-190420,Recommend interesting items: How can social curiosity help?,Qiong Wu and Siyuan Liu and Chunyan Miao,2019,0,Web Intelligence
10.3233/web-160340,Review of intelligent microblog short text processing,Wei Huang and Zongke Li and Libiao Zhang and Yuefeng Li,2016,1,Web Intelligence
10.3233/web-150318,DIKEA: Exploiting Wikipedia for keyphrase extraction,David X. Wang and Xiaoying Gao and Peter Andreae,2015,2,Web Intelligence
10.3233/web-150309,Sentiment analysis of texts by capturing underlying sentiment patterns,Seyed Ali Bahrainian and Andreas Dengel,2015,4,Web Intelligence
10.3233/web-190408,Higher mathematics teaching resource scheduling system based on cloud computing,Tiejun Chen,2019,9,Web Intelligence
10.3233/web-210462,Feature mining method of information system operation and maintenance big data based on window function,Ruohan Sun and Meihui Hu and Jinping Cao and Wanxing Xiao and Xinying Guo,2021,0,Web Intelligence
10.3233/web-180379,uGait: A platform for automated quantitative gait analysis and its application to Parkinson’s disease,Xi Wu and Chen Tang and Xu Chen and Shengqiang Xu and Nan Cheng and Ning An,2018,1,Web Intelligence
10.3233/web-200440,From traceability to provenance of agricultural products through blockchain,Xiong Zhou and Fang Zheng and Xujuan Zhou and Ka Ching Chan and Raj Gururajan and Zhangguang Wu and Enxing Zhou,2020,5,Web Intelligence
10.3233/web-180374,Collaborative ensemble learning under differential privacy,Tao Xiang and Yang Li and Xiaoguo Li and Shigang Zhong and Shui Yu,2018,8,Web Intelligence
10.3233/web-220054,M2GCF: A multi-mixing strategy for graph neural network based collaborative filtering,Jianan Xu and Jiajin Huang and Jian Yang and Ning Zhong,2022,0,Web Intelligence
10.3233/web-210477,Causal inference for the impact of economic policy on financial and labour markets amid the COVID-19 pandemic,Nhi N.Y. Vo and Guandong Xu and Dat Anh Le,2022,0,Web Intelligence
10.3233/web-180387,Automatic Chinese character similarity measurement,Ming Liu and Vasile Rus and Yue Li and Chuqian Sheng and Li Liu,2018,1,Web Intelligence
10.3233/web-220035,Research on data fusion of power wireless sensor networks based on Kalman filter,Haoran Wang,2022,0,Web Intelligence
10.3233/web-160347,Factors to be considered in cloud computing adoption,Omar Ali and Jeffrey Soar and Jianming Yong and Xiaohui Tao,2016,9,Web Intelligence
10.3233/web-220018,A data cube modeling method for longitudinal cohort study,Xin Li and Huadong Liang and Lin Li,2022,0,Web Intelligence
10.3233/web-220028,An automatic generation of software test data based on improved Markov model,Jiali Chen and Xiaojie Chen and Tao Zan and Mengjia Lian,2022,0,Web Intelligence
10.3233/web-220063,Performance evaluation and comparative analysis of CrowWhale-energy and trust aware multicast routing algorithm,Dipali K. Shende and Yogesh S. Angal,2023,0,Web Intelligence
10.3233/web-190416,Modelling meme adoption pattern on online social networks,Sarah Elsharkawy and Ghada Hassan and Tarek Nabhan and Mohamed Roushdy,2019,5,Web Intelligence
10.3233/web-160329,"Real-time, scalable, content-based Twitter users recommendation",Julien Subercaze and Christophe Gravier and Frédérique Laforest,2016,5,Web Intelligence
10.3233/web-180393,Negative trust for conflict resolution in software management,Giuseppe Primiero and Jaap Boender,2018,7,Web Intelligence
10.3233/web-160348,An intelligent recommender system based on predictive analysis in telehealthcare environment,Raid Lafta and Ji Zhang and Xiaohui Tao and Yan Li and Vincent S. Tseng and Yonglong Luo and Fulong Chen,2016,18,Web Intelligence
10.3233/web-180371,A graph-based approach for resolving incoherent ontology mappings,Weizhuo Li and Songmao Zhang and Guilin Qi,2018,9,Web Intelligence
