DOI,Título,Autores,Año,Citas,Revista
10.1007/s41066-021-00258-2,Multiple classifiers fusion for facial expression recognition,Chuanjie Zhang and Changming Zhu,2022,1,Granular Computing
10.1007/s41066-021-00296-w,Analysis of domination in the environment of picture fuzzy information,Naeem Jan and Muhammad Asif and Abdul Nasir and Sami Ullah Khan and Abdu Gumaei,2022,0,Granular Computing
10.1007/s41066-021-00303-0,Correction to: Fully fuzzy multi-item two-stage fixed charge four-dimensional transportation problems with flexible constraints,Sudeshna Devnath and Pravash Kumar Giri and Seema Sarkar Mondal and Manoranjan Maiti,2022,0,Granular Computing
10.1007/s41066-018-0107-4,Hybrid aggregation operators based on Pythagorean hesitant fuzzy sets and their application to group decision making,Muhammad Sajjad Ali Khan and Saleem Abdullah and Asad Ali and Fazli Amin and Khaista Rahman,2019,24,Granular Computing
10.1007/s41066-023-00370-5,A supervised method to enhance distance-based neural network clustering performance by discovering perfect representative neurons,Qiang Fu and Yuefeng Li and Mubarak Albathan,2023,0,Granular Computing
10.1007/s41066-018-0123-4,On solution of constraint matrix games under rough interval approach,El-Saeed Ammar and M. G. Brikaa,2019,8,Granular Computing
10.1007/s41066-018-0095-4,A Choquet integral-based approach to multiattribute decision-making with correlated periods,Yeleny Zulueta-Veliz and Lina García-Cabrera,2018,14,Granular Computing
10.1007/s41066-017-0040-y,Exploratory multivariate analysis for empirical information affected by uncertainty and modeled in a fuzzy manner: a review,Pierpaolo D’Urso,2017,8,Granular Computing
10.1007/s41066-021-00279-x,Algebraic and Einstein weighted operators of neutrosophic enthalpy values for multi-criteria decision making in neutrosophic multi-valued set settings,Jun Ye and Ezgi Türkarslan and Mehmet Ünver and Murat Olgun,2022,6,Granular Computing
10.1007/s41066-017-0053-6,Granular approximation of solutions of partial differential equations with fuzzy parameter,Ana Maria Bertone and Rosana Motta Jafelice and Laécio Carvalho de Barros and Fernando Gomide,2018,9,Granular Computing
10.1007/s41066-018-0084-7,A new algorithm for finding minimum spanning trees with undirected neutrosophic graphs,Arindam Dey and Said Broumi and Le Hoang Son and Assia Bakali and Mohamed Talea and Florentin Smarandache,2019,25,Granular Computing
10.1007/s41066-022-00316-3,Linguistic multi-criteria decision-making aggregation model based on situational ME-LOWA and ME-LOWGA operators,Ching-Hsue Cheng and Mu-Yen Chen and Jing-Rong Chang,2023,1,Granular Computing
10.1007/s41066-022-00320-7,Modified Pi Sigma artificial neural networks for forecasting,Erol Egrioglu and Eren Bas,2023,2,Granular Computing
10.1007/s41066-017-0050-9,Interval-valued intuitionistic multiplicative aggregation in group decision making,Yuan Jiang and Zeshui Xu and Yihao Shu,2017,40,Granular Computing
10.1007/s41066-021-00310-1,An efficient method for solving neutrosophic Fredholm integral equations of second kind,Sandip Moi and Suvankar Biswas and Smita Pal Sarkar,2023,2,Granular Computing
10.1007/s41066-019-00162-w,Fast feature selection algorithm for neighborhood rough set model based on Bucket and Trie structures,Rachid Benouini and Imad Batioua and Soufiane Ezghari and Khalid Zenkouar and Azeddine Zahi,2020,10,Granular Computing
10.1007/s41066-018-0136-z,Complex vague contexts analysis using Cartesian product and granulation,Prem Kumar Singh,2020,5,Granular Computing
10.1007/s41066-019-00186-2,Single stage fuzzy supply chain model with Weibull distributed demand for milk commodities,M. R. Bhosale and R. V. Latpate,2021,6,Granular Computing
10.1007/s41066-021-00289-9,Solution of a pollution sensitive EOQ model under fuzzy lock leadership game approach,Kousik Bhattacharya and Sujit Kumar De,2022,3,Granular Computing
10.1007/s41066-018-0121-6,Optimization of granulation for fuzzy controllers of autonomous mobile robots using the Firefly Algorithm,Marylu L. Lagunes and Oscar Castillo and Jose Soria and Mario Garcia and Fevrier Valdez,2019,22,Granular Computing
10.1007/s41066-017-0042-9,Generalized multigranulation rough sets and optimal granularity selection,Weihua Xu and Wentao Li and Xiantao Zhang,2017,52,Granular Computing
10.1007/s41066-021-00308-9,"Multiple attribute decision-making based on 3,4-quasirung fuzzy sets",Mijanur Rahaman Seikh and Utpal Mandal,2022,7,Granular Computing
10.1007/s41066-022-00325-2,Finite-time stability of mild solution to time-delay fuzzy fractional differential systems under granular computing,Nguyen Phuong Dong and Nguyen Thi Kim Son and Tofigh Allahviranloo and Ha Thi Thanh Tam,2023,2,Granular Computing
10.1007/s41066-022-00337-y,Finite-difference method for fuzzy singular integro-differential equation deriving from fuzzy non-linear differential equation,Sandip Moi and Suvankar Biswas and Smita Pal Sarkar,2022,2,Granular Computing
10.1007/s41066-015-0008-8,Bridging gaps between several forms of granular computing,Didier Dubois and Henri Prade,2016,104,Granular Computing
10.1007/s41066-018-0089-2,Linguistic intuitionistic fuzzy Hamacher aggregation operators and their application to group decision making,Jie Tang and Fanyong Meng,2019,43,Granular Computing
10.1007/s41066-022-00313-6,Coarsest granularity-based optimal reduct using A* search,Abhimanyu Bar and Anil Kumar and P. S. V. S. Sai Prasad,2023,1,Granular Computing
10.1007/s41066-022-00343-0,Multi-attribute decision-making based on the advanced possibility degree measure of intuitionistic fuzzy numbers,Chirag Dhankhar and Kamal Kumar,2022,1,Granular Computing
10.1007/s41066-019-00168-4,A novel high-order fuzzy time series forecasting method based on probabilistic fuzzy sets,Krishna Kumar Gupta and Sanjay Kumar,2019,21,Granular Computing
10.1007/s41066-021-00281-3,Decision-making with q-rung orthopair fuzzy graph structures,Muhammad Akram and Muzzamal Sitara,2022,7,Granular Computing
10.1007/s41066-021-00254-6,A new picture fuzzy divergence measure based on Jensen–Tsallis information measure and its application to multicriteria decision making,Ratika Kadian and Satish Kumar,2022,5,Granular Computing
10.1007/s41066-018-0114-5,Multi-criteria assessment of cellular mobile telephone service providers using intuitionistic fuzzy WASPAS method with similarity measures,Arunodaya Raj Mishra and Rahul Kumar Singh and Deepak Motwani,2019,50,Granular Computing
10.1007/s41066-018-0110-9,Optimal granulation selection for multi-label data based on multi-granulation rough sets,Meishe Liang and Jusheng Mi and Tao Feng,2019,11,Granular Computing
10.1007/s41066-021-00267-1,A novel VIKOR approach based on weighted correlation coefficients and picture fuzzy information for multicriteria decision making,Rajesh Joshi and Satish Kumar,2022,10,Granular Computing
10.1007/s41066-018-0092-7,Improved possibility degree method for ranking intuitionistic fuzzy numbers and their application in multiattribute decision-making,Harish Garg and Kamal Kumar,2019,59,Granular Computing
10.1007/s41066-023-00366-1,"A novel intuitionistic fuzzy similarity measure with applications in decision-making, pattern recognition, and clustering problems",Rakesh Kumar and Satish Kumar,2023,0,Granular Computing
10.1007/s41066-022-00358-7,Multiple attribute decision making based on probabilistic generalized orthopair fuzzy sets,Feng Feng and Chenxue Zhang and Muhammad Akram and Jianke Zhang,2022,4,Granular Computing
10.1007/s41066-016-0017-2,Semi-greedy heuristics for feature selection with test cost constraints,Fan Min and Juan Xu,2016,53,Granular Computing
10.1007/s41066-020-00249-9,Multi-criteria decision-making based on bi-parametric exponential fuzzy information measures and weighted correlation coefficients,Rajesh Joshi,2022,10,Granular Computing
10.1007/s41066-018-0130-5,Extended MABAC method based on divergence measures for multi-criteria assessment of programming language with interval-valued intuitionistic fuzzy sets,Arunodaya Raj Mishra and Ayushi Chandel and Deepak Motwani,2020,47,Granular Computing
10.1007/s41066-015-0009-7,A comparison of three approaches for estimating (synthesizing) an interval type-2 fuzzy set model of a linguistic term for computing with words,Jerry M. Mendel,2016,120,Granular Computing
10.1007/s41066-017-0046-5,Multi-attribute decision-making based on the SPIFGIA operators,Chengqing Wang and Xinggan Fu and Shanshan Meng and Yingdong He,2017,27,Granular Computing
10.1007/s41066-021-00287-x,The cognitive comparison enhanced hierarchical clustering,Chun Guan and Kevin Kam Fung Yuen,2022,0,Granular Computing
10.1007/s41066-018-0124-3,An outranking approach for hesitant 2-tuple linguistic sets,Shahzad Faizi and Tabasam Rashid and Sohail Zafar,2019,6,Granular Computing
10.1007/s41066-018-0105-6,Neighborhood attribute reduction for imbalanced data,Wendong Zhang and Xun Wang and Xibei Yang and Xiangjian Chen and Pingxin Wang,2019,3,Granular Computing
10.1007/s41066-017-0051-8,Approaches to the selection of cold chain logistics enterprises under hesitant fuzzy environment based on decision distance measures,Nan Liu and Shanshan Meng,2018,13,Granular Computing
10.1007/s41066-017-0057-2,Information granulation for rough fuzzy hypergraphs,Tamunokuro Opubo William-West and Dasharath Singh,2018,15,Granular Computing
10.1007/s41066-018-0098-1,Granular computing in decision-making,Jindong Qin and Xinwang Liu and Luis Martínez,2018,3,Granular Computing
10.1007/s41066-016-0020-7,A study of granular computing in the agenda of growth of artificial neural networks,Mingli Song and Yongbin Wang,2016,62,Granular Computing
10.1007/s41066-019-00191-5,Intuitionistic interval-valued hesitant fuzzy matrix games with a new aggregation operator for solving management problem,Ankan Bhaumik and Sankar Kumar Roy,2021,21,Granular Computing
10.1007/s41066-018-0125-2,Three-way decisions with reflexive probabilistic rough fuzzy sets,Jian-Min Ma and Hong-Ying Zhang and Yu-Hua Qian,2019,9,Granular Computing
10.1007/s41066-017-0052-7,Some arithmetic operations on the generalized sigmoidal fuzzy numbers and its application,Harish Garg,2018,33,Granular Computing
10.1007/s41066-016-0025-2,RETRACTED ARTICLE: SPIFGIA operators and their applications to decision making,Chengqing Wang and Xinggan Fu and Shanshan Meng and Yingdong He,2017,3,Granular Computing
10.1007/s41066-022-00351-0,Fuzzy histogram equalization of hazy images: a concept using a type-2-guided type-1 fuzzy membership function,Nabeeha Abbasi and Mohammad Farhan Khan and Ekram Khan and Afra Alruzaiqi and Rami Al-Hmouz,2022,1,Granular Computing
10.1007/s41066-017-0039-4,Unified Granular-number-based AHP-VIKOR multi-criteria decision framework,Kajal Chatterjee and Samarjit Kar,2017,43,Granular Computing
10.1007/s41066-015-0013-y,Orthopairs and granular computing,Davide Ciucci,2016,92,Granular Computing
10.1007/s41066-016-0031-4,"Concepts of solutions of uncertain equations with intervals, probabilities and fuzzy sets for applied tasks",Boris Kovalerchuk and Vladik Kreinovich,2017,11,Granular Computing
10.1007/s41066-020-00217-3,Unclear database search,Ronald R. Yager,2021,0,Granular Computing
10.1007/s41066-016-0027-0,Inclusion degree with variable-precision model in analyzing inconsistent decision tables,Yu-Ru Syau and Andrzej Skowron and En-Bing Lin,2017,12,Granular Computing
10.1007/s41066-016-0015-4,Granular computing as a basis of human–data interaction: a cognitive cities use case,Gwendolin Wilke and Edy Portmann,2016,84,Granular Computing
10.1007/s41066-019-00185-3,Distance measures for cubic Pythagorean fuzzy sets and its applications to multicriteria decision making,Pranjal Talukdar and Palash Dutta,2021,14,Granular Computing
10.1007/s41066-020-00243-1,Pythagorean fuzzy Schweizer and Sklar power aggregation operators for solving multi-attribute decision-making problems,Animesh Biswas and Nayana Deb,2021,17,Granular Computing
10.1007/s41066-018-0126-1,Hesitant probabilistic fuzzy set based time series forecasting method,Krishna Kumar Gupta and Sanjay Kumar,2019,30,Granular Computing
10.1007/s41066-020-00231-5,Numerical solution of two-dimensional nonlinear fuzzy delay integral equations via iterative method and trapezoidal quadrature rule,Hajar Nouriani and Reza Ezzati and Atiyeh Mashhadi Gholam,2021,3,Granular Computing
10.1007/s41066-022-00323-4,Knowledge and accuracy measure based on dual-hesitant fuzzy sets with application to pattern recognition and site selection for solar power plant,Surender Singh,2023,0,Granular Computing
10.1007/s41066-018-00142-6,Novel hybrid decision-making methods based on mF rough information,Muhammad Akram and Arooj Adeel,2020,12,Granular Computing
10.1007/s41066-021-00306-x,Design of robust control for uncertain fuzzy quadruple-tank systems with time-varying delays,Ghali Naami and Mohamed Ouahi and Abdelhamid Rabhi and Fernando Tadeo and Viet Long Bui Tuan,2022,2,Granular Computing
10.1007/s41066-017-0064-3,Constructing the lie detection system with fuzzy reasoning approach,Ying-Fang Lai and Mu-Yen Chen and Hsiu-Sen Chiang,2018,24,Granular Computing
10.1007/s41066-020-00238-y,Development of a new trapezoidal fuzzy AHP-TOPSIS hybrid approach for manufacturing firm performance measurement,Yusuf Tansel İç and Mustafa Yurdakul,2021,6,Granular Computing
10.1007/s41066-021-00288-w,A generalized fuzzy k-nearest neighbor regression model based on Minkowski distance,Mahinda Mailagaha Kumbure and Pasi Luukka,2022,2,Granular Computing
10.1007/s41066-022-00352-z,Multi-criteria decision-making based on novel fuzzy generalized divergence and knowledge measures,Djamal Chabaane and Djedjiga Kheffache,2022,3,Granular Computing
10.1007/s41066-023-00369-y,Multiple criteria group decision making based on q-rung orthopair fuzzy soft sets,V. Salsabeela and T. M. Athira and Sunil Jacob John and T. Baiju,2023,0,Granular Computing
10.1007/s41066-023-00371-4,Distance measures and $$\delta$$-approximations with rough complex fuzzy models,Musavarah Sarwar and Muhammad Akram and Sundas Shahzadi,2023,0,Granular Computing
10.1007/s41066-019-00206-1,Failure prioritization and control using the neutrosophic best and worst method,Melih Yucesan and Muhammet Gul,2021,15,Granular Computing
10.1007/s41066-020-00246-y,A pythagorean fuzzy algorithm embedded with a new correlation measure and its application in diagnostic processes,Paul Augustine Ejegwa and Idoko Charles Onyeke and Victoria Adah,2021,9,Granular Computing
10.1007/s41066-018-0137-y,Operation properties and algebraic properties of multi-covering rough sets,Qingzhao Kong and Xiawei Zhang and Weihua Xu,2019,4,Granular Computing
10.1007/s41066-019-00188-0,Aggregation operators on cubic linguistic hesitant fuzzy numbers and their application in group decision-making,Aliya Fahmi and Saleem Abdullah and Fazli Amin,2021,13,Granular Computing
10.1007/s41066-019-00205-2,Multiple attribute group decision making based on weighted aggregation operators of triangular neutrosophic cubic fuzzy numbers,Aliya Fahmi and Fazli Amin and Hidayat Ullah,2021,12,Granular Computing
10.1007/s41066-019-00190-6,"Group decision-making approach under multi (Q, N)-soft multi granulation rough model",Muhammad Akram and Ghous Ali,2021,18,Granular Computing
10.1007/s41066-020-00244-0,Multiattribute group decision making based on interval-valued neutrosophic N-soft sets,Jianbo Liu and Ziyue Chen and Yanan Chen and Yanyan Zhang and Chenwei Li,2021,13,Granular Computing
10.1007/s41066-021-00274-2,Training simple recurrent deep artificial neural network for forecasting using particle swarm optimization,Eren Bas and Erol Egrioglu and Emine Kolemen,2022,21,Granular Computing
10.1007/s41066-020-00237-z,A novel intuitionistic Renyi’s–Tsallis discriminant information measure and its applications in decision-making,Ratika Kadian and Satish Kumar,2021,7,Granular Computing
10.1007/s41066-018-0122-5,Nature-inspired framework of ensemble learning for collaborative classification in granular computing context,Han Liu and Mihaela Cocea,2019,13,Granular Computing
10.1007/s41066-019-00199-x,Computation of generalized linguistic term sets based on fuzzy logical algebras for multi-attribute decision making,Zhen Ming Ma and Ze Shui Xu,2020,13,Granular Computing
10.1007/s41066-019-00210-5,Granular approach to data processing under probabilistic uncertainty,Andrzej Pownuk and Vladik Kreinovich,2021,3,Granular Computing
10.1007/s41066-019-00169-3,Supplier selection using a flexible interval-valued fuzzy VIKOR,Iman Mohamad Sharaf,2020,14,Granular Computing
10.1007/s41066-018-0119-0,Trapezoidal interval type-2 fuzzy soft stochastic set and its application in stochastic multi-criteria decision-making,Soumi Manna and Tanushree Mitra Basu and Shyamal Kumar Mondal,2019,17,Granular Computing
10.1007/s41066-018-00152-4,Maclaurin symmetric means of dual hesitant fuzzy information and their use in multi-criteria decision making,Zhiming Zhang,2020,25,Granular Computing
10.1007/s41066-022-00331-4,Adaptive hybrid fuzzy time series forecasting technique based on particle swarm optimization,Gunjan Goyal and Dinesh C. S. Bisht,2023,2,Granular Computing
10.1007/s41066-022-00328-z,Bearing fault diagnosis algorithm based on granular computing,Xiaoyong Wang and Jianhua Yang and Wei Lu,2023,2,Granular Computing
10.1007/s41066-018-0093-6,Pythagorean fuzzy prioritized aggregation operators and their application to multi-attribute group decision making,Muhammad Sajjad Ali Khan and Saleem Abdullah and Asad Ali and Fazli Amin,2019,63,Granular Computing
10.1007/s41066-020-00212-8,"Hexagonal fuzzy number and its distinctive representation, ranking, defuzzification technique and application in production inventory management problem",Avishek Chakraborty and Suman Maity and Shalini Jain and Sankar Prasad Mondal and Shariful Alam,2021,30,Granular Computing
10.1007/s41066-015-0012-z,DCC: a framework for dynamic granular clustering,Georg Peters and Richard Weber,2016,109,Granular Computing
10.1007/s41066-017-0045-6,Measures of the Shapley index for learning lower complexity fuzzy integrals,Anthony J. Pinar and Derek T. Anderson and Timothy C. Havens and Alina Zare and Titilope Adeyeba,2017,20,Granular Computing
10.1007/s41066-019-00154-w,Multiattribute group decision making based on interval-valued Pythagorean fuzzy Einstein geometric aggregation operators,K. Rahman and A. Ali and S. Abdullah,2020,25,Granular Computing
10.1007/s41066-016-0016-3,Evolving granular analytics for interval time series forecasting,Leandro Maciel and Rosangela Ballini and Fernando Gomide,2016,83,Granular Computing
10.1007/s41066-020-00235-1,Generalized intuitionistic fuzzy aggregation operators based on confidence levels for group decision making,K. Rahman and S. Ayub and S. Abdullah,2021,16,Granular Computing
10.1007/s41066-021-00272-4,Some modified Pythagorean fuzzy correlation measures with application in determining some selected decision-making problems,Paul Augustine Ejegwa and Victoria Adah and Idoko Charles Onyeke,2022,19,Granular Computing
10.1007/s41066-022-00349-8,Solving Pythagorean fuzzy partial fractional diffusion model using the Laplace and Fourier transforms,Muhammad Akram and Tayyaba Ihsan,2022,4,Granular Computing
10.1007/s41066-015-0004-z,Multi-objective evolutionary design of granular rule-based classifiers,Michela Antonelli and Pietro Ducange and Beatrice Lazzerini and Francesco Marcelloni,2016,88,Granular Computing
10.1007/s41066-017-0049-2,Semi-random partitioning of data into training and test sets in granular computing context,Han Liu and Mihaela Cocea,2017,78,Granular Computing
10.1007/s41066-017-0041-x,Interval type-2 fuzzy Hamy mean operators and their application in multiple criteria decision making,Jindong Qin,2017,46,Granular Computing
10.1007/s41066-019-00200-7,Solving I-fuzzy two person zero-sum matrix games: Tanaka and Asai approach,Deeba Naqvi and Abha Aggarwal and Geeta Sachdev and Imran Khan,2021,7,Granular Computing
10.1007/s41066-022-00340-3,Information measures for MADM under m-polar neutrosophic environment,Khalid Naeem and Bijan Divvaz,2022,0,Granular Computing
10.1007/s41066-022-00356-9,Defect classification of glass substrate using deep neuro-fuzzy network with optimal parameter combination,Shun-Jie Zhuang and Cheng-Jian Lin,2022,0,Granular Computing
10.1007/s41066-017-0060-7,Concept lattice visualization of data with m-polar fuzzy attribute,Prem Kumar Singh,2018,19,Granular Computing
10.1007/s41066-021-00305-y,Correction to: Multiple attribute group decision-making based on generalized aggregation operators under linguistic interval-valued Pythagorean fuzzy environment,Rajkumar Verma and Nikunj Agarwal,2022,0,Granular Computing
10.1007/s41066-019-00161-x,Granulation-based self-training for the semi-supervised classification of remote-sensing images,Prem Shankar Singh Aydav and Sonajharia Minz,2020,13,Granular Computing
10.1007/s41066-019-00202-5,Prediction of phosphorylation sites based on granular support vector machine,Gong Cheng and Qingfeng Chen and Ruchang Zhang,2021,1,Granular Computing
10.1007/s41066-023-00361-6,An optimization-based method for eliciting priorities from fuzzy preference relations with a novel consistency index,Ziqian Luo and Hui Yang and Fang Liu,2023,0,Granular Computing
10.1007/s41066-018-0078-5,A new approach to control of multivariable systems through a hierarchical aggregation of fuzzy controllers,Oscar Castillo and Leticia Cervantes and Patricia Melin and Witold Pedrycz,2019,18,Granular Computing
10.1007/s41066-023-00363-4,Multi-attribute decision-making for electronic waste recycling using interval-valued Fermatean fuzzy Hamacher aggregation operators,Anam Luqman and Gulfam Shahzadi,2023,0,Granular Computing
10.1007/s41066-021-00275-1,Correction to: Generalized similarity measures under linguistic q-rung orthopair fuzzy environment with application to multiple attribute decision-making,Rajkumar Verma,2022,0,Granular Computing
10.1007/s41066-021-00278-y,New fuzzy mean codeword length and similarity measure,Ratika Kadian and Satish Kumar,2022,3,Granular Computing
10.1007/s41066-017-0067-0,Possibility–necessity–credibility measures on generalized intuitionistic fuzzy number and their applications to multi-product manufacturing system,Totan Garai and Dipankar Chakraborty and Tapan Kumar Roy,2018,16,Granular Computing
10.1007/s41066-017-0066-1,A fuzzy compromise programming model based on the modified S-curve membership functions for supplier selection,Shukuan Liu and Zeshui Xu and Jie Gao,2018,15,Granular Computing
10.1007/s41066-016-0019-0,Editorial,Witold Pedrycz and Shyi-Ming Chen,2016,2,Granular Computing
10.1007/s41066-019-00177-3,New approach of triangular neutrosophic cubic linguistic hesitant fuzzy aggregation operators,Aliya Fahmi and Muhammad Aslam and Muhammad Riaz,2020,5,Granular Computing
10.1007/s41066-019-00183-5,Symptom-herb knowledge discovery based on attribute partial ordered structure diagrams,Hui Meng and Wenxue Hong and Cunguo Yu and Weili Ding and Jialin Song and Shaoxiong Li and Enliang Yan,2021,0,Granular Computing
10.1007/s41066-018-00145-3,Special issue on “Type-2 fuzzy systems and granular computing”,Oscar Castillo and Pranab K. Muhuri,2019,1,Granular Computing
10.1007/s41066-020-00236-0,Induced generalized pythagorean fuzzy aggregation operators and their application based on t-norm and t-conorm,K. Rahman and S. Abdullah and F. Hussain,2021,11,Granular Computing
10.1007/s41066-021-00256-4,Multi-attribute group decision making based on sine trigonometric spherical fuzzy aggregation operators,Muhammad Qiyas and Saleem Abdullah and Saifullah Khan and Muhammad Naeem,2022,6,Granular Computing
10.1007/s41066-021-00268-0,Group decision based on trapezoidal neutrosophic Dombi fuzzy hybrid operator,Aliya Fahmi,2022,2,Granular Computing
10.1007/s41066-021-00280-4,Weighted average LINMAP group decision-making method based on q-rung orthopair triangular fuzzy numbers,Benting Wan and Ruyi Lu and Mengjie Han,2022,7,Granular Computing
10.1007/s41066-022-00350-1,Multicriteria group decision making for COVID-19 testing facility based on picture cubic fuzzy aggregation information,n.m. Muneeza and Aiman Ihsan and Saleem Abdullah,2022,0,Granular Computing
10.1007/s41066-022-00344-z,Solving Pythagorean fuzzy fractional differential equations using Laplace transform,Muhammad Akram and Tayyaba Ihsan and Tofigh Allahviranloo,2022,4,Granular Computing
10.1007/s41066-016-0026-1,Membership grade mining of mutually inverse fuzzy implication propositions,Xunwei Zhou,2017,16,Granular Computing
10.1007/s41066-018-0076-7,Fuzzy rule-based systems for recognition-intensive classification in granular computing context,Han Liu and Li Zhang,2018,33,Granular Computing
10.1007/s41066-018-0138-x,Robust functional observer for stabilising uncertain fuzzy systems with time-delay,Syed Imranul Islam and Peng Shi and Cheng-Chew Lim,2020,1,Granular Computing
10.1007/s41066-021-00295-x,Fully fuzzy multi-item two-stage fixed charge four-dimensional transportation problems with flexible constraints,Sudeshna Devnath and Pravash Kumar Giri and Seema Sarkar Mondal and Manoranjan Maiti,2022,0,Granular Computing
10.1007/s41066-019-00178-2,Algebraic approaches to granular computing,Hua Mao and Mengjun Hu and Yiyu Yao,2021,5,Granular Computing
10.1007/s41066-018-0101-x,Extension of intuitionistic fuzzy TODIM technique for multi-criteria decision making method based on shapley weighted divergence measure,Pratibha Rani and Divya Jain and D. S. Hooda,2019,57,Granular Computing
10.1007/s41066-019-00167-5,Traffic-flow prediction via granular computing and stacked autoencoder,Jianhua Chen and Wenjing Yuan and Jingjing Cao and Haili Lv,2020,7,Granular Computing
10.1007/s41066-017-0069-y,Applying fuzzy petri nets for evaluating the impact of bedtime behaviors on sleep quality,Hsiu-Sen Chiang and Mu-Yen Chen and Zhe-Wei Wu,2018,17,Granular Computing
