DOI,Título,Autores,Año,Citas,Revista
10.1017/s0890060420000037,Using evolutionary algorithms to select text features for mining design rationale,Miriam Lester and Miguel Guerrero and Janet Burge,2020,4,"Artificial Intelligence for Engineering Design, Analysis and Manufacturing"
10.1017/s0890060417000634,AI EDAM special issue: advances in implemented shape grammars: solutions and applications,Sara Eloy and Pieter Pauwels and Athanassios Economou,2018,5,"Artificial Intelligence for Engineering Design, Analysis and Manufacturing"
10.1017/s0890060400141022,Case-based evolutionary design,MIKE ROSENMAN,2000,11,AI EDAM
10.1017/s0890060400142039,Integrating product models with engineering analysis applications: Two case studies,J. ANDREW ARNOLD and JOHN C. KUNZ,2000,2,"Artificial Intelligence for Engineering Design, Analysis and Manufacturing"
10.1017/s0890060408000206,Special Issue: Design Rationale,Janet E. Burge and Rob Bracewell,2008,3,"Artificial Intelligence for Engineering Design, Analysis and Manufacturing"
10.1017/s0890060414000225,Generative spatial performance design system,Benjamin P. Coorey and Julie R. Jupp,2014,2,"Artificial Intelligence for Engineering Design, Analysis and Manufacturing"
10.1017/s0890060410000223,A course for teaching design research methodology,Amaresh Chakrabarti,2010,9,"Artificial Intelligence for Engineering Design, Analysis and Manufacturing"
10.1017/s0890060408000061,Modality and representation in analogy,J.S. Linsey and K.L. Wood and A.B. Markman,2008,93,"Artificial Intelligence for Engineering Design, Analysis and Manufacturing"
10.1017/s0890060422000142,Parametric optimization of FDM using the ANN-based whale optimization algorithm,Praveen Kumar and Pardeep Gupta and Indraj Singh,2022,1,"Artificial Intelligence for Engineering Design, Analysis and Manufacturing"
10.1017/s0890060400141058,Monitoring and diagnosis of a multistage manufacturing process using Bayesian networks,ERIC WOLBRECHT and BRUCE D'AMBROSIO and ROBERT PAASCH and DOUG KIRBY,2000,23,AI EDAM
10.1017/s0890060413000012,Facilitating design communication through engineering information traceability,Neven Pavković and Mario Štorga and Nenad Bojčetić and Dorian Marjanović,2013,11,"Artificial Intelligence for Engineering Design, Analysis and Manufacturing"
10.1017/s0890060420000098,Humanitarian makerspaces in crisis-affected communities,Lucia Corsini and James Moultrie,2020,1,"Artificial Intelligence for Engineering Design, Analysis and Manufacturing"
10.1017/s0890060404040041,Self-configuring components approach to product variant development,MICHELE GERMANI and FERRUCCIO MANDORLI,2004,9,"Artificial Intelligence for Engineering Design, Analysis and Manufacturing"
10.1017/s0890060410000363,A natural-language approach to biomimetic design,L.H. Shu,2010,66,"Artificial Intelligence for Engineering Design, Analysis and Manufacturing"
10.1017/s0890060407070205,Answering engineers' questions using semantic annotations,SANGHEE KIM and ROB H. BRACEWELL and KEN M. WALLACE,2007,2,"Artificial Intelligence for Engineering Design, Analysis and Manufacturing"
10.1017/s0890060413000486,Design problem solving with biological analogies: A verbal protocol study,Hyunmin Cheong and Gregory M. Hallihan and L.H. Shu,2014,11,"Artificial Intelligence for Engineering Design, Analysis and Manufacturing"
10.1017/s0890060404040156,Designing creative artificial systems,PIETER H.G. VAN LANGEN and NIEK J.E. WIJNGAARDS and FRANCES M.T. BRAZIER,2004,3,"Artificial Intelligence for Engineering Design, Analysis and Manufacturing"
10.1017/s089006042100007x,A self-learning finite element extraction system based on reinforcement learning,Jie Pan and Jingwei Huang and Yunli Wang and Gengdong Cheng and Yong Zeng,2021,2,"Artificial Intelligence for Engineering Design, Analysis and Manufacturing"
10.1017/s0890060420000372,Automated areas of interest analysis for usability studies of tangible screen-based user interfaces using mobile eye tracking,M. Batliner and S. Hess and C. Ehrlich-Adám and Q. Lohmeyer and M. Meboldt,2020,3,"Artificial Intelligence for Engineering Design, Analysis and Manufacturing"
10.1017/s089006042000013x,User research enabled by makerspaces: bringing functionality to classical experience prototypes,Matilde Bisballe Jensen and Martin Steinert,2020,1,"Artificial Intelligence for Engineering Design, Analysis and Manufacturing"
10.1017/s0890060407000339,Comparing entropy measures of idea links in design protocols: Linkography entropy measurement and analysis of differently conditioned design sessions,Jeff W.T. Kan and Zafer Bilda and John S. Gero,2007,12,"Artificial Intelligence for Engineering Design, Analysis and Manufacturing"
10.1017/s0890060421000433,Breaking up data-enabled design: expanding and scaling up for the clinical context,Renee Noortman and Peter Lovei and Mathias Funk and Eva Deckers and Stephan Wensveen and Berry Eggen,2022,3,"Artificial Intelligence for Engineering Design, Analysis and Manufacturing"
10.1017/s0890060400144063,Socharis: The instantiation of a strategy for conceptual manufacturing planning,OLEG LUKIBANOV and ILIANA MARTINEZ and TIMOTHY J. LENZ and JAMES K. McDOWELL and CLARK RADCLIFFE and JON STICKLEN,2000,1,AI EDAM
10.1017/s0890060400141010,Towards the support of innovative conceptual design through interactive designer/evolutionary computing strategies,I. C. PARMEE and C. R. BONHAM,2000,18,AI EDAM
10.1017/s0890060420000025,Developing a new hybrid soft computing technique in predicting ultimate pile bearing capacity using cone penetration test data,Hooman Harandizadeh,2020,3,"Artificial Intelligence for Engineering Design, Analysis and Manufacturing"
10.1017/s0890060412000030,Hierarchical structuring of layout problems in an interactive evolutionary layout system,Reinhard Koenig and Sven Schneider,2012,20,"Artificial Intelligence for Engineering Design, Analysis and Manufacturing"
10.1017/s0890060409000092,A methodology for engineering ontology acquisition and validation,Zhanjun Li and Maria C. Yang and Karthik Ramani,2009,37,"Artificial Intelligence for Engineering Design, Analysis and Manufacturing"
10.1017/s089006042200018x,Graph transformation in engineering design: an overview of the last decade,Christopher Voss and Frank Petzold and Stephan Rudolph,2023,1,"Artificial Intelligence for Engineering Design, Analysis and Manufacturing"
10.1017/s0890060420000311,Decent fault classification of VFD fed induction motor using random forest algorithm,Parth Sarathi Panigrahy and Deepjyoti Santra and Paramita Chattopadhyay,2020,2,"Artificial Intelligence for Engineering Design, Analysis and Manufacturing"
10.1017/s0890060417000130,System reliability prediction with shared load and unknown component design details,Zhengwei Hu and Xiaoping Du,2017,8,"Artificial Intelligence for Engineering Design, Analysis and Manufacturing"
10.1017/s0890060415000025,Using analogies to explain versus inspire concepts,Amanda Chou and L.H. Shu,2015,6,"Artificial Intelligence for Engineering Design, Analysis and Manufacturing"
10.1017/s0890060404040119,Curious agents and situated design evaluations,ROB SAUNDERS and JOHN S. GERO,2004,24,"Artificial Intelligence for Engineering Design, Analysis and Manufacturing"
10.1017/s0890060417000336,A whole-grammar implementation of shape grammars for designers,Andrew I-kang Li,2018,1,"Artificial Intelligence for Engineering Design, Analysis and Manufacturing"
10.1017/s0890060419000349,Sketch-based interaction and modeling: where do we stand?,Alexandra Bonnici and Alican Akman and Gabriel Calleja and Kenneth P. Camilleri and Patrick Fehling and Alfredo Ferreira and Florian Hermuth and Johann Habakuk Israel and Tom Landwehr and Juncheng Liu and Natasha M. J. Padfield and T. Metin Sezgin and Paul L. Rosin,2019,13,"Artificial Intelligence for Engineering Design, Analysis and Manufacturing"
10.1017/s0890060423000045,Understanding the effects of hand design on embodiment in virtual reality,Jingjing Zhang and Mengjie Huang and Rui Yang and Yiqi Wang and Xiaohang Tang and Ji Han and Hai-Ning Liang,2023,0,"Artificial Intelligence for Engineering Design, Analysis and Manufacturing"
10.1017/s0890060416000226,Developing products with set-based design: How to set up an idea portfolio and a team organization to establish design feasibility,Anja Schulze,2016,5,"Artificial Intelligence for Engineering Design, Analysis and Manufacturing"
10.1017/s0890060410000442,An empirical study of the expressiveness of the functional basis,Benjamin W. Caldwell and Chiradeep Sen and Gregory M. Mocko and Joshua D. Summers,2011,19,"Artificial Intelligence for Engineering Design, Analysis and Manufacturing"
10.1017/s089006041100014x,Solving the tool switching problem with memetic algorithms,Jhon Edgar Amaya and Carlos Cotta and Antonio J. Fernández-Leiva,2012,12,"Artificial Intelligence for Engineering Design, Analysis and Manufacturing"
10.1017/s0890060406060197,Visual style: Qualitative and context-dependent categorization,JULIE JUPP and JOHN S. GERO,2006,5,"Artificial Intelligence for Engineering Design, Analysis and Manufacturing"
10.1017/s0890060407070138,Biomimetic design through natural language analysis to facilitate cross-domain information retrieval,IVEY CHIU and L.H. SHU,2007,89,"Artificial Intelligence for Engineering Design, Analysis and Manufacturing"
10.1017/s0890060420000438,What difference does an academic makerspace make? A case study on the effect and outreach of DTU Skylab,Ali Gürcan Özkil and Lasse Skovgaard Jensen and Camilla Arndt Hansen,2020,2,"Artificial Intelligence for Engineering Design, Analysis and Manufacturing"
10.1017/s0890060413000334,AIE volume 27 issue 3 Cover and Front matter,,2013,0,"Artificial Intelligence for Engineering Design, Analysis and Manufacturing"
10.1017/s0890060421000111,AIE volume 35 issue 2 Cover and Front matter,,2021,0,"Artificial Intelligence for Engineering Design, Analysis and Manufacturing"
10.1017/s0890060407070102,The need for a science of engineering informatics,WILLIAM REGLI,2007,5,"Artificial Intelligence for Engineering Design, Analysis and Manufacturing"
10.1017/s0890060405050195,Word graphs in architectural design,BAUKE DE VRIES and JORAN JESSURUN and NICOLE SEGERS and HENRI ACHTEN,2005,5,"Artificial Intelligence for Engineering Design, Analysis and Manufacturing"
10.1017/s0890060418000215,CoStorm: a term map system to aid in a collaborative ideation process,Chengwei Zhang and Marcelo López-Parra and Junyu Chen and Ling Tian,2019,0,"Artificial Intelligence for Engineering Design, Analysis and Manufacturing"
10.1017/s0890060411000424,AIE volume 26 issue 1 Cover and Back matter,,2012,0,"Artificial Intelligence for Engineering Design, Analysis and Manufacturing"
10.1017/s0890060409009986,AIE volume 23 issue 1 Cover and Back matter,,2009,0,"Artificial Intelligence for Engineering Design, Analysis and Manufacturing"
10.1017/s0890060414000559,Exploring the effectiveness of parallel systems in distributed design processes subjected to stochastic disruptions,Sourobh Ghosh and Erich Devendorf and Kemper Lewis,2014,1,"Artificial Intelligence for Engineering Design, Analysis and Manufacturing"
10.1017/s0890060414000341,The mechanical transformation and environmentally conscious behavior—ERRATUM,Jay Jungik Son and L.H. Shu,2015,0,"Artificial Intelligence for Engineering Design, Analysis and Manufacturing"
10.1017/s0890060401020029,Visual typology in design: A computational view,HERNAN CASAKIN and WEI DAI,2002,3,"Artificial Intelligence for Engineering Design, Analysis and Manufacturing"
10.1017/s0890060415000268,Affordances and use plans: An analysis of two alternatives to function-based design,Auke J.K. Pols,2015,1,"Artificial Intelligence for Engineering Design, Analysis and Manufacturing"
10.1017/s0890060414000079,Mechanix: A natural sketch interface tool for teaching truss analysis and free-body diagrams,Olufunmilola Atilola and Stephanie Valentine and Hong-Hoe Kim and David Turner and Erin McTigue and Tracy Hammond and Julie Linsey,2014,14,"Artificial Intelligence for Engineering Design, Analysis and Manufacturing"
10.1017/s0890060414000699,Computing the creativeness of amusing advertisements: A Bayesian model of Burma-Shave's muse,Kevin Burns,2015,6,"Artificial Intelligence for Engineering Design, Analysis and Manufacturing"
10.1017/s0890060402164018,"Reflective practice, artificial intelligence, and engineering design: Common trends and interrelationships",W.P.S. DIAS,2002,8,"Artificial Intelligence for Engineering Design, Analysis and Manufacturing"
10.1017/s0890060420000499,Smart design of intelligent companion toys for preschool children,Xin Wang and Nian Yin and Zhinan Zhang,2021,3,"Artificial Intelligence for Engineering Design, Analysis and Manufacturing"
10.1017/s0890060417000439,A bridge to systems thinking in engineering design: An examination of students’ ability to identify functions at varying levels of abstraction,Megan Tomko and Jacob Nelson and Robert L. Nagel and Matthew Bohm and Julie Linsey,2017,4,"Artificial Intelligence for Engineering Design, Analysis and Manufacturing"
10.1017/s0890060405050158,Special Issue: Design computing and cognition,ANDY DONG,2005,0,"Artificial Intelligence for Engineering Design, Analysis and Manufacturing"
10.1017/s0890060407070023,"Happy 20th birthday, AI EDAM",CLIVE L. DYM,2007,0,"Artificial Intelligence for Engineering Design, Analysis and Manufacturing"
10.1017/s0890060414000547,Reasoning about system-level failure behavior from large sets of function-based simulations,David C. Jensen and Oladapo Bello and Christopher Hoyle and Irem Y. Tumer,2014,5,"Artificial Intelligence for Engineering Design, Analysis and Manufacturing"
10.1017/s0890060414000092,"AIEDAM Special Issue, May 2015, Vol. 29, No. 2",Li H. Shu and Ashok K. Goel,2014,0,"Artificial Intelligence for Engineering Design, Analysis and Manufacturing"
10.1017/s0890060421000354,AIE volume 35 issue 3 Cover and Back matter,,2021,0,"Artificial Intelligence for Engineering Design, Analysis and Manufacturing"
10.1017/s089006041600055x,Data-driven process planning for shipbuilding,Jinsong Bao and Xiaohu Zheng and Jianguo Zhang and Xia Ji and Jie Zhang,2018,4,"Artificial Intelligence for Engineering Design, Analysis and Manufacturing"
10.1017/s0890060421000330,A deep learning-based approach to extraction of filler morphology in SEM images with the application of automated quality inspection,Md. Fashiar Rahman and Tzu-Liang (Bill) Tseng and Jianguo Wu and Yuxin Wen and Yirong Lin,2022,1,"Artificial Intelligence for Engineering Design, Analysis and Manufacturing"
10.1017/s0890060419000313,A conceptual tool for environmentally benign design: development and evaluation of a “proof of concept”,Shakuntala Acharya and Amaresh Chakrabarti,2020,4,"Artificial Intelligence for Engineering Design, Analysis and Manufacturing"
10.1017/s0890060413000097,AIE volume 27 issue 2 Cover and Front matter,,2013,0,"Artificial Intelligence for Engineering Design, Analysis and Manufacturing"
10.1017/s0890060415000505,"AI EDAM Special Issue, May 2017, Vol. 31, No. 2",Roger Ghanem and Xiaoping Du,2015,0,"Artificial Intelligence for Engineering Design, Analysis and Manufacturing"
10.1017/s0890060401154077,Architecture and design of a diagnostic information fusion system,KAI GOEBEL,2001,8,"Artificial Intelligence for Engineering Design, Analysis and Manufacturing"
10.1017/s0890060417000105,AIE volume 31 issue 2 Cover and Front matter,,2017,0,"Artificial Intelligence for Engineering Design, Analysis and Manufacturing"
10.1017/s0890060413000267,Ontological characterization of functions: Perspectives for capturing functions and modeling guidelines,Yoshinobu Kitamura and Riichiro Mizoguchi,2013,2,"Artificial Intelligence for Engineering Design, Analysis and Manufacturing"
10.1017/s0890060414000328,A novel hybrid genetic algorithm for the multidepot periodic vehicle routing problem,Mohammad Mirabi,2015,7,"Artificial Intelligence for Engineering Design, Analysis and Manufacturing"
10.1017/s0890060410000041,Images of users and products shown during design processes increase users’ willingness to use the design outcome,Bo T. Christensen,2010,5,"Artificial Intelligence for Engineering Design, Analysis and Manufacturing"
10.1017/s0890060415000438,Dexen: A scalable and extensible platform for experimenting with population-based design exploration algorithms,Patrick Janssen,2015,5,"Artificial Intelligence for Engineering Design, Analysis and Manufacturing"
10.1017/s0890060409000158,Function-based failure propagation for conceptual design,Daniel Krus and Katie Grantham Lough,2009,10,"Artificial Intelligence for Engineering Design, Analysis and Manufacturing"
10.1017/s0890060409000067,Special Issue: Developing and using engineering ontologies,Chris McMahon and Jos van Leeuwen,2009,0,"Artificial Intelligence for Engineering Design, Analysis and Manufacturing"
10.1017/s0890060412000406,"AI EDAM Special Issue, August 2014, Vol. 28, No. 3",Matt Campbell and Kristina Shea,2013,0,"Artificial Intelligence for Engineering Design, Analysis and Manufacturing"
10.1017/s0890060417000208,AIE volume 31 issue 3 Cover and Front matter,,2017,0,"Artificial Intelligence for Engineering Design, Analysis and Manufacturing"
10.1017/s0890060411000266,"AI EDAM Special Issue, August 2013, Vol. 27, No. 3",Pieter Vermaas and Claudia Eckert,2011,0,"Artificial Intelligence for Engineering Design, Analysis and Manufacturing"
10.1017/s0890060409990199,Evaluating an evolutionary method of design style imitation,Andrés Gómez de Silva Garza and Arám Zamora Lores,2011,2,"Artificial Intelligence for Engineering Design, Analysis and Manufacturing"
10.1017/s0890060401152066,Mechanical systems and assemblies modeling using knowledge-intensive Petri nets formalisms,X.F. ZHA and H. DU,2001,11,"Artificial Intelligence for Engineering Design, Analysis and Manufacturing"
10.1017/s0890060421000032,The 35th Year of AI EDAM: Where are We Heading?,Amaresh Chakrabarti,2021,0,"Artificial Intelligence for Engineering Design, Analysis and Manufacturing"
10.1017/s0890060415000402,Evolutionary structural and spatial adaptation of topologically differentiated tensile systems in architectural design,Sean Ahlquist and Dillon Erb and Achim Menges,2015,5,"Artificial Intelligence for Engineering Design, Analysis and Manufacturing"
10.1017/s0890060419000258,Intelligent product-gene acquisition method based on K-means clustering and mutual information-based feature selection algorithm,Pan Li and Yanzhao Ren and Yan Yan and Guoxin Wang,2019,3,"Artificial Intelligence for Engineering Design, Analysis and Manufacturing"
10.1017/s0890060412000303,"AI EDAM Special Issue, May 2014, Vol. 28, No. 2",Tracy Hammond and Julie Linsey,2012,0,"Artificial Intelligence for Engineering Design, Analysis and Manufacturing"
10.1017/s0890060420000207,AIE volume 34 issue 1 Cover and Back matter,,2020,0,"Artificial Intelligence for Engineering Design, Analysis and Manufacturing"
10.1017/s0890060416000470,Learning to predict characteristics for engineering service projects,Lei Shi and Linda Newnes and Steve Culley and Bruce Allen,2017,2,"Artificial Intelligence for Engineering Design, Analysis and Manufacturing"
10.1017/s0890060401154041,Extracting information from free-text aircraft repair notes,BENOIT FARLEY,2001,4,"Artificial Intelligence for Engineering Design, Analysis and Manufacturing"
10.1017/s0890060410000119,"AI EDAM Special Issue, November 2011, Vol. 25, No. 4 Representing and Reasoning About Three-Dimensional Space",Sean Hanna and Bill Regli,2010,0,"Artificial Intelligence for Engineering Design, Analysis and Manufacturing"
10.1017/s0890060414000614,The use of analytics in the design of sociotechnical products,David Van Horn and Kemper Lewis,2015,4,"Artificial Intelligence for Engineering Design, Analysis and Manufacturing"
10.1017/s0890060420000323,Optimization test of a rule-based swarm intelligence simulation for the conceptual design process,Asli Agirbas,2020,1,"Artificial Intelligence for Engineering Design, Analysis and Manufacturing"
10.1017/s0890060410000132,AIE volume 24 issue 1 Cover and Back matter,,2010,0,"Artificial Intelligence for Engineering Design, Analysis and Manufacturing"
10.1017/s0890060421000159,Topology-informed information dynamics modeling in cyber–physical–social system networks,Yan Wang,2021,0,"Artificial Intelligence for Engineering Design, Analysis and Manufacturing"
10.1017/s0890060403171053,Decomposition strategies for configuration problems,DIEGO MAGRO and PIETRO TORASSO,2003,13,"Artificial Intelligence for Engineering Design, Analysis and Manufacturing"
10.1017/s0890060416000408,Discourse analysis based segregation of relevant document segments for knowledge acquisition,N. Madhusudanan and Amaresh Chakrabarti and B. Gurumoorthy,2016,1,"Artificial Intelligence for Engineering Design, Analysis and Manufacturing"
10.1017/s0890060418000173,AIE volume 32 issue 3 Cover and Front matter,,2018,0,"Artificial Intelligence for Engineering Design, Analysis and Manufacturing"
10.1017/s089006041400050x,Improving the systems engineering process with multilevel analysis of interactions,Steven D. Eppinger and Nitin R. Joglekar and Alison Olechowski and Terence Teo,2014,19,"Artificial Intelligence for Engineering Design, Analysis and Manufacturing"
10.1017/s0890060410000211,A study of the role of user-centered design methods in design team projects,Justin Lai and Tomonori Honda and Maria C. Yang,2010,19,"Artificial Intelligence for Engineering Design, Analysis and Manufacturing"
10.1017/s0890060411000217,A coupled configurational description of boundary shape based on distance and directionality,Ermal Shpuza,2011,3,"Artificial Intelligence for Engineering Design, Analysis and Manufacturing"
10.1017/s0890060408000255,Antecedence and consequence in design rationale systems,Vassilis Agouridas and Peter Simons,2008,3,"Artificial Intelligence for Engineering Design, Analysis and Manufacturing"
10.1017/s0890060409000237,Prototyping a tangible tool for design: Multimedia e-paper sticky notes,Maribeth Back and Takashi Matsumoto and Anthony Dunnigan,2009,3,"Artificial Intelligence for Engineering Design, Analysis and Manufacturing"
10.1017/s0890060413000553,AIE volume 28 issue 1 Cover and Front matter,,2014,0,"Artificial Intelligence for Engineering Design, Analysis and Manufacturing"
10.1017/s0890060412000273,The impact of resources on decision making,Iain M. Boyle and Alex H.B. Duffy and R. Ian Whitfield and Shaofeng Liu,2012,3,"Artificial Intelligence for Engineering Design, Analysis and Manufacturing"
10.1017/s0890060406060148,"Special Issue: Understanding, representing, and reasoning about style",CLAUDIA M. ECKERT and ELLEN YI-LUEN DO,2006,1,"Artificial Intelligence for Engineering Design, Analysis and Manufacturing"
10.1017/s0890060416000445,AIE volume 30 issue 4 Cover and Back matter,,2016,0,"Artificial Intelligence for Engineering Design, Analysis and Manufacturing"
10.1017/s0890060409000110,Ontology-based modeling and integration of morphological characteristics of assembly joints for network-based collaborative assembly design,Kyoung-Yun Kim and Seongah Chin and Ohbyung Kwon and R. Darin Ellis,2009,11,"Artificial Intelligence for Engineering Design, Analysis and Manufacturing"
10.1017/s0890060410000089,AIE volume 24 issue 2 Cover and Front matter,,2010,0,"Artificial Intelligence for Engineering Design, Analysis and Manufacturing"
10.1017/s0890060409000973,AIE volume 23 issue 2 Cover and Front matter,,2009,0,"Artificial Intelligence for Engineering Design, Analysis and Manufacturing"
10.1017/s0890060414000134,Reuse of constraint knowledge bases and problem solvers explored in engineering design,Peter M.D. Gray and Trevor Runcie and Derek Sleeman,2015,3,"Artificial Intelligence for Engineering Design, Analysis and Manufacturing"
10.1017/s0890060411000308,"Learning from the past, peering into the future: 25 Years of AI EDAM",Amaresh Chakrabarti,2012,0,"Artificial Intelligence for Engineering Design, Analysis and Manufacturing"
10.1017/s0890060422000221,AIEDAM thematic collection: a perspective on data-enabled design – design meet data science,Jacky Bourgeois and Maaike Kleinsmann,2023,0,"Artificial Intelligence for Engineering Design, Analysis and Manufacturing"
10.1017/s0890060407000224,Support for design teams,Mary Lou Maher and Renate Fruchter,2007,0,"Artificial Intelligence for Engineering Design, Analysis and Manufacturing"
10.1017/s0890060404040211,An approach to the analysis of design concepts using the rough set theory,D. ALISANTOSO and L.P. KHOO and I.B.H. LEE,2004,3,"Artificial Intelligence for Engineering Design, Analysis and Manufacturing"
10.1017/s0890060403173040,Using genetic programming and decision trees for generating structural descriptions of four bar mechanisms,ANIKÓ EKÁRT and ANDRÁS MÁRKUS,2003,11,"Artificial Intelligence for Engineering Design, Analysis and Manufacturing"
10.1017/s0890060401151012,Special Section: Topological representation and reasoning in design and manufacturing,DAN BRAHA,2001,3,"Artificial Intelligence for Engineering Design, Analysis and Manufacturing"
10.1017/s0890060420000268,AIE volume 34 issue 2 Cover and Front matter,,2020,0,"Artificial Intelligence for Engineering Design, Analysis and Manufacturing"
10.1017/s0890060411000254,"AI EDAM Special Issue, May 2013, Vol. 27, No. 2",Maaike Kleinsmann and Anja Maier,2011,0,"Artificial Intelligence for Engineering Design, Analysis and Manufacturing"
10.1017/s089006041600024x,A maintenance-focused approach to complex system design,Bo Yang Yu and Tomonori Honda and Syed M. Zubair and Mostafa H. Sharqawy and Maria C. Yang,2016,4,"Artificial Intelligence for Engineering Design, Analysis and Manufacturing"
10.1017/s0890060415000530,"AI EDAM Special Issue, May 2017, Vol. 31, No. 2",Roger Ghanem and Xiaoping Du,2016,0,"Artificial Intelligence for Engineering Design, Analysis and Manufacturing"
