DOI,Título,Autores,Año,Citas,Revista
10.1162/106365602760972776,Calculating the Expected Loss of Diversity of Selection Schemes,Tatsuya Motoki,2002,37,Evolutionary Computation
10.1162/evco.2007.15.3.345,A New Approach of Data Clustering Using a Flock of Agents,Fabien Picarougne and Hanene Azzag and Gilles Venturini and Christiane Guinot,2007,16,Evolutionary Computation
10.1162/evco.2006.14.2.223,GASAT: A Genetic Local Search Algorithm for the Satisfiability Problem,Frédéric Lardeux and Frédéric Saubion and Jin-Kao Hao,2006,56,Evolutionary Computation
10.1162/106365600568185,Efficient and Scalable Pareto Optimization by Evolutionary Local Selection Algorithms,Filippo Menczer and Melania Degeratu and W. Nick Street,2000,34,Evolutionary Computation
10.1162/evco_a_00260,Diagonal Acceleration for Covariance Matrix Adaptation Evolution Strategies,Y. Akimoto and N. Hansen,2020,23,Evolutionary Computation
10.1162/evco.2006.14.4.383,Linkage Identification by Fitness Difference Clustering,Miwako Tsuji and Masaharu Munetomo and Kiyoshi Akama,2006,17,Evolutionary Computation
10.1162/evco_a_00099,Geometric Differential Evolution for Combinatorial and Programs Spaces,A. Moraglio and J. Togelius and S. Silva,2013,26,Evolutionary Computation
10.1162/evco_a_00212,Probabilistic Analysis of the (1+1)-Evolutionary Algorithm,Hsien-Kuei Hwang and Alois Panholzer and Nicolas Rolin and Tsung-Hsi Tsai and Wei-Mei Chen,2018,19,Evolutionary Computation
10.1162/evco_a_00239,Neuroevolution of a Modular Memory-Augmented Neural Network for Deep Memory Problems,Shauharda Khadka and Jen Jen Chung and Kagan Tumer,2019,7,Evolutionary Computation
10.1162/evco_a_00262,Generating New Space-Filling Test Instances for Continuous Black-Box Optimization,Mario A. Muñoz and Kate Smith-Miles,2020,19,Evolutionary Computation
10.1162/evco_a_00129,Order-2 Stability Analysis of Particle Swarm Optimization,Qunfeng Liu,2015,64,Evolutionary Computation
10.1162/evco_a_00236,Automated Algorithm Selection on Continuous Black-Box Problems by Combining Exploratory Landscape Analysis and Machine Learning,Pascal Kerschke and Heike Trautmann,2019,72,Evolutionary Computation
10.1162/evco.2008.16.4.483,Automated Design of Image Operators that Detect Interest Points,Leonardo Trujillo and Gustavo Olague,2008,72,Evolutionary Computation
10.1162/evco_a_00259,Difficulty Adjustable and Scalable Constrained Multiobjective Test Problem Toolkit,Zhun Fan and Wenji Li and Xinye Cai and Hui Li and Caimin Wei and Qingfu Zhang and Kalyanmoy Deb and Erik Goodman,2020,44,Evolutionary Computation
10.1162/evco_a_00251,Mirrored Orthogonal Sampling for Covariance Matrix Adaptation Evolution Strategies,Hao Wang and Michael Emmerich and Thomas Bäck,2019,8,Evolutionary Computation
10.1162/106365603321829023,Erratum: A Species Conserving Genetic Algorithm for Multimodal Function Optimization,Jian-Ping Li and Marton E. Balazs and Geoffrey T. Parks and P. John Clarkson,2003,14,Evolutionary Computation
10.1162/evco.2009.17.3.307,Performance and Efficiency of Memetic Pittsburgh Learning Classifier Systems,Jaume Bacardit and Natalio Krasnogor,2009,46,Evolutionary Computation
10.1162/evco_a_00122,A Memetic Optimization Strategy Based on Dimension Reduction in Decision Space,Handing Wang and Licheng Jiao and Ronghua Shang and Shan He and Fang Liu,2015,33,Evolutionary Computation
10.1162/evco_a_00137,Determining Relative Importance and Effective Settings for Genetic Algorithm Control Parameters,K. L. Mills and J. J. Filliben and A. L. Haines,2015,28,Evolutionary Computation
10.1162/evco_a_00168,LM-CMA: An Alternative to L-BFGS for Large-Scale Black Box Optimization,Ilya Loshchilov,2017,40,Evolutionary Computation
10.1162/evco.2009.17.4.17409,"Dependency Structure Matrix, Genetic Algorithms, and Effective Recombination",Tian-Li Yu and David E. Goldberg and Kumara Sastry and Claudio F. Lima and Martin Pelikan,2009,67,Evolutionary Computation
10.1162/evco_a_00041,Deductive Sort and Climbing Sort: New Methods for Non-Dominated Sorting,Kent McClymont and Ed Keedwell,2012,79,Evolutionary Computation
10.1162/evco_a_00204,A New Algorithm Using the Non-Dominated Tree to Improve Non-Dominated Sorting,Patrik Gustavsson and Anna Syberfeldt,2018,34,Evolutionary Computation
10.1162/evco.2009.17.1.3,Analyses of Simple Hybrid Algorithms for the Vertex Cover Problem,Tobias Friedrich and Jun He and Nils Hebbinghaus and Frank Neumann and Carsten Witt,2009,30,Evolutionary Computation
10.1162/evco_a_00067,A Novel Mating Approach for Genetic Algorithms,Severino F. Galán and Ole J. Mengshoel and Rafael Pinter,2013,18,Evolutionary Computation
10.1162/evco.2004.12.issue-1,n.m.,,2004,0,Evolutionary Computation
10.1162/evco.2007.15.issue-4,n.m.,,2007,0,Evolutionary Computation
10.1162/106365600568275,Electronic Calendar and Other EC-Related Resources,,2000,0,Evolutionary Computation
10.1162/1063656041775027,Authors' Answer to the Book Review of Introduction to Evolutionary Computing Published in Issue 12:2,A.E. Eiben and J.E. Smith,2004,35,Evolutionary Computation
10.1162/evco_a_00097,On Handling Ephemeral Resource Constraints in Evolutionary Search,Richard Allmendinger and Joshua Knowles,2013,16,Evolutionary Computation
10.1162/1063656043138914,Efficient Linkage Discovery by Limited Probing,Robert B. Heckendorn and Alden H. Wright,2004,44,Evolutionary Computation
10.1162/evco_a_00039,A Methodology to Find the Elementary Landscape Decomposition of Combinatorial Optimization Problems,Francisco Chicano and L. Darrell Whitley and Enrique Alba,2011,23,Evolutionary Computation
10.1162/evco.2000.8.issue-4,n.m.,,2000,0,Evolutionary Computation
10.1162/evco_e_00246,Foreword,Holger Hoos and Frank Neumann and Heike Trautmann,2019,2,Evolutionary Computation
10.1162/evco.2002.10.issue-2,n.m.,,2002,0,Evolutionary Computation
10.1162/1063656043138923,Measures of Diversity for Populations and Distances Between Individuals with Highly Reorganizable Genomes,Claudio Mattiussi and Markus Waibel and Dario Floreano,2004,35,Evolutionary Computation
10.1162/106365600568220,"Building Blocks, Cohort Genetic Algorithms, and Hyperplane-Defined Functions",John H. Holland,2000,124,Evolutionary Computation
10.1162/evco_a_00114,General Upper Bounds on the Runtime of Parallel Evolutionary Algorithms*,Jörg Lässig and Dirk Sudholt,2014,27,Evolutionary Computation
10.1162/106365603322519279,Analysis of Convergence of an Evolutionary Algorithm with Self-Adaptation using a Stochastic Lyapunov function,Mikhail A. Semenov and Dmitri A. Terkel,2003,34,Evolutionary Computation
10.1162/evco_a_00056,Using Previous Models to Bias Structural Learning in the Hierarchical BOA,M. W. Hauschild and M. Pelikan and K. Sastry and D. E. Goldberg,2012,15,Evolutionary Computation
10.1162/evco.2005.13.issue-4,n.m.,,2005,0,Evolutionary Computation
10.1162/106365601750406037,Form Invariance and Implicit Parallelism,Michael D. Vose and Alden H. Wright,2001,15,Evolutionary Computation
10.1162/evco.2010.18.1.18102,Memetic Algorithms for Continuous Optimisation Based on Local Search Chains,Daniel Molina and Manuel Lozano and Carlos García-Martínez and Francisco Herrera,2010,133,Evolutionary Computation
10.1162/evco.2008.16.4.509,Human Body Pose Estimation with Particle Swarm Optimisation,Špela Ivekovič and Emanuele Trucco and Yvan R. Petillot,2008,25,Evolutionary Computation
10.1162/evco_a_00123,Constrained Novelty Search: A Study on Game Content Generation,Antonios Liapis and Georgios N. Yannakakis and Julian Togelius,2015,30,Evolutionary Computation
10.1162/106365604773955120,"At the Crossroads of Evolutionary Computation and Music: Self-Programming Synthesizers, Swarm Orchestras and the Origins of Melody",Eduardo Reck Miranda,2004,21,Evolutionary Computation
10.1162/evco_a_00189,Understanding Innovation Engines: Automated Creativity and Improved Stochastic Optimization via Deep Learning,A. Nguyen and J. Yosinski and J. Clune,2016,24,Evolutionary Computation
10.1162/evco.2008.16.2.151,Step Length Adaptation on Ridge Functions,Dirk V. Arnold and Alexander MacLeod,2008,20,Evolutionary Computation
10.1162/evco.2003.11.issue-1,n.m.,,2003,0,Evolutionary Computation
10.1162/evco.2007.15.3.321,Crossover and Evolutionary Stability in the Prisoner's Dilemma,Xavier Thibert-Plante and Paul Charbonneau,2007,6,Evolutionary Computation
10.1162/evco_a_00270,Evolutionary Image Transition and Painting Using Random Walks,Aneta Neumann and Bradley Alexander and Frank Neumann,2020,7,Evolutionary Computation
10.1162/evco_a_00174,Evolving a Nelder–Mead Algorithm for Optimization with Genetic Programming,Iztok Fajfar and Janez Puhan and Árpád Bűrmen,2017,19,Evolutionary Computation
10.1162/evco_a_00197,Evolutionary Design of Classifiers Made of Droplets Containing a Nonlinear Chemical Medium,Konrad Gizynski and Gerd Gruenert and Peter Dittrich and Jerzy Gorecki,2017,15,Evolutionary Computation
10.1162/evco.2010.18.2.18201,Geometrical Recombination Operators for Real-Coded Evolutionary MCMCs,Mădălina M. Drugan and Dirk Thierens,2010,4,Evolutionary Computation
10.1162/evco.2006.14.3.iii,Editorial Introduction,Marc Schoenauer,2006,0,Evolutionary Computation
10.1162/evco_a_00193,Problem Features versus Algorithm Performance on Rugged Multiobjective Combinatorial Fitness Landscapes,Fabio Daolio and Arnaud Liefooghe and Sébastien Verel and Hernán Aguirre and Kiyoshi Tanaka,2017,18,Evolutionary Computation
10.1162/10636560151075112,Gene Expression and Fast Construction of Distributed Evolutionary Representation,Hillol Kargupta and Byung-Hoon Park,2001,26,Evolutionary Computation
10.1162/106365602760972785,Electronic Calendar and Other EC-Related Resources,,2002,0,Evolutionary Computation
10.1162/1063656053583496,Estimation of Distribution Algorithms with Kikuchi Approximations,Roberto Santana,2005,67,Evolutionary Computation
10.1162/1063656053583469,The Estimation of Distributions and the Minimum Relative Entropy Principle,Heinz Mühlenbein and Robin Höns,2005,67,Evolutionary Computation
10.1162/evco.2007.15.2.199,Reducing the Number of Fitness Evaluations in Graph Genetic Programming Using a Canonical Graph Indexed Database,Jens Niehaus and Christian Igel and Wolfgang Banzhaf,2007,11,Evolutionary Computation
10.1162/evco.2007.15.1.95,Understanding the Biases of Generalised Recombination: Part II,Riccardo Poli and Christopher R. Stephens,2007,1,Evolutionary Computation
10.1162/106365603322519297,An Adaptive Sharing Elitist Evolution Strategy for Multiobjective Optimization,Lino Costa and Pedro Oliveira,2003,16,Evolutionary Computation
10.1162/evco.2008.16.1.63,Finding Alternatives and Reduced Formulations for Process-Based Models,Knut Bernhardt,2008,5,Evolutionary Computation
10.1162/106365603766646834,Electronic Calendar and Other EC-Related Resources,,2003,0,Evolutionary Computation
10.1162/evco_a_00125,"On the Behaviour of the (1, λ)-ES for Conically Constrained Linear Problems",Dirk V. Arnold,2014,7,Evolutionary Computation
10.1162/evco.2004.12.1.136,Electronic Calendar and Other EC-Related Resources,,2004,0,Evolutionary Computation
10.1162/106365602317301745,Editorial Introduction,Darrell Whitley,2002,0,Evolutionary Computation
10.1162/106365601750406046,Adversarial Search by Evolutionary Computation,Tzung-Pei Hong and Ke-Yuan Huang and Wen-Yang Lin,2001,8,Evolutionary Computation
10.1162/evco_a_00176,"Generating, Maintaining, and Exploiting Diversity in a Memetic Algorithm for Protein Structure Prediction",Mario Garza-Fabre and Shaun M. Kandathil and Julia Handl and Joshua Knowles and Simon C. Lovell,2016,35,Evolutionary Computation
10.1162/evco_a_00200,Performance Analysis of Evolutionary Algorithms for Steiner Tree Problems,Xinsheng Lai and Yuren Zhou and Xiaoyun Xia and Qingfu Zhang,2017,7,Evolutionary Computation
10.1162/evco_a_00181,"Solving Multiple Isolated, Interleaved, and Blended Tasks through Modular Neuroevolution",Jacob Schrum and Risto Miikkulainen,2016,7,Evolutionary Computation
10.1162/evco_a_00144,Design Mining Interacting Wind Turbines,Richard J. Preen and Larry Bull,2016,5,Evolutionary Computation
10.1162/evco_a_00149,On the Performance of Different Genetic Programming Approaches for the SORTING Problem,Markus Wagner and Frank Neumann and Tommaso Urli,2015,3,Evolutionary Computation
10.1162/106365602760972758,Embedded Landscapes,Robert B. Heckendorn,2002,28,Evolutionary Computation
10.1162/evco_a_00141,odNEAT: An Algorithm for Decentralised Online Evolution of Robotic Controllers,Fernando Silva and Paulo Urbano and Luís Correia and Anders Lyhne Christensen,2015,29,Evolutionary Computation
10.1162/106365603321828989,Qualms Regarding the Optimality of Cumulative Path Length Control in CSA/CMA-Evolution Strategies,Hans-Georg Beyer and Dirk V. Arnold,2003,31,Evolutionary Computation
10.1162/106365600750078781,"Analysis of the (μ/μ, λ)-ES on the Parabolic Ridge",A. Irfan Oyman and Hans-Georg Beyer,2000,14,Evolutionary Computation
10.1162/evco_a_00077,No Free Lunch and Benchmarks,Edgar A. Duéñez-Guzmán and Michael D. Vose,2013,16,Evolutionary Computation
10.1162/evco.2007.15.3.369,A Graph-Based Evolutionary Algorithm: Genetic Network Programming (GNP) and Its Extension Using Reinforcement Learning,Shingo Mabu and Kotaro Hirasawa and Jinglu Hu,2007,221,Evolutionary Computation
10.1162/evco_a_00225,On the Runtime Analysis of the Clearing Diversity-Preserving Mechanism,Edgar Covantes Osuna and Dirk Sudholt,2019,8,Evolutionary Computation
10.1162/evco_a_00086,Energy Landscapes of Atomic Clusters as Black Box Optimization Benchmarks,C. L. Müller and I. F. Sbalzarini,2012,10,Evolutionary Computation
10.1162/evco_a_00061,On the Effect of Response Transformations in Sequential Parameter Optimization,Tobias Wagner and Simon Wessing,2012,6,Evolutionary Computation
10.1162/evco_a_00132,Convergence Analysis of Evolutionary Algorithms That Are Based on the Paradigm of Information Geometry,Hans-Georg Beyer,2014,32,Evolutionary Computation
10.1162/10636560152642841,Learning to Solve Planning Problems Efficiently by Means of Genetic Programming,Ricardo Aler and Daniel Borrajo and Pedro Isasi,2001,11,Evolutionary Computation
10.1162/evco_a_00080,Dynamical Genetic Programming in XCSF,Richard J. Preen and Larry Bull,2013,6,Evolutionary Computation
10.1162/106365603766646807,Mapping the Royal Road and Other Hierarchical Functions,Janet Wiles and Bradley Tonkes,2003,5,Evolutionary Computation
10.1162/evco.2009.17.1.89,A Generic Multi-dimensional Feature Extraction Method Using Multiobjective Genetic Programming,Yang Zhang and Peter I. Rockett,2009,24,Evolutionary Computation
10.1162/evco_a_00231,Data-Efficient Design Exploration through Surrogate-Assisted Illumination,Adam Gaier and Alexander Asteroth and Jean-Baptiste Mouret,2018,19,Evolutionary Computation
10.1162/evco.2007.15.2.169,An Information-Theoretic Analysis on the Interactions of Variables in Combinatorial Optimization Problems,Dong-Il Seo and Byung-Ro Moon,2007,19,Evolutionary Computation
10.1162/evco.2009.17.4.17401,Analysis of Diversity-Preserving Mechanisms for Global Exploration,Tobias Friedrich and Pietro S. Oliveto and Dirk Sudholt and Carsten Witt,2009,68,Evolutionary Computation
10.1162/evco_a_00066,Multi-Objective Optimization with Estimation of Distribution Algorithm in a Noisy Environment,Vui Ann Shim and Kay Chen Tan and Jun Yong Chia and Abdullah Al Mamun,2013,31,Evolutionary Computation
10.1162/evco_a_00112,On a Vector Space Representation in Genetic Algorithms for Sensor Scheduling in Wireless Sensor Networks,F. V. C. Martins and E. G. Carrano and E. F. Wanner and R. H. C. Takahashi and G. R. Mateus and F. G. Nakamura,2014,9,Evolutionary Computation
10.1162/106365604773955139,Ideal Evaluation from Coevolution,Edwin D. de Jong and Jordan B. Pollack,2004,99,Evolutionary Computation
10.1162/evco_a_00234,Search Dynamics on Multimodal Multiobjective Problems,P. Kerschke and H. Wang and M. Preuss and C. Grimme and A. H. Deutz and H. Trautmann and M. T. M. Emmerich,2019,17,Evolutionary Computation
10.1162/evco_a_00186,A Hidden Markov Model Approach to the Problem of Heuristic Selection in Hyper-Heuristics with a Case Study in High School Timetabling Problems,Ahmed Kheiri and Ed Keedwell,2017,27,Evolutionary Computation
10.1162/evco_a_00214,Cooperative Coevolution with Formula-Based Variable Grouping for Large-Scale Global Optimization,Yuping Wang and Haiyan Liu and Fei Wei and Tingting Zong and Xiaodong Li,2018,28,Evolutionary Computation
10.1162/evco.2008.16.1.31,Automated Discovery of Local Search Heuristics for Satisfiability Testing,Alex S. Fukunaga,2008,110,Evolutionary Computation
10.1162/evco_a_00117,An Adaptive Multi-Swarm Optimizer for Dynamic Optimization Problems,Changhe Li and Shengxiang Yang and Ming Yang,2014,46,Evolutionary Computation
10.1162/106365600568266,Embodiment of Evolutionary Computation in General Agents,Robert E. Smith and Claudio Bonacina and Paul Kearney and Walter Merlat,2000,14,Evolutionary Computation
10.1162/106365603766646799,On the Benefits of Populations for Noisy Optimization,Dirk V. Arnold and Hans-Georg Beyer,2003,22,Evolutionary Computation
10.1162/evco_a_00002,Learning Factorizations in Estimation of Distribution Algorithms Using Affinity Propagation,Roberto Santana and Pedro Larrañaga and José A. Lozano,2010,18,Evolutionary Computation
10.1162/106365603322365315,For Real! XCS with Continuous-Valued Inputs,Christopher Stone and Larry Bull,2003,102,Evolutionary Computation
10.1162/evco_a_00015,An Efficient and Accurate Solution Methodology for Bilevel Multi-Objective Programming Problems Using a Hybrid Evolutionary-Local-Search Algorithm,Kalyanmoy Deb and Ankur Sinha,2010,110,Evolutionary Computation
10.1162/evco_a_00105,Genetic Programming for Evolving Due-Date Assignment Models in Job Shop Environments,Su Nguyen and Mengjie Zhang and Mark Johnston and Kay Chen Tan,2014,27,Evolutionary Computation
10.1162/evco_a_00152,Evolving Gaussian Mixture Models with Splitting and Merging Mutation Operators,Thiago Ferreira Covões and Eduardo Raul Hruschka and Joydeep Ghosh,2016,3,Evolutionary Computation
10.1162/1063656054088530,The Hierarchical Fair Competition (HFC) Framework for Sustainable Evolutionary Algorithms,Jianjun Hu and Erik Goodman and Kisung Seo and Zhun Fan and Rondal Rosenberg,2005,67,Evolutionary Computation
10.1162/evco_a_00226,How to Specify a Reference Point in Hypervolume Calculation for Fair Performance Comparison,Hisao Ishibuchi and Ryo Imada and Yu Setoguchi and Yusuke Nojima,2018,100,Evolutionary Computation
10.1162/106365605774666895,Evaluating the ε-Domination Based Multi-Objective Evolutionary Algorithm for a Quick Computation of Pareto-Optimal Solutions,Kalyanmoy Deb and Manikanth Mohan and Shikhar Mishra,2005,481,Evolutionary Computation
10.1162/106365600568202,Comparison of Multiobjective Evolutionary Algorithms: Empirical Results,Eckart Zitzler and Kalyanmoy Deb and Lothar Thiele,2000,3780,Evolutionary Computation
