DOI,Título,Autores,Año,Citas,Revista
10.1109/tetci.2022.3220224,DLB: A Dynamic Load Balance Strategy for Distributed Training of Deep Neural Networks,Qing Ye and Yuhao Zhou and Mingjia Shi and Yanan Sun and Jiancheng Lv,2022,0,IEEE Transactions on Emerging Topics in Computational Intelligence
10.1109/tetci.2022.3221483,Variational Reinforcement Learning for Hyper-Parameter Tuning of Adaptive Evolutionary Algorithm,Haotian Zhang and Jianyong Sun and Yuhao Wang and Jialong Shi and Zongben Xu,2022,0,IEEE Transactions on Emerging Topics in Computational Intelligence
10.1109/tetci.2019.2907724,On the Computational Power of Asynchronous Axon Membrane Systems,Tao Song and Pan Zheng and M. L. Dennis Wong and Min Jiang and Xiangxiang Zeng,2020,7,IEEE Transactions on Emerging Topics in Computational Intelligence
10.1109/tetci.2022.3140375,Optimal Actor-Critic Policy With Optimized Training Datasets,Chayan Banerjee and Zhiyong Chen and Nasimul Noman and Mohsen Zamani,2022,0,IEEE Transactions on Emerging Topics in Computational Intelligence
10.1109/tetci.2018.2867401,IEEE Transactions on Emerging Topics in Computational Intelligence,,2018,0,IEEE Transactions on Emerging Topics in Computational Intelligence
10.1109/tetci.2022.3141062,Interval-Valued Intuitionistic Fuzzy Decision With Graph Pattern in Big Graph,Lei Li and Lan Jiang and Chenyang Bu and Yi Zhu and Xindong Wu,2022,1,IEEE Transactions on Emerging Topics in Computational Intelligence
10.1109/tetci.2022.3214826,Foreground Fusion-Based Liquefied Natural Gas Leak Detection Framework From Surveillance Thermal Imaging,Junchi Bin and Zhila Bahrami and Choudhury A. Rahman and Shan Du and Shane Rogers and Zheng Liu,2022,0,IEEE Transactions on Emerging Topics in Computational Intelligence
10.1109/tetci.2021.3107488,Optimal Searching Time Allocation for Information Collection Under Cooperative Path Planning of Multiple UAVs,Yanmin Li and Lihua Liu and Jibing Wu and Mao Wang and Haohao Zhou and Hongbin Huang,2022,1,IEEE Transactions on Emerging Topics in Computational Intelligence
10.1109/tetci.2018.2867377,IEEE Transactions on Emerging Topics in Computational Intelligence,,2018,0,IEEE Transactions on Emerging Topics in Computational Intelligence
10.1109/tetci.2018.2867403,Table of Contents,,2018,0,IEEE Transactions on Emerging Topics in Computational Intelligence
10.1109/tetci.2017.2788521,IEEE Transactions on Emerging Topics in Computational Intelligence,,2018,0,IEEE Transactions on Emerging Topics in Computational Intelligence
10.1109/tetci.2023.3234564,Construction of Polar Codes Based on Memetic Algorithm,Ling Liu and Wenhao Yuan and Zhengping Liang and Xiaoliang Ma and Zexuan Zhu,2023,0,IEEE Transactions on Emerging Topics in Computational Intelligence
10.1109/tetci.2020.3005736,Some Generalized Integrals Applied in Scientometrics and Related Evaluation,LeSheng Jin and Radko Mesiar and Andrea Stupnanova and Ronald R. Yager,2021,6,IEEE Transactions on Emerging Topics in Computational Intelligence
10.1109/tetci.2020.3014923,EMODMI: A Multi-Objective Optimization Based Method to Identify Disease Modules,Ye Tian and Xiaochun Su and Yansen Su and Xingyi Zhang,2021,30,IEEE Transactions on Emerging Topics in Computational Intelligence
10.1109/tetci.2020.3035407,An End-to-End Network for Image De-Hazing and Beyond,Akshay Dudhane and Prashant W. Patil and Subrahmanyam Murala,2022,6,IEEE Transactions on Emerging Topics in Computational Intelligence
10.1109/tetci.2018.2809182,IEEE Transactions on Emerging Topics in Computational Intelligence,,2018,0,IEEE Transactions on Emerging Topics in Computational Intelligence
10.1109/tetci.2021.3136642,Triple Cross-Domain Attention on Human Activity Recognition Using Wearable Sensors,Yin Tang and Lei Zhang and Qi Teng and Fuhong Min and Aiguo Song,2022,11,IEEE Transactions on Emerging Topics in Computational Intelligence
10.1109/tetci.2021.3049727,IEEE Transactions on Emerging Topics in Computational Intelligence,,2021,0,IEEE Transactions on Emerging Topics in Computational Intelligence
10.1109/tetci.2021.3109765,Table of Contents,,2021,0,IEEE Transactions on Emerging Topics in Computational Intelligence
10.1109/tetci.2021.3094098,Table of Contents,,2021,0,IEEE Transactions on Emerging Topics in Computational Intelligence
10.1109/tetci.2021.3086577,IEEE Computational Intelligence Society,,2021,0,IEEE Transactions on Emerging Topics in Computational Intelligence
10.1109/tetci.2021.3125588,IEEE Computational Intelligence Society,,2021,0,IEEE Transactions on Emerging Topics in Computational Intelligence
10.1109/tetci.2021.3131352,Machine Learning-Backed Planning of Rapid COVID-19 Tests With Autonomous Vehicles With Zero-Day Considerations,Murat Simsek and Burak Kantarci and Azzedine Boukerche and Shahzad Khan,2022,0,IEEE Transactions on Emerging Topics in Computational Intelligence
10.1109/tetci.2022.3140368,IEEE Transactions on Emerging Topics in Computational Intelligence IEEE,,2022,0,IEEE Transactions on Emerging Topics in Computational Intelligence
10.1109/tetci.2022.3140366,Table of Contents,,2022,0,IEEE Transactions on Emerging Topics in Computational Intelligence
10.1109/tetci.2022.3157784,IEEE Transactions on Emerging Topics in Computational Intelligence,,2022,0,IEEE Transactions on Emerging Topics in Computational Intelligence
10.1109/tetci.2020.3037918,Neural Network Training for Uncertainty Quantification Over Time-Range,H. M. Dipu Kabir and Abbas Khosravi and Saeid Nahavandi and Dipti Srinivasan,2021,5,IEEE Transactions on Emerging Topics in Computational Intelligence
10.1109/tetci.2021.3074919,Information Cartography in Association Rule Mining,I. Fister and I. Fister,2022,6,IEEE Transactions on Emerging Topics in Computational Intelligence
10.1109/tetci.2020.3034702,2020 List of Reviewers,,2020,0,IEEE Transactions on Emerging Topics in Computational Intelligence
10.1109/tetci.2020.3020440,IEEE Computational Intelligence Society,,2020,0,IEEE Transactions on Emerging Topics in Computational Intelligence
10.1109/tetci.2020.2964188,IEEE Transactions on Emerging Topics in Computational Intelligence,,2020,0,IEEE Transactions on Emerging Topics in Computational Intelligence
10.1109/tetci.2020.3020436,Table of Contents,,2020,0,IEEE Transactions on Emerging Topics in Computational Intelligence
10.1109/tetci.2020.2964186,IEEE Transactions on Emerging Topics in Computational Intelligence,,2020,0,IEEE Transactions on Emerging Topics in Computational Intelligence
10.1109/tetci.2020.3007698,IEEE Computational Intelligence Society,,2020,0,IEEE Transactions on Emerging Topics in Computational Intelligence
10.1109/tetci.2018.2883348,Person Re-Identification Based on Heterogeneous Part-Based Deep Network in Camera Networks,Zhong Zhang and Meiyan Huang,2020,5,IEEE Transactions on Emerging Topics in Computational Intelligence
10.1109/tetci.2017.2755692,Scheduling for Time-Constrained Big-File Transfer Over Multiple Paths in Cloud Computing,Chuan Lin and Yuanguo Bi and Guangjie Han and Jucheng Yang and Hai Zhao and Zheng Liu,2018,9,IEEE Transactions on Emerging Topics in Computational Intelligence
10.1109/tetci.2022.3220131,IEEE Transactions on Emerging Topics in Computational Intelligence Publication Information,,2022,0,IEEE Transactions on Emerging Topics in Computational Intelligence
10.1109/tetci.2017.2669187,A Model-Driven Approach to Enable Adaptive QoS in DDS-Based Middleware,Juan F. Ingles-Romero and Adrian Romero-Garces and Cristina Vicente-Chicote and Jesus Martinez,2017,15,IEEE Transactions on Emerging Topics in Computational Intelligence
10.1109/tetci.2022.3204293,Guest Editorial Special Issue on Computational Intelligence in Big Graph Data Management,Guanfeng Liu and An Liu and Qing Li and Huanhuan Chen and Deepak Puthal,2022,0,IEEE Transactions on Emerging Topics in Computational Intelligence
10.1109/tetci.2020.3043764,Energy-Based Dropout in Restricted Boltzmann Machines: Why Not Go Random,Mateus Roder and Gustavo Henrique de Rosa and Victor Hugo C. de Albuquerque and Andre L. D. Rossi and Joao P. Papa,2022,3,IEEE Transactions on Emerging Topics in Computational Intelligence
10.1109/tetci.2022.3174025,IEEE Computational Intelligence Society,,2022,0,IEEE Transactions on Emerging Topics in Computational Intelligence
10.1109/tetci.2021.3102214,Intelligent Resource Allocation and Task Offloading Model for IoT Applications in Fog Networks: A Game-Theoretic Approach,Adila Mebrek and Abdulsalam Yassine,2021,3,IEEE Transactions on Emerging Topics in Computational Intelligence
10.1109/tetci.2018.2869919,Coevolutionary Fuzzy Attribute Order Reduction With Complete Attribute-Value Space Tree,Weiping Ding and Isaac Triguero and Chin-Teng Lin,2021,5,IEEE Transactions on Emerging Topics in Computational Intelligence
10.1109/tetci.2022.3170514,Distributed Continuous and Discrete Time Projection Neurodynamic Approaches for Sparse Recovery,You Zhao and Xiaofeng Liao and Xing He,2022,1,IEEE Transactions on Emerging Topics in Computational Intelligence
10.1109/tetci.2022.3145706,Knowledge-Based Reinforcement Learning and Estimation of Distribution Algorithm for Flexible Job Shop Scheduling Problem,Yu Du and Jun-qing Li and Xiao-long Chen and Pei-yong Duan and Quan-ke Pan,2022,16,IEEE Transactions on Emerging Topics in Computational Intelligence
10.1109/tetci.2023.3240221,A Surrogate-Assisted Two-Stage Differential Evolution for Expensive Constrained Optimization,Yuanchao Liu and Jianchang Liu and Yaochu Jin and Fei Li and Tianzi Zheng,2023,0,IEEE Transactions on Emerging Topics in Computational Intelligence
10.1109/tetci.2018.2872404,Sparse Learning of Higher-Order Statistics for Communications and Sensing,Zhuo Sun and Song Kong and Wenbo Wang,2020,2,IEEE Transactions on Emerging Topics in Computational Intelligence
10.1109/tetci.2018.2867375,Guest Editorial: Special Issue on Large-Scale Memristive Systems and Neurochips for Computational Intelligence,A. Pappachen James and K. Nabil Salama and H. Li and D. Biolek and G. Indiveri and L. O. Chua,2018,1,IEEE Transactions on Emerging Topics in Computational Intelligence
10.1109/tetci.2017.2665592,Routing Multiple Vehicles Cooperatively: Minimizing Road Network Breakdown Probability,Hongliang Guo and Zhiguang Cao and Madhavan Seshadri and Jie Zhang and Dusit Niyato and Ulrich Fastenrath,2017,16,IEEE Transactions on Emerging Topics in Computational Intelligence
10.1109/tetci.2022.3209394,Generative Adversarial Neural Machine Translation for Phonetic Languages via Reinforcement Learning,Amit Kumar and Ajay Pratap and Anil Kumar Singh,2023,0,IEEE Transactions on Emerging Topics in Computational Intelligence
10.1109/tetci.2023.3249255,"Can Graph Neural Networks Go Deeper Without Over-Smoothing? Yes, With a Randomized Path Exploration!",Kushal Bose and Swagatam Das,2023,0,IEEE Transactions on Emerging Topics in Computational Intelligence
10.1109/tetci.2018.2864555,Intuitionistic Fuzzy Logit Model of Discrete Choice,Manish Aggarwal and Madasu Hanmandlu and Mark T. Keane and Kanad. K. Biswas,2019,2,IEEE Transactions on Emerging Topics in Computational Intelligence
10.1109/tetci.2019.2951208,2019 List of Reviewers,,2019,0,IEEE Transactions on Emerging Topics in Computational Intelligence
10.1109/tetci.2019.2960994,2019 Index IEEE Transactions on Emerging Topics in Computational Intelligence Vol. 3,,2019,0,IEEE Transactions on Emerging Topics in Computational Intelligence
10.1109/tetci.2017.2669083,Rating Credits of Online Merchants Using Negative Ranks,Wenjian Luo and Hao Jiang and Dongdong Zhao,2017,17,IEEE Transactions on Emerging Topics in Computational Intelligence
10.1109/tetci.2019.2892762,Selective Transfer Classification Learning With Classification-Error-Based Consensus Regularization,Wenlong Hang and Shuang Liang and Kup-Sze Choi and Fu-Lai Chung and Shitong Wang,2021,3,IEEE Transactions on Emerging Topics in Computational Intelligence
10.1109/tetci.2022.3168507,"Virtual Hardware-in-the-Loop FMU Co-Simulation Based Digital Twins for Heating, Ventilation, and Air-Conditioning (HVAC) Systems",Saber Abrazeh and Saeid-Reza Mohseni and Meisam Jahanshahi Zeitouni and Ahmad Parvaresh and Arman Fathollahi and Meysam Gheisarnejad and Mohammad-Hassan Khooban,2023,1,IEEE Transactions on Emerging Topics in Computational Intelligence
10.1109/tetci.2022.3182415,Taking Away Both Model and Data: Remember Training Data by Parameter Combinations,Wenjian Luo and Licai Zhang and Peiyi Han and Chuanyi Liu and Rongfei Zhuang,2022,0,IEEE Transactions on Emerging Topics in Computational Intelligence
10.1109/tetci.2021.3127925,Multi-Robot Learning Dynamic Obstacle Avoidance in Formation With Information-Directed Exploration,Junjie Cao and Yujie Wang and Yong Liu and Xuesong Ni,2022,1,IEEE Transactions on Emerging Topics in Computational Intelligence
10.1109/tetci.2022.3204616,IEEE Transactions on Emerging Topics in Computational Intelligence Information for Authors,,2022,0,IEEE Transactions on Emerging Topics in Computational Intelligence
10.1109/tetci.2022.3183679,FSNet: Dual Interpretable Graph Convolutional Network for Alzheimer’s Disease Analysis,Hengxin Li and Xiaoshuang Shi and Xiaofeng Zhu and Shuihua Wang and Zheng Zhang,2023,1,IEEE Transactions on Emerging Topics in Computational Intelligence
10.1109/tetci.2021.3086226,Double Fourier Integral Analysis Based Convolutional Neural Network Regression for High-Frequency Energy Disaggregation,Pascal A. Schirmer and Iosif Mporas,2022,3,IEEE Transactions on Emerging Topics in Computational Intelligence
10.1109/tetci.2022.3228538,Surrogate-Assisted Cooperative Co-evolutionary Reservoir Architecture Search for Liquid State Machines,Yan Zhou and Yaochu Jin and Yao Sun and Jinliang Ding,2023,0,IEEE Transactions on Emerging Topics in Computational Intelligence
10.1109/tetci.2019.2961190,SCA2: Novel Efficient Swarm Clustering Algorithm,Wenjian Luo and Wenjie Zhu and Li Ni and Yingying Qiao and Yigui Yuan,2021,6,IEEE Transactions on Emerging Topics in Computational Intelligence
10.1109/tetci.2022.3232821,Generalized Graph Neural Network-Based Detection of False Data Injection Attacks in Smart Grids,Abdulrahman Takiddin and Rachad Atat and Muhammad Ismail and Osman Boyaci and Katherine R. Davis and Erchin Serpedin,2023,1,IEEE Transactions on Emerging Topics in Computational Intelligence
10.1109/tetci.2019.2921787,Realizing Behavior Level Associative Memory Learning Through Three-Dimensional Memristor-Based Neuromorphic Circuits,Hongyu An and Qiyuan An and Yang Yi,2021,13,IEEE Transactions on Emerging Topics in Computational Intelligence
10.1109/tetci.2020.2977678,Unsupervised Representation Disentanglement Using Cross Domain Features and Adversarial Learning in Variational Autoencoder Based Voice Conversion,Wen-Chin Huang and Hao Luo and Hsin-Te Hwang and Chen-Chou Lo and Yu-Huai Peng and Yu Tsao and Hsin-Min Wang,2020,13,IEEE Transactions on Emerging Topics in Computational Intelligence
10.1109/tetci.2023.3235465,Guest Editorial Special Issue on Explainable Deep Learning for Medical Image Processing and Analysis,Yu-Dong Zhang and Juan Manuel Gorriz and Yi Pan and Oscar Cordon,2023,0,IEEE Transactions on Emerging Topics in Computational Intelligence
10.1109/tetci.2020.3047410,Matrix-Based Evolutionary Computation,Zhi-Hui Zhan and Jun Zhang and Ying Lin and Jian-Yu Li and Ting Huang and Xiao-Qi Guo and Feng-Feng Wei and Sam Kwong and Xin-Yi Zhang and Rui You,2022,22,IEEE Transactions on Emerging Topics in Computational Intelligence
10.1109/tetci.2016.2641452,Model-Free Fault Detection and Isolation in Large-Scale Cyber-Physical Systems,Cesare Alippi and Stavros Ntalampiras and Manuel Roveri,2017,47,IEEE Transactions on Emerging Topics in Computational Intelligence
10.1109/tetci.2023.3245103,Generalizable Segmentation of COVID-19 Infection From Multi-Site Tomography Scans: A Federated Learning Framework,Weiping Ding and Mohamed Abdel-Basset and Hossam Hawash and Mahardhika Pratama and Witold Pedrycz,2023,0,IEEE Transactions on Emerging Topics in Computational Intelligence
10.1109/tetci.2020.2997031,EEG-Based Drowsiness Estimation for Driving Safety Using Deep Q-Learning,Yurui Ming and Dongrui Wu and Yu-Kai Wang and Yuhui Shi and Chin-Teng Lin,2021,7,IEEE Transactions on Emerging Topics in Computational Intelligence
10.1109/tetci.2020.3032662,Detecting Disorders of Consciousness in Brain Injuries From EEG Connectivity Through Machine Learning,Fang Wang and Yu-Chu Tian and Xueying Zhang and Fengyun Hu,2022,2,IEEE Transactions on Emerging Topics in Computational Intelligence
10.1109/tetci.2020.2968599,Static2Dynamic: Video Inference From a Deep Glimpse,Yu-Ying Yeh and Yen-Cheng Liu and Wei-Chen Chiu and Yu-Chiang Frank Wang,2020,3,IEEE Transactions on Emerging Topics in Computational Intelligence
10.1109/tetci.2022.3141105,A Survey of Embodied AI: From Simulators to Research Tasks,Jiafei Duan and Samson Yu and Hui Li Tan and Hongyuan Zhu and Cheston Tan,2022,13,IEEE Transactions on Emerging Topics in Computational Intelligence
10.1109/tetci.2019.2909930,Adaptive Feature Selection-Based AdaBoost-KNN With Direct Optimization for Dynamic Emotion Recognition in Human–Robot Interaction,Luefeng Chen and Min Li and Wanjuan Su and Min Wu and Kaoru Hirota and Witold Pedrycz,2021,20,IEEE Transactions on Emerging Topics in Computational Intelligence
10.1109/tetci.2019.2948151,Audio Metric Learning by Using Siamese Autoencoders for One-Shot Human Fall Detection,Diego Droghini and Stefano Squartini and Emanuele Principi and Leonardo Gabrielli and Francesco Piazza,2021,10,IEEE Transactions on Emerging Topics in Computational Intelligence
10.1109/tetci.2022.3174915,LS-HH: A Learning-Based Selection Hyper-Heuristic for Distributed Heterogeneous Hybrid Blocking Flow-Shop Scheduling,Zhongshi Shao and Weishi Shao and Dechang Pi,2023,3,IEEE Transactions on Emerging Topics in Computational Intelligence
10.1109/tetci.2018.2865223,Collaborative Energy Management for a Residential Community: A Non-Cooperative and Evolutionary Approach,Batchu Rajasekhar and Naran Pindoriya and Wayes Tushar and Chau Yuen,2019,35,IEEE Transactions on Emerging Topics in Computational Intelligence
10.1109/tetci.2018.2866239,Community Preserving Network Embedding Based on Memetic Algorithm,Maoguo Gong and Cheng Chen and Yu Xie and Shanfeng Wang,2020,14,IEEE Transactions on Emerging Topics in Computational Intelligence
10.1109/tetci.2017.2748151,A New Design Method for Stable IIR Filters With Nearly Linear-Phase Response Based on Fractional Derivative and Swarm Intelligence,Nikhil Agrawal and Anil Kumar and Varun Bajaj,2017,14,IEEE Transactions on Emerging Topics in Computational Intelligence
10.1109/tetci.2023.3251352,Dynamic Multi-Objective Optimization Framework With Interactive Evolution for Sequential Recommendation,Wei Zhou and Yong Liu and Min Li and Yu Wang and Zhiqi Shen and Liang Feng and Zexuan Zhu,2023,0,IEEE Transactions on Emerging Topics in Computational Intelligence
10.1109/tetci.2018.2880771,Decentralized Online Learning Methods Based on Weight-Balancing Over Time-Varying Digraphs,Changqiao Xu and Junlong Zhu and Dapeng Oliver Wu,2021,9,IEEE Transactions on Emerging Topics in Computational Intelligence
10.1109/tetci.2017.2761915,Stacked-Structure-Based Hierarchical Takagi-Sugeno-Kang Fuzzy Classification Through Feature Augmentation,Ta Zhou and Hisao Ishibuchi and Shitong Wang,2017,14,IEEE Transactions on Emerging Topics in Computational Intelligence
10.1109/tetci.2021.3110086,Compactness Preserving Community Computation Via a Network Generative Process,Jie Cao and Yuyao Wang and Zhan Bu and Youquan Wang and Haicheng Tao and Guixiang Zhu,2022,2,IEEE Transactions on Emerging Topics in Computational Intelligence
10.1109/tetci.2019.2936641,Guest Editorial: Special Issue on New Advances in Deep-Transfer Learning,Z. Deng and J. Lu and D. Wu and K.-S. Choi and S. Sun and Y. Nojima,2019,5,IEEE Transactions on Emerging Topics in Computational Intelligence
10.1109/tetci.2018.2865205,Relative Vehicle Displacement Approach for Path Tracking Adaptive Controller With Multisampling Data Transmission,Aniket K. Kar and Narendra Kumar Dhar and Pankaj Kumar Mishra and Nishchal K. Verma,2019,4,IEEE Transactions on Emerging Topics in Computational Intelligence
10.1109/tetci.2018.2864554,Computational Intelligence in Automatic Face Age Estimation: A Survey,Omaima FathElrahman Osman and Moi Hoon Yap,2019,12,IEEE Transactions on Emerging Topics in Computational Intelligence
10.1109/tetci.2022.3166555,Decision Making in Monopoly Using a Hybrid Deep Reinforcement Learning Approach,Trevor Bonjour and Marina Haliem and Aala Alsalem and Shilpa Thomas and Hongyu Li and Vaneet Aggarwal and Mayank Kejriwal and Bharat Bhargava,2022,1,IEEE Transactions on Emerging Topics in Computational Intelligence
10.1109/tetci.2020.3007905,A Review on Computational Intelligence Techniques in Cloud and Edge Computing,Muhammad Asim and Yong Wang and Kezhi Wang and Pei-Qiu Huang,2020,32,IEEE Transactions on Emerging Topics in Computational Intelligence
10.1109/tetci.2020.2977695,Attacking VQA Systems via Adversarial Background Noise,Akshay Chaturvedi and Utpal Garain,2020,1,IEEE Transactions on Emerging Topics in Computational Intelligence
10.1109/tetci.2020.2964886,A Novel Deep Reinforcement Learning Controller Based Type-II Fuzzy System: Frequency Regulation in Microgrids,Mohammad Hassan Khooban and Meysam Gheisarnejad,2021,44,IEEE Transactions on Emerging Topics in Computational Intelligence
10.1109/tetci.2017.2719711,Dempster–Shafer Approach to Temporal Uncertainty,Paul A. Elmore and Frederick E. Petry and Ronald R. Yager,2017,13,IEEE Transactions on Emerging Topics in Computational Intelligence
10.1109/tetci.2018.2829980,Curriculum Design for Machine Learners in Sequential Decision Tasks,Bei Peng and James MacGlashan and Robert Loftin and Michael L. Littman and David L. Roberts and Matthew E. Taylor,2018,6,IEEE Transactions on Emerging Topics in Computational Intelligence
10.1109/tetci.2021.3100597,Granular Symmetric Implicational Method,Yiming Tang and Witold Pedrycz and Fuji Ren,2022,9,IEEE Transactions on Emerging Topics in Computational Intelligence
10.1109/tetci.2019.2932087,Change Detection in Landsat Images Using Unsupervised Learning and RBF-Based Clustering,Neha Gupta and Samit Ari and Narayan Panigrahi,2021,9,IEEE Transactions on Emerging Topics in Computational Intelligence
10.1109/tetci.2019.2892715,Multiskin Color Segmentation Through Morphological Model Refinement,Huang-Chia Shih and Jung-Yu Chen,2021,2,IEEE Transactions on Emerging Topics in Computational Intelligence
10.1109/tetci.2021.3098354,Deep Reinforcement Learning Based Optimization Algorithm for Permutation Flow-Shop Scheduling,Zixiao Pan and Ling Wang and Jingjing Wang and Jiawen Lu,2021,8,IEEE Transactions on Emerging Topics in Computational Intelligence
10.1109/tetci.2022.3220250,PSNet: Parallel Symmetric Network for Video Salient Object Detection,Runmin Cong and Weiyu Song and Jianjun Lei and Guanghui Yue and Yao Zhao and Sam Kwong,2023,0,IEEE Transactions on Emerging Topics in Computational Intelligence
10.1109/tetci.2022.3182725,Iterative Learning in Support Vector Regression With Heterogeneous Variances,Jinran Wu and You-Gan Wang,2023,1,IEEE Transactions on Emerging Topics in Computational Intelligence
10.1109/tetci.2023.3254840,Guest Editorial: Special Issue on Emerging Computational Intelligence Techniques to Address Challenges in Biomedical Data and Imaging,M. Tanveer and Chin-Teng Lin and Chuan-Kang Ting and Javier Andreu-Perez,2023,0,IEEE Transactions on Emerging Topics in Computational Intelligence
10.1109/tetci.2022.3189084,A Game-Based Evolutionary Clustering With Historical Information Aggregation for Personal Recommendation,Jianrui Chen and Tingting Zhu and Maoguo Gong and Zhihui Wang,2023,0,IEEE Transactions on Emerging Topics in Computational Intelligence
10.1109/tetci.2022.3189408,Broad Graph Convolutional Neural Network and Its Application in Hyperspectral Image Classification,Haoyu Wang and Yuhu Cheng and C. L. Philip Chen and Xuesong Wang,2023,1,IEEE Transactions on Emerging Topics in Computational Intelligence
10.1109/tetci.2017.2743758,An Efficient Feature Selection Algorithm for Evolving Job Shop Scheduling Rules With Genetic Programming,Yi Mei and Su Nguyen and Bing Xue and Mengjie Zhang,2017,57,IEEE Transactions on Emerging Topics in Computational Intelligence
10.1109/tetci.2019.2941757,Computational Intelligence Enabled Cybersecurity for the Internet of Things,Shanshan Zhao and Shancang Li and Lianyong Qi and Li Da Xu,2020,20,IEEE Transactions on Emerging Topics in Computational Intelligence
10.1109/tetci.2020.2968933,A System-Driven Taxonomy of Attacks and Defenses in Adversarial Machine Learning,Koosha Sadeghi and Ayan Banerjee and Sandeep K. S. Gupta,2020,28,IEEE Transactions on Emerging Topics in Computational Intelligence
10.1109/tetci.2018.2823329,StarCraft Micromanagement With Reinforcement Learning and Curriculum Transfer Learning,Kun Shao and Yuanheng Zhu and Dongbin Zhao,2019,71,IEEE Transactions on Emerging Topics in Computational Intelligence
10.1109/tetci.2020.3016302,A Novel Scalable Kernelized Fuzzy Clustering Algorithms Based on In-Memory Computation for Handling Big Data,Preeti Jha and Aruna Tiwari and Neha Bharill and Milind Ratnaparkhe and Mukkamalla Mounika and Neha Nagendra,2021,6,IEEE Transactions on Emerging Topics in Computational Intelligence
10.1109/tetci.2020.3034606,Attention Deep Model With Multi-Scale Deep Supervision for Person Re-Identification,Di Wu and Chao Wang and Yong Wu and Qi-Cong Wang and De-Shuang Huang,2021,25,IEEE Transactions on Emerging Topics in Computational Intelligence
10.1109/tetci.2021.3064028,Remodelling State-Space Prediction With Deep Neural Networks for Probabilistic Load Forecasting,Parul Arora and Abbas Khosravi and B. K. Panigrahi and P. N. Suganthan,2022,5,IEEE Transactions on Emerging Topics in Computational Intelligence
