DOI,Título,Autores,Año,Citas,Revista
10.1002/sam.11509,Exponential calibration for correlation coefficient with additive distortion measurement errors,Jun Zhang and Zhuoer Xu,2021,7,Statistical Analysis and Data Mining: The ASA Data Science Journal
10.1002/sam.11393,Exploratory factor analysis of large data matrices,Nickolay T. Trendafilov and Sara Fontanella,2019,2,Statistical Analysis and Data Mining: The ASA Data Science Journal
10.1002/sam.11555,A family of mixture models for biclustering,Wangshu Tu and Sanjeena Subedi,2022,0,Statistical Analysis and Data Mining: The ASA Data Science Journal
10.1002/sam.11360,Issue Information,,2018,0,Statistical Analysis and Data Mining: The ASA Data Science Journal
10.1002/sam.10127,Retrospective-cost-based adaptive model refinement for the ionosphere and thermosphere,Anthony M. D'Amato and Aaron J. Ridley and Dennis S. Bernstein,2011,21,Statistical Analysis and Data Mining: The ASA Data Science Journal
10.1002/sam.10044,Mining trauma injury data with imputed values,Kay Penny and Thomas Chesney,2009,2,Statistical Analysis and Data Mining: The ASA Data Science Journal
10.1002/sam.11253,Bayesian visual analytics: BaVA,Leanna House and Scotland Leman and Chao Han,2015,19,Statistical Analysis and Data Mining: The ASA Data Science Journal
10.1002/sam.10139,Clusterwise p* models for social network analysis,Douglas Steinley and Michael J. Brusco and Stanley Wasserman,2011,7,Statistical Analysis and Data Mining
10.1002/sam.10020,An Input Variable Selection Method for the Artificial Neural Network of Shear Stiffness of Worsted Fabrics,Ting Chen and Chong Zhang and Xia Chen and Liqing Li,2009,2,Statistical Analysis and Data Mining
10.1002/sam.10045,"Chemogenomic databases: Construction, search and analysis",Paul Blower,2009,0,Statistical Analysis and Data Mining: The ASA Data Science Journal
10.1002/sam.100,John Wiley &amp; Sons will launchStatistical Analysis and Data Mining in early 2007,,2007,2,Statistical Analysis and Data Mining
10.1002/sam.11506,Approximation error of Fourier neural networks,Abylay Zhumekenov and Rustem Takhanov and Alejandro J. Castro and Zhenisbek Assylbekov,2021,0,Statistical Analysis and Data Mining: The ASA Data Science Journal
10.1002/sam.2014.7.issue-6,n.m.,,2014,0,Statistical Analysis and Data Mining
10.1002/sam.11201,Special Issue on Statistical Learning,Bertrand S. Clarke,2013,0,Statistical Analysis and Data Mining: The ASA Data Science Journal
10.1002/sam.11387,Issue Information,,2019,0,Statistical Analysis and Data Mining: The ASA Data Science Journal
10.1002/sam.v6.5,n.m.,,2013,0,Statistical Analysis and Data Mining: The ASA Data Science Journal
10.1002/sam.11471,Data‐driven dimension reduction in functional principal component analysis identifying the change‐point in functional data,Buddhananda Banerjee and Arnab K. Laha and Arjun Lakra,2020,1,Statistical Analysis and Data Mining: The ASA Data Science Journal
10.1002/sam.11177,h-plots for displaying nonmetric dissimilarity matrices,Irene Epifanio,2013,7,Statistical Analysis and Data Mining: The ASA Data Science Journal
10.1002/sam.11599,Evaluation and interpretation of driving risks: Automobile claim frequency modeling with telematics data,Yaqian Gao and Yifan Huang and Shengwang Meng,2023,0,Statistical Analysis and Data Mining: The ASA Data Science Journal
10.1002/sam.v1:2,n.m.,,2008,16,Statistical Analysis and Data Mining: The ASA Data Science Journal
10.1002/sam.11432,Gaussian mixture models as automated particle classifiers for fast neutron detectors,Brenton Blair and Cliff Chen and Andrew Glenn and Alan Kaplan and Jaime Ruz and Lance Simms and Ron Wurtz,2019,5,Statistical Analysis and Data Mining: The ASA Data Science Journal
10.1002/sam.10017,A statistical learning approach for the design of polycrystalline materials,Veera Sundararaghavan and Nicholas Zabaras,2009,24,Statistical Analysis and Data Mining
10.1002/sam.11286,On the estimability of the PV single‐diode model parameters,Brian R. Zaharatos and Mark Campanelli and Luis Tenorio,2015,5,Statistical Analysis and Data Mining: The ASA Data Science Journal
10.1002/sam.11580,Adversarially robust subspace learning in the spiked covariance model,Fei Sha and Ruizhi Zhang,2022,0,Statistical Analysis and Data Mining: The ASA Data Science Journal
10.1002/sam.11585,Factor analysis of mixed data for anomaly detection,Matthew Davidow and David S. Matteson,2022,0,Statistical Analysis and Data Mining: The ASA Data Science Journal
10.1002/sam.11581,Biclustering high‐frequency financial time series based on information theory,Haitao Liu and Jian Zou and Nalini Ravishanker,2022,0,Statistical Analysis and Data Mining: The ASA Data Science Journal
10.1002/sam.v15.4,n.m.,,2022,0,Statistical Analysis and Data Mining: The ASA Data Science Journal
10.1002/sam.10119,Spatially adaptive semi-supervised learning with Gaussian processes for hyperspectral data analysis,Goo Jun and Joydeep Ghosh,2011,10,Statistical Analysis and Data Mining: The ASA Data Science Journal
10.1002/sam.11472,SURE estimates for high dimensional classification,Zhi Ji and Yang Wei and Zhouping Li,2020,2,Statistical Analysis and Data Mining: The ASA Data Science Journal
10.1002/sam.11570,A tutorial on generative adversarial networks with application to classification of imbalanced data,Yuxiao Huang and Kara G. Fields and Yan Ma,2022,0,Statistical Analysis and Data Mining: The ASA Data Science Journal
10.1002/sam.11571,Weighted AutoEncoding recommender system,Shuying Zhu and Weining Shen and Annie Qu,2022,0,Statistical Analysis and Data Mining: The ASA Data Science Journal
10.1002/sam.11338,Dynamic hierarchical models for monetary transmission,Laura Parisi,2017,0,Statistical Analysis and Data Mining: The ASA Data Science Journal
10.1002/sam.11172,Combining computer models to account for mass loss in stellar evolution,Nathan M. Stein and David A. van Dyk and Ted von Hippel and Steven DeGennaro and Elizabeth J. Jeffery and William H. Jefferys,2013,15,Statistical Analysis and Data Mining: The ASA Data Science Journal
10.1002/sam.10114,Smoothing methods for histogram-valued time series: an application to value-at-risk,Javier Arroyo and Gloria González-Rivera and Carlos Maté and Antonio Muñoz San Roque,2011,13,Statistical Analysis and Data Mining: The ASA Data Science Journal
10.1002/sam.11593,Out‐of‐bag stability estimation for k ‐means clustering,Tianmou Liu and Han Yu and Rachael Hageman Blair,2022,0,Statistical Analysis and Data Mining: The ASA Data Science Journal
10.1002/sam.11582,A study of the impact of COVID ‐19 on the Chinese stock market based on a new textual multiple ARMA model,Weijun Xu and Zhineng Fu and Hongyi Li and Jinglong Huang and Weidong Xu and Yiyang Luo,2023,1,Statistical Analysis and Data Mining: The ASA Data Science Journal
10.1002/sam.11596,An auxiliary Part‐of‐Speech tagger for blog and microblog cyber‐slang,Silvia Golia and Paola Zola,2023,0,Statistical Analysis and Data Mining: The ASA Data Science Journal
10.1002/sam.11374,Distribution-preservingk-anonymity,Dennis Wei and Karthikeyan Natesan Ramamurthy and Kush R. Varshney,2018,5,Statistical Analysis and Data Mining: The ASA Data Science Journal
10.1002/sam.10051,Mining maximal quasi-bicliques: Novel algorithm and applications in the stock market and protein networks,Kelvin Sim and Jinyan Li and Vivekanand Gopalkrishnan and Guimei Liu,2009,26,Statistical Analysis and Data Mining
10.1002/sam.11489,Learning network event sequences using long short‐term memory and second‐order statistic loss,Hao Sha and Mohammad Al Hasan and George Mohler,2021,1,Statistical Analysis and Data Mining: The ASA Data Science Journal
10.1002/sam.11434,A Bayesian structural equation model in general pedigree data analysis,Mahdi Akbarzadeh and Abbas Moghimbeigi and Nathan Morris and Maryam S. Daneshpour and Hossein Mahjub and Ali Reza Soltanian,2019,3,Statistical Analysis and Data Mining: The ASA Data Science Journal
10.1002/sam.11540,Multivariate Gaussian RBF‐net for smooth function estimation and variable selection,Arkaprava Roy,2021,0,Statistical Analysis and Data Mining: The ASA Data Science Journal
10.1002/sam.10021,Least Angle Regression and LASSO for Large Datasets,Chris Fraley and Tim Hesterberg,2009,21,Statistical Analysis and Data Mining
10.1002/sam.11337,Forecasting rare disease outbreaks from open source indicators,Theodoros Rekatsinas and Saurav Ghosh and Sumiko R. Mekaru and Elaine O. Nsoesie and John S. Brownstein and Lise Getoor and Naren Ramakrishnan,2017,4,Statistical Analysis and Data Mining: The ASA Data Science Journal
10.1002/sam.10016,Discovering and Exploiting Statistical Properties for Query Optimization in Relational Databases: A Survey,Peter J. Haas and Ihab F. Ilyas and Guy M. Lohman and Volker Markl,2009,7,Statistical Analysis and Data Mining
10.1002/sam.11436,Forecasting basketball players' performance using sparse functional data*,Guillermo Vinué and Irene Epifanio,2019,10,Statistical Analysis and Data Mining: The ASA Data Science Journal
10.1002/sam.11546,An efficient k ‐modes algorithm for clustering categorical datasets,Karin S. Dorman and Ranjan Maitra,2022,3,Statistical Analysis and Data Mining: The ASA Data Science Journal
10.1002/sam.11204,Semi-supervised logistic discrimination via labeled data and unlabeled data from different sampling distributions,Shuichi Kawano,2013,5,Statistical Analysis and Data Mining: The ASA Data Science Journal
10.1002/sam.11150,A resampling approach for interval-valued data regression,Jeongyoun Ahn and Muliang Peng and Cheolwoo Park and Yongho Jeon,2012,20,Statistical Analysis and Data Mining: The ASA Data Science Journal
10.1002/sam.11412,Spatial modeling of brain connectivity data via latent distance models with nodes clustering,Emanuele Aliverti and Daniele Durante,2019,4,Statistical Analysis and Data Mining: The ASA Data Science Journal
10.1002/sam.11459,Knot selection in sparse Gaussian processes with a variational objective function,Nathaniel Garton and Jarad Niemi and Alicia Carriquiry,2020,3,Statistical Analysis and Data Mining: The ASA Data Science Journal
10.1002/sam.11507,A comparison of Gaussian processes and neural networks for computer model emulation and calibration,Samuel Myren and Earl Lawrence,2021,3,Statistical Analysis and Data Mining: The ASA Data Science Journal
10.1002/sam.11364,Order priors for Bayesian network discovery with an application to malware phylogeny,Diane Oyen and Blake Anderson and Kari Sentz and Christine Anderson-Cook,2017,2,Statistical Analysis and Data Mining: The ASA Data Science Journal
10.1002/sam.10100,Complex networks as a unified framework for descriptive analysis and predictive modeling in climate science,Karsten Steinhaeuser and Nitesh V. Chawla and Auroop R. Ganguly,2011,92,Statistical Analysis and Data Mining: The ASA Data Science Journal
10.1002/sam.10128,Using spatiotemporal relational random forests to improve our understanding of severe weather processes,Amy McGovern and David John Gagne and Nathaniel Troutman and Rodger A. Brown and Jeffrey Basara and John K. Williams,2011,20,Statistical Analysis and Data Mining
10.1002/sam.10084,Discriminative frequent subgraph mining with optimality guarantees,Marisa Thoma and Hong Cheng and Arthur Gretton and Jiawei Han and Hans-Peter Kriegel and Alex Smola and Le Song and Philip S. Yu and Xifeng Yan and Karsten M. Borgwardt,2010,30,Statistical Analysis and Data Mining
10.1002/sam.11616,L q regularization for fair artificial intelligence robust to covariate shift,Seonghyeon Kim and Sara Kim and Kunwoong Kim and Yongdai Kim,2023,0,Statistical Analysis and Data Mining: The ASA Data Science Journal
10.1002/sam.11538,Imbalanced classification: A paradigm‐based review,Yang Feng and Min Zhou and Xin Tong,2021,5,Statistical Analysis and Data Mining: The ASA Data Science Journal
10.1002/sam.11416,TiK‐means: Transformation‐infused K ‐means clustering for skewed groups,Nicholas S. Berry and Ranjan Maitra,2019,3,Statistical Analysis and Data Mining: The ASA Data Science Journal
10.1002/sam.11183,Penalized regression and risk prediction in genome-wide association studies,Erin Austin and Wei Pan and Xiaotong Shen,2013,17,Statistical Analysis and Data Mining: The ASA Data Science Journal
10.1002/sam.11437,A hybrid deep learning architecture for classification of microscopic damage on National Ignition Facility laser optics,Connor Amorin and Laura M. Kegelmeyer and W. Philip Kegelmeyer,2019,8,Statistical Analysis and Data Mining: The ASA Data Science Journal
10.1002/sam.11202,Assessing geographic heterogeneity and variable importance in an air pollution data set,S. Stanley Young and Jessie Q. Xia,2013,8,Statistical Analysis and Data Mining: The ASA Data Science Journal
10.1002/sam.10116,A hybrid data mining metaheuristic for the p-median problem,Alexandre Plastino and Richard Fuchshuber and Simone de L. Martins and Alex A. Freitas and Said Salhi,2011,17,Statistical Analysis and Data Mining
10.1002/sam.11348,Random forest missing data algorithms,Fei Tang and Hemant Ishwaran,2017,264,Statistical Analysis and Data Mining: The ASA Data Science Journal
10.1002/sam.v1:6,n.m.,,2009,0,Statistical Analysis and Data Mining
10.1002/sam.11160,Unsupervised classification and analysis of objects described by nonparametric probability distributions,Richard Emilion,2012,2,Statistical Analysis and Data Mining: The ASA Data Science Journal
10.1002/sam.11550,"Residual's influence index ( RINFIN ), bad leverage and unmasking in high dimensional L 2 ‐regression",Yannis G. Yatracos,2022,0,Statistical Analysis and Data Mining: The ASA Data Science Journal
10.1002/sam.v12.6,n.m.,,2019,2,Statistical Analysis and Data Mining: The ASA Data Science Journal
10.1002/sam.11303,Big data and the missing links,Richard D. De Veaux and Roger W. Hoerl and Ronald D. Snee,2016,8,Statistical Analysis and Data Mining: The ASA Data Science Journal
10.1002/sam.2017.10.issue-4,n.m.,,2017,1,Statistical Analysis and Data Mining: The ASA Data Science Journal
10.1002/sam.2017.10.issue-1,n.m.,,2017,0,Statistical Analysis and Data Mining: The ASA Data Science Journal
10.1002/sam.11358,Issue Information,,2018,0,Statistical Analysis and Data Mining: The ASA Data Science Journal
10.1002/sam.10064,Co-clustering numerical data under user-defined constraints,Ruggero G. Pensa and Jean-Francois Boulicaut and Francesca Cordero and Maurizio Atzori,2010,8,Statistical Analysis and Data Mining: The ASA Data Science Journal
10.1002/sam.10056,Special issue on the best papers of SDM'09,Zoran Obradovic and Huan Liu,2009,0,Statistical Analysis and Data Mining: The ASA Data Science Journal
10.1002/sam.10015,Data Mining: A Gateway to Better Data Gathering,Necip Doganaksoy and Gerald J. Hahn,2009,1,Statistical Analysis and Data Mining
10.1002/sam.10123,Local spatial biclustering and prediction of urban juvenile delinquency and recidivism,Alan J. Izenman and Philip W. Harris and Jeremy Mennis and Joseph Jupin and Zoran Obradovic,2011,7,Statistical Analysis and Data Mining
10.1002/sam.11351,A wavelet threshold denoising procedure for multimodel predictions: An application to economic time series,Livio Fenga,2017,2,Statistical Analysis and Data Mining: The ASA Data Science Journal
10.1002/sam.10092,In this issue,Joseph Verducci,2010,0,Statistical Analysis and Data Mining
10.1002/sam.10011,Summary Report of SDM 2008 Panel: Perspectives on Research Directions and Trends for the Data Mining Research Community,Vipin Kumar,2008,1,Statistical Analysis and Data Mining
10.1002/sam.11439,Space‐efficient estimation of empirical tail dependence coefficients for bivariate data streams,Alastair Gregory and Kaushik Jana,2020,0,Statistical Analysis and Data Mining: The ASA Data Science Journal
10.1002/sam.10142,Bayesian methodology for the analysis of spatial-temporal surveillance data,Jian Zou and Alan F. Karr and David Banks and Matthew J. Heaton and Gauri Datta and James Lynch and Francisco Vera,2012,8,Statistical Analysis and Data Mining
10.1002/sam.11522,Issue Information,,2022,0,Statistical Analysis and Data Mining: The ASA Data Science Journal
10.1002/sam.11552,Tracking clusters and anomalies in evolving data streams,Sreelekha Guggilam and Varun Chandola and Abani Patra,2022,1,Statistical Analysis and Data Mining: The ASA Data Science Journal
10.1002/sam.10067,Bayesian adaptive nearest neighbor,Ruixin Guo and Sounak Chakraborty,2010,9,Statistical Analysis and Data Mining: The ASA Data Science Journal
10.1002/sam.10027,Association Rules Network: Definition and Applications,Gaurav Pandey and Sanjay Chawla and Simon Poon and Bavani Arunasalam and Joseph G. Davis,2009,12,Statistical Analysis and Data Mining: The ASA Data Science Journal
10.1002/sam.11166,Biclustering scatter plots using data depth measures,Zhanpan Zhang and Xinping Cui and Daniel R. Jeske and James Borneman,2013,0,Statistical Analysis and Data Mining: The ASA Data Science Journal
10.1002/sam.v5.2,n.m.,,2012,0,Statistical Analysis and Data Mining
10.1002/sam.10144,A nonparametric frequency domain EM algorithm for time series classification with applications to spike sorting and macro-economics,Georg M. Goerg,2011,4,Statistical Analysis and Data Mining: The ASA Data Science Journal
10.1002/sam.11304,Large-margin classification with multiple decision rules,Patrick K. Kimes and David Neil Hayes and J. S. Marron and Yufeng Liu and n.m. n.m.,2016,0,Statistical Analysis and Data Mining: The ASA Data Science Journal
10.1002/sam.11469,Issue Information,,2021,0,Statistical Analysis and Data Mining: The ASA Data Science Journal
10.1002/sam.11433,A sparse Gaussian sigmoid basis function approximation of hyperspectral data for detection of solids,Cory Lanker and Milton O. Smith,2019,0,Statistical Analysis and Data Mining: The ASA Data Science Journal
10.1002/sam.11148,Semi-supervised Eigenbasis novelty detection,David R. Thompson and Walid A. Majid and Colorado J. Reed and Kiri L. Wagstaff,2013,1,Statistical Analysis and Data Mining: The ASA Data Science Journal
10.1002/sam.11467,Issue Information,,2021,0,Statistical Analysis and Data Mining: The ASA Data Science Journal
10.1002/sam.11501,An approach to characterizing spatial aspects of image system blur,Jesse Adams and Jessica Pillow and Kevin Joyce and Michael Brennan and Malena I. Español and Matthias Morzfeld and Sean Breckling and Daniel Champion and Eric Clarkson and Ryan Coffee and Amanda Gehring and Margaret Lund and Duane Smalley and Ajanae Williams and Jacob Zier and Daniel Frayer and Marylesa Howard and Eric Machorro,2021,0,Statistical Analysis and Data Mining: The ASA Data Science Journal
10.1002/sam.11294,Computing quality scores and uncertainty for approximate pattern matching in geospatial semantic graphs,David J. Stracuzzi and Randy C. Brost and Cynthia A. Phillips and David G. Robinson and Alyson G. Wilson and Diane M.‐K. Woodbridge,2015,2,Statistical Analysis and Data Mining: The ASA Data Science Journal
10.1002/sam.11240,Issue Information,,2014,0,Statistical Analysis and Data Mining: The ASA Data Science Journal
10.1002/sam.10038,Biplot methodology in exploratory analysis of microarray data,S. Gardner-Lubbe and N. J. le Roux and H. Maunders and V. Shah and S. Patwardhan,2009,2,Statistical Analysis and Data Mining: The ASA Data Science Journal
10.1002/sam.11382,Fused lasso regression for identifying differential correlations in brain connectome graphs,Donghyeon Yu and Sang Han Lee and Johan Lim and Guanghua Xiao and Richard Cameron Craddock and Bharat B. Biswal,2018,3,Statistical Analysis and Data Mining: The ASA Data Science Journal
10.1002/sam.10121,Erratum: Emerging Topics and Challenges for Statistical Analysis and Data Mining,Goodman Arnold,2011,0,Statistical Analysis and Data Mining
10.1002/sam.v15.2,n.m.,,2022,0,Statistical Analysis and Data Mining: The ASA Data Science Journal
10.1002/sam.11465,Issue Information,,2021,0,Statistical Analysis and Data Mining: The ASA Data Science Journal
10.1002/sam.101,Brief History of the Interface of Computing and Statistics which Preceded Data Mining's Birth,Arnold Goodman,2008,1,Statistical Analysis and Data Mining
10.1002/sam.2016.9.issue-1,n.m.,,2016,0,Statistical Analysis and Data Mining: The ASA Data Science Journal
10.1002/sam.11503,An initial exploration of Bayesian model calibration for estimating the composition of rocks and soils on Mars,Claire‐Alice Hébert and Earl Lawrence and Kary Myers and James P. Colgan and Elizabeth J. Judge,2021,0,Statistical Analysis and Data Mining: The ASA Data Science Journal
10.1002/sam.10094,Special issue on the best papers of SDM'10,Bart Goethals and Jian Pei,2010,0,Statistical Analysis and Data Mining
10.1002/sam.11430,An empirical Bayes approach for learning directed acyclic graph using MCMC algorithm,Vahid Rezaei Tabar and Hamid Zareifard and Selva Salimi and Dariusz Plewczynski,2019,2,Statistical Analysis and Data Mining: The ASA Data Science Journal
10.1002/sam.11249,Issue Information,,2015,0,Statistical Analysis and Data Mining: The ASA Data Science Journal
10.1002/sam.10040,Generating hypotheses about molecular structure-activity relationships (SARs) by solving an optimization problem,Junshui Ma and Christopher Tong and Andy Liaw and Robert Sheridan and John Szumiloski and Vladimir Svetnik,2009,1,Statistical Analysis and Data Mining: The ASA Data Science Journal
10.1002/sam.v1:5,n.m.,,2009,1,Statistical Analysis and Data Mining
10.1002/sam.11592,Distributed dimension reduction with nearly oracle rate,Zhengtian Zhu and Liping Zhu,2022,0,Statistical Analysis and Data Mining: The ASA Data Science Journal
10.1002/sam.11576,Regression‐based Bayesian estimation and structure learning for nonparanormal graphical models,Jami J. Mulgrave and Subhashis Ghosal,2022,0,Statistical Analysis and Data Mining: The ASA Data Science Journal
10.1002/sam.11577,A modified least angle regression algorithm for interaction selection with heredity,Woosung Kim and Seonghyeon Kim and Myung Hwan Na and Yongdai Kim,2022,0,Statistical Analysis and Data Mining: The ASA Data Science Journal
10.1002/sam.11323,Conducting sparse feature selection on arbitrarily long phrases in text corpora with a focus on interpretability,Luke Miratrix and Robin Ackerman,2016,0,Statistical Analysis and Data Mining: The ASA Data Science Journal
10.1002/sam.11168,Maximum Likelihood Estimation Over Directed Acyclic Gaussian Graphs,Yiping Yuan and Xiaotong Shen and Wei Pan,2012,3,Statistical Analysis and Data Mining
10.1002/sam.11497,Identifying build orientation of 3D ‐printed materials using convolutional neural networks,Jan Strube and Malachi Schram and Sabiha Rustam and Zachary Kennedy and Tamas Varga,2021,0,Statistical Analysis and Data Mining: The ASA Data Science Journal
10.1002/sam.2015.8.issue-5,n.m.,,2015,1,Statistical Analysis and Data Mining: The ASA Data Science Journal
10.1002/sam.10090,A framework for clustering massive graph streams,Charu C. Aggarwal and Yuchen Zhao and Philip S. Yu,2010,5,Statistical Analysis and Data Mining: The ASA Data Science Journal
10.1002/sam.11460,Composite quantile‐based classifiers,David A. Pritchard and Yufeng Liu,2020,0,Statistical Analysis and Data Mining: The ASA Data Science Journal
10.1002/sam.11368,Feature subspace learning based on local point processes patterns,Yuting Ma and Yuejing Ding and Tian Zheng,2018,1,Statistical Analysis and Data Mining: The ASA Data Science Journal
10.1002/sam.11213,Introduction,David Banks and Xiaotong Shen,2013,1,Statistical Analysis and Data Mining: The ASA Data Science Journal
10.1002/sam.10147,Introduction to the special issue on best papers from the SLDM competition,Joseph Verducci and Hernando Ombao,2011,0,Statistical Analysis and Data Mining: The ASA Data Science Journal
10.1002/sam.11516,Issue Information,,2022,0,Statistical Analysis and Data Mining: The ASA Data Science Journal
10.1002/sam.11330,Issue Information,,2017,0,Statistical Analysis and Data Mining: The ASA Data Science Journal
10.1002/sam.11420,Making social networks more human: A topological approach,Jonathan W. Berry and Cynthia A. Phillips and Jared Saia,2019,1,Statistical Analysis and Data Mining: The ASA Data Science Journal
10.1002/sam.10107,Emerging topics and challenges for statistical analysis and data mining,Arnold Goodman,2011,3,Statistical Analysis and Data Mining: The ASA Data Science Journal
10.1002/sam.11410,Pruning variable selection ensembles,Chunxia Zhang and Yilei Wu and Mu Zhu,2019,6,Statistical Analysis and Data Mining: The ASA Data Science Journal
10.1002/sam.11192,Mining Compressing Sequential Patterns,Hoang Thanh Lam and Fabian Mörchen and Dmitriy Fradkin and Toon Calders,2014,68,Statistical Analysis and Data Mining: The ASA Data Science Journal
10.1002/sam.11457,Delaunay triangulation‐based spatial colocation pattern mining without distance thresholds,Vanha Tran and Lizhen Wang,2020,5,Statistical Analysis and Data Mining: The ASA Data Science Journal
10.1002/sam.11210,Two-way regularization for MEG source reconstruction via multilevel coordinate descent,Tian Siva Tian and Jianhua Z. Huang and Haipeng Shen,2013,3,Statistical Analysis and Data Mining: The ASA Data Science Journal
10.1002/sam.11450,In praise of partially interpretable predictors,Tri Le and Bertrand Clarke,2020,1,Statistical Analysis and Data Mining: The ASA Data Science Journal
10.1002/sam.10069,Mining and tracking evolving web user trends from large web server logs,Basheer Hawwash and Olfa Nasraoui,2010,2,Statistical Analysis and Data Mining
10.1002/sam.10055,A family of large margin linear classifiers and its application in dynamic environments,Jianqiang Shen and Thomas G. Dietterich,2009,0,Statistical Analysis and Data Mining: The ASA Data Science Journal
10.1002/sam.10122,Discovery of anomalous spatio-temporal windows using discretized spatio-temporal scan statistics,Vandana P. Janeja and Aryya Gangopadhyay and Seyed Mohammadi and Revathi Palanisamy,2011,0,Statistical Analysis and Data Mining
