DOI,Título,Autores,Año,Citas,Revista
10.1002/widm.1052,An overview of the use of neural networks for data mining tasks,Frederic Stahl and Ivan Jordanov,2012,17,WIREs Data Mining and Knowledge Discovery
10.1002/widm.1239,Evolutionary data mining and applications: A revision on the most cited papers from the last 10 years (2007–2017),Rafael Alcalá and María José Gacto and Jesús Alcalá‐Fdez,2018,4,WIREs Data Mining and Knowledge Discovery
10.1002/widm.1297,Big data processing tools: An experimental performance evaluation,Mário Rodrigues and Maribel Yasmina Santos and Jorge Bernardino,2019,5,WIREs Data Mining and Knowledge Discovery
10.1002/widm.1099,Graph-based methods for protein structure comparison,Thomas Fober and Marco Mernberger and Gerhard Klebe and Eyke Hüllermeier,2013,5,Wiley Interdisciplinary Reviews: Data Mining and Knowledge Discovery
10.1002/widm.1275,Eyebrow semantic description via clustering based on Axiomatic Fuzzy Set,Danyang Li and Yan Ren and Tao Du and Wanquan Liu,2018,3,WIREs Data Mining and Knowledge Discovery
10.1002/widm.1183,A novel social network mining approach for customer segmentation and viral marketing,Nivin A. Helal and Rasha M. Ismail and Nagwa L. Badr and Mostafa G. M. Mostafa,2016,2,WIREs Data Mining and Knowledge Discovery
10.1002/widm.2017.7.issue-3,n.m.,,2017,0,WIREs Data Mining and Knowledge Discovery
10.1002/widm.1406,Data mining for energy systems: Review and prospect,Wenxuan Liu and Junhua Zhao and Dianhui Wang,2021,1,WIREs Data Mining and Knowledge Discovery
10.1002/widm.1093,An overview of interactive visual data mining techniques for knowledge discovery,Frederic Stahl and Bogdan Gabrys and Mohamed Medhat Gaber and Monika Berendsen,2013,7,Wiley Interdisciplinary Reviews: Data Mining and Knowledge Discovery
10.1002/widm.1136,Issue information,,2014,0,Wiley Interdisciplinary Reviews: Data Mining and Knowledge Discovery
10.1002/widm.1288,Machine learning from crowds: A systematic review of its applications,Enrique G. Rodrigo and Juan A. Aledo and José A. Gámez,2019,7,WIREs Data Mining and Knowledge Discovery
10.1002/widm.1385,Combating disinformation in a social media age,Kai Shu and Amrita Bhattacharjee and Faisal Alatawi and Tahora H. Nazer and Kaize Ding and Mansooreh Karami and Huan Liu,2020,22,WIREs Data Mining and Knowledge Discovery
10.1002/widm.1060,Knowledge discovery for scheduling in computational grids,Alexander Fölling and Joachim Lepping,2012,1,WIREs Data Mining and Knowledge Discovery
10.1002/widm.1111,Issue information,,2013,0,Wiley Interdisciplinary Reviews: Data Mining and Knowledge Discovery
10.1002/widm.1357,A review of mammographic region of interest classification,Sena B. Yengec Tasdemir and Kasim Tasdemir and Zafer Aydin,2020,4,WIREs Data Mining and Knowledge Discovery
10.1002/widm.2019.9.issue-1,n.m.,,2019,0,WIREs Data Mining and Knowledge Discovery
10.1002/widm.1351,Facial feature discovery for ethnicity recognition,,2020,0,WIREs Data Mining and Knowledge Discovery
10.1002/widm.1250,Trained convolutional neural network based on selected beta filters for Arabic letter recognition,Asma ElAdel and Mourad Zaied and Chokri Ben Amar,2019,2,WIREs Data Mining and Knowledge Discovery
10.1002/widm.v12.1,n.m.,,2022,0,WIREs Data Mining and Knowledge Discovery
10.1002/widm.2015.5.issue-3,n.m.,,2015,0,Wiley Interdisciplinary Reviews: Data Mining and Knowledge Discovery
10.1002/widm.1055,Mining high‐throughput screens for cancer drug targets—lessons from yeast chemical‐genomic profiling and synthetic lethality,Marja A. Heiskanen and Tero Aittokallio,2012,5,WIREs Data Mining and Knowledge Discovery
10.1002/widm.2017.7.issue-4,n.m.,,2017,0,WIREs Data Mining and Knowledge Discovery
10.1002/widm.1398,Predictive analysis of real‐time strategy games: A graph mining approach,Isam A. Alobaidi and Jennifer L. Leopold and Ali A. Allami and Nathan W. Eloe and Dustin Tanksley,2021,0,WIREs Data Mining and Knowledge Discovery
10.1002/widm.5,Mining large medical claims database to identify high-risk patients: The case of antidepressant utilization,Samuel H. Huang and Hua Li and Dengyao Mo and Lawson R. Wulsin,2011,0,Wiley Interdisciplinary Reviews: Data Mining and Knowledge Discovery
10.1002/widm.2018.8.issue-4,n.m.,,2018,1,WIREs Data Mining and Knowledge Discovery
10.1002/widm.1264,Deep learning for remote sensing image classification: A survey,Ying Li and Haokui Zhang and Xizhe Xue and Yenan Jiang and Qiang Shen,2018,143,WIREs Data Mining and Knowledge Discovery
10.1002/widm.1223,Issue Information,,2018,0,WIREs Data Mining and Knowledge Discovery
10.1002/widm.1073,Issue Information,,2012,0,Wiley Interdisciplinary Reviews: Data Mining and Knowledge Discovery
10.1002/widm.1085,Current trends in modeling host-pathogen interactions,Sumanta Mukherjee and Awanti Sambarey and Karyala Prashanthi and Nagasuma Chandra,2013,8,Wiley Interdisciplinary Reviews: Data Mining and Knowledge Discovery
10.1002/widm.2015.5.issue-5,n.m.,,2015,0,Wiley Interdisciplinary Reviews: Data Mining and Knowledge Discovery
10.1002/widm.v3.2,n.m.,,2013,0,Wiley Interdisciplinary Reviews: Data Mining and Knowledge Discovery
10.1002/widm.1145,Issue information,,2015,0,Wiley Interdisciplinary Reviews: Data Mining and Knowledge Discovery
10.1002/widm.1156,Issue information,,2015,0,Wiley Interdisciplinary Reviews: Data Mining and Knowledge Discovery
10.1002/widm.1220,Issue Information,,2018,0,Wiley Interdisciplinary Reviews: Data Mining and Knowledge Discovery
10.1002/widm.2017.7.issue-2,n.m.,,2017,0,WIREs Data Mining and Knowledge Discovery
10.1002/widm.1472,Corporate investment prediction using a weighted temporal graph neural network,Jianing Li and Xin Yao,2022,0,WIREs Data Mining and Knowledge Discovery
10.1002/widm.1097,"Automatic construction of lexicons, taxonomies, ontologies, and other knowledge structures",Olena Medelyan and Ian H. Witten and Anna Divoli and Jeen Broekstra,2013,10,Wiley Interdisciplinary Reviews: Data Mining and Knowledge Discovery
10.1002/widm.1077,A survey on mining multiple data sources,T. Ramkumar and S. Hariharan and S. Selvamuthukumaran,2013,7,Wiley Interdisciplinary Reviews: Data Mining and Knowledge Discovery
10.1002/widm.1194,Scalable machine-learning algorithms for big data analytics: a comprehensive review,Preeti Gupta and Arun Sharma and Rajni Jindal,2016,24,Wiley Interdisciplinary Reviews: Data Mining and Knowledge Discovery
10.1002/widm.1318,Benchmarking in classification and regression,Frank Hoffmann and Torsten Bertram and Ralf Mikut and Markus Reischl and Oliver Nelles,2019,13,WIREs Data Mining and Knowledge Discovery
10.1002/widm.34,Fuzzy machine learning and data mininga,Eyke Hüllermeier,2011,5,Wiley Interdisciplinary Reviews: Data Mining and Knowledge Discovery
10.1002/widm.1072,Overview of random forest methodology and practical guidance with emphasis on computational biology and bioinformatics,Anne-Laure Boulesteix and Silke Janitza and Jochen Kruppa and Inke R. König,2012,368,Wiley Interdisciplinary Reviews: Data Mining and Knowledge Discovery
10.1002/widm.1219,"Algorithms for hierarchical clustering: an overview, II",Fionn Murtagh and Pedro Contreras,2017,103,WIREs Data Mining and Knowledge Discovery
10.1002/widm.1449,Methods and tools for causal discovery and causal inference,Ana Rita Nogueira and Andrea Pugnana and Salvatore Ruggieri and Dino Pedreschi and João Gama,2022,9,WIREs Data Mining and Knowledge Discovery
10.1002/widm.1196,Identifying community structure in a multi-relational network employing non-negative tensor factorization and GA k-means clustering,Ankita Verma and Kamal K. Bharadwaj,2017,15,Wiley Interdisciplinary Reviews: Data Mining and Knowledge Discovery
10.1002/widm.1455,Review and data mining of linguistic studies of English modal verbs,Jianping Yu and Jilin Fu and Tana Bai and Xueping Xu,2022,0,WIREs Data Mining and Knowledge Discovery
10.1002/widm.1233,"Context-aware movement analytics: implications, taxonomy, and design framework",Mohammad Sharif and Ali Asghar Alesheikh,2018,9,Wiley Interdisciplinary Reviews: Data Mining and Knowledge Discovery
10.1002/widm.1371,Knowledge discovery from remote sensing images: A review,Lizhe Wang and Jining Yan and Lin Mu and Liang Huang,2020,12,WIREs Data Mining and Knowledge Discovery
10.1002/widm.1474,A survey on artificial intelligence in histopathology image analysis,Mohammed M. Abdelsamea and Usama Zidan and Zakaria Senousy and Mohamed Medhat Gaber and Emad Rakha and Mohammad Ilyas,2022,5,WIREs Data Mining and Knowledge Discovery
10.1002/widm.1129,Data privacy,Vicenç Torra and Guillermo Navarro-Arribas,2014,11,Wiley Interdisciplinary Reviews: Data Mining and Knowledge Discovery
10.1002/widm.1115,Data stream mining in ubiquitous environments: state-of-the-art and current directions,Mohamed Medhat Gaber and João Gama and Shonali Krishnaswamy and João Bártolo Gomes and Frederic Stahl,2014,22,Wiley Interdisciplinary Reviews: Data Mining and Knowledge Discovery
10.1002/widm.19,Outlier detection,Xiaogang Su and Chih‐Ling Tsai,2011,29,WIREs Data Mining and Knowledge Discovery
10.1002/widm.1405,"Data stream analysis: Foundations, major tasks and tools",Maroua Bahri and Albert Bifet and João Gama and Heitor Murilo Gomes and Silviu Maniu,2021,14,WIREs Data Mining and Knowledge Discovery
10.1002/widm.1479,"Distributional regression modeling via generalized additive models for location, scale, and shape: An overview through a data set from learning analytics",Fernando Marmolejo‐Ramos and Mauricio Tejo and Marek Brabec and Jakub Kuzilek and Srecko Joksimovic and Vitomir Kovanovic and Jorge González and Thomas Kneib and Peter Bühlmann and Lucas Kook and Guillermo Briseño‐Sánchez and Raydonal Ospina,2023,1,WIREs Data Mining and Knowledge Discovery
10.1002/widm.1426,Critical insights into modern hyperspectral image applications through deep learning,Garima Jaiswal and Arun Sharma and Sumit Kumar Yadav,2021,6,WIREs Data Mining and Knowledge Discovery
10.1002/widm.1367,Temporal association rule mining: An overview considering the time variable as an integral or implied component,Alberto Segura‐Delgado and María José Gacto and Rafael Alcalá and Jesús Alcalá‐Fdez,2020,7,WIREs Data Mining and Knowledge Discovery
10.1002/widm.1350,Healthcare 4.0: A review of frontiers in digital health,Prem Prakash Jayaraman and Abdur Rahim Mohammad Forkan and Ahsan Morshed and Pari Delir Haghighi and Yong‐Bin Kang,2020,46,WIREs Data Mining and Knowledge Discovery
10.1002/widm.1127,Open issues for partitioning clustering methods: an overview,Maria Camila N. Barioni and Humberto Razente and Alessandra M. R. Marcelino and Agma J. M. Traina and Caetano Traina,2014,9,Wiley Interdisciplinary Reviews: Data Mining and Knowledge Discovery
10.1002/widm.1126,Clustering on heterogeneous networks,Yue Huang and Xuedong Gao,2014,14,Wiley Interdisciplinary Reviews: Data Mining and Knowledge Discovery
10.1002/widm.1407,Table understanding approaches for extracting knowledge from heterogeneous tables,Sara Bonfitto and Elena Casiraghi and Marco Mesiti,2021,6,WIREs Data Mining and Knowledge Discovery
10.1002/widm.1340,Blockchain for explainable and trustworthy artificial intelligence,Mohamed Nassar and Khaled Salah and Muhammad Habib ur Rehman and Davor Svetinovic,2020,39,WIREs Data Mining and Knowledge Discovery
10.1002/widm.1177,Enhancing Iterative Dichotomiser 3 algorithm for classification decision tree,Ayman E. Khedr and Amira M. Idrees and Ahmed I. El Seddawy,2016,23,Wiley Interdisciplinary Reviews: Data Mining and Knowledge Discovery
10.1002/widm.20,Sensor selection to support practical use of health-monitoring smart environments,Diane J. Cook and Lawrence B. Holder,2011,33,Wiley Interdisciplinary Reviews: Data Mining and Knowledge Discovery
10.1002/widm.1050,Dynamic clustering with soft computing,Georg Peters and Richard Weber,2012,9,WIREs Data Mining and Knowledge Discovery
10.1002/widm.4,Multivariate image mining,Julia Herold and Christian Loyek and Tim W. Nattkemper,2011,11,WIREs Data Mining and Knowledge Discovery
10.1002/widm.1448,Data and text mining from online reviews: An automatic literature analysis,Sérgio Moro and Paulo Rita,2022,1,WIREs Data Mining and Knowledge Discovery
10.1002/widm.1226,Triangle counting in large networks: a review,Mohammad Al Hasan and Vachik S. Dave,2018,33,WIREs Data Mining and Knowledge Discovery
10.1002/widm.1251,Automatic synthesis of fuzzy systems: An evolutionary overview with a genetic programming perspective,Adriano S. Koshiyama and Ricardo Tanscheit and Marley M. B. R. Vellasco,2019,2,WIREs Data Mining and Knowledge Discovery
10.1002/widm.1079,Evolutionary design of decision trees,Vili Podgorelec and Matej Šprogar and Sandi Pohorec,2013,8,Wiley Interdisciplinary Reviews: Data Mining and Knowledge Discovery
10.1002/widm.1252,Model selection and error estimation without the agonizing pain,Luca Oneto,2018,14,WIREs Data Mining and Knowledge Discovery
10.1002/widm.1483,ExplainFix : Explainable spatially fixed deep networks,Alex Gaudio and Christos Faloutsos and Asim Smailagic and Pedro Costa and Aurélio Campilho,2023,1,WIREs Data Mining and Knowledge Discovery
10.1002/widm.1487,Review of artificial intelligence‐based question‐answering systems in healthcare,Leona Cilar Budler and Lucija Gosak and Gregor Stiglic,2023,0,WIREs Data Mining and Knowledge Discovery
10.1002/widm.42,Evolving fuzzy systems for data streams: a survey,Rashmi Dutta Baruah and Plamen Angelov,2011,14,Wiley Interdisciplinary Reviews: Data Mining and Knowledge Discovery
10.1002/widm.2019.9.issue-4,n.m.,,2019,2,WIREs Data Mining and Knowledge Discovery
10.1002/widm.1245,A dynamic‐adversarial mining approach to the security of machine learning,Tegjyot Singh Sethi and Mehmed Kantardzic and Lingyu Lyu and Jiashun Chen,2018,4,WIREs Data Mining and Knowledge Discovery
10.1002/widm.1333,Sentiment analysis for mining texts and social networks data: Methods and tools,Chiara Zucco and Barbara Calabrese and Giuseppe Agapito and Pietro H. Guzzi and Mario Cannataro,2020,28,WIREs Data Mining and Knowledge Discovery
10.1002/widm.1197,Tensor decompositions and data fusion in epileptic electroencephalography and functional magnetic resonance imaging data,Borbála Hunyadi and Patrick Dupont and Wim Van Paesschen and Sabine Van Huffel,2017,32,Wiley Interdisciplinary Reviews: Data Mining and Knowledge Discovery
10.1002/widm.1147,Data visualization by nonlinear dimensionality reduction,Andrej Gisbrecht and Barbara Hammer,2015,33,Wiley Interdisciplinary Reviews: Data Mining and Knowledge Discovery
10.1002/widm.1362,On the determinants of Uber accessibility and its spatial distribution: Evidence from Uber in Philadelphia,Sina Shokoohyar and Anae Sobhani and Saeed R. Ramezanpour Nargesi,2020,8,WIREs Data Mining and Knowledge Discovery
10.1002/widm.1280,There and back again: Outlier detection between statistical reasoning and data mining algorithms,Arthur Zimek and Peter Filzmoser,2018,67,WIREs Data Mining and Knowledge Discovery
10.1002/widm.1125,Support vector machines in engineering: an overview,S. Salcedo-Sanz and J. L. Rojo-Álvarez and M. Martínez-Ramón and G. Camps-Valls,2014,94,Wiley Interdisciplinary Reviews: Data Mining and Knowledge Discovery
10.1002/widm.1265,"Performance evaluation in non‐intrusive load monitoring: Datasets, metrics, and tools—A review",Lucas Pereira and Nuno Nunes,2018,79,WIREs Data Mining and Knowledge Discovery
10.1002/widm.1078,Large-scale data mining using genetics-based machine learning,Jaume Bacardit and Xavier Llorà,2013,48,Wiley Interdisciplinary Reviews: Data Mining and Knowledge Discovery
10.1002/widm.1432,"Themes in data mining, big data, and crime analytics",Giles C. Oatley,2022,5,WIREs Data Mining and Knowledge Discovery
10.1002/widm.1243,"Learning analytics: A glance of evolution, status, and trends according to a proposed taxonomy",Alejandro Peña‐Ayala,2018,26,WIREs Data Mining and Knowledge Discovery
10.1002/widm.1312,Causability and explainability of artificial intelligence in medicine,Andreas Holzinger and Georg Langs and Helmut Denk and Kurt Zatloukal and Heimo Müller,2019,417,WIREs Data Mining and Knowledge Discovery
10.1002/widm.1059,Objective function‐based clustering,Lawrence O. Hall,2012,8,WIREs Data Mining and Knowledge Discovery
10.1002/widm.1254,Recent trends in machine learning for human activity recognition—A survey,Sreenivasan Ramasamy Ramamurthy and Nirmalya Roy,2018,133,WIREs Data Mining and Knowledge Discovery
10.1002/widm.1257,An overview on the evolution and adoption of deep learning applications used in the industry,Sourav Dutta,2018,14,WIREs Data Mining and Knowledge Discovery
10.1002/widm.1332,Text mining in education,Rafael Ferreira‐Mello and Máverick André and Anderson Pinheiro and Evandro Costa and Cristobal Romero,2019,49,WIREs Data Mining and Knowledge Discovery
10.1002/widm.1485,"Remote patient monitoring using artificial intelligence: Current state, applications, and challenges",Thanveer Shaik and Xiaohui Tao and Niall Higgins and Lin Li and Raj Gururajan and Xujuan Zhou and U. Rajendra Acharya,2023,1,WIREs Data Mining and Knowledge Discovery
10.1002/widm.1329,Frequent itemset mining: A 25 years review,José María Luna and Philippe Fournier‐Viger and Sebastián Ventura,2019,84,WIREs Data Mining and Knowledge Discovery
10.1002/widm.1178,Community detection in social networks,Punam Bedi and Chhavi Sharma,2016,125,Wiley Interdisciplinary Reviews: Data Mining and Knowledge Discovery
10.1002/widm.1475,Review of automated time series forecasting pipelines,Stefan Meisenbacher and Marian Turowski and Kaleb Phipps and Martin Rätz and Dirk Müller and Veit Hagenmeyer and Ralf Mikut,2022,6,WIREs Data Mining and Knowledge Discovery
10.1002/widm.2016.6.issue-1,n.m.,,2016,0,WIREs Data Mining and Knowledge Discovery
10.1002/widm.1323,Issue Information,,2020,0,WIREs Data Mining and Knowledge Discovery
10.1002/widm.1222,Issue Information,,2018,0,WIREs Data Mining and Knowledge Discovery
10.1002/widm.2018.8.issue-2,n.m.,,2018,0,WIREs Data Mining and Knowledge Discovery
10.1002/widm.2018.8.issue-3,n.m.,,2018,0,WIREs Data Mining and Knowledge Discovery
10.1002/widm.v11.3,n.m.,,2021,0,WIREs Data Mining and Knowledge Discovery
10.1002/widm.1189,Issue Information,,2017,0,Wiley Interdisciplinary Reviews: Data Mining and Knowledge Discovery
10.1002/widm.2013.3.issue-6,n.m.,,2013,0,Wiley Interdisciplinary Reviews: Data Mining and Knowledge Discovery
10.1002/widm.1270,Issue Information,,2019,0,WIREs Data Mining and Knowledge Discovery
10.1002/widm.1182,Mining from distributed and abstracted data,Xiaofeng Zhang and William K. Cheung and Yunming Ye,2016,4,WIREs Data Mining and Knowledge Discovery
10.1002/widm.2016.6.issue-5,n.m.,,2016,0,WIREs Data Mining and Knowledge Discovery
10.1002/widm.1262,δ ‐Open set clustering—A new topological clustering method,Shuliang Wang and Qi Li and Hanning Yuan and Deren Li and Jing Geng and Chuanfeng Zhao and Yimeng Lei and Chuanlu Liu and Chengfei Liu,2018,3,WIREs Data Mining and Knowledge Discovery
10.1002/widm.1408,"Foundational ontologies, ontology‐driven conceptual modeling, and their multiple benefits to data mining",Glenda Amaral and Fernanda Baião and Giancarlo Guizzardi,2021,3,WIREs Data Mining and Knowledge Discovery
10.1002/widm.50,Protecting Sensitive knowledge in association patterns mining,Guanling Lee and Yi Chun Chen,2012,1,WIREs Data Mining and Knowledge Discovery
10.1002/widm.1140,Issue information,,2014,0,Wiley Interdisciplinary Reviews: Data Mining and Knowledge Discovery
10.1002/widm.1162,Issue information,,2015,0,Wiley Interdisciplinary Reviews: Data Mining and Knowledge Discovery
10.1002/widm.2017.7.issue-6,n.m.,,2017,0,WIREs Data Mining and Knowledge Discovery
10.1002/widm.v11.5,n.m.,,2021,0,WIREs Data Mining and Knowledge Discovery
10.1002/widm.1083,Issue information,,2013,0,Wiley Interdisciplinary Reviews: Data Mining and Knowledge Discovery
10.1002/widm.1217,"Cover Image, Volume 7, Issue 4",Yang Chen and Zhong‐yi Wang and Gang Yuan and Lan Huang,2017,0,WIREs Data Mining and Knowledge Discovery
10.1002/widm.v9.6,n.m.,,2019,0,WIREs Data Mining and Knowledge Discovery
10.1002/widm.1277,Inference enterprise models: An approach to organizational performance improvement,Dennis M. Buede and Elise T. Axelrad and David P. Brown and Daniel W. Hudson and Kathryn B. Laskey and Paul J. Sticha and Jordan L. Thomas,2018,7,WIREs Data Mining and Knowledge Discovery
10.1002/widm.1167,Issue information,,2016,0,Wiley Interdisciplinary Reviews: Data Mining and Knowledge Discovery
10.1002/widm.1274,Issue Information,,2019,0,WIREs Data Mining and Knowledge Discovery
10.1002/widm.v12.6,n.m.,,2022,0,WIREs Data Mining and Knowledge Discovery
10.1002/widm.21,Information enhancement for data mining,Shichao Zhang,2011,0,Wiley Interdisciplinary Reviews: Data Mining and Knowledge Discovery
10.1002/widm.1271,Issue Information,,2019,0,WIREs Data Mining and Knowledge Discovery
10.1002/widm.1089,Issue information,,2013,0,Wiley Interdisciplinary Reviews: Data Mining and Knowledge Discovery
10.1002/widm.40,Fuzzy association rule mining framework and its application to effective fuzzy associative classification,Keivan Kianmehr and Mehmet Kaya and Abdallah M. ElSheikh and Jamal Jida and Reda Alhajj,2011,15,Wiley Interdisciplinary Reviews: Data Mining and Knowledge Discovery
10.1002/widm.1213,Leader‐based community detection algorithm for social networks,Nivin A. Helal and Rasha M. Ismail and Nagwa L. Badr and Mostafa G. M. Mostafa,2017,2,WIREs Data Mining and Knowledge Discovery
10.1002/widm.1373,Issue Information,,2021,0,WIREs Data Mining and Knowledge Discovery
10.1002/widm.1411,Automatic segmentation to characterize anthropometric parameters and cardiovascular indicators in children,Daniel Gustavo Goroso and Alvaro Fraga and Michel Macedo and Carla Fernanda de Miranda Rodrigues and Bruno Mendes de Oliveira Silva and William Tsutomu Watanabe and Diego Pereira da Silva and Robson Rodrigues da Silva and José Luis Puglisi and James Marcin and Madan Dharmar,2021,0,WIREs Data Mining and Knowledge Discovery
10.1002/widm.1428,Mining text from natural scene and video images: A survey,Palaiahnakote Shivakumara and Alireza Alaei and Umapada Pal,2021,3,WIREs Data Mining and Knowledge Discovery
10.1002/widm.2014.4.issue-1,n.m.,,2014,0,WIREs Data Mining and Knowledge Discovery
10.1002/widm.1185,An overview of inference methods in probabilistic classifier chains for multilabel classification,Deiner Mena and Elena Montañés and José Ramón Quevedo and Juan José del Coz,2016,8,Wiley Interdisciplinary Reviews: Data Mining and Knowledge Discovery
10.1002/widm.1107,Market Basket Analysis algorithms with MapReduce,Jongwook Woo,2013,4,Wiley Interdisciplinary Reviews: Data Mining and Knowledge Discovery
10.1002/widm.1482,Table understanding: Problem overview,Alexey Shigarov,2023,0,WIREs Data Mining and Knowledge Discovery
10.1002/widm.1442,Process mining applications in the healthcare domain: A comprehensive review,Antonella Guzzo and Antonino Rullo and Eugenio Vocaturo,2022,5,WIREs Data Mining and Knowledge Discovery
10.1002/widm.1282,Relationship‐based access control: More than a social network access control model,Jorge Lobo,2019,3,WIREs Data Mining and Knowledge Discovery
10.1002/widm.1238,Big data analytics—A review of data‐mining models for small and medium enterprises in the transportation sector,Siti Aishah Mohd Selamat and Simant Prakoonwit and Reza Sahandi and Wajid Khan and Manoharan Ramachandran,2018,7,WIREs Data Mining and Knowledge Discovery
10.1002/widm.11,A study of methodological issues in design and development of rule-based systems: proposal of a new approach,Antoni Ligęza and Grzegorz J. Nalepa,2011,21,Wiley Interdisciplinary Reviews: Data Mining and Knowledge Discovery
10.1002/widm.1284,Shannon versus semantic information processing in the brain,Kaushik K. Majumdar,2019,2,WIREs Data Mining and Knowledge Discovery
10.1002/widm.1169,Issue Information,,2016,0,Wiley Interdisciplinary Reviews: Data Mining and Knowledge Discovery
10.1002/widm.22,Ensembles of case-based reasoning classifiers in high-dimensional biological domains,Niloofar Arshadi and Igor Jurisica,2011,0,Wiley Interdisciplinary Reviews: Data Mining and Knowledge Discovery
10.1002/widm.1348,Learning decision trees through Monte Carlo tree search: An empirical evaluation,Cecília Nunes and Mathieu De Craene and Hélène Langet and Oscar Camara and Anders Jonsson,2020,2,WIREs Data Mining and Knowledge Discovery
10.1002/widm.1328,A review on sentiment discovery and analysis of educational big‐data,Zhongmei Han and Jiyi Wu and Changqin Huang and Qionghao Huang and Meihua Zhao,2020,7,WIREs Data Mining and Knowledge Discovery
10.1002/widm.2014.4.issue-5,n.m.,,2014,0,Wiley Interdisciplinary Reviews: Data Mining and Knowledge Discovery
10.1002/widm.1317,Editorial,Witold Pedrycz,2019,0,WIREs Data Mining and Knowledge Discovery
10.1002/widm.1203,Positive and negative behavioral analysis in social networks,Anna Squicciarini and Sarah Rajtmajer and Christopher Griffin,2017,2,WIREs Data Mining and Knowledge Discovery
10.1002/widm.v1.3,n.m.,,2011,1,WIREs Data Mining and Knowledge Discovery
10.1002/widm.v2.5,n.m.,,2012,0,Wiley Interdisciplinary Reviews: Data Mining and Knowledge Discovery
10.1002/widm.v9.5,n.m.,,2019,0,WIREs Data Mining and Knowledge Discovery
10.1002/widm.v1.6,n.m.,,2011,0,Wiley Interdisciplinary Reviews: Data Mining and Knowledge Discovery
10.1002/widm.1215,Entity disambiguation with decomposable neural networks,Yaming Sun and Zhenzhou Ji and Lei Lin and Duyu Tang and Xiaolong Wang,2017,1,Wiley Interdisciplinary Reviews: Data Mining and Knowledge Discovery
10.1002/widm.2018.8.issue-6,n.m.,,2018,1,WIREs Data Mining and Knowledge Discovery
