DOI,Título,Autores,Año,Citas,Revista
10.1007/s12530-017-9197-5,Kernel averaged gradient descent subtractive clustering for exemplar selection,Y. Kokkinos and K. G. Margaritis,2018,3,Evolving Systems
10.1007/s12530-021-09409-x,A new optimal prediction technique for energy demand based on CNN and improved water strider algorithm: a study on socio-economic-climatic parameters,Shimin Liao and Giorgos Jimenez,2022,0,Evolving Systems
10.1007/s12530-018-9250-z,Sonar inspired optimization (SIO) in engineering applications,Alexandros Tzanetos and Georgios Dounias,2020,8,Evolving Systems
10.1007/s12530-011-9036-z,On the effect of dimensionality reduction by Manifold Learning for Evolutionary Learning,Hisashi Handa,2011,4,Evolving Systems
10.1007/s12530-014-9121-1,Recent advances on evolving intelligent systems and applications,Fernando Gomide and Edwin Lughofer,2014,4,Evolving Systems
10.1007/s12530-011-9029-y,Spatial–temporal knowledge base for modeling and analysis of evolving systems,Gancho Vachkov,2011,0,Evolving Systems
10.1007/s12530-021-09400-6,Cubic graph representation of concept lattice and its decomposition,Prem Kumar Singh,2022,0,Evolving Systems
10.1007/s12530-017-9193-9,A graph-theoretic approach toward autonomous skill acquisition in reinforcement learning,Seed Jalal Kazemitabar and Nasrin Taghizadeh and Hamid Beigy,2018,3,Evolving Systems
10.1007/s12530-018-9248-6,Dendrite ellipsoidal neurons based on k-means optimization,Fernando Arce and Erik Zamora and Carolina Fócil-Arias and Humberto Sossa,2019,10,Evolving Systems
10.1007/s12530-010-9024-8,An efficient evolutionary algorithm for fuzzy inference systems,Cheng-Jian Lin and Cheng-Hung Chen and Chin-Teng Lin,2011,3,Evolving Systems
10.1007/s12530-017-9200-1,Producing fuzzy inclusion and entropy measures and their application on global image thresholding,Athanasios C. Bogiatzis and Basil K. Papadopoulos,2018,12,Evolving Systems
10.1007/s12530-012-9063-4,Real-time algorithm for changes detection in depth of anesthesia signals,Raquel Sebastião and Margarida M. Silva and Rui Rabiço and João Gama and Teresa Mendonça,2013,10,Evolving Systems
10.1007/s12530-011-9035-0,Adaptive bidding in combinatorial auctions in dynamic markets,Xin Sui and Ho-fung Leung,2011,0,Evolving Systems
10.1007/s12530-019-09321-5,Hybrid ACO algorithm for edge detection,Cristian A. Martínez and María E. Buemi,2021,0,Evolving Systems
10.1007/s12530-010-9016-8,Online self-evolving fuzzy controller with global learning capabilities,Ana Belén Cara and Héctor Pomares and Ignacio Rojas and Zsófia Lendek and Robert Babuška,2010,15,Evolving Systems
10.1007/s12530-019-09310-8,Automatic pectoral muscle removal in mammograms,Samuel Rahimeto and Taye Girma Debelee and Dereje Yohannes and Friedhelm Schwenker,2021,11,Evolving Systems
10.1007/s12530-020-09344-3,Evaluation of a dynamic classification method for multimodal ambiguities based on Hidden Markov Models,Patrizia Grifoni and Maria Chiara Caschera and Fernando Ferri,2021,0,Evolving Systems
10.1007/s12530-017-9184-x,Improved discrete particle swarm optimization for solving the practical sensors deployment,Xu Jian and Zhang Tong-Yi and Huang Wei and Hu Ming-yi,2017,2,Evolving Systems
10.1007/s12530-014-9109-x,Change mining in evolving fuzzy concept lattices,T. P. Martin,2014,1,Evolving Systems
10.1007/s12530-012-9061-6,Drift detection using uncertainty distribution divergence,Patrick Lindstrom and Brian Mac Namee and Sarah Jane Delany,2013,22,Evolving Systems
10.1007/s12530-018-9240-1,An evolutionary spectral representation for blind separation of biosignals,Seda Senay,2019,1,Evolving Systems
10.1007/s12530-021-09378-1,On utilizing the transitivity pursuit-enhanced object partitioning to optimize self-organizing lists-on-lists,O. Ekaba Bisong and B. John Oommen,2021,0,Evolving Systems
10.1007/s12530-022-09420-w,Adaptive particle swarm optimization model for resource leveling,Jerry Chun-Wei Lin and Qing Lv and Dehu Yu and Gautam Srivastava and Chun-Hao Chen,2022,1,Evolving Systems
10.1007/s12530-022-09474-w,Adaptive octopus deep transfer learning based epileptic seizure classification on field programmable gate arrays,B. Indira Priyadarshini and D. Krishna Reddy,2022,0,Evolving Systems
10.1007/s12530-016-9161-9,Fuzzy cognitive maps as a decision support tool for container transport logistics,Athanasios Tsadiras and George Zitopoulos,2017,8,Evolving Systems
10.1007/s12530-017-9176-x,Design of spiking neural networks for blood pressure prediction during general anesthesia: considerations for optimizing results,Go Hamano and Andrew Lowe and David Cumin,2017,1,Evolving Systems
10.1007/s12530-021-09380-7,Unit hydrograph identification based on fuzzy regression analysis,Mike Spiliotis and Luis Garrote,2021,2,Evolving Systems
10.1007/s12530-017-9214-8,Partial identification and control of MIMO systems via switching linear reduced-order models under weak stimulations,Saeed Ansari-Rad and Ahmad Kalhor and Babak N. Araabi,2019,11,Evolving Systems
10.1007/s12530-022-09450-4,Comparative analysis with topic modeling and word embedding methods after the Aegean Sea earthquake on Twitter,Nazmiye Eligüzel and Cihan Çetinkaya and Türkay Dereli,2022,0,Evolving Systems
10.1007/s12530-022-09481-x,An efficient real-time stock prediction exploiting incremental learning and deep learning,Tinku Singh and Riya Kalra and Suryanshi Mishra and n.m. Satakshi and Manish Kumar,2022,0,Evolving Systems
10.1007/s12530-014-9124-y,Penalized ensemble feature selection methods for hidden associations in time series environments case study: equities companies in Saudi Stock Exchange Market,Adel Aloraini,2015,2,Evolving Systems
10.1007/s12530-019-09279-4,Robust aerial image mosaicing algorithm based on fuzzy outliers rejection,Abdelhai Lati and Mahmoud Belhocine and Noura Achour,2020,9,Evolving Systems
10.1007/s12530-013-9085-6,Adaptive evolving strategy for dextrous robotic manipulation,César Arismendi and David Álvarez and Santiago Garrido and Luis Moreno,2014,2,Evolving Systems
10.1007/s12530-021-09382-5,Smart walking assistant (SWA) for elderly care using an intelligent realtime hybrid model,Pratik Bhattacharjee and Suparna Biswas,2022,7,Evolving Systems
10.1007/s12530-019-09280-x,An efficient method for classifying motor imagery using CPSO-trained ANFIS prediction,M. R. Mosavi and A. Ayatollahi and S. Afrakhteh,2021,12,Evolving Systems
10.1007/s12530-015-9129-1,Evolving Takagi–Sugeno model based on online Gustafson-Kessel algorithm and kernel recursive least square method,Soroosh Shafieezadeh-Abadeh and Ahmad Kalhor,2016,12,Evolving Systems
10.1007/s12530-016-9160-x,A methodology to carry out voting classification tasks using a particle swarm optimization-based neuro-fuzzy competitive learning network,Androniki Tamvakis and George E. Tsekouras and Anastasios Rigos and Christos Kalloniatis and Christos-Nikolaos Anagnostopoulos and George Anastassopoulos,2017,2,Evolving Systems
10.1007/s12530-019-09281-w,General controllability and observability tests for Takagi-Sugeno fuzzy systems,J. A. Meda-Campaña and J. de J. Rubio and C. Aguilar-Ibañez and R. Tapia-Herrera and R. Gonzalez-Salazar and R. A. Rodriguez-Manzanarez and G. Lopez-Contreras and J. O. Hernandez-Monterrosas and I. Elias and D. R. Cruz,2020,1,Evolving Systems
10.1007/s12530-010-9026-6,A novel content classification scheme for web caches,G. P. Sajeev and M. P. Sebastian,2011,12,Evolving Systems
10.1007/s12530-019-09309-1,A novel method for digital image copy-move forgery detection and localization using evolving cellular automata and local binary patterns,Gulnawaz Gani and Fasel Qadir,2021,8,Evolving Systems
10.1007/s12530-013-9096-3,Online and interactive self-adaptive learning of user profile using incremental evolutionary algorithms,Abdelhamid Bouchachia and Arthur Lena and Charlie Vanaret,2014,5,Evolving Systems
10.1007/s12530-022-09432-6,Nature inspired optimization algorithms: a comprehensive overview,Ankur Kumar and Mohammad Nadeem and Haider Banka,2023,4,Evolving Systems
10.1007/s12530-018-9255-7,Artificial bee colony algorithm for enhancing image edge detection,Anan Banharnsakun,2019,15,Evolving Systems
10.1007/s12530-018-9225-0,Hybrid fuzzy inference system for evaluating lean product development practice,Daniel O. Aikhuele and Gabriel Oluwadare,2019,6,Evolving Systems
10.1007/s12530-023-09490-4,Fuzzy PROMETHEE model for public transport mode choice analysis,Laila Oubahman and Szabolcs Duleba,2023,0,Evolving Systems
10.1007/s12530-019-09275-8,Spatial shape feature descriptors in classification of engineered objects using high spatial resolution remote sensing data,Rubeena Vohra and K. C. Tiwari,2020,4,Evolving Systems
10.1007/s12530-017-9202-z,Multi-label active learning: key issues and a novel query strategy,Everton Alvares Cherman and Yannis Papanikolaou and Grigorios Tsoumakas and Maria Carolina Monard,2019,7,Evolving Systems
10.1007/s12530-020-09326-5,A comparative study of cellular automata-based digital image scrambling techniques,Zubair Jeelani and Fasel Qadir,2021,5,Evolving Systems
10.1007/s12530-010-9025-7,Recursive clustering based on a Gustafson–Kessel algorithm,Dejan Dovžan and Igor Škrjanc,2011,92,Evolving Systems
10.1007/s12530-021-09404-2,Extreme gradient boosting model based on improved Jaya optimizer applied to forecasting energy consumption in residential buildings,João Sauer and Viviana Cocco Mariani and Leandro dos Santos Coelho and Matheus Henrique Dal Molin Ribeiro and Mirco Rampazzo,2022,7,Evolving Systems
10.1007/s12530-020-09339-0,Automatic acoustic identification of respiratory diseases,Stavros Ntalampiras and Ilyas Potamitis,2021,2,Evolving Systems
10.1007/s12530-021-09386-1,Evolutionary-based generation of rotation and scale invariant texture descriptors from SIFT keypoints,Mohamed Hazgui and Haythem Ghazouani and Walid Barhoumi,2021,5,Evolving Systems
10.1007/s12530-016-9168-2,Discussion and review on evolving data streams and concept drift adapting,Imen Khamassi and Moamar Sayed-Mouchaweh and Moez Hammami and Khaled Ghédira,2018,123,Evolving Systems
10.1007/s12530-016-9147-7,AnyNovel: detection of novel concepts in evolving data streams,Zahraa S. Abdallah and Mohamed Medhat Gaber and Bala Srinivasan and Shonali Krishnaswamy,2016,33,Evolving Systems
10.1007/s12530-014-9108-y,Self-adaptive and local strategies for a smooth treatment of drifts in data streams,Ammar Shaker and Edwin Lughofer,2014,60,Evolving Systems
10.1007/s12530-019-09296-3,An aggregation approach to multi-criteria recommender system using genetic programming,Shweta Gupta and Vibhor Kant,2020,11,Evolving Systems
10.1007/s12530-022-09421-9,Evolving fuzzy predictor with multivariable Gaussian participatory learning and multi-innovations recursive weighted least squares: eFMI,Fernanda Pereira Santos Rodrigues and Alisson Marques Silva and Andre Paim Lemos,2022,1,Evolving Systems
10.1007/s12530-020-09364-z,Developing new deep-learning model to enhance network intrusion classification,Hanane Azzaoui and Akram Zine Eddine Boukhamla and David Arroyo and Abdallah Bensayah,2022,8,Evolving Systems
10.1007/s12530-013-9091-8,"EANN 2012: exploratory analysis of mobile phone traffic patterns using 1-dimensional SOM, clustering and anomaly detection",Pekka Kumpulainen and Kimmo Hätönen,2013,0,Evolving Systems
10.1007/s12530-013-9086-5,Elastic Adaptive Dynamics Methodology on Ontology Matching on Evolving Folksonomy Driven Environment,Massimiliano Dal Mas,2014,4,Evolving Systems
10.1007/s12530-021-09372-7,Science4Fashion: an end-to-end decision support system for fashion designers,Maria Th. Kotouza and Alexandros-Charalampos Kyprianidis and Sotirios-Filippos Tsarouchis and Antonios C. Chrysopoulos and Pericles A. Mitkas,2021,1,Evolving Systems
10.1007/s12530-013-9088-3,Fault-tolerant gait learning and morphology optimization of a polymorphic walking robot,David Johan Christensen and Jørgen Christian Larsen and Kasper Stoy,2014,17,Evolving Systems
10.1007/s12530-013-9082-9,Integrated temporal partitioning and partial reconfiguration techniques for design latency improvement,Ramzi Ayadi and Bouraoui Ouni and Abdellatif Mtibaa,2014,2,Evolving Systems
10.1007/s12530-019-09284-7,A hybrid probabilistic bi-sector fuzzy regression based methodology for normal distributed hydrological variable,M. Spiliotis and P. Angelidis and B. Papadopoulos,2020,4,Evolving Systems
10.1007/s12530-017-9210-z,Correction to: Predictive intelligence to the edge: impact on edge analytics,Natascha Harth and Christos Anagnostopoulos and Dimitrios Pezaros,2018,1,Evolving Systems
10.1007/s12530-018-9243-y,Vessel traffic flow analysis and prediction by an improved PSO-BP mechanism based on AIS data,Ze-guo Zhang and Jian-chuan Yin and Ni-ni Wang and Zi-gang Hui,2019,26,Evolving Systems
10.1007/s12530-018-9216-1,A dynamically adapted and weighted Bat algorithm in image enhancement domain,Krishna Gopal Dhal and Sanjoy Das,2019,14,Evolving Systems
10.1007/s12530-014-9105-1,Classification of mammography images based on cellular automata and Haralick parameters,Sarah Benmazou and Hayet Farida Merouani and Soumia Layachi and Beledjhem Nedjmeddine,2014,6,Evolving Systems
10.1007/s12530-019-09290-9,Clustering subspace generalization to obtain faster reinforcement learning,Maryam Hashemzadeh and Reshad Hosseini and Majid Nili Ahmadabadi,2020,0,Evolving Systems
10.1007/s12530-011-9044-z,Stable parallel looped systems: a new theoretical framework for the evolution of order,Muralidhar Ravuri,2012,0,Evolving Systems
10.1007/s12530-013-9073-x,Application of neural network and fuzzy model to grinding process control,A. O. Odior,2013,11,Evolving Systems
10.1007/s12530-019-09287-4,EDUC8 pathways: executing self-evolving and personalized intra-organizational educational processes,Omiros Iatrellis and Achilles Kameas and Panos Fitsilis,2020,2,Evolving Systems
10.1007/s12530-018-9246-8,Extractive summarization using semigraph (ESSg),Sheetal Sonawane and Parag Kulkarni and Charusheela Deshpande and Bhagyashree Athawale,2019,6,Evolving Systems
10.1007/s12530-013-9094-5,A fast cellular automata algorithm for liquid diffusion phenomenon modeling,Abbas M. Al-Ghaili and Khairulmizam Samsudin and M. Iqbal Saripan and W. Azizun Wan Adnan,2015,2,Evolving Systems
10.1007/s12530-010-9007-9,Editorial,Plamen Angelov and Dimitar Filev and Nikola Kasabov,2010,5,Evolving Systems
10.1007/s12530-010-9013-y,Adversarial learning: the impact of statistical sample selection techniques on neural ensembles,Shir Li Wang and Kamran Shafi and Chris Lokan and Hussein A. Abbass,2010,3,Evolving Systems
10.1007/s12530-015-9131-7,Online feature extraction based on accelerated kernel principal component analysis for data stream,Annie Anak Joseph and Takaomi Tokumoto and Seiichi Ozawa,2016,17,Evolving Systems
10.1007/s12530-017-9207-7,Applying nature-inspired optimization algorithms for selecting important timestamps to reduce time series dimensionality,Muhammad Marwan Muhammad Fuad,2019,1,Evolving Systems
10.1007/s12530-013-9101-x,Immune optimization approach solving multi-objective chance-constrained programming,Zhuhong Zhang and Lei Wang and Fei Long,2015,3,Evolving Systems
10.1007/s12530-022-09476-8,Quick continual kernel learning on bounded memory space based on balancing between adaptation and forgetting,Koichiro Yamauchi,2022,0,Evolving Systems
10.1007/s12530-022-09444-2,Classification of attention levels using a Random Forest algorithm optimized with Particle Swarm Optimization,María Guadalupe Bedolla-Ibarra and Maria del Carmen Cabrera-Hernandez and Marco Antonio Aceves-Fernández and Saul Tovar-Arriaga,2022,1,Evolving Systems
10.1007/s12530-022-09418-4,Application of hybrid metaheuristic with Levenberg-Marquardt algorithm for 6-dimensional magnetic localization,Memduh Suveren and Rustu Akay and Mustafa Yusuf Yildirim and Muzaffer Kanaan,2022,1,Evolving Systems
10.1007/s12530-017-9215-7,Multiple traffic sign detection based on the artificial bee colony method,Anan Banharnsakun,2018,8,Evolving Systems
10.1007/s12530-016-9171-7,Characterizing evolving behavior of context vectors for context based clustering,Anagha R Kulkarni and Vrinda Tokekar and Parag Kulkarni,2017,0,Evolving Systems
10.1007/s12530-011-9039-9,Adaptive unified predictive control applied to first-order-plus-dead-time processes to eliminate unknown class of deterministic disturbance,S. K. Lin and A. C. Lee,2012,0,Evolving Systems
10.1007/s12530-014-9103-3,"Applications, results and future direction (EAIS 12)",José Antonio Iglesias and Igor Škrjanc,2014,5,Evolving Systems
10.1007/s12530-010-9020-z,Finding top-k elements in a time-sliding window,Nuno Homem and Joao Paulo Carvalho,2011,17,Evolving Systems
10.1007/s12530-014-9104-2,Evolving classification of UNIX users’ behaviors,Jose Antonio Iglesias and Agapito Ledezma and Araceli Sanchis,2014,4,Evolving Systems
10.1007/s12530-022-09462-0,XECryptoGA: a metaheuristic algorithm-based block cipher to enhance the security goals,Md Saquib Jawed and Mohammad Sajid,2022,2,Evolving Systems
10.1007/s12530-022-09470-0,A trust region based local Bayesian optimization without exhausted optimization of acquisition function,Qingxia Li and Anbing Fu and Wenhong Wei and Yuhui Zhang,2022,0,Evolving Systems
10.1007/s12530-018-9258-4,Automated skin lesion division utilizing Gabor filters based on shark smell optimizing method,Hasan Hosseinzadeh,2020,3,Evolving Systems
10.1007/s12530-018-9221-4,ACFLN: artificial chemical functional link network for prediction of stock market index,S. C. Nayak and B. B. Misra and H. S. Behera,2019,31,Evolving Systems
10.1007/s12530-017-9205-9,ILIOU machine learning preprocessing method for depression type prediction,Theodoros Iliou and Georgia Konstantopoulou and Mandani Ntekouli and Christina Lymperopoulou and Konstantinos Assimakopoulos and Dimitrios Galiatsatos and George Anastassopoulos,2019,10,Evolving Systems
10.1007/s12530-014-9107-z,Addressing concept drift to improve system availability by updating one-class data-driven models,Ahmad Alzghoul and Magnus Löfstrand,2015,0,Evolving Systems
10.1007/s12530-016-9155-7,On using density maps for the calculation of ship routes,Philip Azariadis,2017,2,Evolving Systems
10.1007/s12530-021-09370-9,"Fuzzy hypotheses tests for crisp data using non-asymptotic fuzzy estimators, fuzzy critical values and a degree of rejection or acceptance",Nikos Mylonas and Basil Papadopoulos,2021,1,Evolving Systems
10.1007/s12530-010-9010-1,A fast and light classifier for data streams,Vahida Attar and Pradeep Sinha and Kapil Wankhade,2010,15,Evolving Systems
10.1007/s12530-023-09484-2,AMTLDC: a new adversarial multi-source transfer learning framework to diagnosis of COVID-19,Hadi Alhares and Jafar Tanha and Mohammad Ali Balafar,2023,0,Evolving Systems
10.1007/s12530-011-9033-2,A real-time personal authentication system based on incremental feature extraction and classification of audiovisual information,Young-Min Jang and Minho Lee and Seiichi Ozawa,2011,5,Evolving Systems
10.1007/s12530-022-09483-9,Fast and efficient exception tolerant ensemble for limited training,Sayan Sikder and Pankaj Dadure and Sanjeev K. Metya,2023,0,Evolving Systems
10.1007/s12530-020-09327-4,On utilizing an enhanced object partitioning scheme to optimize self-organizing lists-on-lists,O. Ekaba Bisong and B. John Oommen,2021,0,Evolving Systems
10.1007/s12530-012-9045-6,An improved approach of self-organising fuzzy neural network based on similarity measures,Gang Leng and Xiao-Jun Zeng and John A. Keane,2012,22,Evolving Systems
10.1007/s12530-018-9217-0,A novel synergistic fibroblast optimization based Kalman estimation model for forecasting time-series data,T. T. Dhivyaprabha and P. Subashini and M. Krishnaveni and N. Santhi and Ramesh Sivanpillai and G. Jayashree,2019,3,Evolving Systems
10.1007/s12530-022-09461-1,Improved equilibrium optimization based on Levy flight approach for feature selection,K. Balakrishnan and R. Dhanalakshmi and M. Akila and Bam Bahadur Sinha,2022,0,Evolving Systems
10.1007/s12530-015-9140-6,A speed FPGA hardware accelerator based FSBMA-VBSME used in H.264/AVC,Amira Yahi and Salah Toumi and El-bay Bourennane and Kamel Messaoudi,2016,1,Evolving Systems
10.1007/s12530-015-9136-2,On cluster validity indices with its application to interleaved radar pulse separation through fuzzy-based representation,A. H. Mazinan,2016,4,Evolving Systems
10.1007/s12530-019-09315-3,A new flexible pricing mechanism considering price–quality relation for cloud resource allocation,Sepideh Adabi and Fatemeh Alayin and Arash Sharifi,2021,2,Evolving Systems
10.1007/s12530-014-9125-x,On-line incremental learning for unknown conditions during assembly operations with industrial robots,J. L. Navarro-Gonzalez and I. Lopez-Juarez and K. Ordaz-Hernandez and R. Rios-Cabrera,2015,9,Evolving Systems
10.1007/s12530-010-9015-9,Backpropagation to train an evolving radial basis function neural network,José de Jesús Rubio and Diana M. Vázquez and Jaime Pacheco,2010,24,Evolving Systems
10.1007/s12530-022-09466-w,DBF-Net: a semi-supervised dual-task balanced fusion network for segmenting infected regions from lung CT images,Xiaoyan Lu and Yang Xu and Wenhao Yuan,2022,0,Evolving Systems
10.1007/s12530-016-9166-4,Sustainable mobility leveraging on 5G mobile communication infrastructures in the context of smart city operations,George Dimitrakopoulos,2017,5,Evolving Systems
10.1007/s12530-021-09403-3,Evolving and explainable clinical risk assessment at the edge,Andrea Pazienza and Roberto Anglani and Corrado Fasciano and Corrado Tatulli and Felice Vitulano,2022,4,Evolving Systems
10.1007/s12530-020-09333-6,Grasshopper optimization algorithm utilized Xilinx controller for maximum power generation in photovoltaic system,B. V. Kalyan Ram and N. Chidambararaj,2021,2,Evolving Systems
10.1007/s12530-017-9208-6,Multistatic radar classification of armed vs unarmed personnel using neural networks,Jarez S. Patel and Francesco Fioranelli and Matthew Ritchie and Hugh Griffiths,2018,12,Evolving Systems
10.1007/s12530-010-9017-7,Incremental quantile estimation,Katharina Tschumitschew and Frank Klawonn,2010,10,Evolving Systems
10.1007/s12530-019-09276-7,An improved decision support system for ABC inventory classification,Ergün Eraslan and Yusuf Tansel İÇ,2020,8,Evolving Systems
10.1007/s12530-019-09317-1,Anomaly process detection using negative selection algorithm and classification techniques,Soodeh Hosseini and Hossein Seilani,2021,12,Evolving Systems
10.1007/s12530-021-09416-y,Ant colony optimization technique for integrating renewable DG in distribution system with techno-economic objectives,Nisha R. Godha and Vishram N. Bapat and Iranna Korachagaon,2022,3,Evolving Systems
10.1007/s12530-012-9060-7,Single-pass active learning with conflict and ignorance,Edwin Lughofer,2012,91,Evolving Systems
10.1007/s12530-010-9002-1,Evolvable fuzzy systems: some insights and challenges,Witold Pedrycz,2010,25,Evolving Systems
10.1007/s12530-017-9180-1,A C4.5 algorithm for english emotional classification,Phu Vo Ngoc and Chau Vo Thi Ngoc and Tran Vo Thi Ngoc and Dat Nguyen Duy,2019,27,Evolving Systems
10.1007/s12530-019-09291-8,A hybridization of grey wolf optimizer and differential evolution for solving nonlinear systems,Mohamed A. Tawhid and Abdelmonem M. Ibrahim,2020,26,Evolving Systems
10.1007/s12530-021-09401-5,Battle royale optimizer for training multi-layer perceptron,Saeid Agahian and Taymaz Akan,2022,9,Evolving Systems
10.1007/s12530-019-09306-4,Power spectrum and dynamic time warping for DNA sequences classification,Abdesselem Dakhli and Chokri Ben Amar,2020,3,Evolving Systems
10.1007/s12530-023-09489-x,PDRF-Net: a progressive dense residual fusion network for COVID-19 lung CT image segmentation,Xiaoyan Lu and Yang Xu and Wenhao Yuan,2023,0,Evolving Systems
10.1007/s12530-010-9023-9,Extended sequential adaptive fuzzy inference system for classification problems,Hai-Jun Rong and N. Sundararajan and Guang-Bin Huang and Guang-She Zhao,2011,68,Evolving Systems
10.1007/s12530-016-9146-8,Maintenance of a Bayesian network: application using medical diagnosis,Ahlem Refai and H. F. Merouani and Hayet Aouras,2016,8,Evolving Systems
10.1007/s12530-018-9260-x,Finger kunckcle patterns based person recognition via bank of multi-scale binarized statistical texture features,Abdelouahab Attia and Mourad Chaa and Zahid Akhtar and Youssef Chahir,2020,8,Evolving Systems
10.1007/s12530-015-9133-5,Real-time vessel behavior prediction,Dimitrios Zissis and Elias K. Xidias and Dimitrios Lekkas,2016,34,Evolving Systems
10.1007/s12530-017-9181-0,Discrete-time Kalman filter for Takagi–Sugeno fuzzy models,L. A. Páramo-Carranza and J. A. Meda-Campaña and José de Jesús Rubio and R. Tapia-Herrera and A. V. Curtidor-López and A. Grande-Meza and I. Cázares-Ramírez,2017,27,Evolving Systems
10.1007/s12530-014-9112-2,OWA filters and forecasting models applied to electric power load time series,R. Ballini and R. R. Yager,2014,12,Evolving Systems
10.1007/s12530-022-09448-y,A review of online supervised learning,Charanjeet Singh and Anuj Sharma,2022,0,Evolving Systems
10.1007/s12530-022-09447-z,Min max kurtosis distance based improved initial centroid selection approach of K-means clustering for big data mining on gene expression data,Kamlesh Kumar Pandey and Diwakar Shukla,2022,0,Evolving Systems
10.1007/s12530-021-09368-3,A memetic animal migration optimizer for multimodal optimization,Taymaz Rahkar Farshi,2022,3,Evolving Systems
10.1007/s12530-015-9143-3,Adaptive PID controller design for wing rock suppression using self-recurrent wavelet neural network identifier,Milad Malekzadeh and Jalil Sadati and Mojtaba Alizadeh,2016,18,Evolving Systems
