DOI,Título,Autores,Año,Citas,Revista
10.1109/tetci.2018.2868474,Learning Automata Based Competition Scheme to Train Deep Neural Networks,Haonan Guo and Shenghong Li and Kaiyue Qi and Ying Guo and Zhengwu Xu,2020,5,IEEE Transactions on Emerging Topics in Computational Intelligence
10.1109/tetci.2020.3011432,Dynamic Node Embeddings From Edge Streams,John Boaz Lee and Giang Nguyen and Ryan A. Rossi and Nesreen K. Ahmed and Eunyee Koh and Sungchul Kim,2020,5,IEEE Transactions on Emerging Topics in Computational Intelligence
10.1109/tetci.2022.3171769,Monitoring Social Distancing With Single Image Depth Estimation,Alessio Mingozzi and Andrea Conti and Filippo Aleotti and Matteo Poggi and Stefano Mattoccia,2022,1,IEEE Transactions on Emerging Topics in Computational Intelligence
10.1109/tetci.2018.2880815,ANFIS Microgrid Energy Management System Synthesis by Hyperplane Clustering Supported by Neurofuzzy Min–Max Classifier,Stefano Leonori and Alessio Martino and Fabio Massimo Frattale Mascioli and Antonello Rizzi,2019,12,IEEE Transactions on Emerging Topics in Computational Intelligence
10.1109/tetci.2020.2990757,Guest Editorial Special Issue on Big Data and Computational Intelligence for Agile Wireless IoT,,2020,0,IEEE Transactions on Emerging Topics in Computational Intelligence
10.1109/tetci.2017.2745399,Table of Contents,,2017,0,IEEE Transactions on Emerging Topics in Computational Intelligence
10.1109/tetci.2016.2645720,Task Intelligence of Robots: Neural Model-Based Mechanism of Thought and Online Motion Planning,In-Bae Jeong and Woo-Ri Ko and Gyeong-Moon Park and Deok-Hwa Kim and Yong-Ho Yoo and Jong-Hwan Kim,2017,24,IEEE Transactions on Emerging Topics in Computational Intelligence
10.1109/tetci.2017.2766721,Table of Contents,,2017,0,IEEE Transactions on Emerging Topics in Computational Intelligence
10.1109/tetci.2022.3145639,Obtaining Fuzzy Membership Function of Clusters With the Memristor Hardware Implementation and On-Chip Learning,Mohammad Javadian and Arian Hejazi and Sajad Haghzad Klidbary,2022,1,IEEE Transactions on Emerging Topics in Computational Intelligence
10.1109/tetci.2017.2681538,Become a published author in 4 to 6 weeks,,2017,0,IEEE Transactions on Emerging Topics in Computational Intelligence
10.1109/tetci.2018.2878633,2018 List of Reviewers,,2018,0,IEEE Transactions on Emerging Topics in Computational Intelligence
10.1109/tetci.2018.2854341,IEEE Transactions on Emerging Topics in Computational Intelligence,,2018,0,IEEE Transactions on Emerging Topics in Computational Intelligence
10.1109/tetci.2020.2971307,IEEE Transactions on Emerging Topics in Computational Intelligence,,2020,0,IEEE Transactions on Emerging Topics in Computational Intelligence
10.1109/tetci.2018.2868061,Multidomain Features Fusion for Zero-Shot Learning,Zhihao Liu and Zhigang Zeng and Cheng Lian,2020,0,IEEE Transactions on Emerging Topics in Computational Intelligence
10.1109/tetci.2020.2993420,Table of Contents,,2020,0,IEEE Transactions on Emerging Topics in Computational Intelligence
10.1109/tetci.2018.2858788,Intelligent Item Searching With Gesture-Based Interfaces Through Mobile Cloud Computing,Lien-Wu Chen and Yung-En Li and Jun-Xian Liu and Hsi-Min Chen and Ming-Fong Tsai,2020,1,IEEE Transactions on Emerging Topics in Computational Intelligence
10.1109/tetci.2020.3020706,IEEE Transactions on Artificial Intelligence,,2020,0,IEEE Transactions on Emerging Topics in Computational Intelligence
10.1109/tetci.2020.3036202,Table of Contents,,2020,0,IEEE Transactions on Emerging Topics in Computational Intelligence
10.1109/tetci.2020.2993422,IEEE Transactions on Emerging Topics in Computational Intelligence,,2020,0,IEEE Transactions on Emerging Topics in Computational Intelligence
10.1109/tetci.2020.3007696,IEEE Transactions on Emerging Topics in Computational Intelligence,,2020,0,IEEE Transactions on Emerging Topics in Computational Intelligence
10.1109/tetci.2019.2951074,IEEE Transactions on Emerging Topics in Computational Intelligence,,2019,0,IEEE Transactions on Emerging Topics in Computational Intelligence
10.1109/tetci.2019.2902899,IEEE Computational Intelligence Society,,2019,0,IEEE Transactions on Emerging Topics in Computational Intelligence
10.1109/tetci.2018.2868326,A Novel Doubly Reweighting Multisource Transfer Learning Framework,Dingcheng Ji and Yizhang Jiang and Pengjiang Qian and Shitong Wang,2019,2,IEEE Transactions on Emerging Topics in Computational Intelligence
10.1109/tetci.2019.2938429,Table of contents,,2019,0,IEEE Transactions on Emerging Topics in Computational Intelligence
10.1109/tetci.2018.2890322,IEEE Transactions on Emerging Topics in Computational Intelligence,,2019,0,IEEE Transactions on Emerging Topics in Computational Intelligence
10.1109/tetci.2019.2911787,IEEE Computational Intelligence Society,,2019,0,IEEE Transactions on Emerging Topics in Computational Intelligence
10.1109/tetci.2018.2848293,System Network Complexity: Network Evolution Subgraphs of System State Series,Animesh Chaturvedi and Aruna Tiwari,2020,7,IEEE Transactions on Emerging Topics in Computational Intelligence
10.1109/tetci.2017.2764113,TANSA: Task Allocation Using Nomadic Soft Agents for Multirobot Systems,Shashi Shekhar Jha and Shivashankar B. Nair,2018,1,IEEE Transactions on Emerging Topics in Computational Intelligence
10.1109/tetci.2023.3237951,IEEE Computational Intelligence Society Information,,2023,0,IEEE Transactions on Emerging Topics in Computational Intelligence
10.1109/tetci.2021.3058672,Learning Sparse Neural Networks Using Non-Convex Regularization,Mohammad Khalid Pandit and Roohie Naaz and Mohammad Ahsan Chishti,2022,3,IEEE Transactions on Emerging Topics in Computational Intelligence
10.1109/tetci.2022.3221491,Multi-View Adjacency-Constrained Hierarchical Clustering,Jie Yang and Chin-Teng Lin,2022,0,IEEE Transactions on Emerging Topics in Computational Intelligence
10.1109/tetci.2020.3017242,S-DIGing: A Stochastic Gradient Tracking Algorithm for Distributed Optimization,Huaqing Li and Lifeng Zheng and Zheng Wang and Yu Yan and Liping Feng and Jing Guo,2022,8,IEEE Transactions on Emerging Topics in Computational Intelligence
10.1109/tetci.2022.3193367,A DRL-Driven Intelligent Joint Optimization Strategy for Computation Offloading and Resource Allocation in Ubiquitous Edge IoT Systems,Meng Yi and Peng Yang and Miaojiang Chen and Nguyen The Loc,2023,0,IEEE Transactions on Emerging Topics in Computational Intelligence
10.1109/tetci.2020.3028581,Artificial Neural Networks in Action for an Automated Cell-Type Classification of Biological Neural Networks,Eirini Troullinou and Grigorios Tsagkatakis and Spyridon Chavlis and Gergely F. Turi and Wenke Li and Attila Losonczy and Panagiotis Tsakalides and Panayiota Poirazi,2021,3,IEEE Transactions on Emerging Topics in Computational Intelligence
10.1109/tetci.2017.2721440,On the Reconstruction Method For Negative Surveys with Application to Education Surveys,Hao Jiang and Wenjian Luo and Li Ni and Bei Hua,2017,11,IEEE Transactions on Emerging Topics in Computational Intelligence
10.1109/tetci.2021.3097740,StreamSoNG: A Soft Streaming Classification Approach,Wenlong Wu and James M. Keller and Jeffrey Dale and James C. Bezdek,2022,2,IEEE Transactions on Emerging Topics in Computational Intelligence
10.1109/tetci.2017.2669523,Automatic Microstructure Defect Detection of Ti-6Al-4V Titanium Alloy by Regions-Based Graph,Ruoxu Ren and Terence Hung and Kay Chen Tan,2017,5,IEEE Transactions on Emerging Topics in Computational Intelligence
10.1109/tetci.2022.3199733,Parameter-Free Similarity-Aware Attention Module for Medical Image Classification and Segmentation,Jie Du and Kai Guan and Yanhong Zhou and Yuanman Li and Tianfu Wang,2022,0,IEEE Transactions on Emerging Topics in Computational Intelligence
10.1109/tetci.2023.3234545,SafeCool: Safe and Energy-Efficient Cooling Management in Data Centers With Model-Based Reinforcement Learning,Jianxiong Wan and Yanduo Duan and Xiang Gui and Chuyi Liu and Leixiao Li and Zhiqiang Ma,2023,0,IEEE Transactions on Emerging Topics in Computational Intelligence
10.1109/tetci.2020.2998919,Consensus Learning for Distributed Fuzzy Neural Network in Big Data Environment,Ye Shi and Chin-Teng Lin and Yu-Cheng Chang and Weiping Ding and Yuhui Shi and Xin Yao,2021,5,IEEE Transactions on Emerging Topics in Computational Intelligence
10.1109/tetci.2021.3055873,Joint Domain Adaptation Based on Adversarial Dynamic Parameter Learning,Yumeng Yuan and Yuhua Li and Zhenlong Zhu and Ruixuan Li and Xiwu Gu,2021,1,IEEE Transactions on Emerging Topics in Computational Intelligence
10.1109/tetci.2019.2926769,Deep Learning Based Hotspot Prediction and Beam Management for Adaptive Virtual Small Cell in 5G Networks,Yanan Liu and Xianbin Wang and Gary Boudreau and Akram Bin Sediq and Hatem Abou-zeid,2020,22,IEEE Transactions on Emerging Topics in Computational Intelligence
10.1109/tetci.2017.2739124,Biogeography-Based Optimization: A 10-Year Review,Haiping Ma and Dan Simon and Patrick Siarry and Zhile Yang and Minrui Fei,2017,87,IEEE Transactions on Emerging Topics in Computational Intelligence
10.1109/tetci.2018.2849414,Power Line Detection by Pyramidal Patch Classification,Yan Li and Chaofeng Pan and Xianbin Cao and Dapeng Wu,2019,15,IEEE Transactions on Emerging Topics in Computational Intelligence
10.1109/tetci.2022.3173443,Trends and Prospects of Techniques for Haze Removal From Degraded Images: A Survey,Geet Sahu and Ayan Seal and Debotosh Bhattacharjee and Mita Nasipuri and Peter Brida and Ondrej Krejcar,2022,6,IEEE Transactions on Emerging Topics in Computational Intelligence
10.1109/tetci.2020.3032701,Security and Privacy in Shared HitLCPS Using a GA-Based Multiple-Threshold Sanitization Model,Jimmy Ming-Tai Wu and Gautam Srivastava and Alireza Jolfaei and Matin Pirouz and Jerry Chun-Wei Lin,2022,8,IEEE Transactions on Emerging Topics in Computational Intelligence
10.1109/tetci.2020.2971218,Forecasting Fluctuations in the Financial Index Using a Recurrent Neural Network Based on Price Features,Yu-Fei Lin and Tzu-Ming Huang and Wei-Ho Chung and Yeong-Luh Ueng,2021,4,IEEE Transactions on Emerging Topics in Computational Intelligence
10.1109/tetci.2017.2705873,IEEE Transactions on Emerging Topics in Computational Intelligence,,2017,0,IEEE Transactions on Emerging Topics in Computational Intelligence
10.1109/tetci.2017.2778716,Video Dynamics Detection Using Deep Neural Networks,Keji Zheng and Wei Qi Yan and Parma Nand,2018,25,IEEE Transactions on Emerging Topics in Computational Intelligence
10.1109/tetci.2019.2922340,Stochastic Sensitivity Tree Boosting for Imbalanced Prediction Problems of Protein-Ligand Interaction Sites,Wing W. Y. Ng and Yuda Zhang and Jianjun Zhang and Debby D. Wang and Fu Lee Wang,2021,1,IEEE Transactions on Emerging Topics in Computational Intelligence
10.1109/tetci.2020.2969213,A Survey of Evolutionary Computation for Web Service Composition: A Technical Perspective,Alexandre Sawczuk da Silva and Hui Ma and Yi Mei and Mengjie Zhang,2020,13,IEEE Transactions on Emerging Topics in Computational Intelligence
10.1109/tetci.2022.3140372,Information for Authors,,2022,0,IEEE Transactions on Emerging Topics in Computational Intelligence
10.1109/tetci.2018.2871466,"Comparison of Use of a 2000 Qubit D-Wave Quantum Annealer and MCMC for Sampling, Image Reconstruction, and Classification",Yaroslav Koshka and Mark A. Novotny,2021,4,IEEE Transactions on Emerging Topics in Computational Intelligence
10.1109/tetci.2019.2923001,Training Deep Photonic Convolutional Neural Networks With Sinusoidal Activations,Nikolaos Passalis and George Mourgias-Alexandris and Apostolos Tsakyridis and Nikos Pleros and Anastasios Tefas,2021,16,IEEE Transactions on Emerging Topics in Computational Intelligence
10.1109/tetci.2021.3122743,Dynamic Path Planning for Unmanned Aerial Vehicles Under Deadline and Sector Capacity Constraints,Sudharsan Vaidhun and Zhishan Guo and Jiang Bian and Haoyi Xiong and Sajal Das,2022,0,IEEE Transactions on Emerging Topics in Computational Intelligence
10.1109/tetci.2021.3136598,Do Models Learn the Directionality of Relations? A New Evaluation: Relation Direction Recognition,Shengfei Lyu and Xingyu Wu and Jinlong Li and Qiuju Chen and Huanhuan Chen,2022,0,IEEE Transactions on Emerging Topics in Computational Intelligence
10.1109/tetci.2021.3132405,2021 Index IEEE Transactions on Emerging Topics in Computational Intelligence Vol. 5,,2021,0,IEEE Transactions on Emerging Topics in Computational Intelligence
10.1109/tetci.2023.3234548,Sparse Adversarial Unsupervised Domain Adaptation With Deep Dictionary Learning for Traffic Scene Classification,Mohsen Saffari and Mahdi Khodayar and Seyed Mohammad Jafar Jalali,2023,0,IEEE Transactions on Emerging Topics in Computational Intelligence
10.1109/tetci.2020.3045485,O-SegNet: Robust Encoder and Decoder Architecture for Objects Segmentation From Aerial Imagery Data,Karuna Kumari Eerapu and Shyam Lal and A. V. Narasimhadhan,2022,3,IEEE Transactions on Emerging Topics in Computational Intelligence
10.1109/tetci.2018.2868253,Marginal Likelihood Based Model Comparison in Fuzzy Bayesian Learning,Indranil Pan and Dirk Bester,2020,2,IEEE Transactions on Emerging Topics in Computational Intelligence
10.1109/tetci.2021.3067104,Angle-Based Multi-Objective Evolutionary Algorithm Based On Pruning-Power Indicator for Game Map Generation,Lianbo Ma and Shi Cheng and Mingli Shi and Yinan Guo,2022,1,IEEE Transactions on Emerging Topics in Computational Intelligence
10.1109/tetci.2022.3165935,Local Visual and Global Deep Features Based Blind Stitched Panoramic Image Quality Evaluation Using Ensemble Learning,Yueli Cui and Gangyi Jiang and Mei Yu and Yang Song,2022,2,IEEE Transactions on Emerging Topics in Computational Intelligence
10.1109/tetci.2022.3210582,Probabilistic Combination of Non-Linear Eigenprojections For Ensemble Classification,Juan E. Arco and Andres Ortiz and Javier Ramirez and Francisco J. Martinez-Murcia and Yu-Dong Zhang and Jordi Broncano and M. Alvaro Berbis and Javier Royuela-del-Val and Antonio Luna and Juan M. Gorriz,2022,0,IEEE Transactions on Emerging Topics in Computational Intelligence
10.1109/tetci.2022.3170520,A Buffer-Based Ant Colony System Approach for Dynamic Cold Chain Logistics Scheduling,Li-Jiao Wu and Lin Shi and Zhi-Hui Zhan and Kuei-Kuei Lai and Jun Zhang,2022,2,IEEE Transactions on Emerging Topics in Computational Intelligence
10.1109/tetci.2022.3160702,Pharmaceutical Foreign Particle Detection: An Efficient Method Based on Adaptive Convolution and Multiscale Attention,Junfei Yi and Hui Zhang and Jianxu Mao and Yurong Chen and Hang Zhong and Hang Zhong,2022,0,IEEE Transactions on Emerging Topics in Computational Intelligence
10.1109/tetci.2019.2960474,3D-CNN-SPP: A Patient Risk Prediction System From Electronic Health Records via 3D CNN and Spatial Pyramid Pooling,Ronghui Ju and Pan Zhou and Shiping Wen and Wei Wei and Yuan Xue and Xiaolei Huang and Xin Yang,2021,3,IEEE Transactions on Emerging Topics in Computational Intelligence
10.1109/tetci.2020.2979462,Discrete Multiplierless Implementation of Fractional Order Hindmarsh–Rose Model,S. A. Malik and A. H. Mir,2021,4,IEEE Transactions on Emerging Topics in Computational Intelligence
10.1109/tetci.2017.2699228,Epistasis Based ACO for Regression Test Case Prioritization,Yi Bian and Zheng Li and Ruilian Zhao and Dunwei Gong,2017,27,IEEE Transactions on Emerging Topics in Computational Intelligence
10.1109/tetci.2019.2939582,Reducing Parameter Value Uncertainty in Discrete Bayesian Network Learning: A Semantic Fuzzy Bayesian Approach,Monidipa Das and Soumya K. Ghosh,2021,6,IEEE Transactions on Emerging Topics in Computational Intelligence
10.1109/tetci.2021.3086237,Deep Learning in Physics: A Study of Dielectric Quasi-Cubic Particles in a Uniform Electric Field,Zhe Wang and Claude Guet,2022,1,IEEE Transactions on Emerging Topics in Computational Intelligence
10.1109/tetci.2019.2914266,Discriminative Learning in the Model Space for Symbolic Sequence Classification,Yaqiang Yao and Huanhuan Chen and Xin Yao,2021,1,IEEE Transactions on Emerging Topics in Computational Intelligence
10.1109/tetci.2022.3209306,Coordinated Cyber Security Enhancement for Grid-Transportation Systems With Social Engagement,Pengfei Zhao and Shuangqi Li and Paul Jen-Hwa Hu and Zhidong Cao and Chenghong Gu and Da Xie and Daniel Dajun Zeng,2022,1,IEEE Transactions on Emerging Topics in Computational Intelligence
10.1109/tetci.2020.3039520,Tactful Networking: Humans in the Communication Loop,Rafael Lima Costa and Aline Carneiro Viana and Artur Ziviani and Leobino Nascimento Sampaio,2021,4,IEEE Transactions on Emerging Topics in Computational Intelligence
10.1109/tetci.2022.3201294,Exploring Abnormal Behavior in Swarm: Identify User Using Adversarial Examples,Zichi Wang and Sheng Li and Xinpeng Zhang and Guorui Feng,2023,0,IEEE Transactions on Emerging Topics in Computational Intelligence
10.1109/tetci.2023.3243909,An Intelligent Fuzzy System Based on the Optimization of Ecological Agriculture Areas,Xiaozeng Xu and Meng Li,2023,0,IEEE Transactions on Emerging Topics in Computational Intelligence
10.1109/tetci.2022.3146965,Feature Pyramid Network With Level-Aware Attention for Meningioma Segmentation,Wei Huang and Xin Shu and Zizhou Wang and Lei Zhang and Chaoyue Chen and Jianguo Xu and Zhang Yi,2022,0,IEEE Transactions on Emerging Topics in Computational Intelligence
10.1109/tetci.2020.3045483,Smart Sensor Control for Rehabilitation in Parkinson's Patients,Behnam Faraji and Meysam Gheisarnejad and Zahra Esfahani and Mohammad-Hassan Khooban,2022,5,IEEE Transactions on Emerging Topics in Computational Intelligence
10.1109/tetci.2021.3059007,Quantifying Mobility and Mixing Propensity in the Spatiotemporal Context of a Pandemic Spread,Satyaki Roy and Preetom Biswas and Preetam Ghosh,2021,3,IEEE Transactions on Emerging Topics in Computational Intelligence
10.1109/tetci.2017.2669104,Evolutionary Many-Objective Optimization of Hybrid Electric Vehicle Control: From General Optimization to Preference Articulation,Ran Cheng and Tobias Rodemann and Michael Fischer and Markus Olhofer and Yaochu Jin,2017,88,IEEE Transactions on Emerging Topics in Computational Intelligence
10.1109/tetci.2020.3020061,Modelling Segmented Cardiotocography Time-Series Signals Using One-Dimensional Convolutional Neural Networks for the Early Detection of Abnormal Birth Outcomes,Paul Fergus and Carl Chalmers and Casimiro Curbelo Montanez and Denis Reilly and Paulo Lisboa and Beth Pineles,2021,5,IEEE Transactions on Emerging Topics in Computational Intelligence
10.1109/tetci.2023.3257262,Self-Supervised Pretraining Based on Noise-Free Motion Reconstruction and Semantic-Aware Contrastive Learning for Human Motion Prediction,Qin Li and Yong Wang,2023,0,IEEE Transactions on Emerging Topics in Computational Intelligence
10.1109/tetci.2017.2769104,Insights on Transfer Optimization: Because Experience is the Best Teacher,Abhishek Gupta and Yew-Soon Ong and Liang Feng,2018,159,IEEE Transactions on Emerging Topics in Computational Intelligence
10.1109/tetci.2022.3205384,Multi-View Point Cloud Registration Based on Evolutionary Multitasking With Bi-Channel Knowledge Sharing Mechanism,Yue Wu and Yibo Liu and Maoguo Gong and Peiran Gong and Hao Li and Zedong Tang and Qiguang Miao and Wenping Ma,2023,6,IEEE Transactions on Emerging Topics in Computational Intelligence
10.1109/tetci.2020.3041019,Granulated RCNN and Multi-Class Deep SORT for Multi-Object Detection and Tracking,Anima Pramanik and Sankar K. Pal and J. Maiti and Pabitra Mitra,2022,31,IEEE Transactions on Emerging Topics in Computational Intelligence
10.1109/tetci.2023.3237949,IEEE Transactions on Emerging Topics in Computational Intelligence Publication Information,,2023,0,IEEE Transactions on Emerging Topics in Computational Intelligence
10.1109/tetci.2022.3231657,A Lightweight Multimode Medical Image Fusion Method Using Similarity Measure Between Intuitionistic Fuzzy Sets Joint Laplacian Pyramid,Qian Jiang and Xin Jin and Xiaohui Cui and Shaowen Yao and Keqin Li and Wei Zhou,2023,0,IEEE Transactions on Emerging Topics in Computational Intelligence
10.1109/tetci.2021.3115666,A New Semi-Supervised Fault Diagnosis Method via Deep CORAL and Transfer Component Analysis,Xinyu Li and Zhao Zhang and Liang Gao and Long Wen,2022,4,IEEE Transactions on Emerging Topics in Computational Intelligence
10.1109/tetci.2020.2983426,Generating Knowledge-Guided Discriminative Features Using Genetic Programming for Melanoma Detection,Qurrat Ul Ain and Harith Al-Sahaf and Bing Xue and Mengjie Zhang,2021,13,IEEE Transactions on Emerging Topics in Computational Intelligence
10.1109/tetci.2022.3186180,A Long Short-Term Memory Based Framework for Early Detection of Mild Cognitive Impairment From EEG Signals,Ashik Mostafa Alvi and Siuly Siuly and Hua Wang,2023,10,IEEE Transactions on Emerging Topics in Computational Intelligence
10.1109/tetci.2019.2902438,EmoSense: Computational Intelligence Driven Emotion Sensing via Wireless Channel Data,Yu Gu and Yantong Wang and Tao Liu and Yusheng Ji and Zhi Liu and Peng Li and Xiaoyan Wang and Xin An and Fuji Ren,2020,18,IEEE Transactions on Emerging Topics in Computational Intelligence
10.1109/tetci.2018.2872036,Monitoring Wind Turbines' Unhealthy Status: A Data-Driven Approach,Tinghui Ouyang and Yusen He and Heming Huang,2019,19,IEEE Transactions on Emerging Topics in Computational Intelligence
10.1109/tetci.2020.2992778,A Comprehensive Review of Shepherding as a Bio-Inspired Swarm-Robotics Guidance Approach,Nathan K. Long and Karl Sammut and Daniel Sgarioto and Matthew Garratt and Hussein A. Abbass,2020,41,IEEE Transactions on Emerging Topics in Computational Intelligence
10.1109/tetci.2018.2829919,Technology Aware Training in Memristive Neuromorphic Systems for Nonideal Synaptic Crossbars,Indranil Chakraborty and Deboleena Roy and Kaushik Roy,2018,52,IEEE Transactions on Emerging Topics in Computational Intelligence
10.1109/tetci.2017.2783885,Automatic Programming of VST Sound Synthesizers Using Deep Networks and Other Techniques,Matthew John Yee-King and Leon Fedden and Mark d'Inverno,2018,15,IEEE Transactions on Emerging Topics in Computational Intelligence
10.1109/tetci.2021.3120513,Quaternion Capsule Neural Network With Region Attention for Facial Expression Recognition in Color Images,Yu Zhou and Lianghai Jin and Guangzhi Ma and Xiangyang Xu,2022,4,IEEE Transactions on Emerging Topics in Computational Intelligence
10.1109/tetci.2019.2897815,Graph Embedded Convolutional Neural Networks in Human Crowd Detection for Drone Flight Safety,Maria Tzelepi and Anastasios Tefas,2021,25,IEEE Transactions on Emerging Topics in Computational Intelligence
10.1109/tetci.2018.2804885,No-Reference Stereoscopic Image Quality Assessment Based on Image Distortion and Stereo Perceptual Information,Liquan Shen and Ruigang Fang and Yang Yao and Xianqiu Geng and Dapeng Wu,2019,23,IEEE Transactions on Emerging Topics in Computational Intelligence
10.1109/tetci.2021.3086036,Modeling and Control of Probabilistic Fuzzy Discrete Event Systems,Feng Lin and Hao Ying,2022,2,IEEE Transactions on Emerging Topics in Computational Intelligence
10.1109/tetci.2017.2699218,A Model-Driven Methodology for the Design of Autonomic and Cognitive IoT-Based Systems: Application to Healthcare,Emna Mezghani and Ernesto Exposito and Khalil Drira,2017,59,IEEE Transactions on Emerging Topics in Computational Intelligence
10.1109/tetci.2022.3192890,Self-Learning Fuzzy Automaton With Input and Output Fuzzy Sets for System Modelling,Hao Ying and Feng Lin,2023,0,IEEE Transactions on Emerging Topics in Computational Intelligence
10.1109/tetci.2022.3221126,Recent Advances of Computational Intelligence Techniques for Composing Music,Yu-Wei Wen and Chuan-Kang Ting,2023,0,IEEE Transactions on Emerging Topics in Computational Intelligence
10.1109/tetci.2022.3221940,Balancing Convergence and Diversity in Objective and Decision Spaces for Multimodal Multi-Objective Optimization,Fei Ming and Wenyin Gong and Ling Wang and Liang Gao,2023,1,IEEE Transactions on Emerging Topics in Computational Intelligence
10.1109/tetci.2019.2916051,An Adaptive Archive-Based Evolutionary Framework for Many-Task Optimization,Yongliang Chen and Jinghui Zhong and Liang Feng and Jun Zhang,2020,52,IEEE Transactions on Emerging Topics in Computational Intelligence
10.1109/tetci.2017.2782800,Effective Quality-Aware Sensor Data Management,Giuseppe D'Aniello and Matteo Gaeta and Tzung-Pei Hong,2018,22,IEEE Transactions on Emerging Topics in Computational Intelligence
10.1109/tetci.2017.2739128,Computational Intelligence for Demand Response Exchange Considering Temporal Characteristics of Load Profile via Adaptive Fuzzy Inference System,Srikanth Reddy K. and Lokesh Kumar Panwar and B.K. Panigrahi and Rajesh Kumar,2018,16,IEEE Transactions on Emerging Topics in Computational Intelligence
10.1109/tetci.2021.3100646,Identity-Preserved Complete Face Recovering Network for Partial Face Image,Mengke Li and Yiu-ming Cheung,2023,1,IEEE Transactions on Emerging Topics in Computational Intelligence
10.1109/tetci.2022.3171855,Multi-Modal Non-Euclidean Brain Network Analysis With Community Detection and Convolutional Autoencoder,Qi Zhu and Jing Yang and Shuihua Wang and Daoqiang Zhang and Zheng Zhang,2023,1,IEEE Transactions on Emerging Topics in Computational Intelligence
10.1109/tetci.2022.3182654,(MLE$^{2}$A$^{2}$U)-Net: Image Super-Resolution via Multi-Level Edge Embedding and Aggregated Attentive Upsampler Network,Nancy Mehta and Subrahmanyam Murala,2023,1,IEEE Transactions on Emerging Topics in Computational Intelligence
10.1109/tetci.2019.2960546,Improving Adversarial Neural Machine Translation for Morphologically Rich Language,Chenggang Mi and Lei Xie and Yanning Zhang,2020,4,IEEE Transactions on Emerging Topics in Computational Intelligence
