DOI,Título,Autores,Año,Citas,Revista
10.1109/tetci.2019.2892748,Indoor WLAN Intelligent Target Intrusion Sensing Using Ray-Aided Generative Adversarial Network,Mu Zhou and Yixin Lin and Nan Zhao and Qing Jiang and Xiaolong Yang and Zengshan Tian,2020,28,IEEE Transactions on Emerging Topics in Computational Intelligence
10.1109/tetci.2021.3078026,Information for Authors,,2021,0,IEEE Transactions on Emerging Topics in Computational Intelligence
10.1109/tetci.2021.3063877,Information for Authors,,2021,0,IEEE Transactions on Emerging Topics in Computational Intelligence
10.1109/tetci.2020.3027300,Deep COLA: A Deep COmpetitive Learning Algorithm for Future Home Energy Management Systems,Ghulam Mohi-Ud-Din and Angelos K. Marnerides and Qi Shi and Chelsea Dobbins and Aine MacDermott,2020,0,IEEE Transactions on Emerging Topics in Computational Intelligence
10.1109/tetci.2021.3110260,MOCLoc: Emerging Online Collaborative Localization Enhanced by Multidimensional Scaling,Chanxin Zhou and Bang Wang and Yijun Mo and Zeng Zeng,2022,0,IEEE Transactions on Emerging Topics in Computational Intelligence
10.1109/tetci.2022.3150757,Real-Time Activities of Daily Living Recognition Under Long-Tailed Class Distribution,Atul Chaudhary and Hari Prabhat Gupta and K. K. Shukla,2022,0,IEEE Transactions on Emerging Topics in Computational Intelligence
10.1109/tetci.2018.2833135,IEEE Transactions on Emerging Topics in Computational Intelligence,,2018,0,IEEE Transactions on Emerging Topics in Computational Intelligence
10.1109/tetci.2018.2803777,Handwriting Trajectory Reconstruction Using Low-Cost IMU,Tse-Yu Pan and Chih-Hsuan Kuo and Hou-Tim Liu and Min-Chun Hu,2018,6,IEEE Transactions on Emerging Topics in Computational Intelligence
10.1109/tetci.2022.3182360,Unsupervised Monocular Depth Estimation in Highly Complex Environments,Chaoqiang Zhao and Yang Tang and Qiyu Sun,2022,2,IEEE Transactions on Emerging Topics in Computational Intelligence
10.1109/tetci.2020.3036208,Information for Authors,,2020,0,IEEE Transactions on Emerging Topics in Computational Intelligence
10.1109/tetci.2020.3036204,IEEE Transactions on Emerging Topics in Computational Intelligence,,2020,0,IEEE Transactions on Emerging Topics in Computational Intelligence
10.1109/tetci.2020.3042423,2020 Index IEEE Transactions on Emerging Topics in Computational Intelligence Vol. 4,,2020,0,IEEE Transactions on Emerging Topics in Computational Intelligence
10.1109/tetci.2018.2854339,Table of Contents,,2018,0,IEEE Transactions on Emerging Topics in Computational Intelligence
10.1109/tetci.2017.2734284,Table of Contents,,2017,0,IEEE Transactions on Emerging Topics in Computational Intelligence
10.1109/tetci.2017.2721449,Dendritic Cell Algorithm Applied to Ping Scan Investigation Revisited: Detection Quality and Performance Analysis,Guilherme Costa Silva and Walmir Matos Caminhas and Luciano de Errico,2017,3,IEEE Transactions on Emerging Topics in Computational Intelligence
10.1109/tetci.2017.2788519,Table of contents,,2018,0,IEEE Transactions on Emerging Topics in Computational Intelligence
10.1109/tetci.2017.2736891,Call for Nominations/Applications for the position of Editor-in-Chief of the IEEE Transactions on Games,,2017,0,IEEE Transactions on Emerging Topics in Computational Intelligence
10.1109/tetci.2020.3035937,SNEGAN: Signed Network Embedding by Using Generative Adversarial Nets,Lijia Ma and Yuchun Ma and Qiuzhen Lin and Junkai Ji and Carlos A. Coello Coello and Maoguo Gong,2022,2,IEEE Transactions on Emerging Topics in Computational Intelligence
10.1109/tetci.2022.3232816,Isolating Features of Object and Its State for Compositional Zero-Shot Learning,Aditya Panda and Bikash Santra and Dipti Prasad Mukherjee,2023,0,IEEE Transactions on Emerging Topics in Computational Intelligence
10.1109/tetci.2019.2951813,Efficient Search and Lookup in Unstructured P2P Overlay Networks Inspired by Swarm Intelligence,Vesna Sesum-Cavic and Eva Kuhn and Lukas Fleischhacker,2020,5,IEEE Transactions on Emerging Topics in Computational Intelligence
10.1109/tetci.2017.2699193,Search-Based Energy Optimization of Some Ubiquitous Algorithms,Alexander Edward Ian Brownlee and Nathan Burles and Jerry Swan,2017,10,IEEE Transactions on Emerging Topics in Computational Intelligence
10.1109/tetci.2022.3229010,$L$-Fuzzy Multiset Recognizer: Determinization and Minimization,Mallika Dhingra and Mahesh Kumar Dubey and Jacob Kavikumar,2022,0,IEEE Transactions on Emerging Topics in Computational Intelligence
10.1109/tetci.2019.2892734,minStab: Stable Network Evolution Rule Mining for System Changeability Analysis,Animesh Chaturvedi and Aruna Tiwari and Nicolas Spyratos,2021,5,IEEE Transactions on Emerging Topics in Computational Intelligence
10.1109/tetci.2018.2870125,Generating Style-Specific Chinese Tang Poetry With a Simple Actor-Critic Model,Dayiheng Liu and Jiancheng Lv and Yunxia Li,2019,7,IEEE Transactions on Emerging Topics in Computational Intelligence
10.1109/tetci.2022.3170515,A Deep 1-D CNN and Bidirectional LSTM Ensemble Model With Arbitration Mechanism for LDDoS Attack Detection,Zengguang Liu and Jiguo Yu and Biwei Yan and Guijuan Wang,2022,0,IEEE Transactions on Emerging Topics in Computational Intelligence
10.1109/tetci.2022.3146983,Dynamic Network Structure: Doubly Stacking Broad Learning Systems With Residuals and Simpler Linear Model Transmission,Runshan Xie and Chi-Man Vong and C. L. Philip Chen and Shitong Wang,2022,0,IEEE Transactions on Emerging Topics in Computational Intelligence
10.1109/tetci.2021.3066999,An Enhanced Adaptivity of Reinforcement Learning-Based Temperature Control in Buildings Using Generalized Training,Vincent Taboga and Amine Bellahsen and Hanane Dagdougui,2022,2,IEEE Transactions on Emerging Topics in Computational Intelligence
10.1109/tetci.2019.2963469,Guest Editorial: Special Issue on Computational Intelligence for Communications and Sensing,,2020,0,IEEE Transactions on Emerging Topics in Computational Intelligence
10.1109/tetci.2022.3219539,Guest Editorial Special Issue on Computational Intelligence for Perception and Decision-Making of Autonomous Systems,Yang Tang and Gary Yen and Jurgen Kurths,2022,0,IEEE Transactions on Emerging Topics in Computational Intelligence
10.1109/tetci.2020.2978238,Using Feature Selection for Local Causal Structure Learning,Zhaolong Ling and Kui Yu and Hao Wang and Lei Li and Xindong Wu,2021,10,IEEE Transactions on Emerging Topics in Computational Intelligence
10.1109/tetci.2022.3182765,Robust Architecture-Agnostic and Noise Resilient Training of Photonic Deep Learning Models,Manos Kirtas and Nikolaos Passalis and George Mourgias-Alexandris and George Dabos and Nikos Pleros and Anastasios Tefas,2023,3,IEEE Transactions on Emerging Topics in Computational Intelligence
10.1109/tetci.2022.3224954,Towards Simple and Accurate Human Pose Estimation With Stair Network,Chenru Jiang and Kaizhu Huang and Shufei Zhang and Xinheng Wang and Jimin Xiao and Zhenxing Niu and Amir Hussain,2022,2,IEEE Transactions on Emerging Topics in Computational Intelligence
10.1109/tetci.2018.2825456,Bidirectional Hetero-Associative Memory Network With Flexible Sensors and Cloud Computing for Blood Leakage Detection in Intravenous and Dialysis Therapy,Jian-Xing Wu and Ping-Tzan Huang and Chien-Ming Li and Chia-Hung Lin,2018,5,IEEE Transactions on Emerging Topics in Computational Intelligence
10.1109/tetci.2022.3224937,Semi-Supervised Multi-View Fusion for Identifying CAP and COVID-19 With Unlabeled CT Images,Qi Zhu and Yuze Zhou and Yuan Yao and Liang Sun and Feng Shi and Wei Shao and Daoqiang Zhang and Dinggang Shen,2022,1,IEEE Transactions on Emerging Topics in Computational Intelligence
10.1109/tetci.2022.3189695,ADAST: Attentive Cross-Domain EEG-Based Sleep Staging Framework With Iterative Self-Training,Emadeldeen Eldele and Mohamed Ragab and Zhenghua Chen and Min Wu and Chee-Keong Kwoh and Xiaoli Li and Cuntai Guan,2023,2,IEEE Transactions on Emerging Topics in Computational Intelligence
10.1109/tetci.2022.3171784,An Emerging Fuzzy Feature Selection Method Using Composite Entropy-Based Uncertainty Measure and Data Distribution,Weihua Xu and Kehua Yuan and Wentao Li and Weiping Ding,2023,15,IEEE Transactions on Emerging Topics in Computational Intelligence
10.1109/tetci.2017.2787125,End-to-End Learning for Physics-Based Acoustic Modeling,Leonardo Gabrielli and Stefano Tomassetti and Carlo Zinato and Francesco Piazza,2018,3,IEEE Transactions on Emerging Topics in Computational Intelligence
10.1109/tetci.2018.2812897,Dynamic Evolutionary Multiobjective Optimization for Raw Ore Allocation in Mineral Processing,Jinliang Ding and Cuie Yang and Qiong Xiao and Tianyou Chai and Yaochu Jin,2018,4,IEEE Transactions on Emerging Topics in Computational Intelligence
10.1109/tetci.2018.2848289,Decoding Neural Correlates of Cognitive States to Enhance Driving Experience,Ricardo Chavarriaga and Marija Uscumlic and Huaijian Zhang and Zahra Khaliliardali and Ruslan Aydarkhanov and Sareh Saeedi and Lucian Gheorghe and Jose del R. Millan,2018,18,IEEE Transactions on Emerging Topics in Computational Intelligence
10.1109/tetci.2023.3235378,Computationally Efficient Scaled Clustering for Perceptually Invisible Image Intensity Tuning,Reman Kumar and Ashish Kumar Bhandari,2023,0,IEEE Transactions on Emerging Topics in Computational Intelligence
10.1109/tetci.2023.3243920,Multi-Scale Attention Generative Adversarial Network for Medical Image Enhancement,Guojin Zhong and Weiping Ding and Long Chen and Yingxu Wang and Yu-Feng Yu,2023,0,IEEE Transactions on Emerging Topics in Computational Intelligence
10.1109/tetci.2018.2890048,Guest Editorial: Special Issue on New Trends in Smart Chips and Smart Hardware,G.-B. Huang and E. S. Eleftheriou and D. Kudithipudi and J. Tapson and H. Yu,2019,3,IEEE Transactions on Emerging Topics in Computational Intelligence
10.1109/tetci.2021.3132365,Annotating Motion Primitives for Simplifying Action Search in Reinforcement Learning,Isaac J. Sledge and Darshan W. Bryner and Jose C. Principe,2022,1,IEEE Transactions on Emerging Topics in Computational Intelligence
10.1109/tetci.2022.3209655,Automatic Curriculum Learning for Large-Scale Cooperative Multiagent Systems,Tianle Zhang and Zhen Liu and Zhiqiang Pu and Jianqiang Yi,2022,0,IEEE Transactions on Emerging Topics in Computational Intelligence
10.1109/tetci.2022.3214627,SA-ES: Subspace Activation Evolution Strategy for Black-Box Adversarial Attacks,Zhenhua Li and Huilin Cheng and Xinye Cai and Jun Zhao and Qingfu Zhang,2022,0,IEEE Transactions on Emerging Topics in Computational Intelligence
10.1109/tetci.2022.3225550,Graph-Based Feature Selection in Classification: Structure and Node Dynamic Mechanisms,Fan Cheng and Changjun Zhou and Xudong Liu and Qijun Wang and Jianfeng Qiu and Lei Zhang,2022,0,IEEE Transactions on Emerging Topics in Computational Intelligence
10.1109/tetci.2021.3067661,Dense Vector Embedding Based Approach to Identify Prominent Disseminators From Twitter Data Amid COVID-19 Outbreak,Amit Agarwal and Deepak Uniyal and Durga Toshniwal and Dipanjan Deb,2021,2,IEEE Transactions on Emerging Topics in Computational Intelligence
10.1109/tetci.2022.3215137,Unsupervised MRI Super Resolution Using Deep External Learning and Guided Residual Dense Network With Multimodal Image Priors,Yutaro Iwamoto and Kyohei Takeda and Yinhao Li and Akihiko Shiino and Yen-Wei Chen,2023,0,IEEE Transactions on Emerging Topics in Computational Intelligence
10.1109/tetci.2022.3201620,Viewpoint-Based Kernel Fuzzy Clustering With Weight Information Granules,Yiming Tang and Zhifu Pan and Witold Pedrycz and Fuji Ren and Xiaocheng Song,2023,18,IEEE Transactions on Emerging Topics in Computational Intelligence
10.1109/tetci.2022.3201619,V-PCC Projection Based Blind Point Cloud Quality Assessment for Compression Distortion,Renwei Tu and Gangyi Jiang and Mei Yu and Ting Luo and Zongju Peng and Fen Chen,2023,2,IEEE Transactions on Emerging Topics in Computational Intelligence
10.1109/tetci.2022.3230941,RSCDNet: A Robust Deep Learning Architecture for Change Detection From Bi-Temporal High Resolution Remote Sensing Images,n.m. Deepanshi and Rahasya Barkur and Devishi Suresh and Shyam Lal and C. Sudhakar Reddy and P. G. Diwakar,2023,0,IEEE Transactions on Emerging Topics in Computational Intelligence
10.1109/tetci.2019.2892733,Optimal Computational Offloading and Content Caching in Wireless Heterogeneous Mobile Edge Computing Systems With Hopfield Neural Networks,Alia Asheralieva,2021,13,IEEE Transactions on Emerging Topics in Computational Intelligence
10.1109/tetci.2023.3235323,Guest Editorial Special Issue on Computational Intelligence to Edge AI for Ubiquitous IoT Systems,Honghao Gao and Biao Luo and Ramon Duran Barroso and Walayat Hussain,2023,0,IEEE Transactions on Emerging Topics in Computational Intelligence
10.1109/tetci.2019.2902897,Information for Authors,,2019,0,IEEE Transactions on Emerging Topics in Computational Intelligence
10.1109/tetci.2019.2902901,Table of Contents,,2019,0,IEEE Transactions on Emerging Topics in Computational Intelligence
10.1109/tetci.2018.2881225,Gaussian Transfer Convolutional Neural Networks,Hongren Wang and Ce Li and Xiantong Zhen and Wankou Yang and Baochang Zhang,2019,5,IEEE Transactions on Emerging Topics in Computational Intelligence
10.1109/tetci.2019.2951076,IEEE Transactions on Emerging Topics in Computational Intelligence,,2019,0,IEEE Transactions on Emerging Topics in Computational Intelligence
10.1109/tetci.2019.2911785,IEEE Transactions on Emerging Topics in Computational Intelligence,,2019,0,IEEE Transactions on Emerging Topics in Computational Intelligence
10.1109/tetci.2019.2951072,IEEE Transactions on Emerging Topics in Computational Intelligence,,2019,0,IEEE Transactions on Emerging Topics in Computational Intelligence
10.1109/tetci.2022.3190946,Information for Authors,,2022,0,IEEE Transactions on Emerging Topics in Computational Intelligence
10.1109/tetci.2022.3221135,Two-Dimensional Embedded Fuzzy Data Clustering,Yong Peng and Keding Chen and Feiping Nie and Bao-Liang Lu and Wanzeng Kong,2022,0,IEEE Transactions on Emerging Topics in Computational Intelligence
10.1109/tetci.2019.2952587,Preserving Edge Knowledge Sharing Among IoT Services: A Blockchain-Based Approach,Gaolei Li and Mianxiong Dong and Laurence T. Yang and Kaoru Ota and Jun Wu and Jianhua Li,2020,26,IEEE Transactions on Emerging Topics in Computational Intelligence
10.1109/tetci.2018.2864747,A Parallel Surrogate Model Assisted Evolutionary Algorithm for Electromagnetic Design Optimization,Mobayode O. Akinsolu and Bo Liu and Vic Grout and Pavlos I. Lazaridis and Maria Evelina Mognaschi and Paolo Di Barba,2019,46,IEEE Transactions on Emerging Topics in Computational Intelligence
10.1109/tetci.2018.2829922,One-Board Design and Simulation of Double-Layer Perceptron Based on Metal-Oxide Memristive Nanostructures,Alexey N. Mikhaylov and Yana I. Pigareva and Alexey S. Pimashkin and Sergey A. Lobov and Victor B. Kazantsev and Oleg A. Morozov and Pavel E. Ovchinnikov and Ivan N. Antonov and Alexey I. Belov and Dmitry S. Korolev and Alexander N. Sharapov and Evgeniy G. Gryaznov and Oleg N. Gorshkov,2018,27,IEEE Transactions on Emerging Topics in Computational Intelligence
10.1109/tetci.2020.3019014,Asset Picking Based on a Markov Chain Modeling the Asset Performance,Jean-Marc Le Caillec,2022,2,IEEE Transactions on Emerging Topics in Computational Intelligence
10.1109/tetci.2018.2816584,Human–Machine Synergism in High-Level Cognitive Functioning: The Human Component,Robert Earl Patterson and Robert G. Eggleston,2018,7,IEEE Transactions on Emerging Topics in Computational Intelligence
10.1109/tetci.2023.3246559,Topic Integrated Opinion-Based Drug Recommendation With Transformers,Simi Job and Xiaohui Tao and Yuefeng Li and Lin Li and Jianming Yong,2023,0,IEEE Transactions on Emerging Topics in Computational Intelligence
10.1109/tetci.2021.3083428,AdaSwarm: Augmenting Gradient-Based Optimizers in Deep Learning With Swarm Intelligence,Rohan Mohapatra and Snehanshu Saha and Carlos A. Coello Coello and Anwesh Bhattacharya and Soma S. Dhavala and Sriparna Saha,2022,7,IEEE Transactions on Emerging Topics in Computational Intelligence
10.1109/tetci.2021.3067655,"Matching Algorithms: Fundamentals, Applications and Challenges",Jing Ren and Feng Xia and Xiangtai Chen and Jiaying Liu and Mingliang Hou and Ahsan Shehzad and Nargiz Sultanova and Xiangjie Kong,2021,24,IEEE Transactions on Emerging Topics in Computational Intelligence
10.1109/tetci.2023.3259434,A Survey on Data-Driven Runoff Forecasting Models Based on Neural Networks,Ziyu Sheng and Shiping Wen and Zhong-kai Feng and Jiaqi Gong and Kaibo Shi and Zhenyuan Guo and Yin Yang and Tingwen Huang,2023,0,IEEE Transactions on Emerging Topics in Computational Intelligence
10.1109/tetci.2022.3147225,Efficient Brain Decoding Based on Adaptive EEG Channel Selection and Transformation,Jiaxing Wang and Lei Shi and Weiqun Wang and Zeng-Guang Hou,2022,2,IEEE Transactions on Emerging Topics in Computational Intelligence
10.1109/tetci.2017.2769111,Multiscale Kernel PLS-Based Exponentially Weighted-GLRT and Its Application to Fault Detection,Majdi Mansouri and Mohamed Numan Nounou and Hazem Numan Nounou,2019,26,IEEE Transactions on Emerging Topics in Computational Intelligence
10.1109/tetci.2016.2646278,Editorial IEEE Transactions on Emerging Topics in Computational Intelligence,Y.-S. Ong,2017,5,IEEE Transactions on Emerging Topics in Computational Intelligence
10.1109/tetci.2021.3102619,VRConvMF: Visual Recurrent Convolutional Matrix Factorization for Movie Recommendation,Zhu Wang and Honglong Chen and Zhe Li and Kai Lin and Nan Jiang and Feng Xia,2022,5,IEEE Transactions on Emerging Topics in Computational Intelligence
10.1109/tetci.2018.2849380,Cooperative Evolutionary Framework With Focused Search for Many-Objective Optimization,Jiahai Wang and Binzhong Cen and Shangce Gao and Zizhen Zhang and Yuren Zhou,2020,17,IEEE Transactions on Emerging Topics in Computational Intelligence
10.1109/tetci.2021.3051973,Furnace-Grouping Problem Modeling and Multi-Objective Optimization for Special Aluminum,Hao Zhang and Lianbo Ma and Junyi Wang and Liang Wang,2022,1,IEEE Transactions on Emerging Topics in Computational Intelligence
10.1109/tetci.2021.3070713,Attend to Where and When: Cascaded Attention Network for Facial Expression Recognition,Xiaoye Qu and Zhikang Zou and Xinxing Su and Pan Zhou and Wei Wei and Shiping Wen and Dapeng Wu,2022,3,IEEE Transactions on Emerging Topics in Computational Intelligence
10.1109/tetci.2022.3230400,Online Label Distribution Learning Using Random Vector Functional-Link Network,Jintao Huang and Chi-Man Vong and Wenbin Qian and Qin Huang and Yimin Zhou,2022,0,IEEE Transactions on Emerging Topics in Computational Intelligence
10.1109/tetci.2018.2829907,Three Branches of Negative Representation of Information: A Survey,Wenjian Luo and Ran Liu and Hao Jiang and Dongdong Zhao and Linli Wu,2018,21,IEEE Transactions on Emerging Topics in Computational Intelligence
10.1109/tetci.2018.2872598,Temporal Bag-of-Features Learning for Predicting Mid Price Movements Using High Frequency Limit Order Book Data,Nikolaos Passalis and Anastasios Tefas and Juho Kanniainen and Moncef Gabbouj and Alexandros Iosifidis,2020,25,IEEE Transactions on Emerging Topics in Computational Intelligence
10.1109/tetci.2018.2849417,Fuzzy-Logic-Based Integration of Web Contextual Linguistic Structures for Enriching Conceptual Visual Representations,Mohammed Belkhatir,2019,3,IEEE Transactions on Emerging Topics in Computational Intelligence
10.1109/tetci.2020.3013713,Identification of Failure Regions for Programs With Numeric Inputs,Rubing Huang and Weifeng Sun and Tsong Yueh Chen and Sebastian Ng and Jinfu Chen,2021,2,IEEE Transactions on Emerging Topics in Computational Intelligence
10.1109/tetci.2022.3230930,A High-Order Proximity-Incorporated Nonnegative Matrix Factorization-Based Community Detector,Zhigang Liu and Yugen Yi and Xin Luo,2023,0,IEEE Transactions on Emerging Topics in Computational Intelligence
10.1109/tetci.2022.3157026,Multiagent Reinforcement Learning for Community Energy Management to Mitigate Peak Rebounds Under Renewable Energy Uncertainty,Bo-Chen Lai and Wei-Yu Chiu and Yuan-Po Tsai,2022,2,IEEE Transactions on Emerging Topics in Computational Intelligence
10.1109/tetci.2021.3053253,Optimized Bezier Curve Based Intensity Mapping Scheme for Low Light Image Enhancement,Magudeeswaran Veluchamy and Ashish Kumar Bhandari and Bharath Subramani,2022,4,IEEE Transactions on Emerging Topics in Computational Intelligence
10.1109/tetci.2023.3237953,IEEE Transactions on Emerging Topics in Computational Intelligence Information for Authors,,2023,0,IEEE Transactions on Emerging Topics in Computational Intelligence
10.1109/tetci.2018.2850314,Neuromorphic Architecture for the Hierarchical Temporal Memory,Abdullah M. Zyarah and Dhireesha Kudithipudi,2019,17,IEEE Transactions on Emerging Topics in Computational Intelligence
10.1109/tetci.2018.2838124,Hierarchical Temporal Memory Using Memristor Networks: A Survey,Olga Krestinskaya and Irina Dolzhikova and Alex Pappachen James,2018,25,IEEE Transactions on Emerging Topics in Computational Intelligence
10.1109/tetci.2022.3189385,ShVEEGc: EEG Clustering With Improved Cosine Similarity-Transformed Shapley Value,Guanghui Li and Jiahua Shen and Chenglong Dai and Jia Wu and Stefanie I. Becker,2023,1,IEEE Transactions on Emerging Topics in Computational Intelligence
10.1109/tetci.2021.3089328,Brain-Inspired Spiking Neural Network Using Superconducting Devices,Huilin Zhang and Chen Gang and Chen Xu and Guoliang Gong and Huaxiang Lu,2023,4,IEEE Transactions on Emerging Topics in Computational Intelligence
10.1109/tetci.2019.2930249,Pedestrian Flow Optimization to Reduce the Risk of Crowd Disasters Through Human–Robot Interaction,Chao Jiang and Zhen Ni and Yi Guo and Haibo He,2020,5,IEEE Transactions on Emerging Topics in Computational Intelligence
10.1109/tetci.2018.2829914,Memristor-Based Circuit Design for Neuron With Homeostatic Plasticity,Xinming Shi and Zhigang Zeng and Le Le Yang and Yi Huang,2018,9,IEEE Transactions on Emerging Topics in Computational Intelligence
10.1109/tetci.2021.3067017,Frequent Pattern Mining in Big Social Graphs,Lei Li and Ping Ding and Huanhuan Chen and Xindong Wu,2022,4,IEEE Transactions on Emerging Topics in Computational Intelligence
10.1109/tetci.2021.3075723,"A Survey on Facial Wrinkles Detection and Inpainting: Datasets, Methods, and Challenges",Moi Hoon Yap and Nazre Batool and Choon-Ching Ng and Mike Rogers and Kevin Walker,2021,3,IEEE Transactions on Emerging Topics in Computational Intelligence
10.1109/tetci.2023.3251441,Learning to Learn Evolutionary Algorithm: A Learnable Differential Evolution,Xin Liu and Jianyong Sun and Qingfu Zhang and Zhenkun Wang and Zongben Xu,2023,0,IEEE Transactions on Emerging Topics in Computational Intelligence
10.1109/tetci.2023.3246777,IEEE Computational Intelligence Society Information,,2023,0,IEEE Transactions on Emerging Topics in Computational Intelligence
10.1109/tetci.2023.3256466,Towards Efficient Cross-Modal Anomaly Detection Using Triple-Adaptive Network and Bi-Quintuple Contrastive Learning,Shu-Juan Peng and Ye Fan and Yiu-ming Cheung and Xin Liu and Zhen Cui and Taihao Li,2023,0,IEEE Transactions on Emerging Topics in Computational Intelligence
10.1109/tetci.2017.2690913,Automatic EEG Artifact Removal Techniques by Detecting Influential Independent Components,Sim Kuan Goh and Hussein A. Abbass and Kay Chen Tan and Abdullah Al-Mamun and Chuanchu Wang and Cuntai Guan,2017,31,IEEE Transactions on Emerging Topics in Computational Intelligence
10.1109/tetci.2021.3115518,Multiobjective Multitasking Optimization With Subspace Distribution Alignment and Decision Variable Transfer,Weifeng Gao and Jiangli Cheng and Maoguo Gong and Hong Li and Jin Xie,2022,1,IEEE Transactions on Emerging Topics in Computational Intelligence
10.1109/tetci.2021.3127906,Attributes Guided Feature Learning for Vehicle Re-Identification,Hongchao Li and Xianmin Lin and Aihua Zheng and Chenglong Li and Bin Luo and Ran He and Amir Hussain,2022,4,IEEE Transactions on Emerging Topics in Computational Intelligence
10.1109/tetci.2018.2822836,A Novel Time Series-Histogram of Features (TS-HoF) Method for Prognostic Applications,Pin Lim and Chi Keong Goh and Kay Chen Tan,2018,11,IEEE Transactions on Emerging Topics in Computational Intelligence
10.1109/tetci.2017.2739838,Denial of Service Attack on Tie-Line Bias Control in a Power System With PV Plant,Xingsi Zhong and Iroshani Jayawardene and Ganesh Kumar Venayagamoorthy and Richard Brooks,2017,40,IEEE Transactions on Emerging Topics in Computational Intelligence
10.1109/tetci.2019.2923426,Computational Intelligence for Information Security: A Survey,Ruili Wang and Wanting Ji,2020,11,IEEE Transactions on Emerging Topics in Computational Intelligence
10.1109/tetci.2023.3251400,Neural Network Ensemble With Evolutionary Algorithm for Highly Imbalanced Classification,Poly Z. H. Sun and Tian-Yu Zuo and Rob Law and Edmond Q. Wu and Aiguo Song,2023,0,IEEE Transactions on Emerging Topics in Computational Intelligence
10.1109/tetci.2018.2868323,Hemodynamic Analysis for Cognitive Load Assessment and Classification in Motor Learning Tasks Using Type-2 Fuzzy Sets,Lidia Ghosh and Amit Konar and Pratyusha Rakshit and Atulya K. Nagar,2019,12,IEEE Transactions on Emerging Topics in Computational Intelligence
10.1109/tetci.2019.2937566,Mimicking Short-Term Memory in Shape-Reconstruction Task Using an EEG-Induced Type-2 Fuzzy Deep Brain Learning Network,Lidia Ghosh and Amit Konar and Pratyusha Rakshit and Atulya K. Nagar,2020,5,IEEE Transactions on Emerging Topics in Computational Intelligence
