DOI,Título,Autores,Año,Citas,Revista
10.1007/s12530-019-09295-4,Optimization of future charging infrastructure for commercial electric vehicles using a multi-objective genetic algorithm and real travel data,Li Zeng and Timo Krallmann and Andrea Fiege and Marek Stess and Timo Graen and Michael Nolting,2020,8,Evolving Systems
10.1007/s12530-022-09458-w,A player unknown's battlegrounds ranking based optimization technique for power system optimization problem,Kapil Deo Bodha and V. Mukherjee and Vinod Kumar Yadav,2022,1,Evolving Systems
10.1007/s12530-018-9236-x,Weakly supervised multilabel classification for semantic interpretation of endoscopy video frames,Michael D. Vasilakakis and Dimitris Diamantis and Evaggelos Spyrou and Anastasios Koulaouzidis and Dimtris K. Iakovidis,2020,8,Evolving Systems
10.1007/s12530-022-09426-4,Deep learning system applicability for rapid glaucoma prediction from fundus images across various data sets,Law Kumar Singh and n.m. Pooja and Hitendra Garg and Munish Khanna,2022,5,Evolving Systems
10.1007/s12530-013-9078-5,Neurocomputing techniques to dynamically forecast spatiotemporal air pollution data,Antonios Papaleonidas and Lazaros Iliadis,2013,9,Evolving Systems
10.1007/s12530-019-09313-5,A novel differential evolution algorithm integrating opposition-based learning and adjacent two generations hybrid competition for parameter selection of SVM,Jun Li and Guokang Fang,2021,3,Evolving Systems
10.1007/s12530-019-09271-y,Application of hybrid forecast engine based intelligent algorithm and feature selection for wind signal prediction,Mahdi Mir and Mahdi Shafieezadeh and Mohammad Amin Heidari and Noradin Ghadimi,2020,115,Evolving Systems
10.1007/s12530-014-9119-8,Hybrid dynamic data-driven approach for drift-like fault detection in wind turbines,Houari Toubakh and Moamar Sayed-Mouchaweh,2015,20,Evolving Systems
10.1007/s12530-014-9113-1,Experimental assessment and design of multiple model predictive control based on local model networks for industrial processes,Thiago V. Costa and Ana M. F. Fileti and Luís C. Oliveira-Lopes and Flávio V. Silva,2015,7,Evolving Systems
10.1007/s12530-021-09376-3,A simple and efficient incremental missing data imputation method for evolving neo-fuzzy network,Giovanni Amormino da Silva Júnior and Alisson Marques da Silva,2022,1,Evolving Systems
10.1007/s12530-023-09492-2,Fast approach for link prediction in complex networks based on graph decomposition,Abdelhamid Saifi and Farid Nouioua and Samir Akhrouf,2023,0,Evolving Systems
10.1007/s12530-016-9152-x,Online network traffic classification with incremental learning,H. R. Loo and M. N. Marsono,2016,8,Evolving Systems
10.1007/s12530-018-9241-0,Detecting changes in the heart rate of firefighters to prevent smoke inhalation and health effects,Raquel Sebastião and Sandra Sorte and Joana Valente and Ana I. Miranda and José Maria Fernandes,2019,1,Evolving Systems
10.1007/s12530-021-09391-4,"Fuzzy logic, neural-fuzzy network and honey bees algorithm to develop the swarm motion of aerial robots",Iman Shafieenejad and Elham Dehghan Rouzi and Jamshid Sardari and Mohammad Siami Araghi and Amirhosein Esmaeili and Shervin Zahedi,2022,0,Evolving Systems
10.1007/s12530-020-09346-1,A new framework for grayscale ear images recognition using generative adversarial networks under unconstrained conditions,Yacine Khaldi and Amir Benzaoui,2021,24,Evolving Systems
10.1007/s12530-016-9156-6,Evolving connectionist method for adaptive audiovisual speech recognition,Mario Malcangi and Philip Grew,2017,3,Evolving Systems
10.1007/s12530-021-09394-1,A parametric scoring function and the associated method for interval neutrosophic multi-criteria decision-making,Hassan Pouresmaeil and Esmaile Khorram and Elyas Shivanian,2022,0,Evolving Systems
10.1007/s12530-014-9118-9,On-line learning with minimized change of the global mapping,Andreas Buschermöhle and Werner Brockmann,2015,0,Evolving Systems
10.1007/s12530-013-9075-8,Iris data encryption based on Aztec Symbology,Shrinivasrao B. Kulkarni and Ravindra S. Hegadi and Umakant P. Kulkarni,2013,0,Evolving Systems
10.1007/s12530-019-09283-8,Estimates of residential building energy consumption using a multi-verse optimizer-based support vector machine with k-fold cross-validation,Hamed Tabrizchi and Mohammad Masoud Javidi and Vahid Amirzadeh,2021,10,Evolving Systems
10.1007/s12530-021-09369-2,Neural network based CT-Canny edge detector considering watermarking framework,M. F. Kazemi and A. H. Mazinan,2022,0,Evolving Systems
10.1007/s12530-012-9051-8,"Guest editorial: Evolving learning and adaptive modelling approaches to prediction, forecasting and control—preface to the special issue",Xiao-Jun Zeng,2012,0,Evolving Systems
10.1007/s12530-021-09397-y,3D convolution neural network-based person identification using gait cycles,P. Supraja and Rijo Jackson Tom and Ravi Shekhar Tiwari and V. Vijayakumar and Yan Liu,2021,1,Evolving Systems
10.1007/s12530-021-09405-1,Cluster head selection using hesitant fuzzy and firefly algorithm in wireless sensor networks,Mojgan Rayenizadeh and Marjan Kuchaki Rafsanjani and Arsham Borumand Saeid,2022,2,Evolving Systems
10.1007/s12530-016-9164-6,Timely advances in evolving neural-based systems special issue,Lazaros Iliadis and Konstantinos Margaritis and Ilias Maglogiannis,2017,3,Evolving Systems
10.1007/s12530-016-9157-5,Intuitionistic neuro-fuzzy network with evolutionary adaptation,Petr Hájek and Vladimír Olej,2017,11,Evolving Systems
10.1007/s12530-019-09292-7,Employing query disambiguation using clustering techniques,Andreas Kanavos and Panagiota Kotoula and Christos Makris and Lazaros Iliadis,2020,3,Evolving Systems
10.1007/s12530-018-9247-7,Neutrosophic soft set decision making for stock trending analysis,Sudan Jha and Raghvendra Kumar and Le Hoang Son and Jyotir Moy Chatterjee and Manju Khari and Navneet Yadav and Florentin Smarandache,2019,29,Evolving Systems
10.1007/s12530-022-09467-9,Multi-class classification of Alzheimer’s disease through distinct neuroimaging computational approaches using Florbetapir PET scans,Nitika Goenka and Shamik Tiwari,2022,1,Evolving Systems
10.1007/s12530-022-09451-3,Prim based link quality and thermal aware adaptive routing protocol for IoMT using SigFox network in WBAN,Padma Vijetha Dev Bakkaiahgari and K. Venkata Prasad,2022,0,Evolving Systems
10.1007/s12530-012-9057-2,Middleware for task resolution and adaptation in pervasive environments,Imen Ben Lahmar and Djamel Belaïd and Hamid Mukhtar,2012,2,Evolving Systems
10.1007/s12530-019-09282-9,Editorial,Lazaros Iliadis and Ilias Maglogiannis,2019,1,Evolving Systems
10.1007/s12530-016-9150-z,An inventory model for controllable probabilistic deterioration rate under shortages,Umakanta Mishra,2016,10,Evolving Systems
10.1007/s12530-015-9130-8,Know-How: a design pattern for generic log adapter,M. M. Math and S. F. Rodd and Harish Kenchannavar and S. B. Kulkarni and U. P. Kulkarni and A. R. Yardi,2015,0,Evolving Systems
10.1007/s12530-021-09417-x,A semi-supervised deep rule-based classifier for robust finger knuckle-print verification,Mounir Benmalek and Abdelouahab Attia and Abderraouf Bouziane and M. Hassaballah,2022,3,Evolving Systems
10.1007/s12530-019-09277-6,Danger theory inspired micro-population immune optimization for probabilistic constrained programming,Zhuhong Zhang and Renchong Zhang,2020,0,Evolving Systems
10.1007/s12530-016-9154-8,A recommendation system based on mining human portfolio for museum navigation,Jason C. Hung and Jing-De Weng and Yung-Hui Chen,2016,5,Evolving Systems
10.1007/s12530-017-9185-9,Modality of teaching learning based optimization algorithm to reduce the consistency ratio of the pair-wise comparison matrix in analytical hierarchy processing,Prashant Borkar and M. V. Sarode,2018,1,Evolving Systems
10.1007/s12530-022-09469-7,An advance computational intelligent approach to solve the third kind of nonlinear pantograph Lane–Emden differential system,Zulqurnain Sabir and Muhammad Asif Zahoor Raja and Mohamed R. Ali and R. Sadat,2022,0,Evolving Systems
10.1007/s12530-022-09438-0,An evolutionary approach with reliability priority to design Scada systems for water reservoirs,Ali Dolatshahi Zand and Kaveh Khalili-Damghani and Sadigh Raissi,2022,0,Evolving Systems
10.1007/s12530-017-9188-6,Semantic lexicons of English nouns for classification,Vo Ngoc Phu and Vo Thi Ngoc Tran and Vo Thi Ngoc Chau and Dat Nguyen Duy and Khanh Ly Doan Duy,2019,9,Evolving Systems
10.1007/s12530-016-9172-6,A fuzzy approach towards inductive transfer and human–machine interface control design,Rui Azevedo Antunes and Luís Brito Palma and Fernando Vieira Coito and Hermínio Duarteramos,2018,3,Evolving Systems
10.1007/s12530-021-09384-3,NestEn_SmVn: boosted nested ensemble multiplexing to diagnose coronary artery disease,Sourabh Shastri and Kuljeet Singh and Sachin Kumar and Paramjit Kour and Vibhakar Mansotra,2022,0,Evolving Systems
10.1007/s12530-022-09480-y,A human activity recognition method using wearable sensors based on convtransformer model,Zhanpeng Zhang and Wenting Wang and Aimin An and Yuwei Qin and Fazhi Yang,2023,0,Evolving Systems
10.1007/s12530-018-9242-z,MONDE: a method for predicting social network dynamics and evolution,Maria Chiara Caschera and Arianna D’Ulizia and Fernando Ferri and Patrizia Grifoni,2019,2,Evolving Systems
10.1007/s12530-015-9128-2,Adaptive and on-line learning in non-stationary environments,Edwin Lughofer and Moamar Sayed-Mouchaweh,2015,10,Evolving Systems
10.1007/s12530-018-9233-0,A method for the detection of the most suitable fuzzy implication for data applications,Panagiotis Pagouropoulos and Christos D. Tzimopoulos and Basil K. Papadopoulos,2020,1,Evolving Systems
10.1007/s12530-021-09407-z,Optimization of FRP jacket by fractional‑order pathfinder algorithm to improve the reinforced concrete frames' seismic response,Chengliang Wang and Wenrui Li and Dragan Rodriguez,2022,0,Evolving Systems
10.1007/s12530-010-9011-0,ReAd: reactive-adaptive methodology to enable evolving intelligent agents for virtual environments,Mario Gongora and David Irvine,2010,1,Evolving Systems
10.1007/s12530-012-9047-4,Online variational learning of finite Dirichlet mixture models,Wentao Fan and Nizar Bouguila,2012,13,Evolving Systems
10.1007/s12530-018-9239-7,Uniform global asymptotic stability for nonlinear systems with delay and sampling,Zeinab Echreshavi and Alireza Roosta,2019,0,Evolving Systems
10.1007/s12530-010-9018-6,Data base definition and feature selection for the genetic generation of fuzzy rule bases,Marcos E. Cintra and Maria C. Monard and Heloisa A. Camargo,2010,3,Evolving Systems
10.1007/s12530-017-9177-9,A dedicated state space for power system modeling and frequency and unbalance estimation,Anh Tuan Phan and Patrice Wira and Gilles Hermann,2018,3,Evolving Systems
10.1007/s12530-018-9257-5,Reconstruction of catadioptric omnidirectional images using dual alternating total variation minimization,Soraya Zenati and Abdelhani Boukrouche and Larbi Boubchir,2019,1,Evolving Systems
10.1007/s12530-017-9203-y,Hybrid local boosting utilizing unlabeled data in classification tasks,Christos K. Aridas and Sotiris B. Kotsiantis and Michael N. Vrahatis,2019,1,Evolving Systems
10.1007/s12530-022-09435-3,Deep recurrent Gaussian Nesterovs recommendation using multi-agent in social networks,Vinita Tapaskar and Mallikarjun M. Math,2022,1,Evolving Systems
10.1007/s12530-018-9254-8,Energy efficient clustering protocol for WSNs based on bio-inspired ICHB algorithm and fuzzy logic system,Prateek Gupta and Ajay K. Sharma,2019,4,Evolving Systems
10.1007/s12530-022-09473-x,Multichannel KHMF for speech separation with enthalpy based DOA and score based CNN (SCNN),Yannam Vasantha Koteswararao and C. B. Rama Rao,2022,0,Evolving Systems
10.1007/s12530-019-09323-3,Evolving and intelligent systems applications special issue,Lazaros Iliadis and Costin Badica,2020,1,Evolving Systems
10.1007/s12530-021-09415-z,Analyzing flight delay prediction under concept drift,Lucas Giusti and Leonardo Carvalho and Antonio Tadeu Gomes and Rafaelli Coutinho and Jorge Soares and Eduardo Ogasawara,2022,1,Evolving Systems
10.1007/s12530-022-09424-6,Adaptive nonparametric evolving fuzzy controller for uncertain nonlinear systems with dead zone,Zhao-Xu Yang and Zhi-Xin Yang and Hai-Jun Rong,2022,0,Evolving Systems
10.1007/s12530-022-09468-8,Application of feature extraction using nonlinear dynamic system in face recognition,Lianglei Sun and Hongchen Lin and Wanbo Yu and Yi Zhang,2022,0,Evolving Systems
10.1007/s12530-021-09383-4,Eyelid basal cell carcinoma classification using shallow and deep learning artificial neural networks,Adam Adamopoulos and Evaggelos Georgios Chatzopoulos and George Anastassopoulos and Efstathios Detorakis,2021,2,Evolving Systems
10.1007/s12530-012-9069-y,Evolving integrated multi-model framework for on line multiple time series prediction,Russel Pears and Harya Widiputra and Nikola Kasabov,2013,8,Evolving Systems
10.1007/s12530-019-09286-5,A plug ‘n’ play approach for dynamic data acquisition from heterogeneous IoT medical devices of unknown nature,Argyro Mavrogiorgou and Athanasios Kiourtis and Dimosthenis Kyriazis,2020,7,Evolving Systems
10.1007/s12530-019-09320-6,Multi-area economic dispatching using improved grasshopper optimization algorithm,Peng Zhang and Weiwei Ma and Yanli Dong and Babak Daneshvar Rouyendegh,2021,7,Evolving Systems
10.1007/s12530-017-9204-x,A machine learning approach for asperities’ location identification,Konstantinos Arvanitakis and Ioannis Karydis and Katia L. Kermanidis and Markos Avlonitis,2019,1,Evolving Systems
10.1007/s12530-022-09460-2,A novel multilevel color image segmentation technique based on an improved firefly algorithm and energy curve,Qiuping Guo and Hao Peng,2022,0,Evolving Systems
10.1007/s12530-018-9232-1,An efficient classification approach in imbalanced datasets for intrinsic plagiarism detection,Andrianna Polydouri and Eleni Vathi and Georgios Siolas and Andreas Stafylopatis,2020,6,Evolving Systems
10.1007/s12530-023-09486-0,High gain circular slot MIMO antenna for Wi-Max and WLAN application with minimum ECC value,P. Sushmachowdary and Sampath Kumar Panda and V. Praveen Naidu,2023,0,Evolving Systems
10.1007/s12530-022-09434-4,Transparent rule generator random forest (TRG-RF): an interpretable random forest,Arpita Nath Boruah and Saroj Kumar Biswas and Sivaji Bandyopadhyay,2023,0,Evolving Systems
10.1007/s12530-022-09428-2,Punjabi news multi-classification using language generation-based optimized long short-term memory networks,Varun Gupta and Ekta Gupta,2023,0,Evolving Systems
10.1007/s12530-012-9066-1,A fuzzy logic model based Markov random field for medical image segmentation,Thanh Minh Nguyen and Q. M. Jonathan Wu,2013,22,Evolving Systems
10.1007/s12530-020-09335-4,"Handling of advanced persistent threats and complex incidents in healthcare, transportation and energy ICT infrastructures",Spyridon Papastergiou and Haralambos Mouratidis and Eleni-Maria Kalogeraki,2021,10,Evolving Systems
10.1007/s12530-020-09334-5,An overview on evolving systems and learning from stream data,Daniel Leite and Igor Škrjanc and Fernando Gomide,2020,31,Evolving Systems
10.1007/s12530-013-9084-7,A robust fuzzy adaptive law for evolving control systems,Sašo Blažič and Igor Škrjanc and Drago Matko,2014,51,Evolving Systems
10.1007/s12530-021-09410-4,Varying combination of feature extraction and modified support vector machines based prediction of myocardial infarction,A. Razia Sulthana and A. K. Jaithunbi,2022,1,Evolving Systems
10.1007/s12530-022-09479-5,RGB-D indoor semantic segmentation network based on wavelet transform,Runze Fan and Yuhong Liu and Shiyi Jiang and Rongfen Zhang,2022,0,Evolving Systems
10.1007/s12530-021-09379-0,Intelligent tasks allocation at the edge based on machine learning and bio-inspired algorithms,Madalena Soula and Anna Karanika and Kostas Kolomvatsos and Christos Anagnostopoulos and George Stamoulis,2022,4,Evolving Systems
10.1007/s12530-010-9001-2,A semi-supervised dynamic version of Fuzzy K-Nearest Neighbours to monitor evolving systems,Laurent Hartert and Moamar Sayed Mouchaweh and Patrice Billaudel,2010,26,Evolving Systems
10.1007/s12530-023-09487-z,Adaptive deep Runge Kutta Garson’s network with node disjoint local repair protocol based multipath routing in MANET,Sangamesh C. Jalade and Nagaraj B. Patil,2023,0,Evolving Systems
10.1007/s12530-017-9194-8,Simulation evaluation of a relative frequency metric for web cache replacement policies,Nadjette Benhamida and Louiza Bouallouche-Medjkoune and Djamil Aïssani,2018,3,Evolving Systems
10.1007/s12530-017-9178-8,"Evolving, dynamic clustering of spatio/spectro-temporal data in 3D spiking neural network models and a case study on EEG data",Maryam Gholami Doborjeh and Nikola Kasabov and Zohreh Gholami Doborjeh,2018,18,Evolving Systems
10.1007/s12530-020-09332-7,A multicriteria fuzzy pattern recognition approach for assessing the vulnerability to drought: Mediterranean region,M. Spiliotis and A. Iglesias and L. Garrote,2021,7,Evolving Systems
10.1007/s12530-023-09488-y,Modified remora optimization based matching pursuit with density peak clustering for localization of epileptic seizure onset zones,B. Indira Priyadarshini and D. Krishna Reddy,2023,0,Evolving Systems
10.1007/s12530-018-9220-5,Identification of realistic distillation column using hybrid particle swarm optimization and NARX based artificial neural network,E. Abdul Jaleel and K. Aparna,2019,11,Evolving Systems
10.1007/s12530-021-09390-5,Deep learning for efficient and multi-labelled classification of synthetic aperture radar images,G. Siva krishna and N. Prakash,2021,4,Evolving Systems
10.1007/s12530-018-9218-z,Infinite impulse response systems modeling by artificial intelligent optimization methods,Ali Mohammadi and Seyed Hamid Zahiri and Seyyed Mohammad Razavi,2019,12,Evolving Systems
10.1007/s12530-015-9132-6,Generalized smart evolving fuzzy systems,Edwin Lughofer and Carlos Cernuda and Stefan Kindermann and Mahardhika Pratama,2015,123,Evolving Systems
10.1007/s12530-019-09318-0,Measuring the curse of population size over swarm intelligence based algorithms,Krishna Gopal Dhal and Arunita Das and Samarendu Sahoo and Rohi Das and Sanjoy Das,2021,12,Evolving Systems
10.1007/s12530-021-09402-4,A novel improved arithmetic optimization algorithm for optimal design of PID controlled and Bode’s ideal transfer function based automobile cruise control system,Davut Izci and Serdar Ekinci and Murat Kayri and Erdal Eker,2022,20,Evolving Systems
10.1007/s12530-018-9235-y,Self-supervised autoencoders for clustering and classification,Paraskevi Nousi and Anastasios Tefas,2020,5,Evolving Systems
10.1007/s12530-020-09356-z,Optimal integration of multi-type DG in RDS based on novel voltage stability index with future load growth,Shradha Singh Parihar and Nitin Malik,2021,4,Evolving Systems
10.1007/s12530-021-09396-z,Dimensionality reduction in the context of dynamic social media data streams,Moritz Heusinger and Christoph Raab and Frank-Michael Schleif,2022,1,Evolving Systems
